id_gs,autor,cargo,id_institucion,email,citaciones,intereses
9232372474901007921,Manuel Vivanco Arancibia,"Profesor Estadística, Universidad de Chile",uchile,u.uchile.c,1281,estadística aplicada 
9232372474901007921,Nancy Hitschfeld Kahler,"Full Professor at the Computer Science Department, University of Chile",uchile,dcc.uchile,1277,Mesh generation Meshing tools GPU-computing Computational science and engineering 
9232372474901007921,Rodrigo Villegas,"School of Public Health, University of Chile",uchile,uchile.cl,1276,linear models longitudinal analysis statistical computing survival analysis 
9232372474901007921,Michael Handford,Universidad de Chile,uchile,uchile.cl,1270,Plant biology and biotechnology 
9232372474901007921,Franck Quero,University of Chile,uchile,ing.uchile,1263,Nanocellulose Biopolymers Polymer Composites 
9232372474901007921,Christian Miranda,"Associate Professor of Education, Universidad of Chile",uchile,u.uchile.c,1257,Teacher Training evaluating program of education educational policy 
9232372474901007921,Prof. Dr. Juan Pablo Manalich R.,"Facultad de Derecho, Universidad de Chile",uchile,derecho.uc,1248,
9232372474901007921,Lorena Norambuena,Universidad de Chile,uchile,uchile.cl,1233,Cell and Molecular Biology Chemical genetics 
9232372474901007921,"Maracaja-Coutinho, Vinicius",Universidad de Chile,uchile,uchile.cl,1228,Computational Systems Biology Comparative Genomics Non-Coding RNAs Bioinformatics Science Outreach 
9232372474901007921,Raphael Bergoeing,"Professor of Economics, Universidad de Chile",uchile,fen.uchile,1228,Growth Trade Banking 
9232372474901007921,Claudia Rahmann,"Department of Electrical Engineering, University of Chile",uchile,ing.uchile,1222,Energy 
9232372474901007921,Nicolás García,Universidad de Chile,uchile,uchile.cl,1221,Botany plant systematics taxonomy evolution flora of Chile 
9232372474901007921,Paul H Delano,Universidad de Chile,uchile,med.uchile,1216,Neuroscience Otolaryngology Biology 
9232372474901007921,Pablo Farías,"Facultad de Economía y Negocios, U. de Chile",uchile,fen.uchile,1205,low price strategies promotion tools marketing metrics 
9232372474901007921,Lorena Sanhueza,Universidad de Chile,uchile,uchile.cl,1204,Arqueologia 
9232372474901007921,Felipe Barra,Departamento de Física - Universidad de Chile,uchile,dfi.uchile,1202,quantum chaos nonequilibrium statistical mechanics 
9232372474901007921,Claudio Saitz Barría,"Profesor Asociado, Depto. Quimica Organica y Fisico quimica, Fac. Cs. Químicas y …",uchile,ciq.uchile,1201,Quimica Organica quimica supramolecular espectroscopia complejación 
9232372474901007921,Zoltan Berger,"Médico, Profesor de gastroenterologia, Universidad de Chile, Santiago",uchile,hcuch.cl,1200,gastroenterologia pancreatologia 
9232372474901007921,Carlos Ruiz Encina,"Académico del Departamento de Sociología, Facultad de Ciencias Sociales, Universidad de …",uchile,uchile.cl,1192,América Latina Clases Sociales Conflicto Social Modelos de Desarrollo Estado 
9232372474901007921,Teresa Torres,Profesora de Física y  paleobotánica Universidad de Chile Facultad de Agronomía,uchile,u.uchile.c,1190,física paleobotánica paleoxylología flora fósil antártica 
9232372474901007921,Paola Carvajal Pavez,Profesora Asociada Facultad de Odontología Universidad de Chile,uchile,odontologi,1190,Salud Pública Epidemiología de las enfermedades … 
9232372474901007921,Inmaculada Vaca,Universidad de Chile,uchile,uchile.cl,1189,
9232372474901007921,Jorge Soto-Andrade,University of Chile,uchile,uchile.cl,1182,
9232372474901007921,VERONICA CORNEJO,"Professor, University of Chile",uchile,inta.uchil,1174,inborn errors of metabolism neonatal screening nutrition in metabolic disease 
9232372474901007921,Sebastian A. Rios,"Assistant Professor, Industrial Engineering, University of Chile",uchile,dii.uchile,1171,Artificial Intelligence Data Mining Pattern Recognition Business Intelligence 
9232372474901007921,Carmen Romero,"Full Professor University of Chile, Head of Endocrinology and Biology Reproduction …",uchile,hcuch.cl,1168,Ovarian cancer neuroendocrinology of the ovary biology of reproduction 
9232372474901007921,Cristian Araneda,"Associate Professor, Depto. Producción Animal, Universidad de Chile",uchile,uchile.cl,1155,Genetics Animal Breeding QTL Mapping Aquaculture Food Quality 
9232372474901007921,Pablo Sarricolea,"Profesor Asociado. Departamento de Geografía, Universidad de Chile",uchile,uchilefau.,1155,Geografía Física Climatología clima urbano Incendios forestales Riesgos 
9232372474901007921,Germán Ebensperger,"Laboratorio Mecanismos de Adaptación y Estrés Vascular, Universidad de Chile, Programa",uchile,uchile.cl,1154,Hypoxia Vascular Stress and Adaptation Perinatal Physiology Vascular development 
9232372474901007921,Luis Morales-Salinas,"Laboratory for Research in Environmental Sciences (LARES), University of Chile",uchile,renare.uch,1143,Agrometeorology Climatology Remote Sensing Environmental Modeling 
9232372474901007921,David Veliz,Universidad de Chile,uchile,uchile.cl,1134,
9232372474901007921,Néstor Becerra Yoma,Universidad de Chile,uchile,ing.uchile,1133,… intelligence and signal processing applied to … speech processing and seismology. 
9232372474901007921,Mauricio Jara Bertin,"Facultad de Economía y Negocios, Universidad de Chile",uchile,unegocios.,1132,Corporate Governance Corporate Finance 
9232372474901007921,Rodrigo Espinoza-González,"Depto. de Ingeniería Química Biotecnología y Materiales, FCFM, Universidad de Chile",uchile,ing.uchile,1120,Materiales dieléctricos nanotecnología perovsquitas 
9232372474901007921,Miguel Ángel Rincón Cervera,"Laboratorio de lípidos, INTA, Universidad de Chile",uchile,inta.uchil,1120,
9232372474901007921,Ricardo C. Muñoz,University of Chile,uchile,dgf.uchile,1119,meteorology 
9232372474901007921,Mario Riquelme,"Assistant Professor, Physics Department - University of Chile",uchile,uchile.cl,1113,Astrophysical and space plasmas high energy astrophysics 
9232372474901007921,Ruben Mercado,"Parasitology, Faculty of Medicine, Universidad de Chile",uchile,med.uchile,1096,Parasitology 
9232372474901007921,Cesar Azurdia,"Associate Professor, Universidad de Chile",uchile,ing.uchile,1090,OFDM-based systems Nyquist Pulses Visible light communications V2X Communications 
9232372474901007921,Alexander O. Vargas,"Professor of Evolution, University of Chile",uchile,uchile.cl,1086,Morphology Evolution and Development Paleontology 
9232372474901007921,Claudia P. Cortes,University of Chile,uchile,med.uchile,1086,HIV Infectious Diseases 
9232372474901007921,Fernando Santibañez,Profesor Universidad de Chile,uchile,uchile.cl,1082,Bioclimatologia modelacion sistemas ecologicos cambio climatico 
9232372474901007921,"Francisca Echeverría, PhD","Profesora Asistente, Universidad de Chile",uchile,uchile.cl,1079,
9232372474901007921,María Olivia Monckeberg,profesora titular Universidad de Chile,uchile,uchile.cl,1065,grupos económicos medios comunicación universidades religión 
9232372474901007921,Daniel Hojman,"Associate Professor of Economics, University of Chile",uchile,fen.uchile,1056,
9232372474901007921,Cristian  Covarrubias G.,University of Chile,uchile,odontologi,1053,Nanobiomaterials tissue engineering dental materials 
9232372474901007921,Teresa Matus,Universidad de Chile      Facultad de Ciencias Sociales      Departamento de Trabajo Social,uchile,uchile.cl,1051,… Social en Políticas Públicas     Trabajo Social … 
9232372474901007921,Alexis Vásquez,"Profesor de Geografía, Universidad de Chile",uchile,u.uchile.c,1049,
9232372474901007921,Benjamin A. Toledo,Universidad de Chile,uchile,macul.cien,1044,
9232372474901007921,Fausto Patricio Mena,Universidad de Chile,uchile,u.uchile.c,1040,Astronomical Instrumentation Solid State Physics 
9232372474901007921,Nicolas Mujica,Universidad de Chile,uchile,dfi.uchile,1031,
9232372474901007921,Juan Cristobal Zagal,"Associate Professor of Mechanical Engineering, University of Chile",uchile,ing.uchile,1027,Robotics Soft Robotics Artificial Life 3D Printing Digital Fabrication 
9232372474901007921,Mauricio López Cruz,Universidad de Chile,uchile,uchile.cl,1024,psicología evolutiva y de la educación inclusión educativa 
9232372474901007921,Jose Miguel Piquer,"Department of Computer Science, University of Chile",uchile,dcc.uchile,1015,Distributed Systems Computer Networks Programming Languages 
9232372474901007921,Ivan Rapaport,"Discrete Mathematics, Universidad de Chile",uchile,dim.uchile,1011,Discrete Mathematics Distributed Computing Theory of Computing Cellular Automata 
9232372474901007921,Pedro I. Leiva,"Associate Professor, Faculty of Economics and Bussines, University of Chile",uchile,unegocios.,1009,Organizational Behavior Human Resource Management Teamwork Work Family Conflict 
9232372474901007921,Denis Saure,University of Chile,uchile,dii.uchile,1009,Revenue Management Assortment Planning 
9232372474901007921,Andres Musalem,University of Chile,uchile,dii.uchile,1008,Marketing Empirical Operations Management Bayesian Statistics Game Theory Econometrics 
9232372474901007921,Marcos Flores,Universidad de Chile,uchile,ing.uchile,1004,Metallic Thin films nanostructures self-assembled monolayers 
9232372474901007921,Claudio A. Bonilla,University of Chile,uchile,fen.uchile,1003,Financial Economics Risk and Uncertainty Economics of Entrepreneurship 
9232372474901007921,Paulina Osorio-Parraguez,Universidad de Chile,uchile,uchile.cl,1000,Vejez y envejecimiento 
9232372474901007921,Josiane Bonnefoy,"School of Public Health, Faculty of Medicine, University of Chile",uchile,med.uchile,985,Social determinants of health equity in health child mortality avoidable mortality 
9232372474901007921,eduardo alvarez duarte,University of Chile,uchile,med.uchile,979,Medical Mycology General Mycology mycology aspergillus dermatophytes 
9232372474901007921,Víctor Orellana Calderón,Universidad de Chile,uchile,ciae.uchil,978,Sociología de la Educación Política Pública Estructura Social Desigualdad 
9232372474901007921,Igor Pacheco,INTA - Universidad de Chile,uchile,inta.uchil,976,Plant Genetics Genomics Fruit Phenotyping Quantitative Genetics Healthy Compounds 
9232372474901007921,Carla Jara,Universidad de Chile,uchile,u.uchile.c,973,microbiologia y biotecnologia enológica 
9232372474901007921,Marcos Kiwi,University of Chile,uchile,dim.uchile,973,Theory of computation Discrete Mathematics. 
9232372474901007921,Daniel Remenik,Universidad de Chile,uchile,dim.uchile,970,Probability Theory 
9232372474901007921,Jaime H. Ortega,"DIM-CMM, U. de Chile",uchile,dim.uchile,968,Applied Math Inverse Problemas Control Theory PDE 
9232372474901007921,Romulo Fuentes-Flores,Universidad de Chile,uchile,uchile.cl,960,
9232372474901007921,"Franco Cavalla, DDS, Periodontist, MSc, PhD","Associate Professor of Conservative Dentistry, University of Chile",uchile,odontologi,957,dentistry periodontics immunology genetics 
9232372474901007921,Victoria Cristina Guixe Leguia,Universidad de Chile,uchile,uchile.cl,955,
9232372474901007921,David Diaz,"Profesor Asistente (Facultad de Economía y Negocios, Universidad de Chile)",uchile,fen.uchile,954,business intelligence service analytics finance environmental information management 
9232372474901007921,Enrique Aliste,"Profesor Titular, Universidad de Chile",uchile,uchile.cl,952,Geografía Geografía Social Geografía Cultural Sustentabilidad Estudios socioambientales 
9232372474901007921,Gregory P. De Pascale,"Assistant Professor, Department of Geology, University of Chile",uchile,ing.uchile,950,Neotectonics geohazards seismic hazard 
9232372474901007921,Anne J Lagomarcino,Universidad de Chile,uchile,uchile.cl,947,epidemiology infectious disease microbiome community ecology paleontology 
9232372474901007921,Laura Tamayo,Universidad de Chile,uchile,uchile.cl,938,Biomaterials 
9232372474901007921,Anahí Urquiza,Universidad de Chile,uchile,uchile.cl,937,Ciencias Sociales y Cambio Climático 
9232372474901007921,Juan Carlos Salazar Garrido,"Profesor Asociado. ICBM. Facultad de Medicina.Universidad de Chile,",uchile,u.uchile.c,936,Gene regulation tRNA modification pathogenesis 
9232372474901007921,Nelly Bustos Zapata,"Profesora Asistente INTA, Universidad de Chile",uchile,inta.uchil,931,Entornos escolares saludables 
9232372474901007921,Eduardo Martinez,"Profesor Asistente, Universidad de Chile",uchile,uchile.cl,930,soil science soil conservation forest science 
9232372474901007921,Sergio A. Barroilhet,"Assistant Professor of Psychiatry, University of Chile / Research Fellow, MGH - Harvard …",uchile,hcuch.cl,930,Clinical Psychiatry Bipolar Disorder Personality Disorders Prevention in Mental Health 
9232372474901007921,alvaro sepulveda,"Profesor asistente, Hospital Clínico Universidad de Chile",uchile,uchile.cl,922,intrauterine growth restriction preeclampsia echocardiography doppler 
9232372474901007921,Jorge San Martin,"Associate Professor, University of Chile",uchile,dim.uchile,920,Mathematical models of Fluid-Structue … 
9232372474901007921,Willy Kracht,Universidad de Chile,uchile,uchile.cl,918,Mineral Processing Geometallurgy Renewable Energies 
9232372474901007921,Katherine Marcelain,Universidad de Chile,uchile,med.uchile,917,
9232372474901007921,Daniel Schwartz,University of Chile,uchile,dii.uchile,915,Decision Making Prosocial Behavior Consumer Behavior Behavioral Economics 
9232372474901007921,Alejandro Hevia,"Computer Science Department, University of Chile",uchile,dcc.uchile,911,Cryptography Computer Security 
9232372474901007921,Alejandra Gonzalez Vasquez,Universidad de Chile,uchile,uchile.cl,910,biologia evolutionary ecology fitoecología 
9232372474901007921,Rodrigo Torres-Castro,Universidad de Chile,uchile,med.uchile,906,Respiratory Care Pulmonary Rehabilitation Respiratory Physiotherapy 
9232372474901007921,DANIELA SAUMA,"Departamento de Biología, Facultad de Ciencias, Universidad de Chile",uchile,uchile.cl,903,Inmunologia 
9232372474901007921,Maya Stein,University of Chile,uchile,dim.uchile,902,Graph theory Combinatorics 
9232372474901007921,Ernest A. Michael,Universidad de Chile,uchile,ing.uchile,901,astronomical instrumentation astro-photonics micro-devices terahertz 
9232372474901007921,Claudio Muñoz,CNRS and Universidad de Chile,uchile,dim.uchile,893,Dispersive equations Solitons Stability Asymptotic Stability Long time asymptotics 
9232372474901007921,Carolina Valck,Universidad de Chile,uchile,u.uchile.c,891,Inmunología 
9232372474901007921,Claus Kobrich,"profesor de Economia Agraria, Universidad de Chile",uchile,uchile.cl,888,cadenas de valor economía y salud animal 
9232372474901007921,Alejandro Tapia-Pizarro,"Associate Professor, Institute for Maternal and Child Research, University of Chile",uchile,uchile.cl,881,Biology of Reproduction uterine biology embryo implantation 
9232372474901007921,Dr Jaime Ruiz-Tagle,"Department of Economics, University of Chile",uchile,fen.uchile,876,Labor Economics Micro Entrepreneurship Household Finance 
9232372474901007921,Alicia A. Colombo Flores,"Profesor Asistente, Universidad de Chile",uchile,hcuch.cl,876,Biobank craneofacial development cancer 
9232372474901007921,Julieta Orlando,"Department of Ecological Sciences, Faculty of Sciences, Universidad de Chile",uchile,uchile.cl,868,Microbial Ecology Soil Microbiology Lichen Ecology 
9232372474901007921,Juan Cristobal Castro-Alonso,"Center for Advanced Research in Education, Universidad de Chile",uchile,ciae.uchil,865,Educational psychology Cognitive load theory Multimedia learning STEM education Visuospatial processing 
9232372474901007921,Hector Ramirez C.,"Depto Ingeniería Matemática & Centro de Modelamiento Matemático, Universidad de Chile",uchile,dim.uchile,864,Continuous optimization fisheries managment control and optimization of bioprocesses 
9232372474901007921,Roberto Araya,"Centro de Investigación Avanzada en Educación, Universidad de Chile",uchile,ciae.uchil,862,STEM Education 
9232372474901007921,Mauricio Venegas,Profesor in University of Chile Clinical Hospital,uchile,hcuch.cl,858,Hepatology 
9232372474901007921,Erwin Orlando Aballay Espinoza,Universidad de Chile,uchile,uchile.cl,854,Nematologia fitopatologia 
9232372474901007921,Marcela Del Pilar Urzúa Acevedo,Universidad de Chile,uchile,uchile.cl,852,Polímeros polielectrolitos físico química modificación de superficies biomoléculas 
9232372474901007921,Fernando Lolas  Stepke,"Director, Center for Bioethics, University of Chile",uchile,uchile.cl,848,Psychiatry Mental Health Bioethics History 
9232372474901007921,Rafael Opazo PhD,Profesor asistente Universidad de Chile,uchile,inta.uchil,841,Aquaculture Molecular Biology Omics technologies 
9232372474901007921,Mauricio Henriquez,"Lab. Bronchovascular Dynamics & Lung Damage, ICBM, Fac of Medicine, University of …",uchile,uchile.cl,840,Purinergic signalling Lung Physiology 
9232372474901007921,Tamara Alejandra Tadich Gallo,Universidad de Chile,uchile,u.uchile.c,834,bienestar animal 
9232372474901007921,Pablo A. Mendoza,"Department of Civil Engineering, Universidad de Chile",uchile,uchile.cl,831,Hydrological modeling climate change streamflow forecasting hydroclimatology snow hydrology 
9232372474901007921,José Valdés,"Associate Professor, University of Chile",uchile,uchile.cl,828,Neuroscience Arousal Learning and Memory MOtivation 
9232372474901007921,ANGELA DELUCCHI,Facultad de Medicina.Universidad de Chile,uchile,uchile.cl,827,Nefrologia Pediatrica 
9232372474901007921,German Manriquez,"Universidad de Chile, Centro de Análisis Cuantitativo en Antropología Dental y Dpto …",uchile,odontologi,823,Evolution Morphometrics Statistics Dental Anthropology 
9232372474901007921,Galia Ramirez Toloza,Universidad de Chile,uchile,uchile.cl,822,Immunology parasitology 
9232372474901007921,Johan Fabry,"Raincode Labs, previously DCC - Universidad de Chile",uchile,dcc.uchile,820,Programming Languages Source code analysis and manipulation 
9232372474901007921,Sebastian Riquelme,"Seismologist, Operations Manager at National Seismological Center, University of Chile",uchile,dgf.uchile,820,Earthquakes Tsunamis Seismogeodesy Early Warning 
9232372474901007921,Sigifredo Laengle,University of Chile,uchile,fen.uchile,815,Business Process Management Optimization 
9232372474901007921,Patricio Retamal,"Departamento de Medicina Preventiva Animal, Facultad de Ciencias Veterinarias y …",uchile,uchile.cl,814,microbiology infectious diseases zoonotic diseases salmonellosis tuberculosis 
9232372474901007921,Patricio de Souza,Universidad de Chile,uchile,uchile.cl,809,Hunters-gatherers Archaeology - Lithic … 
9232372474901007921,sbuvinic,"Facultad de Odontología, Universidad de Chile",uchile,u.uchile.c,809,
9232372474901007921,Patricio V. Poblete,"Professor of Computer Science, University of Chile",uchile,dcc.uchile,808,Data Structures Analysis of Algorithms Computer Networks 
9232372474901007921,Carlos A. Manzano,"Universidad de Chile, San Diego State University",uchile,uchile.cl,801,urban pollution environmental chemistry public health 
9232372474901007921,Yasna Contreras Gatica,"Profesora Asociada Departamento de Geografía, Universidad de Chile",uchile,uchilefau.,796,Migración Gentrificación Geografía Humana Geografía Urbana 
9232372474901007921,Martín  Matamala,Universidad de Chile,uchile,uchile.cl,793,Graph Theory Algorithmic Graph Theory 
9232372474901007921,Oscar Aguilera Ruiz,Universidad de Chile,uchile,u.uchile.c,791,Estudios de Juventud Movimientos Sociales Cultura y comunicación 
9232372474901007921,Felipe Tobar,Universidad de Chile,uchile,dim.uchile,789,Signal Processing Machine Learning 
9232372474901007921,Magdalena Sanhueza,Universidad de Chile,uchile,uchile.cl,789,Plasticidad sináptica en el cerebro de … 
9232372474901007921,J. Cristian Salgado,"Assistant Professor, University of Chile",uchile,ing.uchile,787,mathematical modeling biology proteins chromatography 
9232372474901007921,Rodrigo A. Asún,Universidad de Chile,uchile,uchile.cl,781,psychometrics social movements teacher assessment 
9232372474901007921,Giorgio Boccardo Bosoni,"Profesor Asistente, Departamento de Sociología, Universidad de Chile",uchile,u.uchile.c,776,Clases sociales conflicto social trabajo América Latina Chile 
9232372474901007921,Juan Carlos Castillo,"Departamento de Sociología, Universidad de Chile",uchile,uchile.cl,776,
9232372474901007921,Tatiana Adasme Rocha,"Centro de Investigación Clínica Avanzada, HCUCH; Instituto de Neurociencia Biomedica …",uchile,ciq.uchile,771,Synaptic plasticity spine remodeling learning and memory Calcium signaling Neurodegenerative disease 
9232372474901007921,Daniel Moncada,"Assistant Professor of Geology, Departamento de Geología, Universidad de Chile",uchile,ing.uchile,770,geochemistry fluid inclusions melt inclusions mineral deposits 
9232372474901007921,Ali Akbari-Fakhrabadi,"Advanced Materials Laboratory (AmLab), Department of Mechanical Engineering,University …",uchile,uchile.cl,770,Structural … and Electrical Properties of Materials for … 
9232372474901007921,Pablo S. Moya,"Assistant Professor, Faculty of Sciences, Department of Physics, University of Chile",uchile,uchile.cl,768,Plasma Physics Astrophysical plasma Space Plasma Physics Solar wind Statistical Mechanics 
9232372474901007921,Sergio Soto Acuña,"Red Paleontológica U-Chile, Depto. de Biología, Facultad de Ciencias, Universidad de …",uchile,ug.uchile.,768,Paleontología de vertebrados Evolución 
9232372474901007921,Carolina Paz Valenzuela,Universidad de Chile,uchile,u.uchile.c,765,
9232372474901007921,José Manuel Zavala,Universidad de Chile,uchile,uchile.cl,764,Etnohistoria. Antropologia Histórica 
9232372474901007921,Rosana Muñoz Videla,"Departamento de Tecnología Médica, Facultad de Medicina, Universidad de Chile",uchile,uchile.cl,764,Biología del Desarrollo Embriología Biología Celular Biología Molecular 
9232372474901007921,Silvia Lamadrid,"Professor of Sociology, Universidad de Chile",uchile,u.uchile.c,759,gender history 
9232372474901007921,Sandra Lopez-Arana,"Department of Nutrition, University of Chile",uchile,med.uchile,755,Public Health Nutrition 
9232372474901007921,Francisco P. Chávez,"Profesor Asociado, Departamento de Biología, Facultad de Ciencias, Universidad de Chile",uchile,u.uchile.c,754,Microbiología Patógenos Microbioma Omicas 
9232372474901007921,Osvaldo Salazar,Universidad de Chile,uchile,uchile.cl,747,soil sciences soil fertility water quality nitrogen leaching 
9232372474901007921,Federico Olmedo,University of Chile,uchile,dcc.uchile,745,Program Verification Probabilistic Programs Program Semantics 
9232372474901007921,Felix A. Urra,Universidad de Chile,uchile,u.uchile.c,742,
9232372474901007921,Nicolás Tobar Bächler,"Profesor asistente, INTA, Universidad de Chile",uchile,inta.uchil,740,Breast Cancer Obesity Inflammation Drosophila model 
9232372474901007921,Damian Clarke,"Associate Professor of Economics, University of Chile",uchile,fen.uchile,737,Health Economics Development Economics Applied Econometrics 
9232372474901007921,Freddy Coronado,"Assistant Profesor, Universidad de Chile",uchile,fen.uchile,731,Management Control Innovation Bibliometrics Higher Education 
9232372474901007921,Daniela Thumala,Departamento de Psicología Universidad de Chile,uchile,uchile.cl,730,Healthy coping in old age Social inclusion/exclusion of the elderly Psychosocial factors associated with healthy … 
9232372474901007921,Natalia Díaz-Valdivia,Universidad de Chile,uchile,ciq.uchile,725,Caveolin-1 Cancer Cell Migration Cell Invasion Metastasis 
9232372474901007921,Paulina Correa-Burrows,Universidad de Chile (INTA),uchile,inta.uchil,724,Public Health Nutrition Human Nutrition Epidemiology & Biostatistics Multidisciplinary Science 
9232372474901007921,RH Palma,Universidad de Chile,uchile,ing.uchile,723,materiales powdermetalurgy creep sintering copper 
9232372474901007921,Cecilia Luengo,"Medico Intensivista Adultos, Universidad de Chile",uchile,hcuch.cl,722,educación en ciencias de la salud sepsis shock séptico reanimación microcirculación 
9232372474901007921,Leonardo E. Letelier S.,"Instituto de Asuntos Públicos, Universidad de Chile",uchile,iap.uchile,721,Finanzas Públicas Descentralización Fiscal Economía Política 
9232372474901007921,Mauricio Correa,AMTC - Universidad de Chile,uchile,ing.uchile,720,Robotics - Computer Vision - Machine … 
9232372474901007921,Marianela Castillo-Riquelme,Universidad de Chile,uchile,uchile.cl,717,Salud Pública Economía de la Salud Evaluación de Tecnologías en Salud 
9232372474901007921,Pamela Romanque,"Instituto de Ciencias Biomédicas, Facultad de Medicina, Universidad de Chile",uchile,med.uchile,713,Liver injury liver regeneration liver transplantation 
9232372474901007921,Mario A. Laborda,"Associate Professor, Department of Psychology, Universidad de Chile",uchile,u.uchile.c,711,Associative Learning Behavior Therapy Experimental Psychology Comparative Psychology History of Psychology 
9232372474901007921,M.Beatriz Fernández,Universidad de Chile,uchile,uchile.cl,709,
9232372474901007921,Alexia  Nunez-Parra,University of Chile,uchile,uchile.cl,707,Neuroscience 
9232372474901007921,Sergio A. Álvarez,Universidad de Chile,uchile,uchile.cl,704,bacterial pathogenesis 
9232372474901007921,Hugo F. Arellano,Department of Physics - FCFM - University of Chile,uchile,dfi.uchile,703,Nuclear Physics Nuclear Astrophysics 
9232372474901007921,Leonora Reyes,"Profesora, Universidad de Chile",uchile,uchile.cl,702,Historia de la educación políticas educacionales movimientos pedagógicos movimientos docentes movimientos de educación 
9232372474901007921,Marcela Pardo,"Investigadora, Centro de Investigación Avanzada en Educación, Universidad de Chile",uchile,ciae.uchil,702,Educación inicial 
