id_gs,autor,cargo,id_institucion,email,citaciones,intereses
9232372474901007921,Jesus Perez-Martin,"Ph.D. candidate, Department of Computer Science, University of Chile",uchile,dcc.uchile,36,Computer Vision Computational Linguistics Vision and Language Machine Learning Face Recognition 
9232372474901007921,Constanza Rivas Q.,Universidad de Chile- Instituto de Investigaciones Agropecuarias,uchile,u.uchile.c,36,Plant Breeding Native flora Micropropagation 
9232372474901007921,Mauricio Iván Weibel,Universidad de Chile,uchile,uchile.cl,36,Periodismo de investigación memoria y derechos humanos 
9232372474901007921,Camilo Morales Retamal,"Académico adjunto, Facultad de Ciencias Sociales, Universidad de Chile",uchile,uchile.cl,36,políticas públicas investigación social en infancia sistemas de protección participación 
9232372474901007921,Daniela Siel,Universidad de Chile,uchile,uchile.cl,36,Inmunologia Veterinaria 
9232372474901007921,Tamara Jorquera-Álvarez,Universidad de Chile,uchile,uchile.cl,35,psicología social metodologías de investigación social derechos humanos violencias políticas prácticas de resistencia 
9232372474901007921,Pablo Lobos-Ruiz,Universidad de Chile,uchile,uchile.cl,35,Structural Biology Biophysics Amyloids Microbiology 
9232372474901007921,Fernando Carvallo Arrau,Universidad de Chile,uchile,ug.uchile.,35,Derecho Sociologia Educación Economía Política 
9232372474901007921,Melissa Gómez,Universidad de Chile,uchile,ug.uchile.,35,
9232372474901007921,Julian Cortes Oggero,Universidad de Chile,uchile,uchile.cl,33,Derecho Reducción de Riesgos Gobernanza Policéntrica Educación Ambiental Teoria de Sistemas 
9232372474901007921,Raúl Villarroel,"Professor of Philosophy, Universidad de Chile",uchile,uchile.cl,33,Contemporary Philosophy Éthics Bioethics Biopolitics 
9232372474901007921,Max Aguirre,"Profesor Historia y Teoría, Universidad de Chile, Universidad Finis Terrae",uchile,uchilefau.,33,historia y teoría arquitectura moderna Chile siglo XX Latino América 
9232372474901007921,Esteban Aguilera,University of Chile,uchile,ug.uchile.,33,Condensed Matter Topology Spintronics 
9232372474901007921,Francisco Antonio Catalán Meyer,"Departamento de Química, Universidad de Chile",uchile,ug.uchile.,33,climate change air pollution machine learning 
9232372474901007921,Tomas Hernandez-Díaz,Universidad de Chile,uchile,ug.uchile.,33,Virología Microbiología Biología Celular Inmunología RNA 
9232372474901007921,Francisco Cuevas Cervera,Universidad de Chile,uchile,u.uchile.c,32,
9232372474901007921,Luis Osandón Millavil,Universidad de Chile,uchile,uchile.cl,32,currículum escolar didáctica teoría de la educación 
9232372474901007921,Sergio Caruman Jorquera,"Profesor de Literatura, Universidad de Chile",uchile,uchile.cl,32,Teoría literaria análisis del discurso comprensión de lectura currículo y evaluación 
9232372474901007921,ROBERTO CERON REYES,Universidad de Chile y Universidad de los Andes (Chile),uchile,derecho.uc,32,Derecho del trabajo e historia del derecho 
9232372474901007921,Monica Manhey Moreno,Universidad de Chile,uchile,u.uchile.c,32,educación infancia evaluación currículum 
9232372474901007921,DANIEL ANDRES RAPPOPORT WURGAFT,"Professor of Surgery, Universidad de Chile",uchile,uchile.cl,32,Head and Neck surgery 
9232372474901007921,Josué Pino Castillo,"Profesor Asistente, Universidad de Chile",uchile,uchile.cl,31,fonética fonología fonética clínica tecnologías del habla Praat 
9232372474901007921,Séverin Lions,"Postdoctoral researcher, Centro de Investigación Avanzada en Educación, Universidad de …",uchile,ciae.uchil,31,Position effects multiple-choice questions 
9232372474901007921,Fernanda Uribe Gajardo,Universidad de Chile,uchile,uchile.cl,31,Escritura académica Educación Inclusión 
9232372474901007921,Daniel Zavala,Académico profesor asistente Facultad de Medicina Universidad de Chile,uchile,uchile.cl,31,ergonomía terapia ocupacional 
9232372474901007921,Santiago Maldonado-Magnere,"PhD student, Universidad  de Chile",uchile,ug.uchile.,31,Graphene  Synthetic and Natural Polymers 
9232372474901007921,Ítalo Tamburrino,Universidad de Chile,uchile,uchile.cl,31,Ecología Evolución Biogeografía Sistemática 
9232372474901007921,Renee Marlene Rivero Hurtado,"Facultad de Derecho, Universidad de Chile",uchile,derecho.uc,30,Derecho Procesal 
9232372474901007921,Pablo Maturana,Universidad de Chile,uchile,ug.uchile.,30,
9232372474901007921,Eduardo Villa,Universidad de Chile,uchile,ug.uchile.,30,
9232372474901007921,Verónica María Gallegos,universidad de chile,uchile,uchile.cl,30,gestión de organizaciones educativas 
9232372474901007921,Benjamin Constant,University of Chile,uchile,ing.uchile,30,Chemical engineering 
9232372474901007921,Marcial Cariqueo,Hospital Clinico Universidad de Chile,uchile,hcuch.cl,29,
9232372474901007921,Sebastian C. Carrasco,Universidad de Chile,uchile,ug.uchile.,29,Mecánica cuántica Física del estado sólido Mecánica estadística 
9232372474901007921,Fernando Gimeno,"Asistente Investigación, Universidad de Chile",uchile,ug.uchile.,29,Hidrología Landuse Landcover Change 
9232372474901007921,José Ignacio Lillo-Moya,"Facultad de Medicina, Universidad de Chile",uchile,ug.uchile.,29,oxidative stress 
9232372474901007921,Moisés H. Sandoval,"Assistant Professor INTA, Universidad de Chile",uchile,inta.uchil,29,SES and Mortality Aging and Health Population and Ethnicity Formal Demography 
9232372474901007921,Juan E. Salazar,"Lab. de Neurobiología y Biología del Conocer, Lab. de Zoología de Vertebrados …",uchile,ug.uchile.,28,Neuroethology Ornithology Comparative Neuroanatomy Neuroscience Education 
9232372474901007921,Patricio Javier Espinosa Polanco,Universidad de Chile,uchile,ug.uchile.,28,antropología sociología teoría de sistemas sociales 
9232372474901007921,Sofia Letelier,"Profesora Titular Arquitectura, Universidad de Chile",uchile,uchilefau.,28,Percepción Escala arquitectónica Docencia 
9232372474901007921,Wladimir Corrales Ibáñez,Universidad de Chile,uchile,ug.uchile.,27,Neuroplasticity Bioinformatics 
9232372474901007921,César Abusleme,Universidad de Chile,uchile,um.uchile.,27,Trasparencia Gobierno Digital Gobierno Abierto Tecnología 
9232372474901007921,navarro venegas,Universidad de Chile,uchile,uchile.cl,27,Microbiology 
9232372474901007921,Leonel Miguel Ruiz Rodriguez,"Estudiante de Derecho, Universidad de Chile",uchile,ug.uchile.,27,Derecho ciencias del derecho derechos humanos legal trafico de personas 
9232372474901007921,Leandro Antonio Cadiz Nuñez,Jefe Técnico Laboratorio Patología Aviar Universidad de Chile,uchile,veterinari,27,Microbiologia Inmunologia Patología Aviar Enfermedades infecciosas 
9232372474901007921,Scarlett Mac-Ginty,"King's College London, Universidad de Chile",uchile,u.uchile.c,27,Public health social inequalities mental health dentistry 
9232372474901007921,Felipe A. Santibáñez-Leal,"ALGES/AMTC, Universidad de Chile",uchile,ug.uchile.,26,Bayesian Modelling Machine/Deep learning Mathematical Biology Geostatistics information and sensing theory and … 
9232372474901007921,Leah LR Renwick,"Postdoctoral Researcher, Universidad de Chile",uchile,uchile.cl,26,agroecology soil health soil carbon plant ecophysiology soil-plant-water interactions 
9232372474901007921,María Agnes Salah Abusleme,Universidad de Chile,uchile,derecho.uc,26,derecho 
9232372474901007921,Carla Milar Peñaloza Palma,universidad de chile,uchile,uchile.cl,26,Historia Reciente Memoria Derechos Humanos Género 
9232372474901007921,Nicolás Igor Tapia-Rivas,Universidad de Chile,uchile,ug.uchile.,26,Machine Learning Signal Processing Biomedical Engineering Information Theory 
9232372474901007921,Jacqueline Arriagada,Universidad de Chile,uchile,ing.uchile,26,Public transport Smart card data Route choice modelling 
9232372474901007921,Jessy Zumaeta,University of Chile,uchile,unegocios.,25,Organizational Behavior Leadership Organizational Theory Future of Work 
9232372474901007921,Daniela Quenti,Universidad de Chile,uchile,inta.uchil,25,Metabolism Microbiome Drosophila Cancer 
9232372474901007921,Ricardo Amigo Dürre,Universidad de Chile,uchile,ug.uchile.,25,estudios afrolatinoamericanos antropología de la danza 
9232372474901007921,Juan Sebastián Reyes Valenzuela,Universidad de Chile,uchile,ug.uchile.,25,Biochemestry Biophysics. 
9232372474901007921,Sebastián Urquiza,Universidad de Chile,uchile,ug.uchile.,25,Bioinformática Biología Molecular Biología Celular Biotecnología 
9232372474901007921,Mónica Manhey Moreno,"académica asociada, Universidad de Chile.",uchile,u.uchile.c,25,currículum evaluación infancia. 
9232372474901007921,Carlos González Cortés,"Investigador, Laboratorio de Exploración Espacial y Planetaria, Universidad de Chile",uchile,uchile.cl,24,cubesat nanosatellite space embedded … 
9232372474901007921,Camillo Robertini,"Instituto de Estudios Internacionales, Universidad de Chile",uchile,uchile.cl,24,storia storia dell'America latina storia orale storia del movimento operaio 
9232372474901007921,Juan David Zabala-Sandoval,"Estudiante, Doctorado en Ciencias Sociales, Universidad de Chile",uchile,ug.uchile.,24,Ciencias Sociales Psicología Social Educación Individuación. 
9232372474901007921,Juan Carlos Carmona,Universidad de Chile,uchile,uchile.cl,24,productos vegetales betaxantinas colorantes alimentarios cactus pear mucilage 
9232372474901007921,Patricia Peña Miranda,"Universidad de Chile, Instituto de la Comunicación e Imagen",uchile,uchile.cl,24,Comunicación Internet tecnologias digitales data tecnofeminismo 
9232372474901007921,Fabián Villena Rodríguez,"Centro de Modelamiento Matemático, Universidad de Chile",uchile,uchile.cl,24,Natural Language Processing Machine Learning Medical Informatics 
9232372474901007921,Fernando Feres,Universidad de Chile,uchile,ing.uchile,24,Transportation Economics Industrial Organization 
9232372474901007921,María Cristina Díaz Jarabran,Universidad de Chile,uchile,uchile.cl,24,Micologia hongos levaduras 
9232372474901007921,Oscar Cartagena,Universidad de Chile,uchile,ug.uchile.,24,Predictive Control Interval Modeling Computational Intelligence 
9232372474901007921,Juglar Diaz,Ph.D. Candidate Universidad de Chile,uchile,dcc.uchile,23,Data Mining Natural Language Processing Neural Networks Artificial Intelligence Machine Learning 
9232372474901007921,Tomas Vera,Universidad de Chile,uchile,dcc.uchile,23,RE Scoping Software effort estimation Empirical Software Engineering 
9232372474901007921,Eduardo Saldías,"Ph.D, MSc, Universidad de Chile",uchile,uchile.cl,23,biological anthropology human anatomy osteology bioarchaeology forensic anthropology 
9232372474901007921,Pablo N. Pizarro,"MSc. Student in Structural Engineering and Computer Science, Universidad de Chile",uchile,ing.uchile,23,structural design machine learning computer vision computer graphics computer aided design 
9232372474901007921,Margarita María Vélez Maya,Universidad de Chile,uchile,ug.uchile.,23,Memorias colectivas Psicología social Derechos Humanos 
9232372474901007921,Temistocles Molina González,"Bioestadístico, Académico, Universidad de Chile",uchile,med.uchile,23,Bioestadística 
9232372474901007921,Ehsan Azad,Universidad de Chile,uchile,ug.uchile.,22,Geomechanics Rock mechanics Mining engineering Fracture Mechanics 
9232372474901007921,Iván Castro,"Electrical Engineering and MSc, Universidad de Chile",uchile,ug.uchile.,22,Machine Learning Kernel Methods Mathematical Modelling Biomedical Signal Processing 
9232372474901007921,Miguel Cordero Vega,University of Chile,uchile,inta.uchil,22,Health outcomes child development epidemiology 
9232372474901007921,Iván Romo-Medina,Universidad de Chile,uchile,ug.uchile.,22,Psicología comunitaria Psicología Educacional Psicología social 
9232372474901007921,Daniela C. Pérez-Orellana,Universidad de Chile,uchile,ug.uchile.,22,
9232372474901007921,Marcelo Sanhueza,Universidad de Chile,uchile,ug.uchile.,22,Estudios literarios Historia intelectual Estudios postcoloniales Literatura latinoamericana 
9232372474901007921,Matias Fuentes Becerra,"Estudiante de Economía, Universidad de Chile",uchile,fen.uchile,22,economía política teoría de juegos teoría de redes economía de género 
9232372474901007921,Paola A.Benavides,Universidad de Chile,uchile,ug.uchile.,22,Aleación Mecánica Sinterización Materiales Compuestos Biomateriales 
9232372474901007921,D. CACERES,"Estudiante Doctorado en Nutrición y Alimentos, Universidad de Chile",uchile,ug.uchile.,21,Alimentos procesamiento de alimentos compuestos bioactivos Agronomía postcosecha de frutas 
9232372474901007921,Luis F Piña,"Profesor de Manejo de Praderas y Pasturas, Universidad de Chile",uchile,uchile.cl,21,Praderas y forrajes manejo del pastoreo conducta de pastoreo manejo silvopastoril 
9232372474901007921,Wai-Houng Francisco Chou Kam,Universidad de Chile,uchile,postqyf.uc,21,Nanomedicine nanotechnology biopharmaceutics drug delivery natural products 
9232372474901007921,Jenaro Antonio Espitia Corredor,"PhD candidate, University of Chile, Chile",uchile,ug.uchile.,21,Pharmacology Cardiovascular Inflammation Senescence 
9232372474901007921,Cristopher Gómez,Universidad de Chile,uchile,ug.uchile.,20,Robotics 
9232372474901007921,Marcela Andrea Antúnez-Riveros,Universidad de Chile. Departamento de Educación en Ciencias de la Salud,uchile,med.uchile,20,educación en ciencias de la salud rehabilitación músculoesquelética 
9232372474901007921,Claudio Méndez-Rojas,Universidad de Chile,uchile,ciq.uchile,20,Medicinal Chemistry Pharmacology Drug Design Oncology Clinical Pharmacy 
9232372474901007921,Francisco  Bustos,"Facultad de Derecho, Universidad de Chile",uchile,derecho.uc,20,Human Rights Law International Cirminal Law Transitional Justice 
9232372474901007921,Camila Bravo L.,Universidad de Chile,uchile,ug.uchile.,20,behavioral ecology molecular ecology mountain birds ecology spatial ecology 
9232372474901007921,Pedro Soza,"Departamento de Arquitectura, Universidad de Chile",uchile,uchile.cl,19,Design cognition Design computing 
9232372474901007921,Felipe Vera Cid,Universidad de Chile,uchile,ing.uchile,19,data science health informatics public health 
9232372474901007921,Jorge Hernandez Muñoz,"Asesor de estudios, Universidad de Chile",uchile,uchile.cl,19,
9232372474901007921,Sebastian Nicolás Campos Micin,"Profesor de Derecho Civil, Universidad de Chile",uchile,derecho.uc,19,Derecho Civil 
9232372474901007921,Jhonny Williams Acevedo,"Profesor Facultad de Medicina, Universidad de Chile",uchile,uchile.cl,19,Salud Pública gestión en salud ciencias de la salud educación médica Atención Primaria de Salud 
9232372474901007921,Leonardo Cofré Pérez,Universidad de Chile; University of Edinburgh,uchile,derecho.uc,18,constitutional law public law political participation access to justice legal aid 
9232372474901007921,Jorge Ossandón (https://orcid.org/0000-0002-7265-3970),Universidad de Chile,uchile,ug.uchile.,18,Derecho Ambiental 
9232372474901007921,Alberto Castro R.,University of Chile (UChile) & Pontifical Catholic University of Chile (PUC),uchile,uchile.cl,18,Machine learning Statistics data analysis Time series Forecasting Modeling and simulation of communication … 
9232372474901007921,Edgardo Opazo-Diaz,"Profesor Asistente, Departamento de Kinesiología, Universidad de Chile",uchile,uchile.cl,18,Efectos de la Actividad Física 
9232372474901007921,Carolina Muñoz Rojas,Universidad de Chile,uchile,uchile.cl,18,estudios de género políticas públicas políticas de igualdad 
9232372474901007921,Pedro Calandra Bustos,"Profesor Universidad de Chile, Bibliotecario Documentalista",uchile,uchile.cl,17,TIC Historia Bibliotecario Agronomia Extensión 
9232372474901007921,CRISTHIAN CERNA MOSCOSO,Universidad de Chile,uchile,u.uchile.c,17,… Programa de Magíster en Ciencias Sociales 
9232372474901007921,Teresa Bracamonte,"Phd Computer Science, University of Chile",uchile,dcc.uchile,17,Multimedia Retrieval Data Mining 
9232372474901007921,Lisbel Bárzaga Martell,Universidad de Chile,uchile,ug.uchile.,17,Fractional/Adaptive control Observers 
9232372474901007921,Valeska Zambra,Universidad de Chile,uchile,ug.uchile.,17,Physics liquid crystals topological defects vortices optics 
9232372474901007921,Nicolas Gonzalez Alonso-de-Linaje,"Research Assistant, University of Chile - MSc (in progress), Technical University of Denmark …",uchile,ug.uchile.,17,Atmospheric Sciences Wind Energy Micrometeorology WRF model 
9232372474901007921,Francisco Pastén-Araya,"Investigador Postdoctoral, Departamento de Geofísica, Universidad de Chile",uchile,dgf.uchile,17,Sismotectónica Sismología Fallas Geológicas Geología 
9232372474901007921,Omar Miranda,"M.Sc. (c) of Computer Science, Universidad de Chile",uchile,dcc.uchile,16,Social Network Analysis Data Mining 
9232372474901007921,Nalda Marcela Romero Palacios,Universidad de Chile,uchile,uchile.cl,16,Química de Alimentos materias grasas antioxidantes 
9232372474901007921,Raimil Cruz,"Software Engineer, Microsoft. PhD Graduate of Computer Science, University of Chile",uchile,dcc.uchile,16,Programming Languages Information flow control 
9232372474901007921,Gonzalo Olave Wolff,"Departament of Electrical Engineering, Universidad de Chile",uchile,ing.uchile,16,Robótica 
9232372474901007921,María José Vilches García,Universidad de Chile,uchile,ug.uchile.,16,
9232372474901007921,Andrea Alejandra Correa Ramírez,"Facultad de Odontología, Universidad de Chile",uchile,odontologi,16,Salud pública odontología caries dental psicología de la salud 
9232372474901007921,Jorge J. Roman,Researcher at University of Chile,uchile,fen.uchile,16,Business Excellence Quality Management Benchmarking metrics management control process innovation 
9232372474901007921,maria angelica michea rivera,"Assistant Professor, Faculty of Dentistry, University of Chile",uchile,odontologi,16,dental periodontics education 
9232372474901007921,José Díaz Fernández,Universidad deChile,uchile,ug.uchile.,16,Filosofía Política de la Educación … 
9232372474901007921,Belisario Panay Schweizer,Universidad de Chile,uchile,dcc.uchile,16,Machine learning 
9232372474901007921,Andrea Puebla-Huerta,"Estudiante, Universidad de Chile",uchile,ug.uchile.,16,Bioquímica Biología celular 
9232372474901007921,Vincenzo Benedetti,Universidad de Chile,uchile,ug.uchile.,15,
9232372474901007921,Fabian Vicencio,Universidad de Chile,uchile,fen.uchile,15,
9232372474901007921,Matías Pavez Bahamondes,"EE and CS Student, University of Chile",uchile,ing.uchile,15,Artificial Intelligence Computer Vision Robotics 
9232372474901007921,Hernan Sarmiento,Universidad de Chile,uchile,dcc.uchile,15,Information Retrieval Data Mining Crisis Informatics Social Network Analysis 
9232372474901007921,Thiare Espinoza,Universidad de Chile,uchile,fen.uchile,15,Human resources Gender and work non profit organizations work inclusion 
9232372474901007921,Silvania Mejías G.,Universidad de Chile,uchile,uchile.cl,15,Sociología Ciencia Política Ciencias Sociales 
9232372474901007921,Lorena Berríos Barra,"Profesora Asistente, Departamento de Estudios Pedagógicos, Universidad de Chile",uchile,uchile.cl,15,Multimodalidad literacidad digital clásicos grecolatinos Literatura hipertexto didáctico 
9232372474901007921,Claudia Sepulveda Cerda,Académico Departamento de Enfermería Universidad de Chile,uchile,med.uchile,15,gestión en salud cuidados del niño y adolescente informática en salud 
9232372474901007921,Jorge Quinteros,Universidad de Chile,uchile,ug.uchile.,15,Machine Learning Deep Learning e-Health Blockchain 
9232372474901007921,Oscar Hernández Lanas,"Académico Instructor, Universidad de Chile",uchile,uchile.cl,15,Tecnología Asistiva Razonamiento Profesional Neurorehabilitación Terapia Ocupacional Deporte Adaptado 
9232372474901007921,NATALIA PAZ FORNO,Universidad de Chile,uchile,veterinari,15,Farmacología Veterinaria Inocuidad de Alimentos Alternativas Terapéuticas Terapéutica Veterinaria 
9232372474901007921,Sebastián Bustamante,University of Chile,uchile,dim.uchile,14,Graph Theory Combinatorics 
9232372474901007921,Yadira Palenzuela Fundora (ORCID: 0000-0002-4812-7604),ypalenzuela@ug.uchile.cl,uchile,ug.uchile.,14,Psicología Social Redes Sociales Etnografía Virtual Metodologías de Investigación Cualitativa 
9232372474901007921,Vladimir Venegas Figueroa,"Sociólogo, Universidad de Chile",uchile,veterinari,14,Educacion Movilidad social Urbanismo Economia 
9232372474901007921,Nicolas Rojas Covarrubias,"Universidad de Chile, Facultad de Derecho",uchile,derecho.uc,14,contratos consumo consumidores competencia antitrust 
9232372474901007921,Daniel Alejandro Larenas Rosa,"Facultad de Medicina, Universidad de Chile",uchile,uchile.cl,14,public policy public health human migration health promotion 
9232372474901007921,Constanza Luisa Villegas Mardones,Universidad de Chile,uchile,ug.uchile.,14,
9232372474901007921,Francisca González Cohens,"Web Intelligence Centre, Facultad de Ciencias Físicas y Matemáticas, Universidad de Chile",uchile,ug.uchile.,14,procuramiento de órganos y tegidos trasplante sistemas de salud 
9232372474901007921,Rubén Alejandro Valenzuela Matamala,Hospital San Juan de Dios - Universidad de Chile - Clínica BUPA Santiago,uchile,ug.uchile.,14,Cirugía de Tórax 
9232372474901007921,Antonio Letelier Soto,Universidad de Chile,uchile,u.uchile.c,14,Psicología ética bioética biopolítica 
9232372474901007921,Simoné Malacchini,"Académica, Departamento de Diseño, Universidad de Chile; Académica, Escuela de …",uchile,uchilefau.,13,Diseño Historia Patrimonio Cultura Material y Visual Identidad 
9232372474901007921,Luis Madrid,Doctorando Universidad de Chile,uchile,ug.uchile.,13,Historia de Chile estudios afrolatinamericanos 
9232372474901007921,Francisco Lagos Susaeta,Universidad de Chile,uchile,uchile.cl,13,Sostenibilidad agroalimentaria agricultura familiar agroecología 
9232372474901007921,Francisco Sereño Ahumada,Universidad de Chile,uchile,uchile.cl,13,Tecnología educación 
9232372474901007921,Rodrigo Torres,"Profesor e Investigador, Universidad de Chile",uchile,uchile.cl,12,Macroeconomía y salud Bioestadística Salud Ambiental 
9232372474901007921,Felipe Stefano Ruiz Bruzzone,"Magíster en Ciencias Sociales, Universidad de Chile",uchile,ug.uchile.,12,Economía Política Metodología de la Investigación 
9232372474901007921,Adrian Baeza Araya,Universidad de Chile,uchile,uchile.cl,12,didáctica didáctica de lengua y literatura pedagogía estudios latinoamericanos 
9232372474901007921,Jessica Trespalacios,"PhD. Student, University of Chile",uchile,dim.uchile,12,Partial DIfferential Equations 
9232372474901007921,Nastassja Mancilla Ivaca,Universidad de Chile,uchile,ug.uchile.,12,territorios comunicación social análisis de discursos prácticas de resistencias memorias colectivas 
9232372474901007921,Pedro Acuña,"Postdoctoral Fellow, University of Chile",uchile,uchile.cl,12,Latin American History sports history mass culture and media masculinities 
9232372474901007921,Daniel Briones,Universidad de Chile,uchile,ug.uchile.,12,Historia cultural historia del deporte historia de Chile 
9232372474901007921,Felipe Andrés Medina Marín,"Professor of Biostatistics, Universidad de Chile",uchile,uchile.cl,12,statistical inference machine learning 
9232372474901007921,Paula Ahumada,"Profesora asistente, Facultad de Derecho, Universidad de Chile",uchile,derecho.uc,12,
9232372474901007921,Consuelo González Pavicich,"MSc Human Geography and Planning, Utrecht University. Antropóloga Social, Universidad …",uchile,uchilefau.,12,Estudios Urbanos Migraciones transnacionales Movilidades 
9232372474901007921,Mauricio Arnoldo Carcamo Pino,Faculty of Architecture and Urbanism - University of Chile,uchile,uchile.cl,11,Architecture Representation Embodied Manuage Hands 
9232372474901007921,Jaime Clark,"PhD in Physics, Universidad de Chile",uchile,ug.uchile.,11,Complex Networks Dynamics Systems Nonlinear Physcis 
9232372474901007921,Daniel Burgos - Bravo,Profesor Adjunto - Universidad de Chile,uchile,uchile.cl,11,gestión y administración universitaria gobernanza universitaria formación de directivos públicos competencias directivas 
9232372474901007921,David Valenzuela-Urrutia,Universidad de Chile,uchile,ing.uchile,11,Artificial Intelligence Optimization algorithms Machine Learning 
9232372474901007921,Cristóbal Quezada Herrera,"Magíster (c) en Historia, Universidad de Chile",uchile,ug.uchile.,11,historia de la medicina estudios sociales de ciencia y tecnología apropiación tecnológica cáncer 
9232372474901007921,Tania Veronica Ibañez Gericke,Universidad de Chile,uchile,u.uchile.c,11,
9232372474901007921,María Francisca Lohaus-Reyes,Universidad de Chile,uchile,ug.uchile.,11,Educación Diversidad 
9232372474901007921,Camila Belén Lizama Zamora,Universidad de Chile,uchile,ug.uchile.,11,Sociología Salud Educación Familia Envejecimiento 
9232372474901007921,Constanza Ulriksen Moretti,"Postdoctorante, Universidad de Chile",uchile,uchilefau.,11,sociología urbana policy mobility movilidad urbana ciudad y tecnología 
9232372474901007921,Danner Schlotterbeck Mendez,"Mathematical Modeling Assistant, CIAE IE, University of Chile",uchile,ug.uchile.,11,Machine Learning Deep Learning Audio Processing Natural Language Processing Approximation Algorithms 
9232372474901007921,Francisco Venegas M,Universidad de Chile - Universidad Complutense de Madrid,uchile,dim.uchile,11,Análisis funcional 
9232372474901007921,Felipe Smith,University of Chile,uchile,dcc.uchile,10,Education Image Processing Data Mining Robotics 
9232372474901007921,Monica Osorio Vargas,Universidad de Chile,uchile,uchile.cl,10,orientación psicología pedagogía evaluación 
