id_gs,autor,cargo,id_institucion,email,citaciones,intereses
9232372474901007921,patricio cabello,Universidad de Chile,uchile,ciae.uchil,355,habilidades digitales educación tecnología infancia conflictos ambientales 
9232372474901007921,raul gormaz,"Profesor de Matematicas, Universidad de Chile",uchile,dim.uchile,355,Matematicas aplicadas educacion matematica 
9232372474901007921,Francisco Delgado,Universidad de Chile,uchile,uchile.cl,352,volcanology active tectonics InSAR geodesy 
9232372474901007921,Ignacio Miranda-Mendoza,"Professor Gynecology, Universidad de Chile",uchile,hcuch.cl,346,Endometriosis Laparoscopy Hysteroscopy 
9232372474901007921,Natalia Jorquera Silva,"Profesor asistente Departamento de Arquitectura, Universidad de Chile",uchile,uchilefau.,345,arquitectura vernácula técnicas de construcción tradicionales arquitectura en tierra patrimonio arquitectónico riesgo 
9232372474901007921,Alberto Cerda,Tenured Assistant Professor in Law and Technology at Universidad de Chile Facultad de …,uchile,uchile.cl,343,human rights cyber law copyright intellectual property personal data protection 
9232372474901007921,Williams R. Calderón-Muñoz,"Universidad de Chile, Mechanical Engineering Department",uchile,uchile.cl,342,Electromobility Energy Conversion and Storage Thermal Management Fluid Mechanics and Heat Transfer Semiconductor Devices 
9232372474901007921,Rafael O. Ruiz,"Assistant Professor, Universidad de Chile",uchile,uchile.cl,341,uncertainty quantification and propagation computational dynamic stochastic simulation 
9232372474901007921,Ramesh Sivasamy,University of Chile,uchile,ing.uchile,339,Nanomaterials Synthesis Layered structures First-principle calculations Energy application 
9232372474901007921,Cinthya Leonor,Docente Universidad de Chile,uchile,uchile.cl,337,Data Science Análisis de datos Políticas Públicas 
9232372474901007921,RICARDO GUTIERREZ-GARCIA,Universidad de Chile,uchile,ug.uchile.,335,
9232372474901007921,Sergio Villanueva,Universidad de Chile,uchile,uchile.cl,335,Physiology 
9232372474901007921,Flavio Guiñez,"Scientist, Universidad de Chile",uchile,uchile.cl,335,Math Education Discrete Maths 
9232372474901007921,Macarena A. Valdés Salgado,"Escuela de Salud Pública, Universidad de Chile. Center for Climate and Resilience …",uchile,uchile.cl,335,Epidemiología ambiental Cambio climático Contaminación del Aire Metales pesados 
9232372474901007921,Lelya Troncoso Perez,Universidad de Chile,uchile,uchile.cl,335,género memoria interseccionalidad psicología social feminismo 
9232372474901007921,Erwin Hansen,University of Chile,uchile,fen.uchile,330,Empirical Asset Pricing International Finance 
9232372474901007921,Mabel Catalán,Universidad de Chile,uchile,ciq.uchile,329,Farmacología 
9232372474901007921,Rurik Romero,University of Chile,uchile,ing.uchile,329,Geochronology Mass spectrometry Tectonics 
9232372474901007921,Paulina Contreras,Universidad de Chile,uchile,u.uchile.c,328,Política educativa y cultura escolar 
9232372474901007921,Miguel Angel Lopez Varas,Instituto de Estudios Internacionales. Universidad de Chile,uchile,uchile.cl,328,Ciencia Política conducta electoral opinión pública métodología 
9232372474901007921,Mauricio Cerda,Universidad de Chile,uchile,uchile.cl,327,Image processing Computational Geometry Machine Learning 
9232372474901007921,Hugo Torres Contreras,"Departamento de Educación, Facultad de Ciencias Sociales, Universidad de Chile",uchile,uchile.cl,322,habilidades de pensamientos científico ecología conducta y evolución de organismos sociales 
9232372474901007921,Roberto Eduardo Yury Yáñez,Magister en Ciencias Biológicas Universidad de Chile,uchile,ug.uchile.,321,vertebrate paleontology cladistics 
9232372474901007921,Rodrigo H. Hernández,Mechanical Engineering - Universidad de Chile,uchile,ing.uchile,321,Fluid Mechanics Heat Transfer Feedback Control 
9232372474901007921,Aler Daniel Fuentes del Campo,University of Chile. Institute for Research in Dental Sciences,uchile,odontologi,318,Electromyography Temporomandibular Disorders Dental Oclussion 
9232372474901007921,Mauricio Pino-Yancovic,"CIAE, Universidad de Chile",uchile,ciae.uchil,317,School Networks Collaborative Inquiry Educational Policy 
9232372474901007921,Lenguas Modernas,Universidad de Chile,uchile,uchile.cl,316,Desarrollo de las lenguas modernas aprendizaje de segundas lenguas análisis del discurso 
9232372474901007921,Juan Francisco Cabello,"Professor, Instituto de Nutricion y Tecnologia de los Alimentos, Universidad de Chile",uchile,inta.uchil,316,Inborn Errors of Metabolism Pediatric neurology Neuroscience 
9232372474901007921,Martin AH Escobar,Universidad de Chile,uchile,renare.uch,315,Wildlife Ecology Biodiversity Conservation Human-Wildlife Conflict 
9232372474901007921,Maria Christina Fragkou,"Department of Geography, Universidad de Chile",uchile,uchilefau.,315,
9232372474901007921,Natalia Lam,Universidad de Chile,uchile,uchile.cl,311,Genetics Cytogenetics 
9232372474901007921,Camilo G. Sotomayor,Clinical Hospital University of Chile,uchile,ug.uchile.,311,Radiology and artificial intelligence 
9232372474901007921,Ian Robin Murray Homer Bannister,Universidad de Chile,uchile,uchile.cl,311,
9232372474901007921,Pablo Gutierrez,Universidad de Chile,uchile,fen.uchile,310,Inequality Measurement Public Finances Taxation. 
9232372474901007921,Víctor San Martín,Subdirector de Educación Continua en la Universidad de Chile,uchile,uchile.cl,309,Currículo gestión universitaria desarrollo moral 
9232372474901007921,Héctor Morales Morgado,Universidad de Chile,uchile,uchile.cl,309,Antropología 
9232372474901007921,Jorge Pinares Toledo,Professor at University of Chile and Pontifical Catholic University of Chile,uchile,odontologi,309,Oral & Maxillofacial Radiology 
9232372474901007921,Ruben Fernandez,University of Chile,uchile,uchile.cl,308,
9232372474901007921,"Víctor M. Espinoza, Ph.D.","Associate Professor at the Department of Sound, Universidad de Chile",uchile,uchile.cl,306,Clinical Voice Assessment Voice Processing Audio Processing Biomedical Engineering 
9232372474901007921,Maria Gabriela Rubilar Donoso,Universidad de Chile,uchile,uchile.cl,304,Trabajo social Investigacion social pobreza exclusión 
9232372474901007921,Denisse Pasten,"Académica Asistente, Universidad de Chile",uchile,uchile.cl,303,complex systems geophysics complex networks seismicity 
9232372474901007921,Nicolas Libedinsky,"Professor of Mathematics, University of Chile",uchile,u.uchile.c,302,Representation theory 
9232372474901007921,José Cañete,Universidad de Chile,uchile,ug.uchile.,302,Natural Language Processing Representation Learning 
9232372474901007921,Ignacio Reyes Jainaga,"M.Sc. Electrical Engineering, University of Chile; Millennium Institute of Astrophysics MAS",uchile,ing.uchile,301,Machine Learning Deep Learning Astroinformatics 
9232372474901007921,Maria Paz Bertoglia,"Assistant Professor, University of Chile",uchile,med.uchile,301,Epidemiology Biostatistics Public Health 
9232372474901007921,Rodrigo Booth,Universidad de Chile,uchile,uchilefau.,299,Landscape History Urban History Architectural History 
9232372474901007921,MARIO STEFANO CARUFFO,"INTA, Universidad de Chile",uchile,uchile.cl,298,
9232372474901007921,Rafael Sepúlveda,"Psiquiatra, Profesor de la Escuela de Salud Pùblica de la Universidad de Chile",uchile,uchile.cl,298,Salud Mental 
9232372474901007921,Davor Cotoras Tadic,Universidad de Chile,uchile,ciq.uchile,298,Microbiology Biotechnology Bioprocessing 
9232372474901007921,Claudia Heiss,"Instituto de Asuntos Públicos, Universidad de Chile",uchile,iap.uchile,297,Political theory constitutionalism Latin America states of exception 
9232372474901007921,Jose Luis Ruiz,Universidad de Chile,uchile,unegocios.,297,Finanzas Mercados de Capitales Fondos de Pensiones 
9232372474901007921,Andrea Wechsler,Universidad de Chile,uchile,uchilefau.,296,Sustainable materials 
9232372474901007921,Gonzalo Barriga,"Virologo, Universidad de Chile",uchile,uchile.cl,296,Virologia patógenos emergentes bats virus 
9232372474901007921,Eric Eduardo Palma González,"Profesor Facultad de Derecho, Universidad de Chile",uchile,derecho.uc,294,Historia del Derecho/Historia Constitucional … 
9232372474901007921,Jorge Levican Asenjo,Universidad de Chile,uchile,med.uchile,294,virologia 
9232372474901007921,Luis Vasconcello-Castillo,"Departamento de Kinesiología, Universidad de Chile",uchile,uchile.cl,294,Respiratory Physiotherapy 
9232372474901007921,Andrea Helo,"Assistant professor, Departamento de Fonoaudiología, Universidad de Chile",uchile,uchile.cl,293,visual attention and language development 
9232372474901007921,Carlos Aravena,AMTC - Universidad de Chile,uchile,ing.uchile,292,Image processing machine learning pattern recognition 
9232372474901007921,Constanza Ahumada,Universidad de Chile,uchile,ing.uchile,292,Microgrids electromechanical interaction aerospace control 
9232372474901007921,Gabriel Chaperon,"Universidad de Chile, MSc. Student",uchile,dcc.uchile,290,ML NLP GNN DL 
9232372474901007921,Marcel Goic,"Industrial Engineering, University of Chile",uchile,uchile.cl,289,Retail Management e-commerce Database Marketing Bayesian Econometrics Decision Support Systems 
9232372474901007921,Aldo Gonzalez,"Departamento de Economia, Universidad de Chile",uchile,fen.uchile,288,Organizacion Industrial Regulación Antitrust 
9232372474901007921,Manuel Andres Leiva Guzman,"Departamento de Quimica, Facultad de Ciencias, Universidad de Chile",uchile,uchile.cl,288,Quimica Atmosferica Ciencias de la Tierra Ciencias Ambientales 
9232372474901007921,Cindy Arteta-Acosta,"Universidad de Cartagena, Universidad del Norte, Universidad de Chile",uchile,ug.uchile.,287,Medicina Epidemiología Ciencias Médicas Pediatría 
9232372474901007921,Maher Musleh,"MD, Assistant Profesor University of Chile.",uchile,hcuch.cl,286,Surgery of the alimentary tract Oncology disease of the oesophagus and stomach bariatric surgery gastric cancer. 
9232372474901007921,Juan Pablo Torres Cepeda,"Associate Professor, Department of Business Administration, Universidad de Chile",uchile,unegocios.,285,Strategic Management Strategic Innovation System Dynamics Modelling 
9232372474901007921,Lorena Oyarzún Serrano,"Profesora de Relaciones Internacionales, Universidad de Chile",uchile,iap.uchile,285,Relaciones Internacionales Regionalismo e Integración Globalización y migraciones Género y Relaciones Internacionales 
9232372474901007921,José Inostroza,Universidad de Chile,uchile,dii.uchile,285,Políticas Públicas Gestión Pública 
9232372474901007921,Claudio Allende,Universidad de Chile,uchile,ciae.uchil,281,educación economía de la educación econometría 
9232372474901007921,Isabel Torres Dujisin,"profesora de Historia, Universidad de Chile",uchile,u.uchile.c,279,Historia política  de Chile 
9232372474901007921,Andrea Canals,Universidad de Chile,uchile,uchile.cl,278,
9232372474901007921,Felipe Donoso,University of Chile,uchile,ug.uchile.,277,Power electronics 
9232372474901007921,Amanda Huerta Fuentes,Universidad de Chile,uchile,uchile.cl,277,Entomología Forestal Manejo Integrado de Plagas Forestales Conservación de Insectos 
9232372474901007921,Luis Osandón,Universidad de Chile. Facultad de Filosofía y Humanidades.Departamento de Estudios …,uchile,uchile.cl,275,curriculum escolar historia de la pedagogía educación ciudadana 
9232372474901007921,Rodrigo Ledezma,"Profesor Asistente, Departamento de Urologia, Universidad de Chile",uchile,ug.uchile.,274,Urologia Oncologica 
9232372474901007921,Jenniffer K. Miranda,Universidad de Chile,uchile,uchile.cl,274,Psicología clínica infanto juvenil 
9232372474901007921,Francisco Valenzuela,"Assistant Professor, University of Chile",uchile,fen.uchile,274,organization studies lacanian psychoanalysis gender affect waste 
9232372474901007921,Benigno Godoy Neira,"Researcher, Universidad de Chile",uchile,uchile.cl,272,volcanology geology petrology mineralogy 
9232372474901007921,Daniel Maturana,Universidad de Chile,uchile,ciq.uchile,271,
9232372474901007921,Claudio Rodrigo Salinas,Universidad de Chile,uchile,u.uchile.c,271,Comunicación Política Cine Latinoamericano 
9232372474901007921,Bertrand Potin,"DGF, Universidad de Chile",uchile,uchile.cl,269,seismology tomography earthquake location 
9232372474901007921,Sebastian Layera Ramos,University of Chile,uchile,uchile.cl,266,Regional Anesthesia 
9232372474901007921,Dorotea López Giral,Universidad de Chile,uchile,uchile.cl,266,Economia Internacional 
9232372474901007921,marcela gallardo,Universidad de Chile,uchile,med.uchile,265,biología molecular 
9232372474901007921,Carlos Rodrigo Sanhueza-Cerda,Universidad de Chile,uchile,uchile.cl,262,History of science circulation of travelers and knowledge 
9232372474901007921,Angel Jimenez-Molina,"Assistant Professor, University of Chile",uchile,dii.uchile,261,Service Oriented Computing Business Process Management Ubiquitous Computing Pervasive Computing Human-Computer-Interaction 
9232372474901007921,Carolina González Undurraga,"Profesora Asistente, Universidad de Chile",uchile,uchile.cl,260,género historia archivos esclavitud feminismos 
9232372474901007921,Daniel Perovich,Universidad de Chile,uchile,dcc.uchile,259,Enterprise Architecture Software Architecture DevOps 
9232372474901007921,Pablo Antonio Cottet,"Profesor Sociología, Universidad de Chile",uchile,uchile.cl,259,
9232372474901007921,Daniel F. Johnson-Mardones,Universidad de Chile,uchile,uchile.cl,257,Curriculum Studies Qualitative Inquiry Teacher Education biographical studies 
9232372474901007921,Michael Lukas,"Assistant Professor, Departamento de Geografía, Facultad de Arquitectura y Urbanismo …",uchile,uchilefau.,257,Urban planning and governance social geography urban political economy urban political ecology 
9232372474901007921,Hugo Navarrete,Universidad de Chile,uchile,ing.uchile,257,Operations Research Optimization Theory 
9232372474901007921,José Ignacio Covarrubias,Universidad de Chile,uchile,uchile.cl,255,Plant nutrition 
9232372474901007921,Mauricio Campos-Mora,Universidad de Chile,uchile,ug.uchile.,254,Inmunología 
9232372474901007921,Juan Alejandro González López,Universidad de Chile,uchile,uchile.cl,254,Políticas Educativas y educación Popular 
9232372474901007921,Roberto Vera Uribe,Departamento de Kinesiología Universidad de Chile,uchile,uchile.cl,253,Cuidados Respiratorios 
9232372474901007921,Valentina Flores Aqueveque,"Departamento de Geología, FCFM, Universidad de Chile",uchile,uchile.cl,251,sedimentología estratigrafía paleoclima geoarqueología 
9232372474901007921,Juan Pablo Valdevenito,"Profesor Asociado de Urología, Universidad de Chile",uchile,hcuch.cl,248,Urología femenina y funcional 
9232372474901007921,Claudia Lagos Lira,"Profesora Asistente, Instituto de la Comunicación e Imagen, Universidad de Chile",uchile,uchile.cl,247,Estudios de Periodismo Libertad de Expresión Feminismo y Medios 
9232372474901007921,Mauricio Loyola,University of Chile,uchile,uchile.cl,246,Architecture 
9232372474901007921,Cristián Lepin Molina,"Profesor Facultad de Derecho, Universidad de Chile",uchile,derecho.uc,246,Derecho de Familia Derecho de Infancia Responsabilidad Civil Enseñanza Clínica del Derecho Cine y Derecho 
9232372474901007921,MAXIMILIANO BARAHONA,Hospital Clinico Universidad de Chile,uchile,hcuch.cl,243,Cirugia de rodilla e investigacion en … 
9232372474901007921,Gerardo Francisco Ubilla-Bravo,Universidad de Chile. Facultad de Ciencias Agronómicas,uchile,uchile.cl,242,ordenamiento territorial planificación regional gobernanza territorial análisis espacial sustentabilidad urbana 
9232372474901007921,Nicolás Grau,Universidad de Chile,uchile,fen.uchile,242,Economics of crime and Economics of … 
9232372474901007921,Hiram Vivanco,Universidad de Chile,uchile,uchile.cl,241,Lingüística fonética enseñanza 
9232372474901007921,Andrés Franco-Gómez,"University of Chile, Department of Chemical Engineering, Biotechnology and Materials",uchile,ing.uchile,240,Nonlinear dynamics Viscous fingering Liquid jets Rheology Bioprinting materials 
9232372474901007921,Jorge Acevedo Guerra,"Profesor Titular de Filosofía, Universidad de Chile",uchile,u.uchile.c,239,Filosofía Heidegger Ortega y Gasset Ortega Técnica 
9232372474901007921,Alvaro Besoain Saldaña,"Profesor de Metodología de la Investigación e investigador, Universidad de Chile",uchile,uchile.cl,239,Kinesiología Salud pública Estudios de discapacidad desarrollo inclusivo 
9232372474901007921,Sebastián Donoso,University of Chile,uchile,dim.uchile,238,Dynamical systems ergodic theory topological dynamics symbolic dynamics 
9232372474901007921,Adriana E. Espinoza,"Profesora Departamento de Psicología, Universidad de Chile",uchile,uchile.cl,236,transmision de trauma desastres naturales trauma político 
9232372474901007921,Felipe Muñoz,"Instituto de Estudios Internacionales, Universidad de Chile",uchile,uchile.cl,236,Trade Policy International Trade International Development Chile WTO 
9232372474901007921,Jose M. Clavero,"Clinica Universidad de Los Andes, Hospital Clínico Universidad de Chile",uchile,hcuch.cl,235,Thoracic Surgery Minimally Invasive Surgery Lung cancer Thymic Malignancies Mesothelioma 
9232372474901007921,Celia Cussen,"Professor of History, Universidad de Chile",uchile,u.uchile.c,235,Colonial Latin America Slavery Religion 
9232372474901007921,Pablo Artaza Barrios,Universidad de Chile,uchile,uchile.cl,235,Historia Historia social de Chile 
9232372474901007921,Carlos Márquez Jara,"INTA, Universidad de Chile",uchile,inta.uchil,234,Nutrición Envejecimiento Epidemiología 
9232372474901007921,Karina Rdz-Navarro,Universidad de Chile,uchile,uchile.cl,233,Structural Equation Modeling latent variables multivariate statistics psychometrics 
9232372474901007921,Matías Guerrero-Gatica,"Departamento de Geografía, Universidad de Chile",uchile,ug.uchile.,233,Social-ecological Systems Indigenous and Local Knowledge Conservation Ethnoecology 
9232372474901007921,Valeria Modesta Herrera Fernández,Universidad de Chile,uchile,u.uchile.c,233,Lectura discapacidad auditiva lengua de señas interculturalidad 
9232372474901007921,Paulina Ormazabal,"Universidad de O'Higgins, INTA- Universidad de Chile",uchile,inta.uchil,230,Hierbas medicinales Obesidad 
9232372474901007921,Fernando Henriquez Chaparro,Universidad de Chile - Pontificia Universidad Católica de Chile,uchile,ug.uchile.,228,Neurociencias Cognitivas Neuropsicología Neuroimagen 
9232372474901007921,Sebastian M. Ugarte,University of Chile,uchile,fen.uchile,227,Human Resource Management Pay Compensation Gender Industrial relations 
9232372474901007921,Andrea Valdivia,Universidad de Chile. Instituto de la Comunicación e Imagen,uchile,uchile.cl,218,Comunicación y educación. Cultura digital … 
9232372474901007921,Andrea Maturana-Ramirez,"Facultad de Odontologia, Universidad de Chile.",uchile,odontologi,218,Patologia y Medicina Oral 
9232372474901007921,Carlos Noton,"Assistant Professor, University of Chile",uchile,dii.uchile,217,Quantitative Marketing Industrial Organization Applied Econometrics 
9232372474901007921,Valentina Paredes,Universidad de Chile,uchile,fen.uchile,217,gender economics of education 
9232372474901007921,Hans Stange,"ICEI, FAU, Universidad de Chile",uchile,uchile.cl,217,teoría crítica cine periodismo 
9232372474901007921,Marco Isaac Garrido,"Assistant Professor, Universidad de Chile",uchile,uchile.cl,217,Ecofisiología Relaciones hídricas hidráulica de plantas agricultura de zonas áridas 
9232372474901007921,Claudio Alejandro Perez Soto,Universidad de Chile,uchile,uchile.cl,216,Reproducción y Biología Molecular de Peces 
9232372474901007921,Comunicación y Medios,"Instituto de la Comunicación e Imagen, Universidad de Chile",uchile,ug.uchile.,215,comunicación 
9232372474901007921,Javier Ojeda,"PhD candidate at DGF, Universidad de Chile and IPGP, Université Paris Cité",uchile,dgf.uchile,215,Geophysics Seismology Earthquake Physics Subduction Zones 
9232372474901007921,Hanne Van Den Bosch,"Universidad de Chile & CMM, Universidad de Chile - UMI CNRS 2807",uchile,uchile.cl,215,Mathematical physics PDE 
9232372474901007921,Felipe Ochoa-Cornejo,"Assistant Professor, University of Chile",uchile,ing.uchile,214,Soil behavior Earthquake Engineering Seismic hazard 
9232372474901007921,Marco Pfeiffer,Universidad de Chile,uchile,uchile.cl,214,Pedology Soil Geography Geomorphology 
9232372474901007921,Laura Rueda Castro,Profesora Titular  Universidad de Chile,uchile,uchile.cl,212,Bioética Terapia Ocupacional Salud Mental Ciencia de la Ocupación. 
9232372474901007921,Raul Letelier,"Professor of Administrative Law, University of Chile, Chile",uchile,derecho.uc,211,Administrative Law Constitutional Law Legal Theory 
9232372474901007921,Bruno Grossi,Universidad de Chile,uchile,ug.uchile.,211,Biomechanics Biomimetics 
9232372474901007921,Efraín Rivera Berríos,Universidad de Chile,uchile,u.uchile.c,211,Seismology Earthquakes Seismic_Source 
9232372474901007921,Adriana Piazza,"Department of Economics, Faculty of Economics and Business, University of Chile",uchile,fen.uchile,210,optimization mathematical economics growth theory sustainability 
9232372474901007921,Luis Arenas-Carmona,"Profesor de la Facultad de Ciencias, Universidad de Chile",uchile,u.uchile.c,210,Algebra y Teoría de Números 
9232372474901007921,Gianinna Muñoz Arce,"Profesora Asistente, Departamento Trabajo Social, Universidad de Chile",uchile,uchile.cl,210,trabajo social teorías críticas intervención social resistencias profesionales 
9232372474901007921,Avelio Sepúlveda,Universidad De Chile,uchile,dim.uchile,209,Probability theory Statistical Physics 
9232372474901007921,Marcela Quiñones,"Assistant professor, University of Chile",uchile,uchile.cl,209,Occupational health psychology 
9232372474901007921,María Francisca Elgueta-Rosas,Universidad de Chile,uchile,derecho.uc,209,Pedagogía Universitaria Didáctica del Derecho Clase magistral Estudiantes Universitarios 
9232372474901007921,Rodrigo Fuster,Universidad de Chile,uchile,uchile.cl,209,Water management Water governance 
9232372474901007921,Ricardo Piña Muñoz,Universidad de  Chile,uchile,ug.uchile.,209,Biología Celular Fisiología Neurociencia 
9232372474901007921,Marcelo Cano-Cappellacci,Facultad de Medicina. Universidad de Chile,uchile,uchile.cl,208,Exercise physiology Physical fitness and Physical activity in … 
9232372474901007921,Robert L. Funk,University of Chile,uchile,iap.uchile,208,comparative politics latin america political parties presidentialism 
9232372474901007921,Cecilia Osorio Gonnet,Universidad de Chile,uchile,iap.uchile,205,Public Policies/ Public Administration/Political … 
9232372474901007921,Christ Devia,"BNI & Laboratorio de Neurosistemas, Universidad de Chile",uchile,ing.uchile,202,Active Sensing Visual Perception Neural Synchrony 
9232372474901007921,Tomás Peters,Universidad de Chile,uchile,uchile.cl,201,Sociología del arte 
9232372474901007921,Bárbara Leyton Dinamarca,"Estadística, INTA, Universidad de Chile",uchile,inta.uchil,201,nutrición actividad física y estadística 
9232372474901007921,"Leottau, David Leonardo","Department of Electrical Engineering, Universidad de Chile",uchile,ing.uchile,199,Decentralized Reinforcement Learning Robotics Type-2 Fuzzy Systems 
9232372474901007921,Paula Francisca Vidal Molina,Universidad de Chile,uchile,u.uchile.c,198,
9232372474901007921,Felipe Olate-Moya,"Departamento de Ingeniería Química, Biotecnología y Materiales, FCFM, Universidad de …",uchile,ing.uchile,198,Materials chemistry Biomaterials 3D printing Polymers 
9232372474901007921,Jean-Baptiste Ammirati,Universidad de Chile,uchile,ing.uchile,196,Seismology Tectonics 
9232372474901007921,Gonzalo Berríos Díaz,Universidad de Chile,uchile,derecho.uc,196,Derecho penal Derecho penal juvenil Justicia juvenil Derechos del niño Criminología 
9232372474901007921,Eduardo Castillo Espinoza,Departamento de Diseño Universidad de Chile,uchile,uchilefau.,194,historia del diseño cultura visual cultura material 
9232372474901007921,Isaac Peña-Villalobos,Universidad de Chile,uchile,uchile.cl,194,Ecophysiology Zooarchaeology Ecology 
9232372474901007921,Pedro Hidalgo Campos,Business Department Head Universidad de Chile,uchile,fen.uchile,194,Marketing and Strategy 
9232372474901007921,Aaron A. Cortes Rojas,"Research Coordinator - Universidad de Chile - Universidad de los Andes, Chile",uchile,hcuch.cl,193,Psychosomatic Medicine 
9232372474901007921,Elvira Jéldrez,"Centro de Investigación Avanzada en Educación, Universidad de Chile",uchile,ciae.uchil,192,
9232372474901007921,María Paz Peirano Olate,"Académica, Instituto de la Comunicación e Imagen, Universidad de Chile.",uchile,uchile.cl,189,Antropología del Cine y los Medios Cine Chileno y Latinoamericano Festivales de Cine Cine Documental Exhibición y Distribu 
9232372474901007921,Maria Sol Anigstein,Universidad de Chile,uchile,uchile.cl,189,Antropología Médica Salud Colectiva Salud Pública 
9232372474901007921,Carolina Angulo-Pineda,University of Chile,uchile,u.uchile.c,189,Biomaterials Electroactive Biomaterials 
9232372474901007921,Fernanda Soler-Urzúa,Universidad de Chile,uchile,uchile.cl,188,Education Institutional Ethnography Intercultural Education 
9232372474901007921,Ricardo Camargo Brito,Universidad de Chile,uchile,derecho.uc,188,Teoría del Derecho Teoría Política Teoría Social 
9232372474901007921,Pablo Berríos-Cárcamo,Universidad de Chile,uchile,ug.uchile.,187,
9232372474901007921,Marcela Díaz Navarrete,Profesor Asociado Universidad de Chile,uchile,uchile.cl,187,fisiologia perinatal neonatologia investigacion clinica 
9232372474901007921,Carolina Velasco-Aguirre,Universidad de Chile,uchile,ug.uchile.,184,Nanotecnología drug delivery 
