id_gs,autor,cargo,id_institucion,email,citaciones,intereses
4555896482842878823,Waleska Muñoz Aravena,"Profesora Asociada, Universidad de Concepción",udec,udec.cl,42,Administración de Recursos Humanos Administraciones locales Administraciones públicas 
4555896482842878823,Bruno Karelovic,"Postdoctoral Position, Department of Computer Science, Universidad de Concepción",udec,udec.cl,42,artificial vision game theory machine learning 
4555896482842878823,Victoria Andrea Muñoz Serra,Profesora Universidad de Concepción.,udec,udec.cl,42,Marketing Coaching Integral Arte Arquitectura y Urbanismo 
4555896482842878823,Dominique Toledo,"PhD in Chemistry, Universidad de Concepción",udec,udec.cl,42,Inorganic chemistry spectroscopy crystal structure education in chemistry 
4555896482842878823,REBECA MARTINEZ RETURETA,Universidad de Concepción,udec,udec.cl,42,Modelación de Procesos Hidrológicos Cambio de uso del suelo Cambio Climático Gestión Integral de Cuencas Soluciones Basadas en la Naturaleza 
4555896482842878823,Francisca Muñoz Campos,"Prof. Asistente, Universidad de Concepción",udec,udec.cl,42,Endodoncia Educación médica 
4555896482842878823,Christopher Flores Jara,Universidad de O'Higgins - Universidad de Concepción,udec,udec.cl,41,natural language processing machine learning biomedical informatics 
4555896482842878823,Fabián Figueroa,Universidad de Concepción,udec,udec.cl,41,Invasive Species Community ecology Natural products 
4555896482842878823,Paul E Méndez,"Applied Mathematics, Ph.D. Universidad de Concepción",udec,udec.cl,41,Applied Mathematics Numerical Analysis Scientific Computing Partial Differential Equations 
4555896482842878823,Maria-Jesus Inostroza A.,Universidad de Concepción,udec,udec.cl,41,ELT primary EFL 
4555896482842878823,manuel castro salas,"Docente de Enfermería, Universidad de Concepción",udec,udec.cl,40,Atención primaria de salud Sociología 
4555896482842878823,Valentina Carrillo,"PhD candidate in Environmental Sciences, Environmental Science Faculty & EULA–Chile …",udec,udec.cl,40,Environmental engineering wastewater reuse wastewater treatment nutrient recovery 
4555896482842878823,Oscar Ramírez-Molina,"PhD Student, University of Concepción",udec,udec.cl,39,Neuroscience 
4555896482842878823,Jaime Contreras Alvarez,Universidad de Concepción,udec,udec.cl,38,Políticas Públicas Políticas de Bienestar Administración Pública 
4555896482842878823,Aharon Cuevas,Universidad de Concepción,udec,udec.cl,38,Data Mining Machine Learning 
4555896482842878823,Marco A. Contreras,Universidad de Concepción,udec,udec.cl,38,lingüística psicolingüística gramática sistémico funcional discurso 
4555896482842878823,Esteban Cea-Klapp,Universidad de Concepción,udec,udec.cl,38,Thermodynamics Equation of State Molecular Simulation 
4555896482842878823,Estefanía Vélez Peña,Universidad de Concepción,udec,udec.cl,38,
4555896482842878823,Pablo Emilio De La Cruz,Profesor en Departamento de Antropología Universidad de Concepción-Investigador …,udec,udec.cl,38,Antropología lúdica de la investigación ciencias ambientales 
4555896482842878823,Ismael Cáceres-Correa,"Pedagogía en Historia y Geografía, Universidad de Concepción; Diplomado en filosofía de …",udec,udec.cl,37,filosofía historia social pedagogía 
4555896482842878823,Carmen L. Veloso Ramos,"Professor, University of Concepcion",udec,udec.cl,37,Corporate Finance IFRS Management 
4555896482842878823,Richard Thomas,Universidad de Concepción,udec,udec.cl,37,
4555896482842878823,Ignacio Lizana,Universidad de Concepción,udec,udec.cl,36,Chemistry 
4555896482842878823,Elias Fierro,"Profesor de Física, Universidad de Concepción",udec,udec.cl,36,Termodinámica aplicada Redes Neuronales Artificaciales 
4555896482842878823,Matthew Caulkins,"Facultad de Arquitectura, Urbanismo y Geografía - Universidad de Concepción",udec,udec.cl,35,urban studies property practice theory urban Indigenous spaces homeless activism 
4555896482842878823,Angelo Beratto Ramos,phD student University of Concepción,udec,udec.cl,35,
4555896482842878823,Francisca Vergara Pinto,"Anthropologist, MSc, Universidad de Concepción",udec,udec.cl,35,Disaster research political ecology volcanic risk ethnovolcanology social imaginaries 
4555896482842878823,Paulina Cubillos González,"Docente de patología Bucal,  Universidad de Concepción",udec,udec.cl,34,Oral pathology oral cancer 
4555896482842878823,Carlos Leandro Delgado Fuentealba,Universidad de Concepción,udec,udec.cl,33,Household finance Corporate finance Macroeconomics 
4555896482842878823,Patricia Pérez-Wilson,"Psicóloga, Programa Salud y Medicina Familiar, Universidad de Concepción, Chile",udec,udec.cl,33,Salutogénesis activos en salud promoción de salud trabajo con familias atención primaria. 
4555896482842878823,Alejandro Vallejos,"GIBMAR, Centro Biotecnología, Universidad de Concepción",udec,udec.cl,33,Biotecnología microalgas enzimas compuestos bioactivos espectrometría de masa 
4555896482842878823,Waldo Chaparro,Universidad de Concepción,udec,udec.cl,32,psicolingüística gesticulación interpretación 
4555896482842878823,Cristobal Castillo,University of Concepción,udec,udec.cl,32,Anthropocene Chemical Oceanography Marine pollution Organic pollutants Persistent pollutants 
4555896482842878823,Nicolás I. Villalobos,"Professor of Systematic Botany, University of Concepción",udec,udec.cl,31,Systematic botany taxonomy of vascular plants Geometric morphometry Colorimetry Biogeography. 
4555896482842878823,Italo Machuca,"PhD student, Universidad de Concepción",udec,udec.cl,31,Quantum information quantum computing 
4555896482842878823,Ruben Garrido Bahamondes,Universidad de Concepción,udec,udec.cl,31,Systematics and Biogeography 
4555896482842878823,Alex Alarcon,"PhD Student, Universidad de Concepcion",udec,udec.cl,30,Formation of Dwarf Galaxies 
4555896482842878823,Luis Merino,Universidad de Concepción,udec,udec.cl,30,Sustentabilidad eficiencia energética 
4555896482842878823,Félix Leaman,Universidad de Concepción,udec,udec.cl,29,Predictive Maintenance Acoustic Emission Digital Signal Processing Machine Learning Sensor Technology 
4555896482842878823,Javier E. Soto,Universidad de Concepción,udec,udec.cl,28,
4555896482842878823,Juan D. Cid Hidalgo,"Departamento de Español, Universidad de Concepción",udec,udec.cl,28,Literatura y artes visuales novela chilena y latinoamericana 
4555896482842878823,Felipe Toledo Carrasco,"PhD Student, Universidad de Concepción",udec,udec.cl,28,Heterogeneous Catalysis Computational Chemistry Materials Science Wood Adhesives 
4555896482842878823,Gunhild Hansen-Rojas,"Profesora de Educación para el Desarrollo Sostenible, Universidad de Concepción",udec,udec.cl,27,Educación para el desarrollo sostenible participación ciudadana energías renovales y eficiencia energética curriculum fo 
4555896482842878823,Pablo Sebastian Tobosque Pereira,"Estudiante de doctorado, Universidad de Concepción",udec,udec.cl,27,electroquimica materiales almacenamiento de energía catálisis 
4555896482842878823,Pablo Muñoz Vega,Universidad de Concepción,udec,udec.cl,27,Blueberries organic 
4555896482842878823,Alejandro Lopez Telgie,"Assistant Professor, University of Concepcion",udec,udec.cl,27,small satellites systems engineering 
4555896482842878823,Manuel Moncada,Universidad de Concepción,udec,udec.cl,27,Mecánica 
4555896482842878823,Carlos Madariaga Cifuentes,University of Concepcion,udec,udec.cl,27,Diseño de Máquinas Eléctricas Optimización de Máquinas Eléctricas Educación en Ingeniería 
4555896482842878823,Mariol Virgili Lillo,"Profesor Asociado, Universidad de Concepción - Chile",udec,udec.cl,26,gobernanza gobernanza universitaria finanzas públicas transparencia participación ciudadana 
4555896482842878823,FERNANDO BORQUEZ,Profesor Agronomia Universidad de Concepcion,udec,udec.cl,26,Alimentacion Animal 
4555896482842878823,Bayron Cerda,Universidad de Concepción,udec,udec.cl,26,Física 
4555896482842878823,César Espinoza Pinochet,"Docente de Química Orgánica, Química General, Universidad de Concepción",udec,udec.cl,26,Química analítica Ciencias y tecnologías Químicas Química de Productos Naturales 
4555896482842878823,Karina Fuentes Riffo,Universidad de Concepción,udec,udec.cl,25,lingüística semántica educación tecnología redes semánticas 
4555896482842878823,Rodrigo Aguayo,Universidad de Concepción,udec,udec.cl,25,Hydrology Remote sensing climate change 
4555896482842878823,Macarena Davila,"Escuela Administración y Negocios, Universidad de Concepción",udec,udec.cl,25,recursos humanos compromiso cultura y clima organizacional coaching 
4555896482842878823,Adis Aymee López Bauta,"Estudiante de Doctorado en Psicología, Universidad de Concepción",udec,udec.cl,25,Psicología Parentalidad Desarrollo infantil Apego Sexualidad 
4555896482842878823,Daniel Neira,Universidad de Concepción,udec,udec.cl,25,Operations Research Transportation Logistics Supply chain management Scheduling 
4555896482842878823,Pablo A. Velásquez Cisterna,UdeC,udec,udec.cl,24,
4555896482842878823,Camila Bañales-Seguel,"Doctoral Researcher, Universidad de Concepción",udec,udec.cl,24,fluvial geomorphology stream ecology forests socialecosystems transdisciplinary research 
4555896482842878823,Pablo Antonio Martínez Fernández,"Investigador y Docente. Universidad de Concepción, Universidad del Desarrollo. (Chile)",udec,udec.cl,23,Teoría Sociológica Epistemología de las Ciencias Sociales 
4555896482842878823,Pablo Andrés Fuentes Retamal,Universidad de Concepción,udec,udec.cl,23,Literatura latinoamericana y chilena 
4555896482842878823,Ignacio Ormazábal,Universidad de Concepción,udec,udec.cl,23,complex systems statistical physics sociophysics 
4555896482842878823,Adrian Alejandro Ges Naranjo,Universidad de Concepción,udec,udec.cl,22,Nanomedicina Ingenieria de  Materiales Polímeros Biosensores Química de las Radiaciones 
4555896482842878823,Leonardo Salazar,"Assistant Professor, University of Concepción",udec,udec.cl,22,cointegration labor economics aquaculture economics education 
4555896482842878823,Enrique Ascencio,Universidad de Concepción,udec,udec.cl,21,Diversidad de algas taxonomía de microalgas. 
4555896482842878823,Jorge Hurtado Pidal,Universidad de Concepción,udec,udec.cl,21,Geomática Hidrología Geografía Física Inundaciones Cambio de Uso de Suelo 
4555896482842878823,Cristian Montero Cartes,UDEC,udec,udec.cl,21,Derecho público/Derecho administrativo 
4555896482842878823,Dany Fernández Vega,"Universidad de Concepción, Chile",udec,udec.cl,20,Psicología Clínica y de la Salud Psicología Social 
4555896482842878823,Cristhian Espinoza Navarrete,"Profesor de Literatura, Universidad de Concepción",udec,udec.cl,20,literatura didáctica de la literatura alfabetización académica pedagogía teatral 
4555896482842878823,Nestor Sánchez Goycochea,Universidad de Concepción,udec,udec.cl,20,Numerical Analysis Mixed Finite Elements Hybridizable Discontinuous Galerkin Computational Fluid Dynamics 
4555896482842878823,Mabel Alarcón Rodríguez,Profesora Asociada Departamento de Urbanismo Universidad de Concepción,udec,udec.cl,20,Urbanismo sustentable Vulnerabilidad Procesos urbanos 
4555896482842878823,Camilo Ulloa Ortega,"Colaborador Académico, Universidad de Concepción",udec,udec.cl,19,epidemiología odontología periodoncia 
4555896482842878823,Claudio Iturra,University of Concepción,udec,oceanografia.,19,Oceanography 
4555896482842878823,Violeta Montero,Universidad de Concepción,udec,udec.cl,19,Sociología Política Políticas Públicas Movimientos Sociales 
4555896482842878823,Oscar Alberto Briones Jorquera,Universidad de Concepción,udec,udec.cl,19,Control Systems 
4555896482842878823,Sergio Rifo,Universidad de Concepción,udec,udec.cl,18,regression models 
4555896482842878823,Ianire Galilea Salvador,Universidad de Concepción,udec,udec.cl,18,Suelos erosión cambios de uso 
4555896482842878823,Cinthya Rivas,Universidad de Concepción,udec,ing-mat.udec.,18,Numerical Analysis 
4555896482842878823,Alan Fritz,university of Concepcion,udec,udec.cl,17,cell biology 
4555896482842878823,Amanda Robau Porrua,"Estudiante de doctorado en Metalurgia , Universidad de Concepción",udec,udec.cl,17,Metalurgia Materiales Biomateriales Resistencia de Materiales 
4555896482842878823,José Oliveros Romero,University of Concepción,udec,udec.cl,17,project management public-private partnerships social housing 
4555896482842878823,Mariela A Gatica Saavedra,Departamento de Psiquiatría y Salud Mental. Universidad de Concepción,udec,udec.cl,17,Psicología clínica y de la salud Salud Mental 
4555896482842878823,Laura A. viafora,"Estudiante Doctorado, Universidad de Concepcion",udec,udec.cl,17,termografia infrarroja ciencias del deporte 
4555896482842878823,Daniela Lazo-Cancino,"phd student, Laboratorio de Mastozoología, Departamento de Zoología, Facultad de …",udec,udec.cl,17,mammals behavior ecology evolution 
4555896482842878823,Bárbaro Maykel López-Portilla Vigil,PhD student. University of Concepción,udec,udec.cl,16,Analog and digital VLSI designs FPGA image and signal processing pattern recognition 
4555896482842878823,Valeria Aylín Infante-Villagrán,Universidad de Concepción,udec,udec.cl,16,Gamificación / Psicología 
4555896482842878823,Yasna Pereira Reyes,Universidad de Concepción,udec,udec.cl,15,L2 speech perception and production Audio-visual speech perception vowel training 
4555896482842878823,Dania Saladrigas,"candidata a doctor, Universidad de Concepción",udec,udec.cl,15,sistemática evolución Lepidoptera 
4555896482842878823,Claudio Parés,Universidad de Concepción,udec,udec.cl,14,Political Economics 
4555896482842878823,Cecilia Rubio,"Profesora Asociada, Departamento de Español, Universidad de Concepción",udec,udec.cl,14,Literatura chilena vanguardia literatura infantil poesía latinoamericana 
4555896482842878823,Mauricio Casanova Brito,University of Concepcion (Chile),udec,udec.cl,14,History Sociology Economy Philosophy 
4555896482842878823,Mg. Anabel Castillo,"Profesor instructora, Universidad de Concepción",udec,udec.cl,14,Envejecimiento Bienestar Atención Primaria Persona mayor 
4555896482842878823,Ricardo Soto-Saravia,Universidad de Concepción,udec,udec.cl,13,Conservation Biology Macroecology Biogeogragphy Ecology 
4555896482842878823,Ana Huaico Malhue,Universidad de Concepción,udec,udec.cl,13,geografía medio ambiente desertificación 
4555896482842878823,Beatriz M. Meriño,Universidad de Concepción,udec,udec.cl,13,
4555896482842878823,Nelson Muñoz Carreño,"Estudiante de Doctorado, Universidad de Concepción",udec,udec.cl,13,Adolescencia adultez emergente bienestar y salud mental 
4555896482842878823,Andres Rojano,Universidad de Concepción,udec,udec.cl,13,
4555896482842878823,Dra. Marcela Hidalgo,"Universidad de Concepción, Chile",udec,udec.cl,12,Soil science 
4555896482842878823,Cristián Gidi,"Doctoral Student, Universidad de Concepción",udec,udec.cl,12,Chromatin Dynamics Gene Regulation Promoter Architecture 
4555896482842878823,Mauricio A. Torres Méndez,Universidad de Concepción,udec,udec.cl,12,Reducción del Riesgo de Desastre Resiliencia ante Desastre Desarrollo Sustentable. 
4555896482842878823,Leonardo Vargas Ovando,Universidad de Concepción,udec,udec.cl,12,Geographic information systems Hydrology Natural resource economics Remote sensing Water valuation 
4555896482842878823,Pablo Vergara-Barra,"Universidad de Concepción, Depto. de Psiquiatría y Salud Mental",udec,udec.cl,12,parentalidad desarrollo infantil salud mental 
4555896482842878823,Bárbara Melo-Baez,Universidad de Concepcion,udec,udec.cl,12,Embriología Animal 
4555896482842878823,Scarlett Rebolledo C.,"Estudiante de Magister, Universidad de Concepción",udec,udec.cl,12,QCD a bajas energías 
4555896482842878823,Davide Di Grumo,PhDc student at Universidad de Concepción,udec,udec.cl,11,Ecology Entomology Evolution 
4555896482842878823,Isyed de la Caridad Rodríguez Trujillo,"PhD student in Computer Science, University of Concepción",udec,udec.cl,11,Computer Science and Software Engineering 
4555896482842878823,Jessica Lujan Candia Cid,Universidad de Concepción. Doctora en Salud Mental.,udec,udec.cl,11,desigualdad social salud mental 
4555896482842878823,Yenie Norambuena Albornoz,Universidad de Concepción,udec,udec.cl,11,Razonamiento analógico Desarrollo del lenguaje Psicología y educación Habilidades pre-lectoras Funciones cognitivas 
4555896482842878823,Benjamin Urra,Universidad de Concepción,udec,udec.cl,11,Geofísica Ionósfera Space Weather Geomagnetismo 
4555896482842878823,Gustavo Castillo Rozas,"Professor at University of Concepción, Chile",udec,udec.cl,10,Social Sciences Social Policy Comparative Social Policy Social Work Latinamerican Studies 
4555896482842878823,Carlos Valenzuela Castillo,"Facultad de Ciencias Forestales, Universidad de Concepción",udec,udec.cl,10,Biometría 
4555896482842878823,Raúl Flores,"Profesor Salud Pública, Universidad de Concepción",udec,udec.cl,10,Salud Pública Determinantes Sociales en Salud Odontología Social 
4555896482842878823,Carlos Quijada Fuentes,"Universidad de Concepción, Concepción, Chile",udec,udec.cl,10,
4555896482842878823,Yasna Salazar Llanos,Universidad de Concepción,udec,udec.cl,9,Estadística Educación Psicología 
4555896482842878823,Vanesa Rodriguez-Merchan,Universidad de Concepción,udec,udec.cl,9,Sustainability Water-Energy-Land nexus Exergy 
4555896482842878823,Paulina Astroza,Profesora de Derecho Internacional y Relaciones Internacionales de Universidad de …,udec,udec.cl,9,relaciones internacionales política europea derecho internacional 
4555896482842878823,Alejandro Useche,Doctorando de la Universidad de Concepción,udec,udec.cl,9,Literatura artes visuales simbolismo mitología 
4555896482842878823,Daniela Leyton L.,"Profesora Antropología, Universidad de Concepción",udec,udec.cl,9,antropología médica antropología del cuerpo sufrimiento social cuidados etnografía 
4555896482842878823,Rodrigo Véjar Asem,Universidad de Concepción,udec,ing-mat.udec.,9,Numerical Analysis 
4555896482842878823,Diego Mundaca,Universidad de Concepción,udec,udec.cl,8,Historia de las mentalidades y la cultura Historia Medieval Historia Colonial 
4555896482842878823,Andrés Schäfer Faulbaum,"Docente Colaborador, Universidad de Concepción",udec,udec.cl,8,Geografía Humana Sistemas de Información Geográfica Análisis Socioespacial Demografía Participación Ciudadana 
4555896482842878823,Danny Luarte,Universidad de Concepción,udec,udec.cl,8,
4555896482842878823,Gonzalo Abarzúa,Universidad de Concepción,udec,udec.cl,7,SOFC 
4555896482842878823,Mario I. Ramos-González,Universidad de Concepción,udec,udec.cl,7,Lepidoptera Geometridae Taxonomy Systematics Biogeography 
4555896482842878823,Rudi Radrigan Ewoldt,"Director CDTA, Universidad de Concepción",udec,udec.cl,7,Ingeniería de procesos y control 
4555896482842878823,Rodrigo Cea-Córdova,"Docente para Formación Inicial Docente, Universidad de Concepción",udec,udec.cl,7,Educación Ambiental Gestión Integral del Riesgo Formación Inicial Docente 
4555896482842878823,Carolina Venegas,"Profesora asistente, Universidad de Concepción",udec,udec.cl,7,Metodología de la investigación Investigación cualitativa Epidemiología sociocultural Sexualidades y género 
4555896482842878823,Daniel Sacasas Suárez,University of Concepción,udec,udec.cl,7,Sistemas de refrigeración intercambiadores de calor compactos. 
4555896482842878823,Miguel Roco,Profesor de Arquitectura (UdeC),udec,udec.cl,6,e_learning didáctica proyectual ePorfolio realidad aumentada 
4555896482842878823,Ignacio Jofré Oliden,"Licenciado en Psicología, Universidad de Concepción",udec,udec.cl,6,Estadistica Psicometria Practicas basadas en la evidencia Psicoterapia 
4555896482842878823,Fernando Massoglia,Universidad de Concepción,udec,udec.cl,6,Dental Implants Prosthodontics 
4555896482842878823,Fernando Antonio Castillo,Universidad de Concepción,udec,udec.cl,6,Combustión radiometría espectrofotometría hyperspectral 
4555896482842878823,Franco Olivares Contador,"estudiante doctorado en Matemática,  Universidad de Concepción",udec,udec.cl,6,Física-Matemática 
4555896482842878823,Patricio Salas,Universidad de Concepción,udec,udec.cl,6,Discrete Choice Models Applied Machine Learning Statistics Travel Modeling Transport 
4555896482842878823,José Castillo,Universidad de Concepcion,udec,udec.cl,6,Catalysis 
4555896482842878823,Javiera Mardones,estudiante de auditoria en la udec,udec,udec.cl,6,información auditoria contabilidad 
4555896482842878823,Cristian Segura-Carrillo,Universidad de Concepción,udec,udec.cl,6,Movilidad Social Desigualdad Trayectoria Laboral y educativa Política Pública Metodología de Investigación Social 
4555896482842878823,Susana Cabrera-Nuñez,Universidad de Concepción,udec,udec.cl,5,Ecology and taxonomic of zooplankton vertical migration biological pump 
4555896482842878823,Nicolás Corvalán Fuentes,"Ingeniero Agrónomo, Universidad de Concepción",udec,udec.cl,5,Viticultura Enología 
4555896482842878823,Felipe Villa Sepúlveda,"Administrador Público, Universidad de Concepción",udec,udec.cl,5,Participación Ciudadana Gobernanza Gestión de Personas 
4555896482842878823,Samuel Piña,Universidad de Concepción,udec,udec.cl,5,Analytical chemistry environmental sciences electrochemistry chemometrics 
4555896482842878823,Fabian A. Bloomfield,Universidad de Concepción,udec,udec.cl,4,Anthropology 
4555896482842878823,Tierry Medeiros,University of Concepción,udec,udec.cl,4,Ecotoxicology Multiple-Stressors Aquatic Pollution Climate Change 
4555896482842878823,Luciano Radrigan,Universidad de Concepción,udec,udec.cl,4,Embedded Systems Industrial Internet of Things Condition Monitoring Machine Learning 
4555896482842878823,German Eduardo Lagos Sepúlveda,Universidad de Concepción,udec,udec.cl,4,
4555896482842878823,joaquin sebastian torres neira,"Estudiante de Tecnologia Médica, Universidad de Concepción",udec,udec.cl,3,Medicina quimica histologia 
4555896482842878823,Andres Perez,Universidad de Concepción,udec,udec.cl,3,Agua Agua y Cambio climático Manejo de recursos hidricos evaporación. 
4555896482842878823,Ignacio Pérez,Universidad de Concepción,udec,udec.cl,3,reconfigurable computing neural networks FPGA 
4555896482842878823,Willian Miranda,"CI2MA, Universidad de Concepción",udec,ci2ma.udec.cl,3,Numerical Analysis 
4555896482842878823,Matías Iván González Hernández,Universidad de Concepción,udec,udec.cl,3,Biología Molecular Bioinformática 
4555896482842878823,José Luis Viloria Rodríguez,"PhD. student of Computer Science, University of Concepción",udec,udec.cl,2,Computer Science Computer vision Robotic 
4555896482842878823,Jesús Morales Bustos,"Laboratorio de Sistemática y Conservación de Herpetozoos, Universidad de Concepción",udec,udec.cl,2,Herpetologia Sistemática molecular Biodiversidad 
4555896482842878823,Hugo Ubilla,Universidad de Concepción,udec,udec.cl,2,optimization operation research machine learning industrial engineering 
4555896482842878823,Felipe Aravena,MSc Universidad de Concepción,udec,udec.cl,2,Química Analítica Alimentos Electroquimica 
4555896482842878823,S. Shiva Samhitha,Universidad de Concepcion,udec,udec.cl,2,
4555896482842878823,"URBE. Arquitectura, Ciudad y Territorio",Universidad de Concepcion,udec,udec.cl,2,Arquitectura Urbanismo planificación urbana geografìa proyecto 
4555896482842878823,Jorge Andrés Espinosa Marín,Universidad de Concepción Chile,udec,udec.cl,1,Hidrologia Cambio Climatico 
4555896482842878823,Edwin Mauricio Padilla Villada,Universidad de Concepción,udec,udec.cl,1,Literatura colombiana Literatura chilena Literatura latinoamericana Estudios del Mal en la literatura … 
4555896482842878823,Camila Neves Guzmán,University of Concepcion,udec,udec.cl,1,Historia de Chile contemporánea Historia de las mujeres Historia del cuerpo 
4555896482842878823,Carolina A. Ortiz,Former masters student at Universidad de Concepción,udec,udec.cl,1,Stellar astrophysics Stellar dynamo 
4555896482842878823,"Nicole B. Vargas, M.Sc.",Universidad de Concepción - Universidad de las Américas.,udec,udec.cl,1,Psicolingüística Neurolingüística Trastornos del Lenguaje Neuropsicología pediátrica Trastornos del Neurodesarrollo. 
4555896482842878823,Carmen Gloria Betancur Moreno,Universidad de Concepción y Centro Salud SEPYA,udec,udec.cl,1,Psiquiatría y Adicciones 
4555896482842878823,Pamela Catalán,Universidad de Concepción,udec,udec.cl,1,Entrelazamiento Cuántico Gravedad topológica. 
4555896482842878823,Valentina Albornoz Toloza,"Estudiante de Doctorado en literatura latinoamericana, Universidad de Concepción",udec,udec.cl,1,Literatura 
4555896482842878823,Esteban Fernandez Villanueva,University of Concepción,udec,udec.cl,1,Paleoclimate modelling biogeochemical cycling oceanography Earth System modelling Carbon cycle 
4555896482842878823,Juan Felipe Gonzalez Saavedra,PhD Student Universidad de Concepción,udec,udec.cl,1,sistemas de asistencia a la conducción redes vehiculares inteligencia artificial IoT 
4555896482842878823,Francisco Larenas,"Professor of Asian Law. University of Concepción, Chile.",udec,udec.cl,,chinese law asian law public law international law 
4555896482842878823,Lya Hernández Palominos,"Bibliotecologa, Gestión Bibliográfica, Universidad de Concepción",udec,udec.cl,,Gestión Bibliográfica Recursos Electrónicos 
4555896482842878823,Manuel Narváez Tejos,"Ingeniero Tecnologías Web, Universidad de Concepción",udec,udec.cl,,Web Technologies Business Intelligence software Architecture Project Management Database Management 
4555896482842878823,daniel contreras pérez,"student, Concepcion University",udec,udec.cl,,Ingeniery 
