id_gs,autor,cargo,id_institucion,email,citaciones,intereses
4555896482842878823,Santiago Yépez,Universidad de Concepción,udec,udec.cl,191,Remote Sensing Fluvial Geomorphology Hyperspectral techniques Water colorimetry Hydrology 
4555896482842878823,Verónica Delgado Schneider,Universidad de Concepción,udec,udec.cl,191,Derecho ambiental Derecho de aguas 
4555896482842878823,Vanessa Novoa,Universidad de Concepción,udec,udec.cl,187,Water 
4555896482842878823,Gustavo Adolfo Torres-Mellado,Universidad de Concepción,udec,udec.cl,183,Botany Mycology Arbuscular mycorrhiza Ecology Antarctica 
4555896482842878823,Fernando Drake Aranda,"Profesor Manejo de Bosques, Universidad de Concepción, Chile",udec,udec.cl,182,silvicultura 
4555896482842878823,Henry D. Montecino PhD.,Universidad de Concepción,udec,udec.cl,182,Physical Geodesy Satellite Geodesy Adjustment Theory Geodynamics 
4555896482842878823,R. Allende,Universidad de Concepción,udec,udec.cl,180,Nutrición animal-Análisis de sistemas 
4555896482842878823,Pablo Oyarzún-Ruiz,Universidad de Concepción,udec,udec.cl,179,Zoology Systematics (Taxonomy) Helminthology Veterinary Parasitology Wildlife Diseases 
4555896482842878823,Harim Arvizu,"Doctorado en Ciencias Geológicas, Universidad de Concepción, Chile",udec,udec.cl,178,Petrología Geoquímica Geocronología y Tectónica de Márgenes … 
4555896482842878823,Lilian Troncoso Gómez,Universidad de Concepcion,udec,udec.cl,178,conservacion recursos gobernanza genetica poblaciones pesquerias evaluacion ambiental marina 
4555896482842878823,Juan Munizaga,Universidad de Concepción - PhD Student,udec,udec.cl,178,Remote Sensing GIS Geomorphology 
4555896482842878823,Armando Cartes Montory,"Departamento de Historia, Universidad de Concepción",udec,udec.cl,178,Historia regional Patrimonio cultural Historia política de Chile 
4555896482842878823,Sebastián Calderón,"Assistant professor, Departamento de Ingeniería Civil, Universidad de Concepción",udec,udec.cl,178,
4555896482842878823,Patricio Flores-Morales,Facultad de Ciencias Químicas - University of Concepcion,udec,udec.cl,178,Eseñanza y aprendizaje de las ciencias didáctica de las ciencias TIC Química Biológica Química Computacional 
4555896482842878823,Elton Oyarzua,Universidad de Concepcion,udec,udec.cl,177,Chemical Engineering Nanofluidics Molecular Dynamics 
4555896482842878823,Oscar Parra Barrientos,"Profesor Titular, Universidad de Concepciòn",udec,udec.cl,175,Ficología Limnología Calidad del Agua y Contaminación y Gestión … 
4555896482842878823,Robinson Dinamarca,"Profesor de Didáctica de la Ciencias, Universidad de Concepción",udec,udec.cl,175,Didáctica de las Ciencias Modelamiento Química nanomateriales 
4555896482842878823,Eugenio Chandia,Universidad de Concepción,udec,udec.cl,174,Formación Inicial de Profesores en … 
4555896482842878823,Ines Picazo Verdejo,"Profesora Ciencia Política, Universidad de Concepción",udec,udec.cl,173,Políticas Públicas educación protección social ciudadanía 
4555896482842878823,Karla Andrea Lobos Peña,"Jefa Área Investigación Educativa, IDEClab, Dirección de Docencia, Universidad de …",udec,udec.cl,171,psicología psicología educacional educación educación superior 
4555896482842878823,María Cecilia Rodríguez Torres,Universidad de Concepción,udec,udec.cl,170,trabajo social psicologia positiva autocuidado infancia mindfullness 
4555896482842878823,Hernán Emilio Pérez,Profesor de fonética (UdeC),udec,udec.cl,167,fonética fonología prosodia 
4555896482842878823,María Carolina Silva de la Fuente,Colaborador Académico Universidad de Concepción; Docente de Enfermedades …,udec,udec.cl,167,ácaros parasitología vectores 
4555896482842878823,Alexey Novoselov,"Institute of Applied Economic Geology (GEA), University of Concepción",udec,udec.cl,166,Geochemical modeling Weathering Hydrotherms Origin of life 
4555896482842878823,Oscar Inostroza-Michael,"Laboratorio de Ecología Evolutiva y Filoinformática, Universidad de Concepción",udec,udec.cl,162,Macroevolución Biogeografía Ecología Evolutiva Método Comparativo Filogenético 
4555896482842878823,Danny Fuentes-Castillo,Universidad de Concepción,udec,udec.cl,159,Ornithology Antibiotic Resistance Wild Birds Wildlife 
4555896482842878823,Myleidi Vera Otero,University of Concepcion,udec,udec.cl,154,Materials Chemistry Polymer Science Green Chemistry 
4555896482842878823,Asieh Hekmat,"Assistant Professor, University of Concepcion- Chile",udec,udec.cl,154,Open pit mining Project management Simulation Mine closure 
4555896482842878823,Daniel Veraguas,"Investigador postdoctoral, Universidad de Concepción, Facultad de Ciencias Veterinarias",udec,udec.cl,151,Embriología Reproducción Animal Biología Celular Biología Molecular. 
4555896482842878823,Glenda Fuentes,Universidad de Concepción,udec,udec.cl,150,Genómica evolución y conservación vegetal 
4555896482842878823,Vicente Hernandez,"Investigador Asociado, Centro de Biotecnología, Universidad de Concepción",udec,udec.cl,149,Ciencia y Tecnologia 
4555896482842878823,Daniel A. Palacio,"Department of Polymers,University of Concepción",udec,udec.cl,148,Chemistry Polymer Science Material Chemistry Removal of emerging Pollutants 
4555896482842878823,Adrián Garrido,"Plant Epigenetics Lab, Faculty of Forest Science (University of Concepcion)",udec,udec.cl,148,Plant epigenetics plant biotechnology plant molecular biology plant development climate change 
4555896482842878823,Manuel Estay,Universidad de Concepción,udec,udec.cl,148,Fishery and Aquaculture Economics Applied Industrial Organization Applied Econometrics and Microeconomics 
4555896482842878823,Adrian Garrido-Bigotes,"Laboratorio de Epigenética Vegetal, Facultad de Cs. Forestales, Universidad de …",udec,udec.cl,148,Plant molecular biology plant physiology plant biotechnology 
4555896482842878823,Yaranay López-Angulo,"Universidad de Concepción,Chile",udec,udec.cl,148,Psicología Educativa 
4555896482842878823,Luis Pino Soto,Universidad de Concepción,udec,udec.cl,148,Ingeniería tratamiento de agua y efluentes 
4555896482842878823,Doris Carrasco Mardones,"Profesor Asistente, Facultad de Odontología, Universidad de Concepción",udec,udec.cl,147,Medical Education Empathy Endodontics 
4555896482842878823,"Lucila Moreno, Lucila Moreno Salas, Lucila Moreno-Salas","Profesora Asociada, Universidad de Concepción",udec,udec.cl,147,Parasitología epidemiología ecología enfermedades vectores 
4555896482842878823,Mauricio A. Figueroa Candia,Universidad de Concepción,udec,udec.cl,146,Phonetics Experimental Phonetics Sociophonetics Ethnolinguistics 
4555896482842878823,Magdalena Cuevas,University of Concepcion,udec,udec.cl,146,Neuroscience ionic channels sperm physiology 
4555896482842878823,Pedro Pablo Pinacho Davidson,"DIICC, Facultad de Ingeniería, Universidad de Concepción",udec,udec.cl,146,Aprendizaje de máquina inteligencia artificial vida artificial metaheurísticas 
4555896482842878823,Pedro Arriagada Sanhueza,"Departamento de Ingeniería Ambiental, Universidad de Concepción",udec,udec.cl,143,Hydropower Hydrology Hydraulic Engineering Energy Sustainability 
4555896482842878823,María Ester Gonzalez-Campos,Universidad de Concepción,udec,udec.cl,141,usabilidad geoportales Infraestructura de Datos Espaciales visualización de la información geográfica 
4555896482842878823,Jose Villagra Reyes,"Estudiante de Sociología, Universidad de Concepción",udec,udec.cl,139,demografía análisis social antropología 
4555896482842878823,Cristian Chandia,UdeC,udec,udec.cl,138,Contaminacion Marina 
4555896482842878823,Ana María Leiva,"Estudiante de Doctorado en Ciencias Ambientales, Universidad de Concepción",udec,udec.cl,137,Ciencias Ambientales Microbiología 
4555896482842878823,Alexander Pari,Universidad de Concepción,udec,udec.cl,136,Evolutionary biology Macroecology 
4555896482842878823,Pamela A Godoy,"Dra. (c), Universidad de Concepción",udec,udec.cl,135,Alzheimer's Disease 
4555896482842878823,Rosa Medina Durán,"Assistant Professor, University of Concepción",udec,udec.cl,132,Combinatorial optimization 
4555896482842878823,Kateryn Pino,Universidad de Concepción,udec,udec.cl,132,Evolutionary Biology Biogeography Conservation Systematics Mammals 
4555896482842878823,Alejandro Andalaft,Universidad de Conepcion,udec,udec.cl,128,Evaluacion de proyectos estrategia organizacional 
4555896482842878823,Alicia Bravo Escobar,"Profesora de Cs. Naturales y Física, Magister en Educación, Universidad de Concepción",udec,udec.cl,126,didáctica de la física entornos virtuales de aprendizaje 
4555896482842878823,Santiago Gómez López,Universidad de Concepción,udec,udec.cl,126,Quantum Information 
4555896482842878823,Juan Pablo Sanhueza,"Departamento de Ingeniería Materiales, Universidad de Concepción",udec,udec.cl,126,Phase transformation Metallurgy Thermodynamic Computational Modelling 
4555896482842878823,Jorge Valdivia Guzmán,"Facultad de Educación, Universidad de Concepción",udec,udec.cl,123,Informática Educativa Comunidades de Práctica Virtual 
4555896482842878823,Javier Cárdenas,Universidad de Concepción,udec,udec.cl,123,Image processing embedded systems reconfigurable hardware design computer architecture 
4555896482842878823,Katia Valenzuela Fuentes,"Profesora Asistente, Universidad de Concepción",udec,udec.cl,123,
4555896482842878823,Moisés Carrasco-Garcés,"Assistant Professor, Universidad de Concepción.",udec,udec.cl,120,Nonmarket Valuation Environmental Economics Subjective well-being Happiness Behavioral Economics 
4555896482842878823,Marcos Fernandez Mena,"estudiante de auditoria, universidad de concepción",udec,udec.cl,120,auditoria 
4555896482842878823,Eduardo  Fuentes-Lillo,"Instituto de Ecología y Biodiversidad (IEB), Universidad de Concepción",udec,udec.cl,119,Invasion Ecology 
4555896482842878823,Jorge Pacheco,"Profesor Asistente, Departamento de Salud Pública, Universidad de Concepción",udec,udec.cl,117,Health Services Accessibility Health equity 
4555896482842878823,Aliro Jesús Manosalva Arriagada,Universidad de Concepción,udec,udec.cl,117,limnology 
4555896482842878823,Toribio Figueroa,Universidad de Concepción,udec,udec.cl,116,Biomaterials 
4555896482842878823,Ximena Gauche,Universidad de Concepción,udec,udec.cl,116,Derechos humanos Género e Infancia 
4555896482842878823,Isabel Lizama,Universidad de Concepción,udec,udec.cl,114,Biological Sciences 
4555896482842878823,Matias Pizarro-Koch,University of Concepcion,udec,udec.cl,113,Eastern boundary dynamics Ocean Modelling Oxygen Minimum Zone 
4555896482842878823,Oscar Toro-Núñez,"Research Associate, Universidad de Concepcion",udec,udec.cl,112,Plant systematics taxonomy biogeogrpahy 
4555896482842878823,Viana Manrique Suárez,Universidad de Concepción,udec,udec.cl,112,Biotecnología Bioquímica Neurociencias Genética 
4555896482842878823,Francisco Saavedra,Universidad de Concepción,udec,biomedica.ude,111,
4555896482842878823,Fernando Venegas Espinoza,Académico Universidad de Concepción,udec,udec.cl,109,Historia de Chile Historia Cultural Historia Social 
4555896482842878823,Gustavo Díaz Garrido,"Departamento de Sistemas Acuáticos. Facultad de Ciencias Ambientales, Universidad de …",udec,udec.cl,108,Aquatic ecology community ecology biodiversity freshwater fishes conservation 
4555896482842878823,Cristian Canales,"Assitant Professor, Universidad de Concepción",udec,udec.cl,106,
4555896482842878823,David Muñoz,Universidad de Concepcion,udec,udec.cl,106,Biologia 
4555896482842878823,Sahba Sedaghat,Universidad de Concepcion,udec,udec.cl,105,
4555896482842878823,David Adrian Saez,"Postdoctoral Researcher, Universidad de Concepción",udec,udec.cl,104,Physical Chemistry Molecular Dynamics Biochemistry 
4555896482842878823,Javiera González Alarcón,"PhD(c), Universidad de Concepción",udec,udec.cl,104,
4555896482842878823,Daniel Ignacio Pereira,Profesor de Lingüística (UDEC),udec,udec.cl,103,lingüística gramática sintaxis entonación 
4555896482842878823,Daviel Gomez,Universidad de Concepción,udec,udec.cl,102,Chemical Engineering Heterogeneous Catalysis Biotechnology Environment Energy 
4555896482842878823,Marco Antonio Rivera Tapia,Universidad de Concepción,udec,udec.cl,102,Relatividad General Información cuántica 
4555896482842878823,Loretto Arriagada,"Department of Water Resources, CHRIAM Water Center, University of Concepcion",udec,udec.cl,102,Biogeoquímica fluvial Planificación Territorial Estresores antrópicos 
4555896482842878823,Narciso López-López,Universidad de Concepción,udec,udec.cl,102,
4555896482842878823,Diego Venegas,Universidad de Concepción,udec,udec.cl,101,Gas licuado de petróleo Gas natural Biogas Sistemas contra incendios 
4555896482842878823,Juliana González-Sanmiguel,"PhD Student, Universidad de Concepción",udec,udec.cl,101,Neurodegeneration Neurobiology 
4555896482842878823,Jose Fuentes Sepúlveda,University of Concepción,udec,udec.cl,100,Parallel algorithms and data structures 
4555896482842878823,Carla Muñoz-Mendoza,"Universidad de Concepcion, Concepcion, Chile",udec,udec.cl,99,Phylogeography Microevolution Biogeography Herpetofauna 
4555896482842878823,Iván M. Quezada,Postdoctoral researcher. Universidad de Concepción.,udec,udec.cl,99,Plant ecophysiology Plant ecology Evolutionary ecology 
4555896482842878823,Enrique Wagemann,Universidad de Concepción,udec,udec.cl,98,Nanotechnology Fluid Dynamics 
4555896482842878823,Paola Cañete,"PhD, Universidad de Concepción, Chile",udec,udec.cl,97,Neology Terminology Translation 
4555896482842878823,Roberto Salazar,University of Concepcion,udec,cefop.udec.cl,97,Quantum information Probability Theory Fluid mechanics 
4555896482842878823,Bastián Torres Durán,"Profesor, Universidad de Concepción",udec,udec.cl,97,ciencias de la educación formación ciudadana didáctica de la historia 
4555896482842878823,Francisco Javier Diaz Pincheira,Assistant Professor. in Business Management Departmet.  Universidad de Concepción,udec,udec.cl,94,Positive Organizational Psychology Happiness Leadership Human Resources Subjective well-being 
4555896482842878823,Joseph Aslan,Universidad de Concepción,udec,udec.cl,93,
4555896482842878823,Andrea Vázquez Varela,"Master's Degree in Computer Science, Universidad de Concepción",udec,udec.cl,92,Digital Image Processing Neuroimaging 
4555896482842878823,Daniel Aguilera-Olivares,Universidad de Concepción,udec,udec.cl,91,Ecology and Evolutionary Biology Social insects Termites 
4555896482842878823,Jose Angel García-Beltrán,"Universidad de Concepción, Chile",udec,udec.cl,90,Systematic Botany Plant Ecology 
4555896482842878823,Selim Musleh Vega,Universidad de Concepción,udec,udec.cl,90,marine biology genomics ecology 
4555896482842878823,Darío Navarrete Campos,"Postdoctorado, Universidad de Concepción",udec,udec.cl,89,Cold stress in plant fruit crop blueberry 
4555896482842878823,Maria Isabel Rivera,"Ph.D., Associate Professor, Universidad de Concepción",udec,udec.cl,86,Sustainable Architecture Indoor environment quality and effects on … well-being and health 
4555896482842878823,Juan Araya,Universidad de Concepcion,udec,udec.cl,84,
4555896482842878823,Karel Vives Hernandez,UNIVERSIDAD DE CONCEPCIÓN (UdeC),udec,udec.cl,84,Biotecnología Vegetal Crioconservación Micropropagación Biología Molecular Fisiología Vegetal 
4555896482842878823,Luis E Quiroz,Universidad de Concepcion,udec,udec.cl,83,FEM CAE RBIM 
4555896482842878823,David Quezada,Universidad de Concepción,udec,udec.cl,81,
4555896482842878823,Angie Quintanilla Espinoza,Universidad de Concepción,udec,udec.cl,80,Linguistics EFL Lexical availability 
4555896482842878823,Mauricio E. Garrido Vásquez,University of Concepción,udec,udec.cl,79,Work and Organizational Psychology 
4555896482842878823,Shahrokh Rajabpour,"Professor (Assistant), University of Concepcion",udec,udec.cl,78,Economic Geology Mineral Resources 
4555896482842878823,Darío Rojas Díaz,Universidad de Concepción,udec,udec.cl,76,Education Computer Science Neuroscience 
4555896482842878823,Claudio J. Sandoval Muñoz,Universidad de Concepción,udec,udec.cl,75,Química Analítica LIBS Hyperspectral imaging chemometrics 
4555896482842878823,Cristóbal Rodrigo Donoso Oliva,Universidad de Concepcion,udec,inf.udec.cl,75,Deep Learning Astrophysics Computer Science 
4555896482842878823,Margarita Ruiz de Gamboa Astroza,"PhD Student. Universidad de Concepción, Chile",udec,udec.cl,74,Biodiversity Molecular Systematics Herpetology Liolaemus 
4555896482842878823,Simón Sandoval,Universidad de Concepción,udec,udec.cl,73,Forest management Forestry modeling Machine Learning Algorithms Remote Sensing LiDAR Scanning 
4555896482842878823,Perla Medina,Universidad de Concepción;Universidad austral de Chile; Centro de Estudios Científicos …,udec,udec.cl,73,General Relativity Einstein-Cartan Theory Cosmology Gravitational Waves Modified Gravity 
4555896482842878823,Roy A. Fernández,Universidad de Concepción,udec,udec.cl,73,Stratigraphy  Biostratigraphy 
4555896482842878823,Valeria Campos,Fundación Kimntrum facultad odontología universidad de Concepción,udec,udec.cl,72,Deaf pediatric dentistry disability Sign Language inclusion 
4555896482842878823,René Gómez Puigpinos,Universidad de Concepción,udec,udec.cl,72,
4555896482842878823,Patricia Rubi González,"Profesor Asociado Facultad de Medicina, Departamento de Psiquiatría y Salud Mental …",udec,udec.cl,72,Salud mental trastornos psicóticos graves educación médica 
4555896482842878823,Jonathan B. Usuba,Universidad de Concepción,udec,udec.cl,69,Ingeniería de Materiales 
4555896482842878823,Carlos Azarel Martinez-Ranero,Universidad de Concepcion,udec,udec.cl,68,Mathematical Logic Set Theory 
4555896482842878823,Jorge A. Muñoz Mendoza,"Associate Professor, University of Concepcion",udec,udec.cl,67,Financial Econometrics Corporate finance Energy Finance International Finance 
4555896482842878823,Carolina Gonzalez,Universidad de Concepción,udec,udec.cl,67,biogeografia ciclos bioquimicos y filogeografia 
4555896482842878823,ME Romero Román,Universidad de  Concepción,udec,udec.cl,66,bioactives functional food molecular biology biotechnology plant breeding 
4555896482842878823,María Fernanda Saavedra-Mondaca,"Investigador de Apoyo, Centro de Recursos Hídricos para la Agricultura y la Minería …",udec,udec.cl,66,Ecosistemas Acuáticos Recurso Hídrico Contaminación acuática Biomarcadores y Bioensayos … Calidad de agu 
4555896482842878823,ricardo concha,"Profesor de Derecho, Universidad de Concepción",udec,udec.cl,65,derecho civi propiedad intelectual 
4555896482842878823,Eduardo Navarrete Espinoza,"Académico e investigador Universidad de Concepción, Chile",udec,udec.cl,65,Modelamiento estadístico evaluación de recursos forestales alometría ciencias del trabajo 
4555896482842878823,Bernardo A. Hernández Vicente,"Universidad de Concepción, Chile",udec,udec.cl,65,Model Predictive Control Adaptive Control Switching Systems Autonomous Driving Vehicle modelling 
4555896482842878823,Karin Albornoz,Assistant Professor at University of Concepcion,udec,udec.cl,64,Postharvest biotechnology molecular biology fruit vegetables 
4555896482842878823,Felipe Morales-León,"Assistant professor, School of Pharmacy, Universidad de Concepción",udec,udec.cl,63,clinical pharmacy antibiotic resistance Klebsiella sp viurlence plasmid 
4555896482842878823,pedro vera castilo,"Profesor de Emprendimiento e innovación, Universidad de Concepción, Chile",udec,udec.cl,63,Emprendimiento Innovación Educación 
4555896482842878823,Nicolas Osiel Riffo Lepe,Universidad de Concepción,udec,udec.cl,62,Neurodegeneration Electrophysiology 
4555896482842878823,"Violeta Rivas, MD","Hepatóloga, Departamento de Medicina Interna, Facultad de Medicina, Universidad de …",udec,udec.cl,62,Liver diseases Viral Hepatitis Hepatocellular Carcinoma Portal hypertension Liver Transplantation 
4555896482842878823,Andrés Agurto Muñoz,Universidad de Concepción,udec,udec.cl,62,biotechnology algae biomaterials bioactive compounds 
4555896482842878823,Edson Faúndez,"Profesor de Literatura, Universidad de Concepción",udec,udec.cl,62,Literatura Hispanoamericana 
4555896482842878823,Gustavo Riveros,Universidad de Concepción,udec,udec.cl,61,Biologia molecular microplásticos microbiologia de suelos apis mellifera virologia 
4555896482842878823,Constanza F. Ramírez,Universidad de Concepción,udec,udec.cl,61,Ecofisiología de plantas 
4555896482842878823,Jorge Dagnino Leone,Universidad de Concepción,udec,udec.cl,61,Biotecnología Ingeniería Metabólica 
4555896482842878823,Jorge Roberto Toledo Alonso,Universidad de Concepción,udec,udec.cl,60,Molecular Biotechnology 
4555896482842878823,Macarena Díaz-Astudillo,Universidad de Concepción,udec,udec.cl,60,Zooplankton ecology krill ecology 
4555896482842878823,A. Maldonado-Trapp,Universidad de Concepción,udec,udec.cl,58,Quantum information Learning analytics 
4555896482842878823,Miguel Alejandro Sanchez Villalba,Universidad de Concepción (Chile),udec,udec.cl,58,Microeconomic theory Game theory Public economics Coordination games 
4555896482842878823,Carlos Rey,"Data Science Unit, Universidad de Concepción, Chile",udec,inf.udec.cl,57,Operations Research Metaheuristics 
4555896482842878823,Manuel Pérez-Carrasco :),"Universidad de Concepción, Harvard IACS",udec,udec.cl,57,Machine Learning Deep Learning Computer Vision 
4555896482842878823,Sergio Augusto López Fonseca,"PhD Estudent Cell and Molecular Biology, Universidad de Concepción",udec,udec.cl,57,Hypothalamus tanycyte glucose metabolism feeding behavior energy balance 
4555896482842878823,Juan Lira Munizaga,Universidad de Concepción,udec,udec.cl,55,
4555896482842878823,Leonardo Zambrano,Universidad de Concepción,udec,udec.cl,55,Quantum Information Quantum Optics 
4555896482842878823,Hugo Moraga Flores,"Doctor en Economía y Empresa, Departamento de Contabilidad y Auditoria, Universidad de …",udec,udec.cl,54,Contabilidad Resposabilidad Social Empresarial Finanzas 
4555896482842878823,Fernanda Barrientos,Universidad de Concepción,udec,udec.cl,53,Linguistics 
4555896482842878823,Alvaro Dominguez Montoya,Universidad de Concepción,udec,udec.cl,53,Derecho del Trabajo Terminación del Contrato de Trabajo Despido 
4555896482842878823,Sixta L. Palencia Luna,"Ph.D. En Ciencias, mención en Microbiología. Universidad de Concepción- Chile",udec,udec.cl,52,Microbiología Molecular Ciencias Agrícolas y Ambientales Biotecnología Nanotecnología y Patogenicidad bacteriana 
4555896482842878823,Claudio Mella,"Investigador Postdoctoral, Universidad de Concepción",udec,udec.cl,52,Nanomateriales Catalisis Compositos 
4555896482842878823,Carla Henríquez Báez,Universidad de Concepción,udec,udec.cl,52,Theoretical physics Gravitation Black Holes 
4555896482842878823,Ariel Soto Caro,Assistant Profesor (UdeC),udec,udec.cl,51,AgEcon International Trade Immigration Innovation Health 
4555896482842878823,Guido Staub,"Associate Professor, University of Concepción",udec,udec.cl,50,
4555896482842878823,Silvia Riquelme,Universidad de Concepción,udec,udec.cl,50,Polímeros Compuestos Ferroeléctricos Piezoeléctricos. 
4555896482842878823,Gabriela Flores-Oyarzo,"Psicóloga, UdeC",udec,udec.cl,49,
4555896482842878823,Rodrigo De la Fuente,"Assistant Professor, University of Concepcion",udec,udec.cl,49,Simulation Optimization Machine Learning Logistics 
4555896482842878823,Marcela V. Parada-Contzen,"Departamento de Ingeniería Industrial, Universidad de Concepcion",udec,udec.cl,48,Applied Microeconomics Labor Economics Health Economics Economics of Risk and Uncertainty Retirement Income Policy 
4555896482842878823,Guillermo Cornejo Contreras,Universidad de Concepción,udec,udec.cl,47,Pediatría 
4555896482842878823,Mario Aguirre-Sanhueza,"Profesor de Radiología dentomaxilofacial, Universidad de Concepción",udec,udec.cl,47,Dento Maxillo Facial Radiology dento maxillo facial pathology dental education 
4555896482842878823,Lisdelys González Rodríguez,"Facultad de Ciencias Ambientales, Universidad de Concepción",udec,udec.cl,47,solar energy UV radiation mathematical modeling solar water treatment 
4555896482842878823,Patricia Henriquez Puentes,Universidad de Concepcion,udec,udec.cl,46,Teatro latinoamericano teatralidades de raíz indígena 
4555896482842878823,Marcela Martinez Bascuñán,Universidad de Concepción,udec,udec.cl,46,Transport Accessibility Urban Mobility 
4555896482842878823,Gonzalo Nelis Suazo,Universidad de Concepción,udec,udec.cl,46,Mine Planning Geometallurgy 
4555896482842878823,Gregory Albornoz-Palma,Universidad de Concepción,udec,udec.cl,46,Cellulose nanomaterials 
4555896482842878823,Nicolás Sanhueza-Matamala,"Assistant professor, Departamento de Ingeniería Matemática, Facultad de Ciencias Físicas y …",udec,udec.cl,46,graph theory combinatorics 
4555896482842878823,María Trinidad Toro Rojas,"Estudiante de doctorado, Universidad de Concepción",udec,udec.cl,45,food science agricultural plant science biotecnology biochemistry 
4555896482842878823,Constanza Rojas Jara,Universidad de Concepción,udec,udec.cl,44,Education curriculum educational leadership 
4555896482842878823,Ignacia Calisto,"Departamento de Geofísica, Universidad de Concepcion",udec,dgeo.udec.cl,43,tsunami sismología geofísica 
4555896482842878823,Mauricio Oyarzo,Professor Universidad de Concepción,udec,udec.cl,43,Local public funding Regional labor markets 
4555896482842878823,Javiera Ortiz,"Agrónomo, Universidad de Concepción",udec,udec.cl,43,control biológico de plagas y enfermedades … 
4555896482842878823,Duván González,"Departamento de Físico-Química, Facultad de Ciencias Químicas, Universidad de …",udec,udec.cl,42,Computational Chemistry 
