id_gs,autor,cargo,id_institucion,email,citaciones,intereses
13542589241086358186,Fabián Guajardo,Universidad Andrés Bello,unab,unab.cl,106,Política Educativa Docencia Educación Neoliberalismo Migraciones Internacionales 
13542589241086358186,María Elena Truyol,Universidad Andres Bello,unab,unab.cl,105,educación en física resolución de problemas aprendizaje activo formación de profesores 
13542589241086358186,Borja Castro,Universidad Andrés Bello,unab,unab.cl,104,Ética y Filosofía política Instituciones e intervención social Gilles Deleuze Emmanuel Lévinas 
13542589241086358186,Sebastian Rojas Navarro,"Profesor Asistente, Facultad de Educación y Ciencias Sociales, Universidad Andrés Bello",unab,unab.cl,95,Cuidados Infancia Antropologia médica Sociología de la medicina STS y Posthumanismos 
13542589241086358186,Felipe Marchant,"Faculty of Life Science, Universidad Andrés Bello, Santiago 8370186, Chile; Millennium …",unab,uandres,94,Cellular and molecular biology coagulation systemic inflammation. 
13542589241086358186,Fernando A. Valenzuela,"Associate Professor, School of Social Sciences, Universidad Andres Bello",unab,unab.cl,93,Sociology of Health and Illness Science and Technology Studies Cultural Studies 
13542589241086358186,Maria Gabriela Huidobro,"Facultad de Educación y Ciencias Sociales, Universidad Andrés Bello",unab,unab.cl,93,Historia Educación 
13542589241086358186,cristian mauricio valderrama nuñez,Universidad Andres Bello,unab,unab.cl,92,terapia ocupacional critica decolonialidad feminismo politica derechos humanos 
13542589241086358186,Ítalo M. Urrutia,Universidad Andrés Bello,unab,uandres,92,Host-pathogen interaction Immunology Cellular Microbiology Vibrio Salmonella 
13542589241086358186,Nicolás Bruna,"Universidad Andres Bello, BioNanotechnology and Microbiology Laboratory, Center for …",unab,uandres,89,Microbiología Nanotecnología Ciencia Antartica Geomicrobiología 
13542589241086358186,Tania Suarez Yana,"PhD candidate, Universidad Andrés Bello",unab,uandres,87,One Health Biodiversity Conservation Conservation Medicine Sustainable Development 
13542589241086358186,Leonardo Vera Benavente,Facultad de Ecología y Recursos Naturales. Universidad Andrés Bello,unab,unab.cl,86,Landscape Management Sustainable Agriculture Management 
13542589241086358186,Jose Llano,"Secretario Academico, Escuela de Arquitectura, Universidad Andres Bello.",unab,unab.cl,85,Arquitectura Teoría Historia de la Arquitectura Innovación social Creatividad aplicada 
13542589241086358186,Patricio Rojas,"Universidad Andrés Bello, Psychology",unab,unab.cl,79,"critical social psychology science and technology studies psychoanalysis process philosophy ""psy"" practices "
13542589241086358186,Elfego Cuevas,Universidad Andrés Bello,unab,uandres,79,avian haemosporidian parasitology behavioral ecology immunogenetics molecular ecology 
13542589241086358186,Guillermo Díaz,Universidad Andrés Bello,unab,unab.cl,78,Empirical Industrial Organization Regulation Applied Microeconomics 
13542589241086358186,Yoan Hidalgo-Rosa,Universidad Andrés Bello,unab,unab.cl,78,Computational chemistry Photophysical Physical chemistry Chemical sensor Luminescent metal-organic frameworks … 
13542589241086358186,Elisa Rita Garro,Universidad Andrés Bello,unab,uandres,78,globular clusters Milky Way formation and evolution infrared optical 
13542589241086358186,Mailiu Díaz Peña,Universidad Andrés Bello,unab,uandres,77,agriculture geostatistic spatio-temporal statistic ensemble forecasting 
13542589241086358186,PhD Carlos Alejandro Cruz,"Postdoc Research, Assistant Professor, Molecular Magnetism Laboratory, Universidad …",unab,uandres,77,Química de Materiales Magnetismo Transición de Spin 
13542589241086358186,Pablo Schwarzenberg,"Assistant Professor, Universidad Andrés Bello",unab,unab.cl,75,Learning Experience Design Learning Analytics AI in Education Game based learning 
13542589241086358186,Monica QUEZADA-ESPINOZA,Universidad Andres Bello,unab,unab.cl,73,Physics Education Research Faculty development Gender issues in STEM education Engineering Education 
13542589241086358186,Pamela Araya-Díaz,Universidad Andrés Bello,unab,uandres,73,Orthodontics Craniofacial Growth Orthopedics 
13542589241086358186,Fernando Díaz Yáñez,Universidad Andrés Bello,unab,uandres,72,
13542589241086358186,Maritza Rosas-Maldonado,"Facultad de Educación y Ciencias Sociales, Universidad Andrés Bello, Santiago, Chile",unab,unab.cl,69,initial teacher education teacher development English teaching and learning 
13542589241086358186,Freddy Urrego,"Investigador líder, Universidad Andrés Bello",unab,unab.cl,68,Ingeniería de alimentos nutraceúticos extractos naturales ingredientes 
13542589241086358186,Evys Ancede Gallardo,PhD Student at Universidad Andrés Bello,unab,uandres,67,Chemistry Skin pharmacology 
13542589241086358186,Carola Cabezas,"Profesor Escuela de Fonoaudiología, Universidad Andrés Bello",unab,unab.cl,67,Trastornos de la comunicación y de la … 
13542589241086358186,Alejandro Vallejos Olivos,Universidad Andrés Bello,unab,uandres,62,Biología molecular fisiopatología inflamación 
13542589241086358186,Víctor Manuel Yáñez Jara,Universidad Andrés Bello,unab,unab.cl,61,Grupos Estratégicos Educación Superior Dinámica Competitiva 
13542589241086358186,Andres Rubio Rivera,Universidad Andres Bello,unab,uandres,59,Psicología Psicopatología Adolescencia. 
13542589241086358186,Juan Paulo Marchant Espinoza,"Escuela de Psicología, Universidad Andrés Bello",unab,uandres,58,Género Familia Violencia y Poder. 
13542589241086358186,Matias Orellana-Saez,"Tesista de Doctorado, Universidad Andrés Bello",unab,uandres,56,Biología de sistemas Bioinformática Biotecnología Biología Biopolímeros. 
13542589241086358186,Héctor Fuentes-Barria,Universidad Andrés Bello,unab,uandres,56,Actividad Fisica y Salud 
13542589241086358186,Gabriela Vásquez Leyton,Universidad Andrés Bello,unab,unab.cl,54,Didáctica de la Historia Desarrollo del pensamiento Histórico Historia reciente Formación inicial de profesores 
13542589241086358186,Paulina E. Varas,Universidad Andres Bello,unab,unab.cl,51,contemporary art estudios culturales 
13542589241086358186,Jesús Unanue Manríquez,"Facultad de Economía y Negocios, Universidad Andres Bello, Santiago, Chile",unab,unab.cl,49,Gratitude Well-being Positive Organizational Psychology 
13542589241086358186,David Necuñir,Universidad Andres Bello,unab,uandres,48,leukemia wnt autism 
13542589241086358186,Diana Lopez Caiza,Universidad Andrés Bello,unab,unab.cl,47,Power Electronics 
13542589241086358186,nicolas contreras,Universidad Andrés Bello,unab,unab.cl,47,entrepreneur behaviour 
13542589241086358186,Raudelio Machin Suarez,"Psychology Professor, Universidad Andres Bello",unab,unab.cl,45,Psicología Psicopatología Psicoanálisis Epistemología Humanidades y Ciencias Sociales 
13542589241086358186,Frano Giakoni Ramírez,Universidad Andrés Bello,unab,unab.cl,43,Sports science Sport Management Marketing Neuromarketing 
13542589241086358186,Silza Ahumada,"Doctoranda, Universidad Andrés Bello",unab,uandres,41,Enseñanza Escritura 
13542589241086358186,Mario Prades Vilar,"Académico, Departamento de Humanidades, Universidad Andrés Bello",unab,unab.cl,40,Historia Moderna Historia Colonial Historia Digital 
13542589241086358186,Blanca Estela Molina Burgos,Centro de Investigación para la Sustentabilidad. Universidad Andrés Bello.,unab,uandres,38,Trophic Ecology Conservation Ecotoxicology 
13542589241086358186,Claudio Broitman Rojas,"Assistant Professor, Universidad Andrés Bello",unab,unab.cl,38,STS Sociology of science scientific communication discourse analysis Public communication of science 
13542589241086358186,leonidas eduardo arias poblete,"Universidad Andrés Bello, Facultad de Ciencias de la Rehabilitación, Escuela de …",unab,unab.cl,37,Dolor Control Motor Biomecánica Riesgo de Caída en el Adulto Mayor Procesamiento de Señales Biológicas 
13542589241086358186,juan antonio castillo,Universidad Andrés Bello,unab,uandres,36,administración gestión pública gobierno universitario gobernanza universitaria gobierno electrónico 
13542589241086358186,Javiera Ramos-Zúñiga,"Universidad Andres Bello, BioNanotechnology and Microbiology Laboratory, Center for …",unab,uandres,36,Microbiología Nanotecnología Microbiología ambiental 
13542589241086358186,Kristov Cerda,Universidad Andrés Bello,unab,uandres,35,Humanidades Filosofía Literatura Estudios Culturales 
13542589241086358186,Cecilia Marambio,"Profesor de metodología de la Investigación, Universidad Andrés Bello",unab,unab.cl,35,Lider Transformador Gestión escolar Modelo Curricular de Innovación educativa procesamiento de la Información Espiral Di 
13542589241086358186,Claudia Pareja-Barrueto,PhD en Biotecnología UNAB,unab,uandres,35,Bioinformática 
13542589241086358186,Fernanda Moraga García,"Académica, Universidad Andrés Bello",unab,unab.cl,35,Literatura latinoamericana Teorías del género y Feminismos Cuerpo y fronteras frontera 
13542589241086358186,Roberto Leon,"Assistant Professor, Faculty of Engineering, Universidad Andres Bello",unab,unab.cl,35,Modeling and Simulation 
13542589241086358186,Tania Busch,"Universidad Andres Bello, Chile",unab,unab.cl,34,jurisdicción constitucional teoría constitucional democracia deliberativa procesos constituyentes derechos fundamentales 
13542589241086358186,Andrés Rosenberg,Universidad Andrés Bello,unab,unab.cl,34,Social Media Computer Mediated Communication Journalism Risk Management Communication 
13542589241086358186,G. Maier,Universidad Andrés Bello,unab,unab.cl,34,Latin American Cultural Studies Irony Cynicism Affects 
13542589241086358186,Claudia Miranda-Fuentes,"Faculty of Rehabilitation Sciences, Universidad Andres Bello, 7591538 Santiago, Chile",unab,unab.cl,34,exercise physiology 
13542589241086358186,Sebastián Espoz-Lazo,Universidad Andrés Bello,unab,unab.cl,30,Formación Deportiva rendimiento Deportivo Salud. 
13542589241086358186,María José Ubilla Carvajal,"Escuela Medicina Veterinaria, Universidad Andrés Bello",unab,unab.cl,30,Etología clínica veterinaria Bienestar Animal Vínculo Humano Animal Bioética 
13542589241086358186,Natalia Urra Jaque,Universidad Andrés Bello,unab,unab.cl,28,Historia Moderna Historia Colonial Historia de las Mujeres Historia de la Inquisición 
13542589241086358186,Margarita Aravena Gaete,Académico Postgrado Universidad  Andrès Bello,unab,uandres,26,Evaluación Docente Evaluación de los Aprendizaje Habilidades del Pensamiento 
13542589241086358186,MSc. Mendoza-León María José,PhD Student at Universidad Andrés Bello.,unab,uandres,26,Microbiología epidemiología enfermedades infecciosas. 
13542589241086358186,Claudia Arenas,Profesor Universidad Andrés Bello,unab,unab.cl,25,odontología educación 
13542589241086358186,Jose Navarrete Oyarce,"Profesor de Contabilidad y Finanzas, Universidad Andrés Bello",unab,unab.cl,24,Reporte Integrado RSE Gobierno Corporativo Contabilidad NIIF 
13542589241086358186,Marcia Martinez Arce,Universidad Andres Bello,unab,uandres,24,Desarrollo profesional docente enseñanza de la escritura aprendizaje docente formación docente 
13542589241086358186,Francisco Yuraszeck,Universidad Andrés Bello,unab,unab.cl,23,Scheduling Metaheuristics Constraint Programming Integer Programming 
13542589241086358186,Brayan Eberth Zambrano Gomez,Centro de investigación para la Sustentabilidad & Programa de Doctorado en Medicina de …,unab,uandres,23,Scavengers conservation ecology Anthropogenic subsidies 
13542589241086358186,Camilo Febres-Molina,"Candidate in Molecular Physical Chemistry PhD program, UNAB - Chile",unab,uandres,21,QM/MM Molecular Dynamics Biotechnology 
13542589241086358186,Cristian Céspedes,UNIVERSIDAD ANDRES BELLO,unab,unab.cl,21,psicología migración bienestar 
13542589241086358186,Brandon A. Úsuga A.,Universidad Andres Bello,unab,uandres,20,Medicinal Chemistry Neurodegenerative Diseases Molecular Dynamics Simulation 
13542589241086358186,Jonathan Martínez-Líbano,UNIVERSIDAD ANDRÉS BELLO,unab,unab.cl,20,psychology mental health higher education emotional exhaustion psychometry 
13542589241086358186,DANIEL NIETO,Universidad Andrés Bello,unab,unab.cl,19,historia historia grecorromana classics historiografía tradición clásica 
13542589241086358186,Alfredo Sierra-Cristancho,Profesor Asistente - Universidad Andrés Bello.,unab,uandres,18,Endodoncia Inmunología 
13542589241086358186,Joaquin Delgado-Rioseco,Universidad Andres Bello,unab,uandres,15,Postharvest Plant Physiology Plant Biology Cell Wall 
13542589241086358186,Estela Pérez,"Profesor Adjunto, Universidad Andrés Bello.",unab,uandres,15,Estrucutura y función de proteínas enzimas enzimología técnicas biofísicas de caracterización de … 
13542589241086358186,Iván Franchi,Universidad Andrés Bello,unab,unab.cl,14,Ecología urbana Ciudades circulares Metabolismo urbano Residuos Municipales Desarrollo Local 
13542589241086358186,Leandro Ayarde,PhD Student at Universidad Andrés Bello,unab,uandres,14,Computational and Theoretical Chemistry Density Functional Theory Topology 
13542589241086358186,David Toloza-Ramírez,Universidad Andres Bello,unab,unab.cl,13,Cognitive Neuroscience Neuropsychology Neurodegenerative Diseases Brain Injury Language Processing 
13542589241086358186,Reyes-Ferrada Waleska,Universidad Andres Bello,unab,unab.cl,13,
13542589241086358186,Pilar Ortega L de T,"Docente, Universidad andres bello",unab,unab.cl,13,terapia ocupacional rehabilitación personas mayores geriatria 
13542589241086358186,Caricia Pérez,Universidad Andrés Bello,unab,unab.cl,13,
13542589241086358186,Consuelo Murillo,Universidad Andrés Bello,unab,unab.cl,13,
13542589241086358186,Carolina Quinteros Urquieta,Universidad Andres Bello,unab,uandres,12,movilidad estudios urbanos ciencias ambientales sostenibilidad 
13542589241086358186,Carlos Calvo-Mac,Universidad Andrés Bello,unab,uandres,12,ecology 
13542589241086358186,Diego Beneventti,Universidad Andrés Bello,unab,unab.cl,12,
13542589241086358186,Nicolás Román González,Universidad Andrés Bello,unab,unab.cl,11,Literatura latinoamericana estudios culturales estudios de género teoría crítica 
13542589241086358186,"Alvarez-Arangua,  S.","Docente, Universidad Andres Bello",unab,uandres,11,Movimiento Humano 
13542589241086358186,Sandrino LLano Ramos,Universidad Andrés Bello,unab,uandres,11,Turismo 
13542589241086358186,Nicolas Garrido Abate,"Departamento de Ciencias de la Vida, Universidad Andrés Bello",unab,uandres,10,Host-pathogen interaction Biosecurity Biodefense 
13542589241086358186,Eliseo LARA ORDENES,Universidad Andres Bello,unab,unab.cl,10,Educación Pedagogía crítica Filosofía latinoamericana Estética Política 
13542589241086358186,Mónica Vergara-Quezada,"Trabajadora Social, Magister en Trabajo Social. Actualmente académica en Universidad …",unab,unab.cl,10,
13542589241086358186,Carmen Droguett,"Facultad de Derecho, Universidad Andrés Bello",unab,unab.cl,10,Derecho Constitucional Información y Protección de Datos … 
13542589241086358186,Franco Palominos,"PhD student,Universidad Andres Bello",unab,uandres,9,Inorganic chemistry singlet oxygen DFT 
13542589241086358186,David Ruete,Universidad Andres Bello,unab,unab.cl,9,Artificial Intelligence Machine Learning Educational Management Higher Thinking Skills network security 
13542589241086358186,Cristina Caparrós Vallcorba,"PhD (e) in Conservation Medicine, Andres Bello University",unab,uandres,9,Veterinary Conservation Medicine One Health Anthropogenic impact Wildlife conservation 
13542589241086358186,pablo nicolas rojas torres,Universidad Andrés Bello,unab,unab.cl,6,Historia descentralización sociología regionalización. 
13542589241086358186,boris araya valencia,Profesor universidad Andrés bello,unab,uandres,6,América colonial historia de Chile siglo XVI territorio representaciones cultura escrita 
13542589241086358186,Victoria Jiménez Arriagada,Universidad Andrés Bello,unab,uandres,6,Cómic Multimodalidad Didáctica de la lengua y Literatura Educación 
13542589241086358186,Constanza Marin Marquez,"Assistant Professor, Universidad Andres Bello",unab,unab.cl,6,Oral Pathology Oral Medicine Odontogenic Tumours Oral Cancer 
13542589241086358186,Loreto Nercelles,Universidad Andres Bello,unab,unab.cl,5,Voice ENT 
13542589241086358186,Paula Pardo,Universidad Andrés Bello,unab,unab.cl,5,Ciencias de la información 
13542589241086358186,Daniela Aravena,Universidad Andrés Bello,unab,uandres,5,Biotecnología Biología Molecular Acuicultura 
13542589241086358186,Giannina Costa,Universidad Andres Bello,unab,unab.cl,5,Software Engineering Educational Management Software Quality Requirement Engineering 
13542589241086358186,Pamela Soto Vergara,Universidad Andrés Bello,unab,unab.cl,4,Infancia Familias Feminismos Derechos de Infancia Derechos humanos 
13542589241086358186,Pamela Gamero Begazo,Universidad Andrés Bello,unab,uandres,4,Química Teorica y computacional Teoría de Funcionales de la Densidad 
13542589241086358186,Matias Vargas Marín,Universidad Andres Bello,unab,uandres,4,Computer Science 
13542589241086358186,Valentina Abello Passteni,Universidad Andrés Bello,unab,uandres,4,Medio ambiente 
13542589241086358186,Luis Leyton-Johns,Universidad Andres Bello,unab,uandres,3,Marketing Retail Management Branding Satisfacción Publicidad 
13542589241086358186,María José Muñoz,"Profesor de Radiología, Universidad Andrés Bello",unab,unab.cl,3,Reputación radiología 
13542589241086358186,Nicolás Espina Bocic,"Docente, Universidad Andrés Bello.",unab,uandres,3,Psicología social metodología de la investigación 
13542589241086358186,Sonia Martínez Moreno,Universidad Alberto Hurtado / Universidad Andrés Bello,unab,uandres,3,Historia del Arte Arte Moderno Arte Contemporáneo Arte Latinoamericano Estudios de la Pintura 
13542589241086358186,Shirin Azadi,"Universidad Andrés Bello, Researcher",unab,unab.cl,3,Power Electronics Drives 
13542589241086358186,Constanza Farías,"Estudiante de Doctorado de Ciencias Físicas, Universidad Andres Bello",unab,uandres,2,Statistical Mechanics Phase transitions Critical Phenomena Complex Systems Sociophysics 
13542589241086358186,Jerónimo Lira,Universidad Andrés Bello,unab,uandres,2,Density Functional Theory Chemical reactivity 
13542589241086358186,MARGOT RECABARREN,"Dra. Educación, Universidad de Alcalá, Docente y Directivo UNAB / Directora Programa …",unab,unab.cl,2,Formación de Profesores Didáctica y aprendizaje Evaluación del Aprendizaje Diseño Curricular por Competencias 
13542589241086358186,Zoraida  Sandoval-Olivares,"Ph.D. Molecular Physical Chemistry, Universidad Andrés Bello",unab,uandres,2,Molecular Magnetism 
13542589241086358186,Richard Soria Mora,Universidad Andrés Bello,unab,uandres,1,Deep learning anomaly detection 
13542589241086358186,Ruben Garcia-Aguirre,"Docente Escuela de Kinesiología, Universidad Andrés Bello (Chile)",unab,uandres,1,kinesiologia respiratoria funcion pulmonar respiratory physiotherapy lung function chest physical therapy 
13542589241086358186,Gonzalo Escobar Elexpuru,"Profesor Economía, Universidad Andrés Bello",unab,unab.cl,1,Organización Industrial 
13542589241086358186,Ximena Monserratt Ovalle Núñez,Universidad Andrés Bello,unab,uandres,1,Medio ambiente 
13542589241086358186,Luis Felipe Varela,"Profesor Asistente, Unidad de Psiquiatría, Escuela de Medicina, Facultad de Medicina …",unab,unab.cl,1,Psychiatry Psychopathology Psychiatric Classifications Psychosis Attachment Theory 
13542589241086358186,Vincent Depassier,Universidad Andres Bello,unab,uandres,1,simulation virtual reality 
13542589241086358186,Maria Victoria Gangas,Universidad Andrés Bello,unab,uandres,1,Microbiology phytopathology 
13542589241086358186,Cristian Saavedra Acuna,"Profesor Asistente, Facultad de Ingeniería, Universidad Andres Bello",unab,unab.cl,1,Emprendimiento Innovación Visualización de Datos Brecha de Género 
13542589241086358186,Eduardo González-Acevedo,"Docente en Universidad Andrés Bello, Viña del Mar, Chile",unab,uandres,,Educación enseñanza de inglés como lengua extranjera 
13542589241086358186,Cecilia Cancino Araya,"Profesora Biología, Universidad Andres Bello",unab,uandres,,ecología morfología funcional educación 
13542589241086358186,José Fernando Aguilera González,PhD (e) Universidad Andrés Bello. Centro de Investigación para la Sustentabilidad,unab,uandres,,Medicina de la Conservación Eco epidemiología espacial 
13542589241086358186,Karen Cecillia Manriquez Diaz,Universidad Andres Bello,unab,uandres,,ecología marina Oceanografía biologica 
13542589241086358186,Juan Alvaro Bello Carrasco,Investigador Universidad Andrés Bello - Universidad de La Frontera,unab,uandres,,sustentabilidad social Social LCA Social Life Cycle Assessment Análisis social de ciclo de vida participación ciudadana 
13542589241086358186,Lautaro Quiroga,Universidad Andrés Bello,unab,uandres,,
13542589241086358186,Pablo Esteban Ortiz Fuentes,"Ingeniero Civil Industrial Universidad Andrés Bello, Licenciado en Ciencias de la Ingeniería",unab,uandres,,Ciencias Política Historia 
13542589241086358186,Marcelo Adasme Valdés,"Ex alumno, Universidad Andrés Bello",unab,uandres,,Extractive Metallurgy Tailing Critical Raw Materials Synergestic Extraction Hydrometallurgy 
13542589241086358186,Luis Felipe Vergara,Universidad Andrés Bello,unab,unab.cl,,Recursos humanos comunicación estratégica comunicación política 
13542589241086358186,Manuel Moreno-Camus,Universidad Andrés Bello,unab,uandres,,Ciencias del Deporte Educación Física Entrenamiento Deportivo 
13542589241086358186,Alejandro Godoy Villalobos,Profesor Adjunto Universidad Andrés Bello,unab,uandres,,Entrepreneurship Innovation 
13542589241086358186,Danilo Leal Moraga,Universidad Andres Bello,unab,unab.cl,,Spatial Statistics Finance Economy Higher thinking 
13542589241086358186,Daniela Lehto Calderón,"Facultad de Educación y Ciencias Sociales, Universidad Andrés Bello",unab,uandres,,Historia de género representaciones mujeres 
13542589241086358186,Gisella Malatesta,Universidad Andrés Bello,unab,unab.cl,,
13542589241086358186,Rayen Rojas Maturana,"Licenciada en Letras con mención en Literatura, Universidad Andrés Bello",unab,uandres,,Literatura 
13542589241086358186,Paula Magdalena A.,"Académica Facultad de Educación y Ciencias Sociales, Universidad Andrés Bello",unab,unab.cl,,Evaluación infancias 
