id_gs,autor,cargo,id_institucion,email,citaciones,intereses
13542589241086358186,Jose Rodriguez,"Professor, Engineering Faculty, Universidad Andres Bello",unab,unab.cl,72720,Power electronics multilevel converters predictive control renewable energy industrial electronics 
13542589241086358186,Eduardo Alejandro Gutierrez Ramirez,"Magister, Universidad Andres Bello",unab,uandres,31989,history 
13542589241086358186,Patricia Perez,Universidad Andres Bello,unab,unab.cl,10364,Theoretical Chemistry Chemical Reactivity 
13542589241086358186,Ariel Orellana,"Universidad Andres Bello, Chile",unab,unab.cl,6150,Plant Biology Cell Biology Genomics Proteomics 
13542589241086358186,Claudia Andrea Riedel,Universidad Andrés Bello,unab,unab.cl,6119,Hypothyroxinemia iodide pregnancy fetal programming inflammatory … 
13542589241086358186,Alvaro A. Elorza,"Full Professor, Institute of Biomedical Sciences, Universidad Andres Bello",unab,unab.cl,5179,Mitochondria Stem Cells Cancer Hematopoiesis Aging 
13542589241086358186,Giancarlo V. De Ferrari,"Full Professor, Universidad Andres Bello",unab,unab.cl,5156,Wnt/beta-catenin signaling Alzheimer's disease autism spectrum disorders cancer genetics and genomics 
13542589241086358186,Eduardo Chamorro,Director Programa de Doctorado en FisicoQuimica Molecular. Universidad Andres Bello,unab,unab.cl,4591,Chemical Reactivity Density Functional Theory Spin polarized 
13542589241086358186,Claudio Cabello-Verrugio,Universidad Andres Bello,unab,unab.cl,3811,skeletal muscle atrophy angiotensin 1-7 TGF-beta angiotensin II 
13542589241086358186,Felipe Simon,Universidad Andres Bello,unab,unab.cl,3575,Inflammation Sepsis Vascular endothelial function Diagnosis ICU 
13542589241086358186,Timo Anguita,"Associate Professor, Universidad Andres Bello",unab,unab.cl,3495,Gravitational lensing Galaxy formation and Evolution AGNs 
13542589241086358186,Guido Mora,"Profesor Titular, UNAB",unab,unab.cl,3373,Microbiology 
13542589241086358186,Ramiro Arratia-Perez,Universidad Andres Bello,unab,unab.cl,3173,Relativistic Molecular Physics 
13542589241086358186,"Fernando Danilo Gonzalez Nilo, PhD","Director Center for Bioinformatics and Integrative Biology, Universidad Andres Bello …",unab,unab.cl,3138,Molecular Simulations Bio-nanotechnology Ion Channels Drug Design Protein Structure 
13542589241086358186,Ernesto Guiraldes,"Universidad Andrés Bello, Santiago, Chile and Profesor Titular P. Universidad Católica de",unab,unab.cl,3088,Health Sciences Education Pediatric Gastroenterology Coeliac Disease Functional Gastrointestinal Disorders Acute diarrhea 
13542589241086358186,Lorena Varela-Nallar,"Assistant Professor, Universidad Andres Bello",unab,unab.cl,2895,
13542589241086358186,Francisca Bronfman,Instituto de Ciencias Biomedicas. Universidad Andres Bello,unab,unab.cl,2624,Neurobiology Cellular and Molecular Biology Signaling Functional Lipids 
13542589241086358186,Cristian Duarte,"Departamento de Ecologia y Biodiversidad, Universidad Andres Bello",unab,unab.cl,2517,Sandy beach ecology ecophysiology environmental stressors 
13542589241086358186,Juan A. Ugalde,"Center for Bioinformatics and Integrative Biology, Universidad Andres Bello",unab,unab.cl,2471,Genomics Metagenomics Microbial Ecology Bioinformatics Evolutionary Genomics 
13542589241086358186,William Tiznado Vásquez,"Profesor de Química, Universidad Andres Bello, Chile",unab,unab.cl,2323,Quantum Chemistry Clusters aromaticity chemical bonding exploration of the potential energy surface 
13542589241086358186,Pérez-Donoso JM,"BioNanotechnology and Microbiology Lab, Universidad Andres Bello",unab,unab.cl,2292,
13542589241086358186,Luca Tarisciotti,Universidad Andres Bello,unab,unab.cl,2159,Power Electronics 
13542589241086358186,Rodrigo Olea,"UNAB, Chile",unab,unab.cl,2093,Gauge/Gravity Duality  Topological Terms … 
13542589241086358186,Claudia Miranda-Castillo,Universidad Andrés Bello,unab,unab.cl,2061,
13542589241086358186,Eyleen Araya Fuentes,Universidad Andres Bello,unab,unab.cl,2001,Biotecnología 
13542589241086358186,Alfredo Molina,universidad andres bello,unab,unab.cl,1884,Fish Physiology and Endocrinology Molecular Biology 
13542589241086358186,Paulo Canessa,"Assistant Professor at Centro de Biotecnologia Vegetal, Universidad Andres Bello",unab,unab.cl,1767,Fungal Microbiology Biotechnology Genomics and Genetics 
13542589241086358186,Walter Orellana,"Associate Professor, Department of Physical Science, Universidad Andres Bello",unab,unab.cl,1744,Condensed matter physics electronic structure calculations clean energy conversion 
13542589241086358186,Jorge H. Valdes,"Associate Professor, Center for Bioinformatics and Integrative Biology, Universidad Andrés …",unab,unab.cl,1739,Biotechnology Evolutionary Genomics Bioinformatics Synthetic Biology 
13542589241086358186,Carmen G Feijoo,"Universidad Andres Bello, Santiago, Chile",unab,unab.cl,1739,zebrafish immunology microbiota 
13542589241086358186,Rafael Islas,Universidad Andres Bello,unab,unab.cl,1736,Computational Chemistry aromaticity electronic delocalization clusters 
13542589241086358186,Maria Teresa Urrutia,Universidad Andres Bello,unab,unab.cl,1650,Cervical cancer hysterectomy women´s health 
13542589241086358186,Luis Araya-Castillo,"Investigador, Universidad Andrés Bello",unab,unab.cl,1637,Estrategia Marketing y Negocios Internacionales 
13542589241086358186,Christian M. Ibáñez,Universidad Andres Bello,unab,unab.cl,1604,Ecología evolución biogeografía Cephalopoda (calamares y pulpos) 
13542589241086358186,jimmy stehberg,"Instituto de Ciencias Biomédicas, Universidad Andrés Bello",unab,unab.cl,1597,
13542589241086358186,Sebastian E. Reyes-Lillo,"Associate Professor, Universidad Andres Bello",unab,unab.cl,1482,first principles materials science condensed matter physics 
13542589241086358186,"Loretto Contreras-Porcia, Loretto Contreras","Full Professor PhD, Departamento de Ecología y Biodiversidad, Universidad Andrés Bello",unab,unab.cl,1429,Phycology-Molecular Biology-Abiotic stress 
13542589241086358186,Claudio Meneses,"Centro de Biotecnología Vegetal, Universidad Andrés Bello",unab,unab.cl,1285,Genetics and genomics 
13542589241086358186,Juan A Fuentes,Universidad Andrés Bello,unab,unab.cl,1274,Microbiología y Genética Molecular 
13542589241086358186,Carlos J Blondel,Universidad Andres Bello,unab,unab.cl,1267,Microbial Pathogenesis 
13542589241086358186,José Miguel Alvarez Herrera,Universidad Andrés Bello,unab,unab.cl,1258,Plant Genomics 
13542589241086358186,Andrés Vega,Universidad Andres Bello,unab,unab.cl,1228,Quimica 
13542589241086358186,Luis Penailillo,"Universidad Andres Bello, Chile",unab,unab.cl,1214,Muscle Physiology Muscle and Tendon Behaviour Eccentric Exercise Muscle Damage Metabolic Syndrome 
13542589241086358186,Francisca Blanco-Herrera,"Professor, Centro de Biotecnología Vegetal, Universidad Andrés Bello",unab,unab.cl,1145,Plant biology plant-pathogen interaction plant system biology 
13542589241086358186,Elizabeth Garrido-Ramírez,Universidad Andres Bello,unab,unab.cl,1139,emergent contaminants advanced oxidation process Fenton reaction allophane nanoclays 
13542589241086358186,Daniel Jerez Mayorga,"Facultad Ciencias de la Rehabilitación, Universidad Andrés Bello, Santiago, Chile",unab,unab.cl,1112,Resistance Training Muscle Quality Physical Activity 
13542589241086358186,Cristian Bulboa,"Profesor Asociado, Universidad Andrés Bello",unab,unab.cl,1037,Botánica Marina ficología Acuicultura de algas marinas 
13542589241086358186,José Pulgar,Universidad Andres Bello,unab,unab.cl,1003,Marine Ecophysiology Coastal Ecology 
13542589241086358186,Carla Fardella,Universidad Andres Bello,unab,unab.cl,965,Psicología Social Psicología del Trabajo Identidad Resistencias Analisis del Discurso 
13542589241086358186,Carola Blazquez,"Professor, Universidad Andres Bello, Chile",unab,unab.cl,904,Transportation Safety ITS Waste Collection Systems 
13542589241086358186,Gloria Arriagada,Universidad Andres Bello,unab,unab.cl,891,virology molecular biology celular biology 
13542589241086358186,Gonzalo Aguila,Universidad Andres Bello,unab,unab.cl,882,Catálisis Ingeniería Química Sustentabilidad de Procesos Energía 
13542589241086358186,Raquel Castellanos,Profesora de la Universidad Andrés Bello,unab,unab.cl,878,Educación en Ciencias de la Salud 
13542589241086358186,Derie Fuentes,Environmental Sustainability at CSB-UNAB,unab,unab.cl,845,Biotechnology Biomonitoring Innovation Vaccines development 
13542589241086358186,Veronica A. Jimenez,Universidad Andres Bello,unab,unab.cl,826,Molecular simulation tubulin binding agents dendrimers 
13542589241086358186,Alejandra Ximena Araya,Universidad Andres Bello,unab,unab.cl,825,Vejez y envejecimiento 
13542589241086358186,Dayán Páez-Hernández,Universidad Andres Bello,unab,unab.cl,819,lanthanide actinide molecular magnetism optical properties aromaticity 
13542589241086358186,Verónica Quirici,Universidad Andres Bello,unab,unab.cl,804,Behavioral Ecology Molecular Ecology 
13542589241086358186,Michelle Mendoza Lira,Universidad Andres Bello,unab,unab.cl,794,
13542589241086358186,Gustavo Chiang,"Universidad Andrés Bello, Facultad de Ciencias de la Vida, Departamento de Ecología y …",unab,unab.cl,789,Aquatic ecology ecotoxicology endocrine disruption environmental pollution Conservation biology 
13542589241086358186,Mauro Basaure,Universidad Andrés Bello,unab,unab.cl,777,Sociology Social Theory Critical Theory Sociology of Time 
13542589241086358186,NALDY FEBRE VERGARA,"Profesor Titular, Facultad de Enfermería, Universidad Andres Bello",unab,unab.cl,770,Calidad seguridad de pacientes eventos adversos IAAS 
13542589241086358186,Pilar Parada Valdecantos,Universidad Andrés Bello,unab,unab.cl,739,Biotecnología biominería bioeconomía bioquímica 
13542589241086358186,Veronica Paredes García,Universidad Andres Bello,unab,unab.cl,738,Magnetismo Molecular Compuestos Polimetalicos Materiales Inorgánicos Materiales Multifuncionales 
13542589241086358186,Jilberto Antonio Zamora Saá,Universidad Andres Bello,unab,unab.cl,723,Physics 
13542589241086358186,Fernando Faunes,Universidad Andrés Bello,unab,unab.cl,719,Biología 
13542589241086358186,Alejandro A. Hidalgo,"Escuela de Química y Farmacia, Facultad de Medicina, Universidad Andres Bello",unab,uandres,702,Microbiology Bacterial genetics Gene expression Cancer biology 
13542589241086358186,karura hitomi shy,universidad Andres Bello,unab,uandres,681,salud 
13542589241086358186,Gisela C. Stotz,Universidad Andrés Bello,unab,unab.cl,675,Ecology Plant ecology Biological invasions Evolutionary ecology 
13542589241086358186,Adrian A. Moreno,Universidad Andres Bello,unab,uandres,659,Plant biology Unfolded Protein Response Endoplasmic Reticulum 
13542589241086358186,Andres Mendiburo Seguel,"Facultad de Educación y Ciencias Sociales, Universidad Andrés Bello",unab,unab.cl,654,Psychology humor 
13542589241086358186,Orietta Nicolis,Universidad Andres Bello,unab,unab.cl,620,modelli spaziali modelli spazio temporali wavelets processi a memoria lunga 
13542589241086358186,Nicolas Villagra,"Profesor Asistente, Facultad Medicina, UNAB",unab,unab.cl,609,Microbiology antimicrobial resistance 
13542589241086358186,Giovanni Giachetti,Universidad Andrés Bello,unab,unab.cl,607,Software Engineering Model-Driven Engineering Software Quality Systems Architecture Requirement Engineering 
13542589241086358186,"Ramon A Jorquera,","Institute of Biomedical Sciences, UNAB, Chile",unab,unab.cl,592,Molecular and Cellular Neurobiology Synaptic Physiology Neuronal Biophysics 
13542589241086358186,Alejandro Vasquez-Espinal,Universidad Andres Bello,unab,uandres,589,Molecular Physical Chemistry Computational Chemistry Electronic Structure Atomic Clusters 
13542589241086358186,Carla Taramasco,Universidad Andres Bello,unab,unab.cl,564,Health Informatics (social) complex systems dynamic networks contagious diseases and obesity 
13542589241086358186,Mauricio J Carter,Universidad Andres Bello,unab,unab.cl,558,Evolutionary Biology 
13542589241086358186,Romina Cayumil,Universidad Andres Bello,unab,unab.cl,556,E-waste Recycling Circular Economy Waste Management Metallurgy 
13542589241086358186,Alberto Faraggi,Universidad Andrés Bello,unab,unab.cl,529,Theoretical High Energy Physics 
13542589241086358186,Alberto Cornejo,"Profesor Asociado, Universidad Andrés Bello",unab,unab.cl,514,Agregación inhibidores tau alpha synuclein 
13542589241086358186,Nancy Pizarro,"Profesor Investigador, Universidad Andres Bello",unab,unab.cl,504,fisicoquimica fotoquimica fotofisica 
13542589241086358186,Sven Niklander Ebensperger,"Associate Professor, Universidad Andrés Bello",unab,unab.cl,473,Oral cancer odontogenic tumours xerostomia oral mucosal disorders cellular senescence 
13542589241086358186,Jorge Soto-Delgado,"Universidad Andrés Bello, Viña del Mar",unab,unab.cl,455,Medicinal Chemistry Computational Chemistry Drug Design 
13542589241086358186,Karen Manríquez Díaz,Universidad Andres Bello,unab,uandres,441,Oceanografia Ecologia 
13542589241086358186,Rodrigo Aguilar,"Assistant Professor, Institute for Biomedical Sciences, Universidad Andres Bello",unab,uandres,435,Epigenetics non coding RNAs 
13542589241086358186,Jose Mauricio Gonzalez Suarez,Universidad Andres Bello,unab,unab.cl,432,física química teórica desarrollo docente docencia universitaria enseñanza de la física 
13542589241086358186,René Valdés Morales (ORCID: 0000-0003-4242-9748),Universidad Andrés Bello,unab,unab.cl,430,Facultad de Educación y Ciencias Sociales 
13542589241086358186,Elizabeth Montero,Universidad Andres Bello,unab,unab.cl,426,Metaheuristic algorithms (Combinatorial) optimization problems Parameter setting problem in metaheuristics Multi-objective (combinatorial) optimization Artificial intelligence for games. 
13542589241086358186,Carolina Urbina,Universidad Andrés Bello,unab,unab.cl,423,Educación inclusiva convivencia escolar crisis sociales 
13542589241086358186,Daniel Aguayo,"Professor, Universidad Andres Bello",unab,unab.cl,412,molecular simulations bioinformatics biochemistry 
13542589241086358186,Romina V. Sepúlveda,Universidad Andres Bello,unab,uandres,392,
13542589241086358186,Javier Torres-Vallejos,Universidad Andres Bello,unab,unab.cl,374,Deserción escolar Convivencia escolar Violencia escolar Bienestar 
13542589241086358186,Edmundo Muñoz Alvear,Universidad Andrés Bello,unab,unab.cl,368,LCA/ACV Metabolismo Urbano Economía CIRCULAR Gestión de Residuos Producción Limpia 
13542589241086358186,Felipe Balmaceda,"Andres Bello University, Economic Poicy Institute",unab,unab.cl,363,microeconomics corporate finance social networks 
13542589241086358186,Nicolás Garrido,"Profesor Asociado Departamento de Economía y Administración, Universidad Andrés Bello",unab,unab.cl,359,macroeconomía cambio tecnológico sistemas complejos metodología de la ciencia 
13542589241086358186,Juliana Murillo,Universidad Andrés Bello,unab,uandres,353,Química y Biología Computacional Fisicoquímica Cinética Enzimática 
13542589241086358186,Romina Torres,Universidad Andres Bello,unab,unab.cl,351,self- aware and organizing systems IoT decisión making recommender systems smart cities 
13542589241086358186,Juan A. Correa,Universidad Andres Bello,unab,unab.cl,331,Industrial Organization Economics of Innovation Labor Economics Economics of Education 
13542589241086358186,Sebastian A. Klarian,"Associated Professor, Universidad Andres Bello",unab,unab.cl,316,Fish Biology Trophic Ecology Stable Isotopes Fisheries Ecology 
13542589241086358186,Rodrigo Zuloaga Royo,Universidad Andres Bello,unab,uandres,315,fish physiology fish endocrinology fish immunology 
13542589241086358186,Francisco Guede Rojas,Universidad Andrés Bello,unab,unab.cl,307,… y rendimiento físico. Metodología de la … 
13542589241086358186,Freddy Flores-Bahamonde,Assistant Professor at Universidad Andrés Bello,unab,unab.cl,307,Power Electronics Renewable Energy Microgrids 
13542589241086358186,Stéphanie Alenda,"Associate Professor of Sociology, School of Sociology, Universidad Andrés Bello",unab,unab.cl,306,Political Sociology Party Members and Activists Collective Action 
13542589241086358186,Nelson Lay Raby,Universidad Andrés Bello,unab,unab.cl,303,Organizaciones discapacidad 
13542589241086358186,Francisco Fernandoy,"Earth Science School, Andres Bello University",unab,unab.cl,294,geology geochemistry stable isotopes glaciology 
13542589241086358186,Paulina Calderón,Universidad Andres Bello,unab,uandres,283,Microbiología Biología molecular 
13542589241086358186,Cristina Navarro,Universidad Andres Bello,unab,unab.cl,282,
13542589241086358186,Luis Navarro,Universidad Andres Bello,unab,unab.cl,281,Educación educabilidad asesoría gestión escolar liderazgo 
13542589241086358186,Mauricio Salgado,Associate Professor. School of Sociology - Universidad Andrés Bello,unab,unab.cl,273,Computational sociology Experimental sociology Agent-based modelling Analytical Sociology Social research methods 
13542589241086358186,Jaime Pizarro Aura,"Professor of English, Andres Bello University, Chile",unab,unab.cl,273,e-learning e-portfolios English phonetics peer feedback critical thinking 
13542589241086358186,Héctor Gutiérrez-Espinoza,"Universidad Andres Bello, Chile",unab,unab.cl,266,Physical Therapy Distal Radius Fracture Shoulder Impingement Syndrome Rotator Cuff Disorders Exercise Therapy 
13542589241086358186,Juan Felipe Calderón,Universidad Andres Bello,unab,unab.cl,254,Software Engineering Collaborative Learning Distributed Systems Computer Science Education 
13542589241086358186,Dafna Benadof,Universidad Andrés Bello,unab,unab.cl,252,odontología educación salud pública ciencias del comportamiento 
13542589241086358186,Paula Plaza,"Escuela de Kinesiología, Facultad de Ciencias de la Rehabilitación, Universidad Andres …",unab,unab.cl,252,Corporal Balance cognitive function 
13542589241086358186,René Andrés Martínez Flores,"Assistant Professor, School Of Dentistry, Andres Bello University",unab,unab.cl,251,Oral Pathology and Oral Medicine 
13542589241086358186,Miguel Vargas,"Full Professor, Facultad de Economía y Negocios, Universidad Andrés Bello",unab,unab.cl,247,Urban Economics Social Dynamics Industrial Organization 
13542589241086358186,Juan  Eberhard,"Assistant Professor, Business School, Universidad Andres Bello",unab,unab.cl,243,Macroeconomics Labor economics 
13542589241086358186,Plinio Cantero-López,"MSc in Chemistry /Ph.D. in Molecular Physical Chemistry,Universidad Andrés Bello",unab,uandres,242,lanthanide optical properties electronic structure molecular biophysics synthesis 
13542589241086358186,Ignacio Díaz-Franulic,Universidad Andres Bello,unab,unab.cl,237,Ion channels 
13542589241086358186,Pablo A. Oyarzún Cabañas,Universidad Andres Bello,unab,unab.cl,231,Genética Biología Reproductiva de Invertebrados Acuicultura 
13542589241086358186,Soraya Bravo,"Centro de Biotecnología Vegetal, Facultad de Ciencias Biológicas, Universidad Andres …",unab,unab.cl,230,Plant epigenetics sRNAs 
13542589241086358186,Tomás Errázuriz,"Profesor Asociado, Campus Creativo, Universidad Andres Bello",unab,unab.cl,230,Vida cotidiana cultura material estudios culturales urbanos espacio doméstico estudios de movilidad 
13542589241086358186,Paula Charbonneau-Gowdy,"Associate Professor, Universidad Andres Bello, Santiago Chile",unab,unab.cl,230,learning and technology e-learning distance learning teacher education 
13542589241086358186,Rodrigo Soto Lagos,"Profesor Investigador, Facultad de Educación y Ciencias Sociales, Universidad Andrés …",unab,unab.cl,221,Politicas públicas deportes investigación cualitativa 
13542589241086358186,Patricio Sánchez,"PhD Student, Universidad Andrés Bello",unab,uandres,211,
13542589241086358186,Carlos del Río Ferretti,Universidad Andrés Bello (Chile),unab,unab.cl,204,Derecho procesal derecho público filosofía del derecho 
13542589241086358186,Aiko Adell,"Escuela de Medicina Veterinaria, Facultad Ciencias de la Vida, Universidad Andres Bello …",unab,unab.cl,187,Biological water quality Waterborne pathogens Antimicrobial resistance 
13542589241086358186,Franko Restovic,Center for Systems Biotechnology (CSB-UNAB),unab,unab.cl,184,Agriculture Biotechnology Plant Molecular Biology Foods & Ingredients Seed Metabolism 
13542589241086358186,Jorge Aedo,Universidad Andrés Bello,unab,uandres,180,Biología molecular Biotecnología Bioinformática 
13542589241086358186,José Aliste-Prieto,"Departamento de Matemáticas, Universidad Andrés Bello",unab,unab.cl,176,dynamical systems non-periodic tilings invariant of graphs 
13542589241086358186,Diego Inostroza,PhD student Universidad Andres Bello,unab,UANDRES,174,Computational Chemistry 
13542589241086358186,Luis  F. Robledo,Universidad Andres Bello,unab,unab.cl,168,Simulation Disaster Risk Reduction Decision-making 
13542589241086358186,Yeray A. Rodríguez-Núñez,Universidad Andrés Bello,unab,uandres,165,Química Orgánica Síntesis orgánica Química medicinal 
13542589241086358186,Denisse Cartagena-Ramos,"Assistant Professor Facultad de Enfermería, Universidad Andrés Bello",unab,unab.cl,163,Sexual Health and Infections Diseases 
13542589241086358186,Juan P Peñaloza,Universidad Andres Bello,unab,uandres,162,
13542589241086358186,Troy Ejsmentewicz,Universidad Andres Bello,unab,uandres,162,Postharvest Physiology Plant Biology Cell and Molecular Biology 
13542589241086358186,Rodrigo Báez-Grez,Universidad Andres Bello,unab,uandres,162,
13542589241086358186,Manuel Arias Calderón,Universidad Andrés Bello,unab,unab.cl,161,Fisiologia Muscular Biología Celular Bioquimica 
13542589241086358186,Nicolás Pacheco,"PhD in Biotechnology , Universidad Andrés Bello",unab,uandres,158,Environmental microbiology 
13542589241086358186,Diego Quintanilla-Ahumada,Universidad Andres Bello,unab,uandres,154,Ecology Marine Biology Marine Ecology Ecophysiology Light Pollution 
13542589241086358186,Carlos Gómez-Pantoja,"Assistant Professor, Universidad Andres Bello",unab,unab.cl,152,Parallel Computing Load Balancing Social Computing Information Retrieval 
13542589241086358186,Jorge Chavez Rojas. Ph.D.,Universidad Andres Bello,unab,unab.cl,151,Group Awareness Online Learning Participation Computer Supported Collaborative Learning. 
13542589241086358186,Claudio Chamorro,"Kinesiólogo, Universidad Andrés Bello y Clínica Las Condes",unab,unab.cl,150,rehabilitación en rodilla hombro confiabilidad instrumentos de medición 
13542589241086358186,Julio J. Guzman,"Faculty of Economics and Business, Universidad Andres Bello (UNAB)",unab,unab.cl,149,Applied Microeconometrics Evaluation of Social Programs 
13542589241086358186,María José Correa Gómez,Universidad Andrés Bello,unab,unab.cl,149,
13542589241086358186,Claudio Olmos González,Universidad Andrés Bello; Clínica INDISA,unab,unab.cl,148,Epidemiología Salud Pública Metodología de Investigación Educación Médica 
13542589241086358186,Leith Passmore,Universidad Andrés Bello,unab,unab.cl,146,
13542589241086358186,Ramón Alexander Uzcátegui Pacheco,Universidad Andrés Bello - Chile,unab,uandres,146,Educación Pedagogía Historia de la Educación 
13542589241086358186,Billy Peralta,Universidad Andres Bello,unab,unab.cl,145,
13542589241086358186,Nacarid Delgado,Universidad Andrés Bello,unab,unab.cl,145,Química 
13542589241086358186,Patricio Zambrano Lobos,Universidad Andres Bello,unab,unab.cl,141,Sedimentologia Icnología Estratigrafia Secuencial 
13542589241086358186,Yorley Duarte,"Researcher Universidad Andrés Bello, Santiago-Chile",unab,unab.cl,141,Organic Synthesis Bioinformatics drug discovery and delivery 
13542589241086358186,Juan Pablo Zavala Crichton,"Profesor Educación Física, Universidad Andrés Bello",unab,unab.cl,137,Educación Física Condición Física y Salud Rendimiento cognitivo 
13542589241086358186,Viviana Toledo,Universidad Andrés Bello,unab,uandres,136,bacterial genomics 
13542589241086358186,Oswaldo Menéndez,"Professor, Engineering Faculty, Universidad Andrés Bello",unab,unab.cl,136,robotics power system smartgrids energy harvesting electric field energy harvesting 
13542589241086358186,Gustavo Cataldo Sanguinetti,Universidad Andres Bello,unab,unab.cl,135,filosofía antigua estética fenomenología hermenéutica 
13542589241086358186,Juan Pablo Toro,Universidad Andres Bello,unab,unab.cl,135,Open channel hydraulics CFD Sediment transport 
13542589241086358186,Sophia Di Cataldo,Universidad Andres Bello,unab,uandres,133,Epidemiology vector-borne diseases wildlife 
13542589241086358186,Jose Zamora,"Departamento de Matemáticas, Universidad Andrés Bello",unab,unab.cl,132,Graph Theory Combinatorics 
13542589241086358186,Luis Felipe Barraza,"Dr. en Química. Profesor de planta adjunta e investigador, Universidad Andrés Bello",unab,uandres,132,Medicinal Chemistry Drug-delivery Molecular Dynamics NMR spectroscopy Nanomaterials 
13542589241086358186,cecilia gamboa,Universidad Andrés Bello,unab,unab.cl,129,Biotecnología Forestal 
13542589241086358186,Guido Carvajal,Universidad Andrés Bello,unab,unab.cl,123,Water treatment Bayesian networks Risk Assessment 
13542589241086358186,Daniel J Pons,"Departamento de Matemáticas, Universidad Andres Bello",unab,unab.cl,122,differential geometry analysis ecology chemistry 
13542589241086358186,Fernanda Mendoza,"Postdoctoral Researcher, Universidad Andres Bello",unab,uandres,117,Molecular Modelling Enzyme Catalysis 
13542589241086358186,Nicolás Pablo Barrientos Oradini,Universidad Andrés Bello,unab,unab.cl,111,Administración Economía Negocios Políticas Públicas Educación 
13542589241086358186,Pamela P. Alvarez,Universidad Andres Bello,unab,unab.cl,110,
13542589241086358186,Niklas Bornhauser,Associate Professor Universidad Andrés Bello,unab,unab.cl,108,Psychoanalyse Philosophie 
