id_gs,autor,cargo,id_institucion,email,citaciones,intereses
4727335469935944428,Bernardo Arriaza,Universidad de Tarapacá,uta,uta.cl,6208,Chinchorro mummies Bioarchaeology Paleopathology 
4727335469935944428,Alejandra Caqueo-Urízar,Universidad de Tarapacá,uta,uta.cl,5782,Psicología Clínica 
4727335469935944428,Calogero M. Santoro,Universidad de Tarapaca,uta,uta.cl,5192,Archaeology hunter-gatherers paleoenviroment South America Andes 
4727335469935944428,Bárbara Rojas-Ayala,"Astronomer, Instituto de Alta Investigación, Universidad de Tarapacá",uta,uta.cl,4923,Low Mass Stars Brown dwarfs Exoplanets 
4727335469935944428,Emilio Rodríguez Ponce,Profesor Titular - Universidad de Tarapacá (Chile),uta,uta.cl,3538,Educación Superior Gestión del Conocimiento Liderazgo 
4727335469935944428,Heriberto Román Flores,Universidad de Tarapacá,uta,uta.cl,3538,
4727335469935944428,ESPINOZA OSCAR .,Facultad de Educación y Humanidades de la Universidad de Tarapacá,uta,academicos.uta.cl,3517,Educación superior políticas educativas equidad aseguramiento de calidad 
4727335469935944428,Francisco Ganga Contreras,Universidad de Tarapacá,uta,academicos.uta.cl,3334,Educación superior gobernanza universitaria gobierno universitario talento humano liderazgo 
4727335469935944428,Liliana Pedraja Rejas,Profesora Titular Universidad de Tarapaca,uta,uta.cl,3221,liderazgo educación superior estrategia. 
4727335469935944428,David Laroze,"Professor of Physics, Universidad de Tarapacá",uta,uta.cl,2294,Chaos Hydrodynamic Instabilities Magnetism Quantum mechanics Mathematical modeling 
4727335469935944428,Sergio gonzález Miranda,"Universidad de Tarapacá, profesor titular",uta,academicos.uta.cl,1683,historia regional relaciones internacionales historia de la minería 
4727335469935944428,Hector Gonzalez,Universidad de Tarapacá,uta,uta.cl,1550,
4727335469935944428,Alejandro Cuadra,Universidad de Tarapaca,uta,uta.cl,1300,Psicología Metodología de Investigación Gestión Organizacional 
4727335469935944428,BARBARA AILEEN CERNA TOVAR,Estudiante Psicología UTA,uta,alumnos.uta.cl,1297,Psicología 
4727335469935944428,Julio A. Carballo-Bello,"Independent Researcher, Universidad de Tarapacá",uta,academicos.uta.cl,1210,Near-Field cosmology Milky Way globular clusters tidal streams 
4727335469935944428,Iván Muñoz Ovalle,Universidad de Tarapacá,uta,uta.cl,1191,Arqueología del norte grande de Chile patrones de asentamiento relacion es interétnicas 
4727335469935944428,JC Flores,Universidad de Tarapacá,uta,uta.cl,1146,Física Matemática 
4727335469935944428,Juan Jesus Rodriguez,"Staff Profesional, Universidad de Tarapacá",uta,uta.cl,1143,Educación Liderazgo Administración 
4727335469935944428,Carolina Guzmán-Valenzuela,University of Tarapacá (Chile),uta,academicos.uta.cl,1135,Higher Education Qualitative research in Education 
4727335469935944428,Constanza Veloso,"Universidad de Tarapacá, Departamento de Psicología",uta,academicos.uta.cl,1123,psicología organizacional psicología positiva metodología de la investigación análisis de datos 
4727335469935944428,Héctor A. Vargas,Universidad de Tarapacá,uta,uta.cl,1062,Entomología 
4727335469935944428,Alfonso Díaz Aguad,"Profesor de Historia, Universidad de Tarapacá",uta,uta.cl,881,Migraciones Historia Regional 
4727335469935944428,Manuel Prieto,"Professor, Universidad de Tarapacá",uta,academicos.uta.cl,757,Geography 
4727335469935944428,Daniela Valenzuela,"Profesora, Investigadora, Universidad de Tarapacá",uta,uta.cl,714,Andean archaeology pre-Hispanic economy animal consumption visual images production/use of rock art and geoglyphs 
4727335469935944428,Cristóbal E. Castro,Universidad de Tarapacá,uta,academicos.uta.cl,697,High order finite volumes unstructured meshes multiphase flows 
4727335469935944428,Carlos Ubeda de la Cerda,Universidad de Tarapacá,uta,uta.cl,676,medical physics física médica protección radiologica radiological protection 
4727335469935944428,Sebastián Lorca,Universidad de Tarapacá,uta,uta.cl,647,Análisis Ecuaciones Diferenciales 
4727335469935944428,Cristian Ovando Santana,"Universidad de Tarapacá, Dpto. de Ciencias Sociales.",uta,academicos.uta.cl,638,Relaciones Internacionales Paradiplomacia Paradiplomacy Fronteras Diplomacy 
4727335469935944428,José Cárcamo-Vega,Universidad de Tarapacá,uta,uta.cl,627,Arqueometria Raman SERS Nanoestructuras 
4727335469935944428,carmen araneda guirriman,Universidad de Tarapacá,uta,academicos.uta.cl,554,
4727335469935944428,Oliver Meseguer-Ruiz,"Associate Professor, Universidad de Tarapacá",uta,academicos.uta.cl,536,Climatology Meteorology 
4727335469935944428,Pilar Mazuela,Universidad de Tarapaca,uta,uta.cl,533,agronomia agricultura cultivo sin suelos fertirriego fertilizacion 
4727335469935944428,MARCOS CARMONA HALTY,Universidad de Tarapacá,uta,academicos.uta.cl,505,
4727335469935944428,Marcos Carmona-Halty,Universidad de Tarapacá,uta,academicos.uta.cl,499,Social Psychology Educational Psychology Organizational Psychology 
4727335469935944428,Vivian Gavilán Vega,Universidad de Tarapacá,uta,uta.cl,420,Estudios de Género Salud y Pueblos Originario Etnicidades 
4727335469935944428,Yoelsy Leyva,"Departamento de Física, Universidad de Tarapacá",uta,academicos.uta.cl,414,Cosmology and Particle Physics 
4727335469935944428,FRANCISCO LEAL-SOTO,"Departamento de Ciencias Sociales, Universidad de Tarapacá",uta,academicos.uta.cl,404,
4727335469935944428,Mario Villalobos,Universidad de Tarapacá,uta,academicos.uta.cl,397,Filosofía de las ciencias cognitivas 
4727335469935944428,Andrés M. Vélez-Pereira,"Departamento de Ingeniería Mecánica, Facultad de Ingeniería, Universidad de Tarapacá",uta,academicos.uta.cl,389,Air pollution Aerobiology Modelling Noise Pollution Environmental Health 
4727335469935944428,CARLOS GONZALEZ SILVA,"prof Bioquimica, microbiologia, Universidad de Tarapaca, iquique, Chile",uta,academicos.uta.cl,388,microbiologia ambiental ecologia bioquimica 
4727335469935944428,Pamela Zapata-Sepúlveda,Universidad de Tarapacá. Escuela de Psicología y Filosofía,uta,uta.cl,382,qualitative inquiry psychology cultural studies critical methodologies 
4727335469935944428,Edmundo Lazo,"Departamento de Física, Facultad de Ciencias, Universidad de Tarapacá",uta,uta.cl,364,disordered systems 
4727335469935944428,Edgar Estupinan,"Associate Professor, University of Tarapaca (Chile)",uta,uta.cl,362,Mechanical Vibrations Rotor Dynamics Tribology Mechatronics 
4727335469935944428,Rodrigo Ferrer Urbina,"Escuela de Psicología y Filosofía, Universidad de Tarapacá",uta,academicos.uta.cl,321,
4727335469935944428,Kanchana C,"Universidad de Tarapacá, Chile",uta,academicos.uta.cl,311,Rayleigh - Benard convection Lorenz model Ginzburg-Landau model 
4727335469935944428,Carlos Mondaca Rojas,Profesor Titular Universidad de Tarapacá,uta,uta.cl,283,Educación Intercultural Educación y Migración Historia y Educación 
4727335469935944428,Ricardo Valdivia Pinto,Universidad de Tarapacá,uta,academicos.uta.cl,281,Educación en Ingeniería Bases de Datos 
4727335469935944428,Luis Antonio Barrio Mateu,"Profesor de biomecánica, Universidad de Tarapacá",uta,uta.cl,268,Biomecánica en el deporte Evaluación y mediciones en deportistas obesidad infantil 
4727335469935944428,"Gonzalo R. Quintana Zunino, PhD.",Universidad de Tarapacá,uta,academicos.uta.cl,266,Orgasm Sex Sexual Behavior Sexual Response Sexual Function 
4727335469935944428,Laura Milena Pérez,"Assistant Professor of Physics, Universidad de Tarapacá",uta,uta.cl,260,Computational Physics Nonlinear Physics Fluids Chaos 
4727335469935944428,Anton Tiutiunnyk,Universidad de Tarapacá,uta,uta.cl,200,Semiconductors nanostructures Condensed matter physics 
4727335469935944428,Ignacio Jessop,Universidad de Tarapacá,uta,uta.cl,178,Conjugated polymers Polymer chemistry Organic synthesis Materials chemistry 
4727335469935944428,Gonzalo Valdés,Universidad de Tarapacá,uta,uta.cl,175,Economics Econometrics Applied Econometrics 
4727335469935944428,Claudio Parra Montes,Universidad de Tarapacá,uta,uta.cl,170,Organic Chemistry and Natural Products 
4727335469935944428,RAUL  BUSTOS GONZALEZ,Universidad de Tarapacá,uta,academicos.uta.cl,168,Historia Regional Innovación Educativa Educación Intercultural Rol docente Historia de la migración en Chile 
4727335469935944428,José Castelleti,"Profesor de Arqueología, Universidad de Tarapacá",uta,uta.cl,156,Arqueología costera Arte rupestre Etnografía Antropología 
4727335469935944428,Roberto Espinosa Oliva,Universidad de Tarapacá,uta,academicos.uta.cl,144,Data Mining Model Driven Development Data Quality 
4727335469935944428,Diego Nocetti García,Universidad de Tarapacá,uta,academicos.uta.cl,144,Radiología protección radiológica garantía de calidad imagen científica educación superior 
4727335469935944428,Vagner de Sousa Beserra,Universidad de Tarapacá,uta,uta.cl,131,Educational Technology Learning Technology 
4727335469935944428,Jorge Bernal,Universidad de Tarapacá,uta,uta.cl,128,Marketing Business 
4727335469935944428,Andrea Chamorro Pérez,"Académica, Departamento de Antropología, Universidad de Tarapacá",uta,academicos.uta.cl,127,Antropología del cuerpo Estudios de Performance Antropología Visual Antropología del Arte 
4727335469935944428,Raul Herrera-Acuna,Universidad de Tarapacá,uta,uta.cl,125,Human-Computer Interaction Virtual Reality Entrepreneurship Software Engineering Intelligent Environments 
4727335469935944428,Matías Calderón-Seguel,Universidad de Tarapacá,uta,academicos.uta.cl,123,cuestión agraria estudios rurales estudios territoriales extractivismo 
4727335469935944428,Andrea Alvarado Urbina,Universidad de Tarapacá,uta,academicos.uta.cl,123,sociology education ethnicity migration 
4727335469935944428,Isabel M. Aguilera,Universidad de Tarapaca,uta,uta.cl,119,Antropología de la alimentación nacionalismos 
4727335469935944428,Carlos Piñones Rivera,"Universidad de Tarapacá, Chile",uta,academicos.uta.cl,117,Medical Anthropology Psychoanalysis Intercultural Health Indigenous People Migrant health 
4727335469935944428,Patricia Palma,Profesora Asistente. Departamento de Ciencias Históricas y Geográficas. Universidad  de …,uta,academicos.uta.cl,103,Chinese in Latin America Migration and health 
4727335469935944428,NATHALIA MEDELIZ CORTES CASTRO,"Estudiante de Psicología, Universidad de Tarapacá",uta,alumnos.uta.cl,88,Psicología Ciencias Sociales 
4727335469935944428,EXEQUIEL MALLEA ZEPEDA,"Profesor de Matemática, Universidad de Tarapacá",uta,uta.cl,86,Análisis Matemático Ecuaciones Diferenciales Parciales Teoría de Control Mecánica de Fluidos 
4727335469935944428,Roxana Chiappa,Universidad de Tarapacá,uta,academicos.uta.cl,76,inequality sociology of science decolonial studies internationalization of higher education 
4727335469935944428,Rubén Capetillo Velásquez,Académico - Universidad de Tarapacá,uta,uta.cl,75,Metodologías de Enseñanza Aprendizaje 
4727335469935944428,José Berríos-Riquelme,"Departamento de Ciencias Sociales, Universidad de Tarapacá",uta,uta.cl,69,
4727335469935944428,KM Lakshmi,Universidad de Tarapaca,uta,academicos.uta.cl,61,Applied Mathematics Fluid mechanics convection heat transfer 
4727335469935944428,JORGE FRANCISCO BERNAL PERALTA,Universidad de Tarapacá,uta,academicos.uta.cl,61,Marketing Business 
4727335469935944428,Paulina Catalina Lira Jorquera,"Estudiante Psicología, Universidad de Tarapacá",uta,alumnos.uta.cl,57,Psicología Ciencias Sociales 
4727335469935944428,Kristopher Chandia,Universidad de Tarapacá,uta,academicos.uta.cl,56,electrical circuits memristors electromagnetic field theory 
4727335469935944428,Rubén López,Universidad de Tarapacá,uta,academicos.uta.cl,56,Optimización 
4727335469935944428,Richard Bustos,INVESTIGADOR ASISTENTE UNIVERSIDAD DE TARAPACA,uta,uta.cl,54,fisiólogia vegetal riego relaciones hidrias 
4727335469935944428,Dailet Fredes Collarte,"Universidad de Tarapacá, Universidad de Salamanca",uta,academicos.uta.cl,54,riesgos psicosociales conciliación familia-trabajo satisfacción laboral. 
4727335469935944428,Ana Maria Cabanas Plana,Universidad de Tarapacá,uta,academicos.uta.cl,49,Física médica física no-lineal magnetismo 
4727335469935944428,Esther Echenique,Universidad de Tarapacá,uta,academicos.uta.cl,48,andean archaeology ceramic analysis 
4727335469935944428,Mónica Meza Aliaga,University of Tarapacá,uta,academicos.uta.cl,42,Geography Social production of space Frontier Border Political geography 
4727335469935944428,Giuliani Coluccio,"Profesor de Management, Universidad de Tarapacá",uta,academicos.uta.cl,33,Educación Superior Liderazgo Equipos 
4727335469935944428,Javier Vélez,Universidad de Tarapacá,uta,academicos.uta.cl,27,Física 
4727335469935944428,OSCAR  CORVACHO-GANAHIN,"Professor of Geography, University of Tarapacá (UTA)",uta,academicos.uta.cl,26,geography landslide floods debris flow flood risk 
4727335469935944428,Hector Beck,"Profesor Asociado, Universidad de Tarapacá, Arica Chile",uta,uta.cl,20,Minería de datos Análisis de Algoritmos Teoría de la Computación 
4727335469935944428,Joselin Leal,Universidad de Tarapacá,uta,academicos.uta.cl,11,Antropología Historia Pueblos Indígenas 
4727335469935944428,Manuel Barraza Rodríguez,"Departamento de ingeniería eléctrica y electrónica, UTA",uta,uta.cl,10,Control automático Robótica 
4727335469935944428,Pablo Gálvez Castex,"Académico, Universidad de Tarapacá",uta,uta.cl,9,Economía aplicada 
4727335469935944428,Ana Soza Romero,"Profesora de Castellano , Universidad de Tarapacá",uta,uta.cl,7,educación formación docente cambio educativo lectura 
4727335469935944428,Katherine Acosta García,Universidad de Tarapacá,uta,academicos.uta.cl,7,Didáctica de las ciencias 
4727335469935944428,María-Carla Morales-Gómez (ORCID 0000-0002-2206-3104),Universidad de Tarapacá,uta,academicos.uta.cl,6,Psicología Social Educación Superior Salud Mental 
4727335469935944428,RICARDO ENRIQUE FUENTES ROMERO,Universidad de Tarapacá,uta,academicos.uta.cl,5,Termofluidos 
4727335469935944428,LORENA DEL PILAR CORNEJO PONCE,Universidad de Tarapacá,uta,academicos.uta.cl,5,
4727335469935944428,Lucas Maubert,Universidad de Tarapacá,uta,alumnos.uta.cl,5,Historia y Relaciones Internacionales 
4727335469935944428,Jorge Díaz-Ramírez,Universidad de Tarapacá,uta,academicos.uta.cl,5,Machine Learning 
4727335469935944428,Víctor Orellana Bravo,Universidad de Tarapacá,uta,academicos.uta.cl,4,Trabajo Social - Historia - Política Social … 
4727335469935944428,PATRICIO PONCE CORREA,"Profesor Derecho Administrativo, Universidad de Tarapacá",uta,academicos.uta.cl,4,Derecho Administrativo Derecho Constitucional Derecho de propiedad 
4727335469935944428,Verónica Alcalde,Universidad de Tarapacá,uta,alumnos.uta.cl,4,Arqueología Antropología Arqueología Costera Arqueomalacología 
4727335469935944428,Karelia Cerda,"Magíster en Historia, Universidad de Tarapacá",uta,academicos.uta.cl,4,Historia Social Historia de las Mujeres Estudios de Género Historia del Feminismo Movimientos Sociales 
4727335469935944428,Gudukuntla Srinivas,University of Tarapaca,uta,academicos.uta.cl,3,Fluid Dynamics 
4727335469935944428,Cristobal Pulido,"profesor de Psicologia, Universidad de Tarapaca",uta,academicos.uta.cl,3,psicologia psicologia del deporte migraciones grupos minorizados 
4727335469935944428,Carlos Oyarce Marambio,"Departamento de Ingeniería y Tecnologías, Universidad de Tarapacá, Iquique-Chile",uta,academicos.uta.cl,2,Control Automático Sistemas Digitales Teoría de Circuitos Eléctricos/Electrónicos 
4727335469935944428,ROBERTO ESPINOSA OLIVA,Universidad de Tarapacá,uta,academicos.uta.cl,2,
4727335469935944428,Mauricio González-Pacheco,"Profesor de Geografía, Universidad de Tarapacá",uta,academicos.uta.cl,1,Geografía de la Salud Cartografía social Sistemas de Información Geográfica 
4727335469935944428,Ximena Badilla-Torrico,Universidad de Tarapacá,uta,academicos.uta.cl,1,Machine Learning Information Systems Business Process Management 
4727335469935944428,Humberto Urrutia López,"Academico Parcial, Universidad de Tarapacá, Arica Chile",uta,uta.cl,,Robot Lego Motivación Redes de ordenadores Enseñanza de la Programación básica de … 
4727335469935944428,ALVARO CORTINEZ PONTONI,"Profesor de Estadística, Universidad de Tarapacá",uta,academicos.uta.cl,,Estadística bayesiana Análisis de Supervivencia didáctica de la estadística 
4727335469935944428,Pablo Guicharrousse,Universidad de Tarapacá,uta,academicos.uta.cl,,Energy Power Electronics Electrical Power Systems Electrical Machinery Engineering Education 
4727335469935944428,Yerko Cubillos Figueroa,"Bibliotecólogo, Universidad de Tarapacá",uta,uta.cl,,Revisiones Sistemáticas Bibliometría Cienciometría 
4727335469935944428,Daniela Ramírez-Carrasco,Universidad de Tarapacá,uta,academicos.uta.cl,,psicología 
4727335469935944428,Bastian Vergara Barrera,UTA,uta,alumnos.uta.cl,,Psicologia 
4727335469935944428,MARJORIE TOVAR-CORREAL,Universidad de Tarapacá,uta,alumnos.uta.cl,,Lenguaje Educación intercultural Inclusión Variación lingüística 
4727335469935944428,EDUARDO ALEJANDRO VELASQUEZ PARRAGUEZ,"Académico, Universidad de Tarapacá",uta,academicos.uta.cl,,Educación 
4727335469935944428,Javier Escudero-Pastén,"Estudiante de Psicología, Universidad de Tarapacá",uta,alumnos.uta.cl,,Neurociencia Metodología Inteligencia artificial 
4727335469935944428,Samuel Fuentealba-Perez,Universidad de Tarapacá,uta,academicos.uta.cl,,Psicologia Comunitaria Community Psychology 
