titulo,autores,revista
Un vitalismo deleuziano: bosquejos sobre el diagrama,"P Landaeta, B Rojas, AM Cristi","Revista de Filosofia Aurora 29 (46), 73-94, 2017"
Hegel y las redes lógicas como diseñadoras de la realidad,"R Espinoza Lolas, P Landaeta, JI Arias","Anales del Seminario de Historia de la Filosofía 33 (2), 583-603, 2016"
Geofilosofía de la ciudad para pensar más allá del organismo,"P Landaeta, R Espinoza","Revista de Filosofía Aurora, Curitiba 26 (38), 295-313, 2014"
Cuerpo y espacio. Reflexiones sobre una topología de la exterioridad,"RE Lolas, P Ascorra, P Landaeta, P Soto","Filosofia Unisinos 15, 237-248, 2014"
Tensiones de clase en El día que me quieras de Osvaldo Rodríguez Musso,"B Rojas, AC Cáceres, PL Mardones","Revista Izquierdas, 12, 2019"
"Racimo, la novela rizoma de Diego Zúñiga","PA Péndola Ramírez, PA Landaeta Mardones","Literatura y lingüística, 35-53, 2018"
"Interpretación del tiempo en Ilya Prigogine a partir de Aristóteles, Newton, Zubiri, Bergson y García Bacca","R Durán, P Landaeta, O Orellana, RE Lolas","Konvergencias, Filosofía y Culturas en Diálogo 5 (17), 171-191, 2008"
La interpretación política de la tragedia griega de Hegel,"P Landaeta Mardones, JI Arias Krause","Co-herencia 10 (19), 113-133, 2013"
Más allá del urbanismo situacionista. Acerca de New Babylon de Constant,"PL Mardones, JIA Krause, A Candia-Cáceres","Quintana: revista do Departamento de Historia da Arte, 2017"
Porteñas buenas mozas: Corazón y belleza en la construcción de la mujer en la narrativa de Salvador Reyes,"A Candia-Cáceres, O Rosales Neira, P Landaeta","Alpha (Osorno), 157-173, 2016"
El desequilibrio de lo político en Hegel,"JI Arias Krause, P Landaeta Mardones","Tópicos (México), 139-158, 2016"
La función de la policía como debate de libertades,"P Landaeta Mardones, JI Arias Krause, R Espinoza Lolas","eidos, 93-116, 2015"
El Estado como sistema. Construcciones jurídico-políticas en las independencias Iberoamericanas,"JIA Krause, RE Lolas, P Landaeta","ideas y valores 68 (169), 181, 2019"
La «cuestión urbana»: apuntes para un diagrama de la relación gobierno y policía en Michel Foucault,"P Landaeta Mardones, JI Arias Krause, R Espinoza Lolas","Universitat Jaume I. Departament de Filosofia i Sociologia, 2017"
La muerte de la ciudad: acerca de la relación de arquitectura y urbanismo,"P Landaeta, J Arias, R Espinoza, P Soto","Arquitetura Revista 12 (1), 24-35, 2016"
Sobre-duración: una Aproximación Cuantitativa,"CM Carvajal, JA González, CA Tassara y María S. Álvarez.","Formación Universitaria 11 (3), 19-28, 2018"
Variables sociodemográficas y académicas explicativas de la deserción de estudiantes en la Facultad de Ciencias Naturales de la Universidad de Playa Ancha (Chile),"CM Carvajal, JA González, SJ Sarzoza","Formación universitaria 11 (2), 3-12, 2018"
Coeficientes edumétricos para la validez y dificultad de un test: Propuesta,"J González Campos, C Carvajal Muquillaza, F Viveros Reyes","Estudios pedagógicos (Valdivia) 42 (3), 467-481, 2016"
Modelación de la deserción universitaria mediante cadenas de Markov,"JA González-Campos, CM Carvajal-Muquillaza, JE Aspeé-Chacón","Uniciencia 34 (1), 129-146, 2020"
Modeling of university dropout using Markov chains,"JA González-Campos, CM Carvajal-Muquillaza, JE Aspeé-Chacón","Uniciencia 34 (1), 129-146, 2020"
Fuzzy representation of rainfall threshold in triggering mass removal processes,"J González-Campos, C Romero-González, C Carvajal-Muquillaza","Uniciencia 35 (1), 231-244, 2021"
Representación difusa del umbral de precipitaciones en el desencadenamiento de procesos de remoción en masa,"J González-Campos, C Romero-González, C Carvajal-Muquillaza","Uniciencia 35 (1), 231-244, 2021"
Modelagem do abandono universitário através das cadeias de Markov,"JA González-Campos, CM Carvajal-Muquillaza, JE Aspeé-Chacón","Uniciencia 34 (1), 129-146, 2020"
Modelo explicativo para la deserción universitaria: una aproximación jerárquica,"JA González, CM Carvajal, S Sarzoza","Evaluación de la Calidad de la Investigación y de la Educación Superior …, 2017"
Edumetrics coefficients for validity and difficulty of a test: Proposal,"J González Campos, C Carvajal Muquillaza, F Viveros Reyes","Estudios pedagógicos (Valdivia) 42 (3), 467-481, 2016"
Equidistant Set of Two Congruent Spheres and Its Orthogonal Projection on Rk,"Carvajal, Manrıquez, Lorca, González","British Journal of Mathematics & Computer Science 13 (6), 1-9, 2016"
La adicción de los estudiantes a las redes sociales on-line: un estudio en el contexto latinoamericano,"J Cabero Almenara, S Martínez Pérez, R Valencia Ortiz, JP Leiva Núñez, ...","Ediciones Complutense, 2020"
"El modelo TPACK en la formación inicial de profesores: modelo Universidad de Playa Ancha (UPLA), Chile","J Leiva Núñez, L Ugalde Meza, MC Llorente Cejudo","Pixel-Bit, 2018"
Entornos personales de aprendizaje (PLE) en estudiantes universitarios de Pedagogía,"JP Leiva Núñez, J Cabero Almenara, L Ugalde Meza","Universidad de Extremadura. Departamento de Ciencias de la Educación, 2018"
Los medios de comunicación a distancia,"ML Sevillano García, I Cantón Mayo, R Baelo Álvarez, P Valdés Salvo, ...","Pixel-Bit. Sevilla, 1994, 45-62, 2011"
"THE TPACK MODEL IN INITIAL TEACHER TRAINING: MODEL UNIVERSITY OF PLAYA ANCHA (UPLA), CHILE","JP Leiva Nunez, L Ugalde Meza, C Llorente-Cejudo","PIXEL-BIT-REVISTA DE MEDIOS Y EDUCACION, 165-177, 2018"
Personal Learning Environments (PLE) in College Students of Pedagogy,"JP Leiva Nunez, J Cabero Almenara, L Ugalde Meza","REVISTA LATINOAMERICANA DE TECNOLOGIA EDUCATIVA-RELATEC 17 (1), 25-39, 2018"
"Formación y capacitación tecnológica de los estudiantes que ingresan a primer año de Ciencias de la Educación en la Universidad de Playa Ancha, Chile",JP Leiva Núñez,
Uso de Internet y portal enlaces en las Escuelas Básicas de la Comuna de Valparaíso,J Leiva Núñez,
"Las cooperativas agroecológicas como una alternativa a la producción, distribución y consumo de alimentos",PS Ramos,"Papeles de relaciones ecosociales y cambio global, 149-158, 2011"
"Circuitos Cortos de Comercialización alimentaria: Análisis de experiencias de la región de Valparaíso, Chile",P Saravia Ramos,"Psicoperspectivas 19 (2), 32-43, 2020"
Heterogeneidades económicas en territorios de la Región de Valparaíso-Chile: aproximaciones y emergencias de otras formas económicas,"P Saravia Ramos, N Carroza Athens, B Cid Aguayo","Población y sociedad 25 (1), 103-131, 2018"
"El derrame de petróleo en Quintero, V región de Chile: una mirada desde las organizaciones sociales","P Saravia Ramos, K Armingol Jaime, B Garland Castro","Población y sociedad 23 (2), 179-206, 2016"
El neoliberalismo en acción,P Ramos,"Universidad Mayor de San Andrés (UMSA), La Paz-Bolivia, 1985"
Políticas de programación radiofónica,P Ramos,"OpenCourseWare de la UNC, 2012"
"Territoriality, environment and hybrid governance tensions in alternative food networks: Cases of small‐scale viticulture in Chile","E Letelier, BC Aguayo, P Saravia, N Carroza, J Vanhulst","Environmental Policy and Governance 31 (3), 186-198, 2021"
Mapping social economy discourses in Chile,"B Cid, EAL Araya, P Saravia, J Vanhulst, N Carroza, D Sandoval","International Journal of Social Economics, 2019"
"Discursos de diversidad económica en el centro-sur de Chile: Definiciones en disputa en torno a la economía social, solidaria y autogestionaria","BC Aguayo, PS Ramos, EL Araya, DS Nazal, J Vanhulst, NC Athens","Miríada: Investigación en Ciencias Sociales 11 (15), 185-207, 2019"
El neoliberalismo en acción. Análisis crítico de la “nueva política económica”,P Ramos,"La Paz-Bolivia, Universidad Mayor de San Andrés, 1985"
Diversidades económicas en la región de Valparaíso-Chile: Hacia la comprensión de “otras” formas posibles de desarrollo territorial,"N Carroza, P Saravia, B Cid, D Vega, G Astroza","Revista Brasileira de Gestão e Desenvolvimento Regional 15 (15), 109-127, 2019"
Una mirada a dos experiencias de Cooperativas Agroecológicas: Los recorridos y discontinuidades de La Acequia y Hortigas [tesis doctoral,P Saravia,"Universidad de Granada, Granada, España, 2012"
Travesías resistentes: estrategias y prácticas alternativas en el discurso de las radios jóvenes de Argentina,"P Ramos, G Mistral, C Salsipuedes","Tesis de Doctorado en Estudios Sociales de América Latina de la Universidad …, 2013"
Movimientos sociales en Andalucía. Una mirada exploratoria a los movimientos críticos con la globalización neoliberal (Tesis Doctoral),P Saravia Ramos,"Granada, Universid de Granada, 2012"
"Interrogantes, desafíos y avances del modelo asambleario: las prácticas políticas de dos experiencias de cooperativa agroecológicas",PS Ramos,"Sistema: revista de ciencias sociales, 99-112, 2014"
Terroir y territorio: casos de la pequeña vitivinicultura en el centro sur de Chile,"BE Cid-Aguayo, E Letelier-Araya, P Saravia-Ramos, J Vanhulst","Urbano (Concepción) 23 (42), 112-123, 2020"
Vinculación con el medio y territorio,"B González López, P Saravia Ramos, N Carroza Athens, ...","Universidad de Playa Ancha, 2017"
Principios y proyecciones de la comercialización agroecológica: miradas desde la región de Valparaíso,P Saravia Ramos,"RIVAR (Santiago) 9 (25), 37-54, 2022"
Collaborative research: Potential and limitations of participative social cartography,"P Saravia-Ramos, D Vega-Valdés, L Espinoza-Almonacid, ...","Íconos. Revista de Ciencias Sociales, 59-80, 2021"
Investigación colaborativa: potencialidades y limitaciones de la cartografía social participativa,"P Saravia-Ramos, D Vega-Valdés, L Espinoza-Almonacid, ...","Íconos. Revista de Ciencias Sociales, 59-80, 2021"
El océano de fronteras invisibles: relecturas históricas sobre (¿ el fin? de) la esclavitud en la novela contemporánea,DN dos Santos,"Editorial Verbum, 2015"
Imaginarios y representaciones en la tradición oral africana y latinoamericana,D Nascimento dos Santos,"Acta literaria, 145-150, 2011"
Memoria y representación del barco y del mar en la travesía y la migración forzada,DN Dos Santos,"Afro-Hispanic Review, 115-128, 2013"
Atlantico negro: el océano en la narrativa de esclavizados,D Nascimento Dos Santos,"Acta literaria, 29-50, 2017"
Nay de Gambia y su himno a la libertad,D Nascimento dos Santos,"Nueva revista del Pacífico, 209-211, 2017"
"Hoz, martillo, resistencia, sudor y pueblo en el brasileño Jorge Amado",DN SANTOS,"Amado Jorge: um retrato de muitas faces. Rio de Janeiro: Bonecker, 39-44, 2018"
La Nueva Novela Histórica y sus insuficiencias teóricas: el emplazamiento negroafricano,DN dos Santos,"Estudios Avanzados, 54-65, 2017"
El realismo socialista en tierras tupiniquines,DN SANTOS,"Pacarina del Sur, ano 5, 0"
A MALA SE PERDEU NO OCEANO,DN dos Santos,"Chasqui 47 (2), 73-85, 2018"
'Descolonização'discursiva e resistência literária em Pepetela,"DN dos Santos, RP Cabral","Colóquio: Letras, 189-196, 2016"
Historia e Memória no romance Um defeito de cor,DN SANTOS,"Izquierdas (Santiago), 162-171, 2016"
Comunismo y Novela en el brasileño Jorge Amado,DN dos Santos,"Revista Izquierdas 3 (6), 1-5, 2010"
1.-O Bildungsroman escrito por mulheres latino-americanas: O Pardal É Um Pássaro Azul (Studart) E Estaba La Pájara Pinta Sentada En El Verde Limón (Ángel),"JMS Caicedo, DN dos Santos","Nueva Revista del Pacífico, 01-22, 2020"
Literatura e Direitos Humanos: representações da violência de um Estado ditatorial,"YN Ferreira, DN Dos Santos","Confluencia: Revista Hispánica de Cultura y Literatura 35 (2), 18-28, 2020"
"Migração, relato e descolonização no Brasil a partir do filme Que horas ela volta?","F Delazari, DN dos Santos","Revista Izquierdas, 3, 2019"
Deshaciendo cadenas: la emergencia de borrar la carimba en el imaginario contemporáneo,DN dos Santos,"Revista Iberoamericana 84 (264), 655-670, 2018"
A migrante africana: processos identitarios e resistencia no contexto contemporaneo,"LC Thibes, DN dos Santos","Communitas 1 (2), 470-479, 2017"
OCEANO DE FRONTEIRAS INVISÍVEIS: Escravidão; migrações e identidades na literatura,DN dos Santos,"Feira Literária Brasil-África de Vitória-ES 1 (2), 2016"
Historia e Memória no romance Um defeito de cor,NDS Daiana,"Izquierdas, 162-171, 2016"
"Los tambores suenan, la voz del pueblo resuena: la representación del negro en la novela contemporánea",DN dos Santos,"Alpha (Osorno), 165-174, 2015"
Paradigma educativo y habilidades del profesor asociadas a la percepción de rol docente en Educación Física de estudiantes chilenos,"U Tobar, B Alonso, A Reyno Freundt, MJ Fehrenberg Gaete, ...","Federación Española de Asociaciones de Docentes de Educación Física (FEADEF), 2020"
Teorías implícitas y modelos de formación subyacentes a la percepción de rol del profesor de Educación Física,"BU Tobar, MJF Gaete, MM Lara, AM Pérez, AMR Freundt","Retos: nuevas tendencias en educación física, deporte y recreación, 159-166, 2019"
Estilos de enseñanza en educación física: Estudio transversal,"TA Jiménez, AMR Freundt","Habilidad motriz: Revista de Ciencias de la Actividad Física y del Deporte …, 2009"
Formación inicial de los profesores de educación física en Chile y la actividad expresivo motriz,RFA Marysol,"Universidad de Las Palmas de Gran Canaria, 2007"
"Teorías implícitas de la Enseñanza en la Educación Física: estudio longitudinal, 2005-2008","TI Alarcón, A Reyno","Revista des-encuentros 8 (1), 37-47, 2009"
Los contenidos de la Expresión Motriz y la Gimnasia Rítmica según la opinión de los profesores de Educación Física en Chile,A Reyno,"Emasf Revista Digital 2 (12), 9-21, 2011"
Los contenidos de la expresión motriz y la gimnasia rítmica según la opinión de los profesores de Educación Física en Chile,AMR Freundt,"EmásF: revista digital de educación física, 9-21, 2011"
"Estudio comparado: La Educación Física en Colombia, Chile, España, Portugal, República Dominicana y Venezuela","M González-Valeiro, SA Bustamante-Castaño, BE Chaverra-Fernández, ...","RECIE. Revista Caribeña de Investigación Educativa 3 (2), 7-18, 2019"
Características que debe tener un profesor de Educación Física,"A Reyno, I Abarzúa, M Acevedo, MP Atienza, C Pérez, J Ugalde","EfDeportes.com Revista Digital 18 (183), 1, 2013"
La música como recurso didáctico,"N Ceriani, S Hidalgo, D Leverton, A Reyno","EfDeportes.com, Revista Digital 17 (176), 1, 2013"
"Los objetivos y contenidos de las actividades de expresión motriz, según la opinión de los profesores de educación física en Chile",AR Freundt,"Retos. Nuevas tendencias en Educación Física, Deporte y Recreación, 56-59, 2010"
""" Los contenidos y necesidades para el desarrollo y aplicación de las actividades de expresión motriz en la formación inicial de los profesores de educación física"": un estudio …","AMR Freundt, MÁD Noguera","European Journal of Human Movement, 3, 2006"
Los Contenidos y necesidades para el desarrollo y aplicación de las Actividades de Expresión Motriz en la Formación Inicial de los Profesores de Educación Física. Un Estudio …,"MA Delgado, A Reyno","VI Congreso Internacional de Investigación y Perfeccionamiento en Ciencias …, 2004"
"Teorías Implícitas de la Enseñanza en la Educación Física: estudio longitudinal, 2005-2008","TIA Jiménez, AR Freundt","Revista des-encuentros 8 (1), 2015"
La formación inicial de los profesores de educación física en Chile y la actividad expresivo motriz,AM Reyno Freundt,
Percepción del rol docente en Educación Física: Análisis e implicancias formativas,"BU Tobar, AMR Freundt","Universidad, innovación e investigación ante el horizonte 2030, 404, 2021"
Percepción del rol docente en educación física: análisis e implicancias formativas,"AMR Freundt, BU Tobar","Innovaciones metodológicas con TIC en educación, 4157-4176, 2021"
"Barreras percibidas por alumnos en situación de discapacidad, en relación a la oferta de actividades universitarias","AM Reyno-Freundt, RB Leal-Cáceres, LA Morales-Maureira, ...","RECIE. Revista Caribeña de Investigación Educativa 3 (2), 73-83, 2019"
Estilos de enseñanza preferidos por los profesores enseñanza media en Educación Física.,"MA Báez Bezama, GC Durán Escudero, SC González Peña, ...",
Las actividades de expresión motriz en la formación inicial de los profesores de educación física.,"A Reyno Freundt, MÁ Delgado",
"El espacio geográfico, una construcción escolar. Un estudio de caso: los alumnos del valle del Limarí","FA Palacios, XM Souto, YH Núñez","Scripta Nova. Revista Electrónica de Geografía y Ciencias Sociales 19, 2015"
Propuesta de un modelo de Integración curricular de las Tics,Y Herrera,"Cibersociedad. Universidad Tecnológica Metropolitana. Consultado el 6, 2008"
Estrategias docentes para el desarrollo de habilidades de pensamiento espacial en República Dominicana y Chile,"F Araya, Y Herrera","Revista geográfica de Valparaíso 47, 27-41, 2013"
Relación funcional entre procrastinación académica y compromiso en estudiantes de educación superior: una propuesta de análisis,"J Aspée, J González, Y Herrera","Perspectiva Educacional 60 (1), 4-22, 2021"
Redes de Dependencia entre Estrategias de Aprendizaje y Perfiles de Estudiantes de Desempeño Académico Medio y Alto en el Contexto de la Educación Superior en Chile,"YA Herrera-Núñez, JA González-Campos","Formación universitaria 12 (4), 27-38, 2019"
Integración de las tecnologías de la información y la comunicación para la enseñanza de la lengua,Y Herrera,"Folios, 13-26, 2007"
Calidad de la escritura académica: comparación de los efectos de comentarios de pares de escritura y expertos,Y Herrera-Núñez,"Revista Lusófona de Educaçao 49 (49), 2020"
"Reconstrucción narrativa de identidades agentivas de mujeres migrantes afrodescendientes en Coquimbo, Chile",YH Núñez,"OXÍMORA Revista Internacional de Ética y Política, 173-188, 2018"
"The geographical space, a school construction. A case study: the pupils of the of the Limari Valley (Chile)","F Araya Palacios, X Manuel Souto, Y Herrera Nunez","Scripta Nova-Revista Electronica De Geografia Y Ciencias Sociales 19 (503), 1-34, 2015"
Aportes de la investigación en didáctica de la geografía a la formación docente: los casos de República Dominicana y Chile,"F Araya, Y Herrera","Didáctica de la Geografía. Prácticas escolares y formación de profesores …, 2014"
Estrategias de lectura y rendimiento académico en la transición a la educación superior,"Y Herrera-Núñez, B Dapelo","Praxis & Saber 13 (32), 1-18, 2022"
Trayectorias lectoras discontinuas: prácticas letradas durante la transición a la universidad,"Y Herrera, B Dapelo","Praxis educativa 24 (2), 101-116, 2020"
La Construcción Narrativa de la Identidad de las Mujeres Desplazadas: Una Aproximación desde el Enfoque Dialógico del Posicionamiento Interaccional,Y Herrera-Nuñez,"Discurso, cultura, emoción. Prácticas discursivas interculturales …, 2018"
Recursos pragmático-retóricos de las narrativas de queja para la construcción social de la identidad de mujeres desplazadas por la violencia política en Colombia,YH Núñez,"Textos en Proceso 1 (2), 237-258, 2015"
Femicidio en el diario regional “La Estrella de Valparaíso”: más allá de la línea editorial,"REP Alcayaga Toro, YA Herrera Núñez, JM Burgos Bravo","Derechos humanos emergentes y periodismo/José Manuel Gómez y Méndez…[et al …, 2015"
"Correlatos lingüístico-discursivos de las narraciones orales referidas a los procesos de construcción, mantención y cambios identitarios de una muestra de mujeres desplazadas a …",YA Herrera Núñez,
Experiencias curriculares en la educación a distancia para el desarrollo de habilidades cognitivas,Y Herrera,"V Congreso de Tecnología en Educación y Educación en Tecnología, 2010"
Integration of Information and Communication Technologies for Language Teaching,Y Herrera,"Folios, 13-26, 2007"
Integración de las tecnologías de,Y Herrera,"Folios: revista de la Facultad de Humanidades, Universidad Pedagógica …, 2006"
Los Perros Del Paraíso: Una Aproximación A Las Estrategias De Veridicción Y Reformulación De La Identidad Histórica Latinoamericana.,YAH Núñez,"Logos: Revista de Lingüística, Filosofía y Literatura, 115-130, 1998"
"Interacción, emoción y cognición: Una aproximación integrada a la comprensión del comportamiento humano","RC Bächler, OG Poblete","Anales de Psicología/Annals of Psychology 28 (2), 490-504, 2012"
¿ De la frustración a la alegría o de la alegría a la frustración? Significados sobre inclusión educativa construidos por docentes a partir de su experiencia emocional,"O Poblete-Christie, M López, L Muñoz","Psykhe (Santiago) 28 (1), 1-14, 2019"
Interacción y emoción: una propuesta integradora,"O Poblete, R Bachler","Revista Argentina de Clínica Psicológica 25 (1), 57-66, 2016"
Evaluación de la formación emocional inicial docente en Chile,"R Bächler Silva, S Meza Fernández, L Mendoza, OG Poblete Christie","Revista de estudios y experiencias en educación 19 (39), 75-106, 2020"
Francisco Varela: una revisión de algunos de sus aportes fundamentales a través de la mirada de David Rudrauf,"R Bachler, O Poblete, X Poblete","Synergies Chili, 121-140, 2012"
From frustration to joy or from joy to frustration? Meanings about educational inclusion constructed by teachers based on their emotional experience¿ De la Frustración a la …,"O Poblete-Christie, M López, L Muñoz","Pontificia Universidad Catolica de Chile, 2019"
El trasfondo humano de las organizaciones. Mapa comprensivo para su intervención,"R Bachler, O Poblete","Administración y Organizaciones 11 (22), 39-53, 2009"
Orientación de los significados emocionales de profesoras durante su trabajo en aula,O Poblete-Christie,"Revista de Sociología 36 (1), 41-56, 2021"
Experiencia emocional en aula en profesoras de la Región Metropolitana,O Poblete Christie,"Universidad de Chile, 2019"
Meditación y proceso de enseñanza aprendizaje: Una experiencia educativa con niñas y niños sordos,"O Poblete Christie, X Vidal Mella, V Gallardo Peña","Universidad de Granada, 2016"
"Interaction, emotion and cognition, an integrative approach to the understanding of human behavior","R Baechler, O Poblete","ANALES DE PSICOLOGIA 28 (2), 490-504, 2012"
"Interaction, emotion and cognition, an integrative approach to the understanding of human behavior [Interacción, emoción y cognición: Una aproximación integrada a la …","R Bächler, O Poblete","Universidad de Murcia Servicio de Publicaciones, 2012"
Feedback by automatic assessment systems used in mathematics homework in the engineering field,"J Gaona, M Reguant, I Valdivia, M Vásquez, T Sancho‐Vinuesa","Computer Applications in Engineering Education, 2018"
Panorama sobre los sistemas de evaluación automática en línea en matemáticas,J Gaona,"Paradigma 40 (Extra 2), 53-80, 2020"
On harmonic Bloch-type mappings,"I Efraimidis, J Gaona, R Hernández, O Venegas","Complex Variables and Elliptic Equations 62 (8), 1081-1092, 2017"
Elaboración de un sistema de evaluación en línea como proceso de formación de profesores de matemáticas,J Gaona,"Université Sorbonne Paris Cité, 2018"
"Transitions Toward Digital Resources: Change, Invariance, and Orchestration","P Drijvers, V Gitirana, J Monaghan, S Okumus, S Besnier, C Pfeiffer, ...","The'Resource'Approach to Mathematics Education, 389-444, 2019"
Instructors' decision making when designing resources: the case of online assessments,J Gaona,"Proceedings Re(s)sources 2018. International Conference, 2018, 279-282, 2018"
Mathematical work in the digital age: Variety of tools and the role of geneses,"J Flores, J Gaona, P Richard","Mathematical work in educational context-the Mathematical Working Space …, 2022"
Argumentation of Prospective Mathematics Teachers in Fraction Tasks Mediated by an Online Assessment System With Automatic Feedback,"J Gaona, R Menares","Eurasia Journal of Mathematics, Science and Technology Education 17 (12), em2055, 2021"
"Integrar tecnología en la enseñanza-aprendizaje de las matemáticas, factores claves",JG Paredes,"REGIES: Revista de Gestión de la innovación 3 (1), 75-93, 2018"
Análisis de la concepción de un banco de problemas en línea aleatorios para la evaluación en matemáticas,J Gaona,"Actas Quinto Simposio Internacional ETM, 369-383, 2016"
Argumentación de futuros profesores de matemáticas en tareas sobre fracciones mediadas por un sistema de evaluación en línea con feedback automático,"J Gaona, R Menares","arXiv preprint arXiv:2108.12496, 2021"
Un ejemplo de nivelación en matemáticas: la evaluación dinámica como motor de aprendizaje incorporando wiris en moodle.,"J Gaona, C Hardy","Congreso Iberoamericano de Ciencia, Tecnología, Innovación y Educación, OEI …, 2014"
Mathematical Work in the Digital Age. Variety of Tools and the Role of Geneses,"JV Flores Salazar, J Gaona, PR Richard","Mathematical Work in Educational Context, 165-209, 2022"
Aprendizaje de los números complejos usando diferentes sistemas de cálculo simbólico y un sistema de evaluación en línea en formación inicial de profesores,"J Gaona, S López, E Montoya Delgadillo","arXiv e-prints, arXiv: 2201.00407, 2022"
Influence of a function's coefficients and feedback of the mathematical work when reading a graph in an online assessment system,"J Gaona, R Hernández, F Guevara, V Bravo","arXiv preprint arXiv:2107.11448, 2021"
Trabajo matemático instrumentado¿ qué matemática trabajar cuando hay programas que resuelven tareas mediante una foto?,J Gaona,"Simposio ETM 6.1 sobre el Trabajo Matemático, 2021"
