titulo,autores,revista
Ultimate bearing capacity of rock masses based on the modified Hoek–Brown criterion,"A Serrano, C Olalla, J Gonzalez","International Journal of Rock Mechanics and Mining Sciences 37 (6), 1013-1018, 2000"
Coherent states on the circle,"JA González, MA Del Olmo","Journal of Physics A: Mathematical and General 31 (44), 8841, 1998"
Diagnóstico sobre la Planeación y Control de Proyectos en las PYMES de Construcción,"JA González, R Solís, C Alcudia","Revista de la Construcción 9 (1), 17-25, 2010"
SPSS: Pruebas no paramétricas,"R García, J González, JM Jornet","Innova MIDE. Recuperado de http://www. uv. es/innomide/spss/SPSS/SPSS_0802A. pdf, 2010"
Competencias parentales que favorecen el desarrollo de funciones ejecutivas en escolares,"F Bernal-Ruiz, M Rodríguez-Vera, J González-Campos, A Torres-Álvarez","Revista Latinoamericana de Ciencias Sociales, Niñez y Juventud 16 (1), 163-176, 2018"
SPSS: Análisis de fiabilidad: alfa de cronbach,"R García–Bellido, J González, M Jornet","Grupo de innovación educativa. Universitat de Valencia, 2010"
SPSS: Análisis de fiabilidad,"R García, J González, J Jornet","Valencia, España: Grupo de Innovación Educativa 6, 2010"
El compromiso estudiantil en educación superior como agencia compleja,"JE Aspeé, JA González, EA Cavieres-Fernández","Formación universitaria 11 (4), 95-108, 2018"
Helechos,"H Navarrete, B León, J Gonzales, DK Aviles, J Salazar, F Mellado, ...","Botánica económica de los Andes centrales, 385-411, 2006"
Semiclassical behaviour of coherent states on the circle,"S DE BIÈVRE, JA GONZÁLEZ","Quantization and Coherent States Methods, 152-157, 1993"
"Ciencia, Tecnología y Sociedad: una aproximación conceptual","E Marino, JC González, JA López, JL Luján, M Marín, C Osorio, C Valdés","Colección Cuadernos de Iberoamérica. Editor: Organización de estados …, 2001"
Intelligent on-line surface inspection on a skinpass mill,"F Obeso, J Gonzalez","Iron and Steel Engineer(USA) 74 (9), 29-35, 1997"
Variables sociodemográficas y académicas explicativas de la deserción de estudiantes en la Facultad de Ciencias Naturales de la Universidad de Playa Ancha (Chile),"CM Carvajal, JA González, SJ Sarzoza","Formación universitaria 11 (2), 3-12, 2018"
Coeficientes edumétricos para la validez y dificultad de un test: Propuesta,"J González Campos, C Carvajal Muquillaza, F Viveros Reyes","Estudios pedagógicos (Valdivia) 42 (3), 467-481, 2016"
Studies of structural and magnetic properties of glass-coated nanocrystalline Fe79Hf7B12Si2 microwires,"C García, A Zhukov, J Gonzalez, V Zhukova, R Varga, JJ Del Val, V Larin, ...","Journal of alloys and compounds 423 (1-2), 116-119, 2006"
Perfil de egreso doctoral: una propuesta desde el análisis documental y las expectativas de los doctorandos,"K Núñez-Valdés, JA González Campos","IE Revista de Investigación Educativa de la REDIECH 10 (18), 161-175, 2019"
The direct and indirect hemolytic factors from animal venoms,"KH Slotta, J Gonzalez, S Roth","RUSSELL Animal Toxins; Elsevier: Amsterdam, The Netherlands, 369-377, 2016"
El compromiso estudiantil ciudadano y su vínculo con el éxito educativo en la educación superior,"JA Chacón, EC Fernández, JG Campos","Opción: Revista de Ciencias Humanas y Sociales, 393-422, 2018"
"Impacto de las habilidades de comprensión lectora en el aprendizaje escolar: Un estudio realizado en una comuna de la región metropolitana, Chile","K Núñez-Valdés, JC Medina-Pérez, J González-Campos","Revista Electrónica Educare 23 (2), 28-49, 2019"
Innova Mide,"R García, J González, JM Jornet","Universidad de Valencia: Valencia. Consultado en http://www. uv. es …, 2010"
Phylogenetic and functional marker genes to study ammonia-oxidizing microorganisms (AOM) in the environment,"P Junier, V Molina, C Dorador, O Hadas, OS Kim, T Junier, KP Witzel, ...","Applied Microbiology and Biotechnology 85 (3), 425-440, 2010"
Anammox bacteria and the anaerobic oxidation of ammonium in the oxygen minimum zone off northern Chile,"A Galan, V Molina, B Thamdrup, D Woebken, G Lavik, MMM Kuypers, ...","Deep sea research part II: topical studies in oceanography 56 (16), 1021-1031, 2009"
High diversity of ammonia‐oxidizing archaea in permanent and seasonal oxygen‐deficient waters of the eastern South Pacific,"V Molina, L Belmar, O Ulloa","Environmental microbiology 12 (9), 2450-2465, 2010"
A combination of extreme environmental conditions favor the prevalence of endospore-forming firmicutes,"S Filippidou, T Wunderlin, T Junier, N Jeanneret, C Dorador, V Molina, ...","Frontiers in microbiology 7, 1707, 2016"
Massive developments of microbial mats following phytoplankton blooms in a naturally eutrophic bay: Implications for nitrogen cycling,"M Graco, L Farías, V Molina, D Gutiérrez, LP Nielsen","Limnology and Oceanography 46 (4), 821-832, 2001"
Abundance and phylogenetic identity of archaeoplankton in the permanent oxygen minimum zone of the eastern tropical South Pacific,"L Belmar, V Molina, O Ulloa","FEMS Microbiology Ecology 78 (2), 314-326, 2011"
Ammonia-oxidizing β-proteobacteria from the oxygen minimum zone off northern Chile,"V Molina, O Ulloa, L Farías, H Urrutia, S Ramírez, P Junier, KP Witzel","Applied and Environmental Microbiology 73 (11), 3547-3555, 2007"
Ammonium cycling under a strong oxygen gradient associated with the Oxygen Minimum Zone off northern Chile (~ 23 S),"V Molina, L Farías, Y Eissler, LA Cuevas, CE Morales, R Escribano","Marine Ecology Progress Series 288, 35-43, 2005"
Aerobic ammonium oxidation in the oxycline and oxygen minimum zone of the eastern tropical South Pacific off northern Chile (∼ 20 S),"V Molina, L Farías","Deep Sea Research Part II: Topical Studies in Oceanography 56 (16), 1032-1041, 2009"
Comparative in silico analysis of PCR primers suited for diagnostics and cloning of ammonia monooxygenase genes from ammonia-oxidizing bacteria,"P Junier, OS Kim, V Molina, P Limburg, T Junier, JF Imhoff, KP Witzel","FEMS microbiology ecology 64 (1), 141-152, 2008"
"Bacterial Survival under Extreme UV Radiation: A Comparative Proteomics Study of Rhodobacter sp., Isolated from High Altitude Wetlands in Chile","V Pérez, M Hengst, L Kurte, C Dorador, WH Jeffrey, R Wattiez, V Molina, ...","Frontiers in microbiology 8, 1173, 2017"
Nitrospina‐like bacteria are the main drivers of nitrite oxidation in the seasonal upwelling area of the Eastern South Pacific (Central Chile ∼36°S),"HA Levipan, V Molina, C Fernandez","Environmental Microbiology Reports 6 (6), 565-573, 2014"
Temporal and spatial variability of biological nitrogen fixation off the upwelling system of central C hile (35–38.5° S),"C Fernandez, ML González, C Muñoz, V Molina, L Farias","Journal of Geophysical Research: Oceans 120 (5), 3330-3349, 2015"
"Microbial activity response to solar radiation across contrasting environmental conditions in Salar de Huasco, Northern Chilean Altiplano","KL Hernández, B Yannicelli, LM Olsen, C Dorador, EJ Menschel, ...","Frontiers in microbiology 7, 1857, 2016"
Bacterial active community cycling in response to solar radiation and their influence on nutrient changes in a high-altitude wetland,"V Molina, K Hernández, C Dorador, Y Eissler, M Hengst, V Pérez, ...","Frontiers in Microbiology 7, 1823, 2016"
Temporal variability and phylogenetic characterization of planktonic anammox bacteria in the coastal upwelling ecosystem off central Chile,"A Galán, V Molina, L Belmar, O Ulloa","Progress in Oceanography 92, 110-120, 2012"
The response of nitrifying microbial assemblages to ammonium (NH4+) enrichment from salmon farm activities in a northern Chilean Fjord,"C Elizondo-Patrone, K Hernández, B Yannicelli, LM Olsen, V Molina","Estuarine, Coastal and shelf science 166, 131-142, 2015"
Dissolved compounds excreted by copepods reshape the active marine bacterioplankton community composition,"VP Valdés, C Fernandez, V Molina, R Escribano, F Joux","Frontiers in Marine Science, 343, 2017"
The transcriptional regulation of the glyoxylate cycle in SAR 11 in response to iron fertilization in the S outhern O cean,"S Beier, MJ Gálvez, V Molina, G Sarthou, F Quéroué, S Blain, ...","Environmental Microbiology Reports 7 (3), 427-434, 2015"
Greenhouse gas cycling by the plastisphere: The sleeper issue of plastic pollution,"M Cornejo-D’Ottone, V Molina, J Pavez, N Silva","Chemosphere 246, 125709, 2020"
Holocene changes in the position and intensity of the southern westerly wind belt,"F Lamy, R Kilian, HW Arz, JP Francois, J Kaiser, M Prange, T Steinke","Nature Geoscience 3 (10), 695-699, 2010"
Millennial-scale variability in Southern Hemisphere westerly wind activity over the last 5000 years in SW Patagonia,"PI Moreno, JP François, RP Villa-Martínez, CM Moy","Quaternary Science Reviews 28 (1-2), 25-38, 2009"
Covariability of the Southern Westerlies and atmospheric CO2 during the Holocene,"PI Moreno, JP Francois, CM Moy, R Villa-Martínez","Geology 38 (8), 727-730, 2010"
"Isotopic evidence for hydrologic change related to the westerlies in SW Patagonia, Chile, during the last millennium","CM Moy, RB Dunbar, PI Moreno, JP Francois, R Villa-Martínez, ...","Quaternary Science Reviews 27 (13-14), 1335-1349, 2008"
Renewed glacial activity during the Antarctic cold reversal and persistence of cold conditions until 11.5 ka in southwestern Patagonia,"PI Moreno, MR Kaplan, JP François, R Villa-Martínez, CM Moy, CR Stern, ...","Geology 37 (4), 375-378, 2009"
"Postglacial vegetation, fire and climate dynamics at Central Chilean Patagonia (Lake Shaman, 44 S)","ME De Porras, A Maldonado, AM Abarzúa, ML Cárdenas, JP Francois, ...","Quaternary Science Reviews 50, 71-85, 2012"
Climate change in Southern South America during the last two millennia,"CM Moy, PI Moreno, RB Dunbar, MR Kaplan, JP Francois, R Villalba, ...","Past climate variability in South America and surrounding regions, 353-393, 2009"
Vegetation and environmental responses to climate forcing during the Last Glacial Maximum and deglaciation in the East Carpathians: attenuated response to maximum cooling and …,"EK Magyari, D Veres, V Wennrich, B Wagner, M Braun, G Jakab, ...","Quaternary Science Reviews 106, 278-298, 2014"
"Reconstruction of palaeoprecipitation based on pollen transfer functions–the record of the last 16 ka from Laguna Potrok Aike, southern Patagonia","F Schäbitz, M Wille, JP Francois, T Haberzettl, F Quintana, C Mayr, ...","Quaternary Science Reviews 71, 175-190, 2013"
"Holocene changes in the position and intensity of the southern westerly wind belt, Nat. Geosci., 3, 695–699","F Lamy, R Kilian, HW Arz, JP Francois, J Kaiser, M Prange, T Steinke",
"Earthquakes and coastal archaeology: assessing shoreline shifts on the southernmost Pacific coast (Chonos Archipelago 43 50′–46 50′ S, Chile, South America)","O Reyes, C Méndez, M San Román, JP Francois","Quaternary International 463, 161-175, 2018"
A pollen–climate calibration from western Patagonia for palaeoclimatic reconstructions,"V Montade, O Peyron, C Favier, JP Francois, SG Haberle","Journal of Quaternary Science 34 (1), 76-86, 2019"
Past climate variability in South America and surrounding regions,"CM Moy, PI Moreno, RB Dunbar, MR Kaplan, JP Francois, R Villalba, ...","Climate Change in Southern South America during the Last Two Millennia 353, 393, 2009"
Modulation of fire regimes by vegetation and site type in southwestern Patagonia since 13 ka,"PI Moreno, I Vilanova, RP Villa-Martínez, JP Francois","Frontiers in Ecology and Evolution 6, 34, 2018"
"Ser humano y medio ambiente durante la transición Pleistoceno Holoceno en las cabeceras del río Cisnes (44 S, Aisén Norte)","C Méndez, O Reyes, A Maldonado, JP François","Arqueología de Patagonia: una mirada desde el último confín (Salemme, M, 75-83, 2009"
Eslabones de una cadena rota: el caso del bosque relicto de Santa Inés,JP Francois,"Historia Natural del Parque Nacional Bosque de Fray Jorge, 205-218, 2004"
"Holocene changes in the position and intensity of the southern westerly wind belt, Nat","F Lamy, R Kilian, HW Arz, JP Francois, J Kaiser, M Prange, T Steinke","Geosci 3 (10), 695-699, 2010"
Chronological and geoarchaeological investigations on an anthropogenic shell accumulation layer in the Longotoma dune field (Central Chile),"SM May, A Zander, JP Francois, D Kelletat, S Pötsch, G Rixhon, ...","Quaternary International 367, 32-41, 2015"
"Distribution of greenhouse gases in hyper-arid and arid areas of northern Chile and the contribution of the high altitude wetland microbiome (Salar de Huasco, Chile)","V Molina, Y Eissler, M Cornejo, PE Galand, C Dorador, M Hengst, ...","Antonie Van Leeuwenhoek 111 (8), 1421-1432, 2018"
Postglacial paleoenvironmental history of the Southern Patagonian Fjords at 53° S,JP Francois,"Universität zu Köln, 2014"
"Geobacter: the microbe electric's physiology, ecology, and practical applications","DR Lovley, T Ueki, T Zhang, NS Malvankar, PM Shrestha, KA Flanagan, ...","Advances in microbial physiology 59, 1-100, 2011"
Índices de fitotoxicidad en residuos orgánicos durante el compostaje,"MT Varnero, C Rojas, R Orellana","Revista de la ciencia del suelo y nutrición vegetal 7 (1), 28-37, 2007"
Living at the frontiers of life: extremophiles in Chile and their potential for bioremediation,"R Orellana, C Macaya, G Bravo, F Dorochesi, A Cumsille, R Valencia, ...","Frontiers in microbiology 9, 2309, 2018"
Characterization and transcription of arsenic respiration and resistance genes during in situ uranium bioremediation,"L Giloteaux, DE Holmes, KH Williams, KC Wrighton, MJ Wilkins, ...","The ISME journal 7 (2), 370-383, 2013"
U(VI) Reduction by Diverse Outer Surface c-Type Cytochromes of Geobacter sulfurreducens,"R Orellana, JJ Leavitt, LR Comolli, R Csencsits, N Janot, KA Flanagan, ...","Applied and environmental microbiology 79 (20), 6369-6374, 2013"
Proteome of Geobacter sulfurreducens in the presence of U (VI),"R Orellana, KK Hixson, S Murphy, T Mester, ML Sharma, MS Lipton, ...","Microbiology 160 (12), 2607-2617, 2014"
Methane production from protozoan endosymbionts following stimulation of microbial metabolism within subsurface sediments,"DE Holmes, L Giloteaux, R Orellana, KH Williams, MJ Robbins, ...","Frontiers in microbiology 5, 366, 2014"
Potential for Methanosarcina to contribute to uranium reduction during acetate-promoted groundwater bioremediation,"DE Holmes, R Orelana, L Giloteaux, LY Wang, P Shrestha, K Williams, ...","Microbial ecology 76 (3), 660-667, 2018"
Phytotoxicity indices of organic residues during composting,"MTM Varnero, C Rojas, R Orellana","Revista de la Ciencia del Suelo y Nutrición Vegetal 7, 28-37, 2007"
Evaluación de especies sensibles a metabolitos fitotóxicos mediante bioensayos de germinación,"MT Varnero, R Orellana, C Rojas, C Santibáñez","Medioambiente en Iberoamérica: visión desde la física y la química en los …, 2007"
Multi-time series RNA-seq analysis of Enterobacter lignolyticus SCF1 during growth in lignin-amended medium,"R Orellana, G Chaput, LM Markillie, H Mitchell, M Gaffrey, G Orr, ...","PloS one 12 (10), e0186440, 2017"
"C., R. Orellano, E. Sotomayor y MT Varnero. 2005. Fitotoxididad de extractos de residuos orgánicos y su efecto sobre el índice de germinación de rabanito y pepino",A Rojas,"Rev. Cienc. Suelo Nutr. Veg 5, 61-66, 0"
Formate hydrogenlyase and formate secretion ameliorate H2 inhibition in the hyperthermophilic archaeon Thermococcus paralvinellae,"B Topcuoglu, C Meydan, R Orellana, J Holden","Environmental Microbiology, 2017"
Assessing technical and economic feasibility of complete bioremediation for soils chronically polluted with petroleum hydrocarbons.,"R Orellana, A Cumsille, C Rojas, P Cabrera, M Seeger, F Cárdenas, ...","Journal of Bioremediation and Biodegradation 8 (3), 2017"
PHYSIOLOGICAL MODELS OF GEOBACTER SULFURREDUCENS AND DESULFOBACTER POSTGATEI TO UNDERSTAND URANIUM REMEDIATION IN SUBSURFACE SYSTEMS,R Orellana,"Umass Amherst, 2014"
"Lignin induced iron reduction by novel sp., Tolumonas lignolytic BRL6-1","KMDA Gina Chaput,Andrew F. Billings,Lani DeDiego,Roberto Orellana,Joshua N ...","PLoS ONE 15 (9), e0233823, 2020"
Ecophysiological Features Shape the Distribution of Prophages and CRISPR in Sulfate Reducing Prokaryotes,"R Orellana, A Arancibia, L Badilla, J Acosta, G Arancibia, R Escar, ...","Microorganisms 9 (5), 931, 2021"
FITOTOXICIDAD DE EXTRACTOS DE RESIDUOS ORGÁNICOS Y SU EFECTO SOBRE EL ÍNDICE DE GERMINACIÓN DE RABANITO Y PEPINO1 ORGANIC WASTES EXTRACT PHYTOTOXICITY AND ITS EFFECT ON …,"C Rojas, R Orellana, E Sotomayor, MT Varnero",
Intersex in teleost fish: are we distinguishing endocrine disruption from natural phenomena?,"PA Bahamonde, KR Munkittrick, CJ Martyniuk","General and comparative endocrinology 192, 25-35, 2013"
"Environment and COVID-19: Pollutants, impacts, dissemination, management and recommendations for facing future epidemic threats","W Espejo, JE Celis, G Chiang, P Bahamonde","Science of the Total Environment 747, 141314, 2020"
Photogrammetry of blue whales with an unmanned hexacopter,"JW Durban, MJ Moore, G Chiang, LS Hickmott, A Bocconcelli, G Howes, ...","Marine Mammal Science 32 (4), 1510-1515, 2016"
Defining the role of omics in assessing ecosystem health: perspectives from the Canadian environmental monitoring program,"PA Bahamonde, A Feswick, MA Isaacs, KR Munkittrick, CJ Martyniuk","Environmental toxicology and chemistry 35 (1), 20-35, 2016"
"Whole organism responses and intersex severity in rainbow darter (Etheostoma caeruleum) following exposures to municipal wastewater in the Grand River basin, ON, Canada. Part A","PA Bahamonde, ML Fuzzen, CJ Bennett, GR Tetreault, ME McMaster, ...","Aquatic Toxicology 159, 290-301, 2015"
Molecular signatures in rainbow darter (Etheostoma caeruleum) inhabiting an urbanized river reach receiving wastewater effluents,"PA Bahamonde, GR Tetreault, ME McMaster, MR Servos, CJ Martyniuk, ...","Aquatic Toxicology 148, 211-220, 2014"
"Molecular pathways associated with the intersex condition in rainbow darter (Etheostoma caeruleum) following exposures to municipal wastewater in the Grand River basin, ON …","PA Bahamonde, ME McMaster, MR Servos, CJ Martyniuk, KR Munkittrick","Aquatic Toxicology 159, 302-316, 2015"
"Plastic residues produced with confirmatory testing for COVID-19: Classification, quantification, fate, and impacts on human health","JE Celis, W Espejo, E Paredes-Osses, SA Contreras, G Chiang, ...","Science of The Total Environment 760, 144167, 2021"
An assessment of the spatial and temporal variability of biological responses to municipal wastewater effluent in rainbow darter (Etheostoma caeruleum) collected along an urban …,"MLM Fuzzen, LM Bragg, GR Tetreault, PA Bahamonde, RN Tanna, ...","PLoS One 11 (10), e0164879, 2016"
Estrogenicity and intersex in juvenile rainbow trout (Oncorhynchus mykiss) exposed to Pine/Eucalyptus pulp and paper production effluent in Chile,"G Chiang, R Barra, M Díaz-Jaramillo, M Rivas, P Bahamonde, ...","Aquatic Toxicology 164, 126-134, 2015"
Hepatic gene expression profiling in zebrafish (Danio rerio) exposed to the fungicide chlorothalonil,"ABS Garayzar, PA Bahamonde, CJ Martyniuk, M Betancourt, ...","Comparative Biochemistry and Physiology Part D: Genomics and Proteomics 19 …, 2016"
Characterizing Chilean blue whale vocalizations with DTAGs: a test of using tag accelerometers for caller identification,"MR Saddler, A Bocconcelli, LS Hickmott, G Chiang, R Landea-Briones, ...","Journal of Experimental Biology 220 (22), 4119-4129, 2017"
Polychlorinated biphenyls in farmed and wild Onchorhynchus kisutch and Onchorhynchus mykiss from the Chilean Patagonia,"M Montory, E Habit, P Bahamonde, P Fernandez, JO Grimalt, K Saez, ...","Environmental Science and Pollution Research 18 (4), 629-637, 2011"
Methylmercury biomagnification in coastal aquatic food webs from western Patagonia and western Antarctic Peninsula,"G Chiang, KA Kidd, M Diaz-Jaramillo, W Espejo, P Bahamonde, ...","Chemosphere 262, 128360, 2021"
Characterizing Transcriptional Networks in Male Rainbow Darter (Etheostoma caeruleum) that Regulate Testis Development over a Complete Reproductive Cycle,"PA Bahamonde, ME McMaster, MR Servos, CJ Martyniuk, KR Munkittrick","PLoS One 11 (11), e0164722, 2016"
Discovering sounds in Patagonia: characterizing sei whale (Balaenoptera borealis) downsweeps in the south-eastern Pacific Ocean,"S Español-Jiménez, PA Bahamonde, G Chiang, V Häussermann","Ocean Science 15 (1), 75-82, 2019"
Body size data collected non-invasively from drone images indicate a morphologically distinct Chilean blue whale (Balaenoptera musculus) taxon,"MS Leslie, CM Perkins-Taylor, JW Durban, MJ Moore, CA Miller, ...","Endangered Species Research 43, 291-304, 2020"
Endocrine disruptor impacts on fish from Chile: The influence of wastewaters,"RO Barra, G Chiang, MF Saavedra, R Orrego, MR Servos, LM Hewitt, ...","Frontiers in Endocrinology, 208, 2021"
"Mucus phosphoproteins as an indirect measure of endocrine disruption in native small-bodied freshwater fish, exposed to wastewater treatment plant and pulp and paper mill effluents","P Bahamonde, C Berrocal, R Barra, ME McMaster, KR Munkittrick, ...","Gayana 83 (1), 10-20, 2019"
"Persistence, bioaccumulation and vertical transfer of pollutants in long-finned pilot whales stranded in Chilean Patagonia","AM Garcia-Cegarra, JL Jung, R Orrego, JA Padilha, O Malm, ...","Science of the Total Environment 770, 145259, 2021"
Evaluation of subjective well-being: Analysis of the satisfaction with life scale in Chilean population,"P Vera-Villarroel, A Urzúa, PPK Celis-Atenas, J Silva","Universitas Psychologica 11 (3), 719-727, 2012"
Evaluación del cuestionario SF-12: verificación de la utilidad de la escala salud mental,"P Vera-Villarroel, J Silva, K Celis-Atenas, P Pavez","Revista médica de Chile 142 (10), 1275-1283, 2014"
Factores de riesgo familiares asociados a la conducta suicida en adolescentes con trastorno depresivo,"P Pavez, N Santander, J Carranza, P Vera-Villarroel","Revista médica de Chile 137 (2), 226-233, 2009"
El rol predisponente del optimismo: hacia un modelo etiológico del bienestar,"P Vera-Villarroel, P Pávez, J Silva","Terapia psicológica 30 (2), 77-84, 2012"
El rol de la felicidad y el optimismo como factor protector de la ansiedad,"P Pavez, L Mena, P Vera-Villarroel","Universitas Psychologica 11 (2), 369-380, 2012"
Escala de bienestar de Ryff: análisis comparativo de los modelos teóricos en distintos grupos de edad,"P Vera-Villarroel, A Urzúa M, JR Silva, P Pavez, K Celis-Atenas","Psicología: Reflexao e crítica 26, 106-112, 2013"
"Money, Age and Happiness: Association of Subjective Wellbeing with Socio-Demographic Variables.","P Vera-Villarroel, K Celis-Atenas, P Pavez, S Lillo, F Bello, N Díaz, ...","Revista latinoamericana de Psicología 44 (2), 155, 2012"
Presentación de una escala para evaluar actitudes y creencias sobre la sexualidad reproductiva en adolescentes varones de la región Caribe colombiana,"AM Bello-Villanueva, O Oviedo-Trespalacios, P Vera-Villarroel, Ó Oviedo, ...","Universitas Psychologica 13 (1), 47-60, 2014"
the Male Warrior Hypothesis: testosterone-related cooperation and Aggression in the context of Intergroup Conflict,"JA Muñoz-Reyes, P Polo, N Valenzuela, P Pavez, O Ramírez-Herrera, ...","Scientific reports 10 (1), 1-12, 2020"
Mayor participación de las mujeres en la economía chilena,"K Berlien, H Franken, P Pavez, D Polanco, P Varela","informe final, Subsecretaría de Economía y Empresas de Menor Tamaño—Isónoma …, 2016"
Muscularity and strength affect individual variation in self-perception of fighting ability in men,"JA Muñoz-Reyes, P Polo, C Rodríguez-Sickert, P Pavez, N Valenzuela, ...","Frontiers in Psychology 10, 18, 2019"
Evaluación chilena del Inventario de Comportamientos de la Pareja que Provocan Celos,"AM Fernández, P Pavez, M Dufey","Revista de Psicología 23 (2), 2014"
Sex differences in jealousy are not explained by attachment style in men and women from Chile,"AM Fernandez, JA Muñoz-Reyes, M Dufey, P Pavez, CG Baeza, ...","Human Ethology Bulletin 30 (1), 139-151, 2015"
"Dinero, edad y felicidad: asociación del bienestar subjetivo y variables sociodemográficas","P Vera-Villarroel, K Celis-Atenas, P Pavez, S Lillo, F Bello, N Díaz, ...","Revista Latinoamericana de Psicología 44 (2), 155-163, 2012"
Familial risk factors for suicide among adolescents with depression,"P Pavez, N Santander, J Carranza, P Vera-Villarroel","Revista médica de Chile 137 (2), 226-233, 2009"
Fuentes de apoyo emocional y su relación con el bienestar subjetivo: Un análisis preliminar,"P Vera-Villarroel, P Pavez, K Celis-Atenas, N Díaz-Pardo","Revista mexicana de Psicología 30 (2), 115-122, 2013"
Testing strategic pluralism: The roles of attractiveness and competitive abilities to understand conditionality in men’s short-term reproductive strategies,"O Figueroa, JA Muñoz-Reyes, C Rodriguez-Sickert, N Valenzuela, ...","Plos one 15 (8), e0237315, 2020"
Testing strategic pluralism: The roles of attractiveness and competitive abilities to understand conditionality in men’s short-term reproductive strategies.,"O Figueroa, JA Muñoz-Reyes, C Rodriguez-Sickert, N Valenzuela, ...","Plos one 15 (8), 2020"
The role of happyness and optimism as a protector factor of anxiety,"P Pavez, L Mena, P Vera-Villarroel","Universitas Psychologica 11 (2), 369-380, 2012"
Correction: Testing strategic pluralism: The roles of attractiveness and competitive abilities to understand conditionality in men’s short-term reproductive strategies,"O Figueroa, JA Muñoz-Reyes, C Rodriguez-Sickert, N Valenzuela, ...","Plos one 16 (6), e0253362, 2021"
"Linking economic complexity, institutions, and income inequality","D Hartmann, MR Guevara, C Jara-Figueroa, M Aristarán, CA Hidalgo","World development 93, 75-93, 2017"
