titulo,autores,revista
El compromiso estudiantil ciudadano y su vínculo con el éxito educativo en la educación superior,"JA Chacón, EC Fernández, JG Campos","Opción: Revista de Ciencias Humanas y Sociales, 393-422, 2018"
Teacher counter stories to a citizenship education mega policy narrative. Preparing for citizenship in Chile,E Cavieres-Fernández,"Journal of Curriculum Studies 49 (4), 414-436, 2017"
"La neoliberalización de la educación chilena o la privatización del sistema educativo"" por dentro""",EC Fernández,"Diálogos educativos, 2, 2009"
Rethinking the role of elite private schools in a neoliberal era: an example from Chile,EC Fernández,"Policy Futures in Education 7 (1), 31-43, 2009"
Instrumento para medir el compromiso estudiantil integrando el desarrollo ciudadano: una propuesta desde Latinoamérica,"J Aspeé Chacón, J González Campos, E Cavieres Fernández","Revista complutense de educación, 2019"
Diversidad de levaduras en canopias y suelos asociados con Bulnesia retama y Larrea divaricata,"ME Toro, NP Oro, AD Vega, YP Maturano, MC Nally, E Fernandez, ...","Revista argentina de microbiología 37 (4), 209-213, 2005"
Pensamiento de los profesores de historia acerca de la ciudadanía y la inclusión de las movilizaciones estudiantiles en su enseñanza,"E Cavieres Fernández, JA Muñoz Reyes","Estudios pedagógicos (Valdivia) 41 (2), 55-70, 2015"
Concepciones pedagógicas y comunicativas de los MOOCS: estado del arte y prospectiva en el marco de un proyecto europeo,"E Fernández, C Rodríguez, A Fueyo","III Workshop Internacional sobre creación de MOOCs con anotaciones multimedia, 2014"
Algunos interrogantes sobre la práctica de actividad físico deportivas en las mujeres adolescentes y su abandono,E Fernández,"ponencia presentada en el Congreso Mujer y Deporte, celebrado en Bilbao (26 …, 2001"
Asignación de conductores a jornadas de trabajo en empresas de transporte colectivo,"C Esclapés, E Fernandez",
"El Compromiso Estudiantil en Educación Superior como Agencia Compleja. Formación universitaria, 11 (4), 95-108","J Aspeé, J González, E Cavieres-Fernández",
Epistemología y experiencia en Freire. Contribuciones a una metodología narrativa,EA Cavieres-Fernández,"Magis. Revista Internacional de Investigación en Educación 11 (22), 87-98, 2018"
Monitorear la convivencia escolar para fortalecer (no disminuir) las capacidades de las escuelas,"V López Leiva, P Ascorra Costa, MÁ Bilbao, C Carrasco Aguilar, ...","RIEE. Revista Iberoamericana de Evaluación Educativa, 2013"
"Significados atribuidos a la convivencia escolar por equipos directivos, docentes y otros profesionales de escuelas chilenas","P Ascorra, V López, C Carrasco-Aguilar, I Pizarro, O Cuadros, CG Núñez","Psykhe (Santiago) 27 (1), 1-12, 2018"
Tensiones y nudos críticos en la implementación de la (s) política (s) de convivencia escolar en Chile,"V López, L Ramírez, R Valdés, P Ascorra, C Carrasco-Aguilar","Calidad en la Educación, 96-129, 2018"
Tensiones normativas de los fiscalizadores de la Superintendencia de Educación en la (s) política (s) de convivencia escolar en Chile,"C Carrasco-Aguilar, P Ascorra, V López, JP Álvarez","Perfiles educativos 40 (159), 126-143, 2018"
Inclusión y violencia: prevalencia de victimización entre pares en estudiantes que participan en programas de integración escolar,"B Villalobos, C Carrasco, V López, MÁ Bilbao, M Morales, S Ortiz, ...","Facultad de Ciencias de la Educación de la Universidad Central de Chile, 2017"
Concepciones de infancia en una escuela con altos índices de violencia escolar de estudiantes a profesores,"CL Carrasco-Aguilar, T Verdejo-Valenzuela, D Asun-Salazar, ...","Revista Latinoamericana de Ciencias Sociales, Niñez y Juventud 14 (2), 1145-1159, 2016"
Políticas de convivencia escolar en tiempos de rendición de cuentas,"P Ascorra, CC Aguilar, V López, M Morales","Education Policy Analysis Archives 27, 31-31, 2019"
Respeto docente y convivencia escolar: Significados y estrategias en escuelas chilenas,"C Carrasco-Aguilar, A Luzón Trujillo","Psicoperspectivas 18 (1), 64-74, 2019"
La práctica de la investigación educativa desde la psicología: Intereses implícitos y finalidad social,CC Aguilar,"Revista de Psicología 19 (1), ág. 154-178, 2010"
Identidad docente y políticas de accountability: el caso de Chile,"C Carrasco Aguilar, A Luzón, V López","Estudios pedagógicos (Valdivia) 45 (2), 121-139, 2019"
Violencia escolar a profesores: Conductas de victimización reportadas por docentes de enseñanza básica,"M Morales, JPÁ González, ÁA del Castillo, PA Costa, MÁB Ramírez, ...","Revista de Estudios Cotidianos 2 (2), 91-116, 2014"
"Inmigración, infancia e integración socioeducativa: un estudio etnográfico sobre niños palestinos en Chile","CC Aguilar, M Molina, MJ Baltar","Revista chilena de Antropología, 2013"
Significados asociados a la participación en juicios orales en niños y niñas víctimas de delitos sexuales,"DO Núñez, V Arredondo, CC Aguilar, CG Vio","Praxis: revista de psicología, 61-82, 2015"
El trabajo interdisciplinario entre psicólogos y profesores: estudio cualitativo sobre los significados de asesores técnicos en educación respecto de su experiencia como equipo …,"MJB De Andrade, CC Aguilar, DJ Bofill, CV Fernández, NT Rojas","Revista de psicología 21 (2), ág. 187-213, 2012"
Formación inicial docente y high stakes accountability: el caso de Chile,"C Carrasco Aguilar, M Figueroa Varela","Universidad de Granada, 2019"
Violencia de reglamento: análisis de los reglamentos de convivencia escolar en dos escuelas con alto nivel de violencia reportada de estudiantes a profesores de la Región de …,"CC Aguilar, JPÁ González, D Asún, MJB de Andrade, CB Raggi, ...","Revista de Estudios Cotidianos 2 (2), 117-137, 2014"
Victimización del personal de la escuela hacia estudiantes referidos a proyectos de integración escolar,"B Villalobos-Parada, V López, M Bilbao, C Carrasco Aguilar, P Ascorra, ...","Universidad de Almería, 2015"
Sujeto/a trabajador/a en la política pública de intervención psicosocial de infancia en Chile: un análisis crítico del discurso,"J Pavez, CC Aguilar, MT Peña, MÁB Ramírez, X Oriol, H Ortúzar, A Rubio, ...","Revista de Estudios Cotidianos 4 (1), 23-45, 2016"
Trayectoria y carrera docente como política neoliberal: el caso del accountability chileno,"C Carrasco-Aguilar, SO Mallegas","Revista de Estudios Teóricos y Epistemológicos en Política Educativa 5, 1-17, 2020"
Policies for school climate in an era of accountability,"P Ascorra, C Carrasco, V López, M Morales","Education Policy Analysis Archives 5 (6), 1-25, 2019"
Entramando pedagogías críticas latinoamericanas: notas teóricas para potenciar el trabajo político-pedagógico comunitario,F Cabaluz Ducasse,"Editorial Quimantú, 2015"
Pedagogias críticas latino-americanas e filosofia da libertação: potencialidades de um diálogo teórico-político,JF Cabaluz-Ducasse,"Educación y educadores 19 (1), 67-88, 2016"
Educación popular y pedagogías críticas en América Latina y el Caribe,"A Guelman, F Cabaluz, M Salazar","Revista Clacso. Buenos Aires-Argentina. Recuperado de: http://biblioteca …, 2018"
El proyecto curricular de la dictadura cívico-militar en Chile (1973-1990),JFC Ducasse,"Perspectiva Educacional, Formación de Profesores 54 (2), 165-180, 2015"
"Estado, mercado y currículum escolar: la experiencia chilena (1964-2018)","L Osandón, M Caro, A Magendzo, M Abraham, S Lavín, F González, ...","UNESCO, 2018"
Colonialidad del poder y geopolítica del conocimiento: reflexiones para re-pensar las pedagogías críticas,"PRO Pizarro, JFC Ducasse","Diálogos educativos, 10, 2010"
"Educación, movimientos sociales y poder popular. Apuntes teóricos para la praxis político-pedagógica","PRO PIZARRO, JFC DUCASSE","Revista Actuel Marx/Intervenciones, 215-235, 2012"
Percurso de Paulo Freire no Chile (1964-1969): alfabetização popular e influências do marxismo heterodoxo,"F Cabaluz, B Areyuna-lbarra","Revista Colombiana de Educación, 291-312, 2020"
Educación popular y pedagogías críticas. Corrientes emancipadoras de la educación chilena,"B Areyuna, F Cabaluz, F Zurita","A. GUELMAN, F. CABALUZ y M. SALAZAR, Educación Popular y Pedagogías críticas …, 2018"
La especificidad del Estado en América Latina. Apuntes a partir de la obra de René Zavaleta Mercado,CDJ Fabian,"Izquierdas, 240-256, 2018"
"Educación, racismo y descolonización. Reflexiones pedagógicas a partir de Silvia Rivera Cusicanqui","D Cabaluz, J Fabián","Actuel Marx/Intervenciones, 2017"
"Politicidad, acción dialógica y luchas por el currículum: notas para reflexionar sobre los usos pedagógicos de los archivos de memoria","JF Cabaluz Ducasse, PR Ojeda Pizarro","Aletheia 2 (3), 2011"
Filosofía de la liberación y pedagogías críticas latinoamericanas. Entrevista a Enrique Dussel,F Cabaluz,"Cuaderno de Pensamiento Latinoamericano 21, 136-148, 2014"
El concepto de trabajo vivo desde el marxismo latinoamericano. Notas a partir de la obra de Enrique Dussel y Álvaro García Linera,"JF Cabaluz, TT López","Izquierdas, 1397-1423, 2020"
Educación Popular en América Latina: trazas históricas y nudos estratégicos para el siglo XXI,JF CABALUZ DUCASSE,"Revista de Ciências da Educação, Americana 45, 2019"
Educación popular: para una pedagogía emancipadora latinoamericana,"F Cabaluz Ducasse, A Guelman, MM Palumbo, M Salazar","CLACSO, 2020"
"Reflexiones sobre el proyecto político-pedagógico del Movimiento de Izquierda Revolucionaria (MIR) durante el gobierno de la Unidad Popular, 1970-1973",FAC Rodriguez,"Diálogos educativos, 21-35, 2011"
"Aproximaciones al marxismo latinoamericano: Teoría, historia y política","F Cabaluz, T Torres","Ariadna Ediciones, 2021"
Educar para la emancipación. Hacia una praxis crítica del sur,"MC Martínez Pineda, E Guachetá Gutiérrez","Otras Publicaciones, 2020"
La dialéctica de la hegemonía y el problema pedagógico como praxis político-transformadora. Reflexiones desde Gramsci para América Latina,"PRO Pizarro, JFC Ducasse",
Nitrospina‐like bacteria are the main drivers of nitrite oxidation in the seasonal upwelling area of the Eastern South Pacific (Central Chile ∼36°S),"HA Levipan, V Molina, C Fernandez","Environmental Microbiology Reports 6 (6), 565-573, 2014"
Spatial and temporal variability of planktonic archaeal abundance in the Humboldt Current System off Chile,"RA Quiñones, HA Levipan, H Urrutia","Deep Sea Research Part II: Topical Studies in Oceanography 56 (16), 1073-1082, 2009"
Different Phenotypes of Mature Biofilm in Flavobacterium psychrophilum Share a Potential for Virulence That Differs from Planktonic State,"HA Levipan, R Avendano-Herrera","Frontiers in cellular and infection microbiology 7, 76, 2017"
"A time series of prokaryote secondary production in the oxygen minimum zone of the Humboldt current system, off central Chile","HA Levipan, RA Quinones, H Urrutia","Progress in Oceanography 75 (3), 531-549, 2007"
Methylotrophic methanogens in the water column of an upwelling zone with a strong oxygen gradient off central Chile,"HA Levipan, RA Quiñones, HE Johansson, H Urrutia","Microbes and environments 22 (3), 268-278, 2007"
Variability of nitrifying communities in surface coastal waters of the Eastern South Pacific (∼ 36° S),"HA Levipan, V Molina, C Anguita, A Rain‐Franco, L Belmar, C Fernandez","Environmental Microbiology Reports 8 (5), 851-864, 2016"
Fingerprinting analysis of the prokaryote community along a marine–freshwater transect in central-southern Chile,"HA Levipan, WO Alarcón, GS Saldías","Annals of microbiology 62 (3), 1121-1140, 2012"
Biofilm development and cell viability: An undervalued mechanism in the persistence of the fish pathogen Tenacibaculum maritimum,"HA Levipan, D Tapia-Cammas, V Molina, R Irgang, AE Toranzo, ...","Aquaculture 511, 734267, 2019"
A high-throughput analysis of biofilm formation by the fish pathogen Tenacibaculum dicentrarchi,"HA Levipan, R Irgang, D Tapia-Cammas, R Avendaño-Herrera","J. Fish Dis 42, 617-621, 2019"
Improved understanding of biofilm development by Piscirickettsia salmonis reveals potential risks for the persistence and dissemination of piscirickettsiosis,"HA Levipan, R Irgang, A Yáñez, R Avendaño-Herrera","Scientific reports 10 (1), 1-16, 2020"
Stress tolerance-related genetic traits of fish pathogen Flavobacterium psychrophilum in a mature biofilm,"HA Levipan, J Quezada, R Avendaño-Herrera","Frontiers in microbiology, 18, 2018"
Molecular analysis of the community structure of nitrifying bacteria in a continuous‐flow bioreactor,"HA Levipan, E Aspe, H Urrutia","Environmental technology 25 (3), 261-272, 2004"
Archaeal and bacterial assemblages in the Oxygen Minimum Zone of the upwelling ecosystem off Central Chile as determined by organic biomarkers,"B Srain, J Sepulveda, S Pantoja, RE Summons, RA Quinones, ...","Universidad de Concepción. Facultad de Ciencias Naturales y Oceanográficas., 2015"
Living in the oxygen minimum zone: A metabolic perspective,"RA Quiñones, RR González, H Levipan, J Gerdhard, MH Gutiérrez","Gayana (Concepción) 70, 68-72, 2006"
Assessing the impacts of skin mucus from Salmo salar and Oncorhynchus mykiss on the growth and in vitro infectivity of the fish pathogen Piscirickettsia salmonis,"HA Levipan, R Avendaño‐Herrera","Journal of Fish Diseases 44 (2), 181-190, 2021"
Development of a multiplex PCR assay for genotyping the fish pathogen Piscirickettsia salmonis through comparative genomics,"A Isla, JE Martinez-Hernandez, HA Levipan, D Haussmann, J Figueroa, ...","Frontiers in microbiology, 1509, 2021"
Spatiotemporal distribution of key pelagic microbes in a seasonal oxygen-deficient coastal upwelling system of the Eastern South Pacific Ocean,"V Molina, L Belmar, HA Levipan, S Ramírez-Flandes, C Anguita, A Galán, ...","Frontiers in Marine Science 7, 561597, 2020"
Piscirickettsia salmonis does not evidence quorum sensing based on acyl‐homoserine lactones,"HA Levipan, L Reyes‐Garcia, R Avendaño‐Herrera","Journal of Fish Diseases 44 (7), 1047-1051, 2021"
Commentary: Piscirickettsia salmonis Produces a N-Acetyl-L-Homoserine Lactone as a Bacterial Quorum Sensing System-Related Molecule,"HA Levipan, L Reyes-Garcia, R Avendaño-Herrera","Frontiers in cellular and infection microbiology, 210, 2022"
"Nitrospina bacteria in a rocky intertidal habitat (Quintay Bay, central Chile)","DV Yepsen, HA Levipan, V Molina","MicrobiologyOpen 8 (3), e00646, 2019"
"Todos los males el mal: la"" estética de la aniquilación"" en la narrativa de Roberto Bolaño",A Candia Cáceres,"Revista chilena de literatura, 43-70, 2010"
"El"" paraíso infernal"" en la narrativa de Roberto Bolaño",A Candia,"Cuarto Propio, 2011"
"Tres: Arturo Belano, Santa Teresa y Sión. Palimpsesto total en la obra de Roberto Bolaño",A Candia,"Espéculo. Revista de estudios literarios 31, 2005"
2666: la magia y el mal= 2666: magic and evil.,A Candia,
El paraíso perdido de Jorge Teillier,A Candia,"Revista chilena de literatura, 57-77, 2007"
Trilogía sucia de La Habana: descarnado viaje por el anteparaíso,AC Cáceres,"Revista Iberoamericana 73 (218), 101-117, 2007"
A cuarenta grados de acuario. La catástrofe permanente en el imaginario urbano de Valparaíso,"A Candia-Cáceres, LG Cunningham","Anales de Literatura Chilena, 97-112, 2018"
"Geografías invisibles de la globalización: Bolaño, Almada y Zúñiga","DG González, A Candia-Cáceres","Anales de literatura chilena, 79-94, 2017"
Mantra: el resplandor de la araña,A Candia,"Espéculo; revista de estudios literarios 32, 2006"
La Universidad (des) conocida de Roberto Bolaño,AC Cáceres,"Mitologías hoy 7, 19-28, 2013"
McOndo y el espejo trizado: la diseminada modernidad latinoamericana,A Candia,"Espéculo 34, 11, 2006"
¿ Cómo construir un puente? Tejidos transparentes y líneas de fuga en la literatura de Roberto Bolaño,AC Cáceres,"Anales de literatura chilena, 179-198, 2014"
Muerte y maravilla de la edad de oro en la poesía de Jorge Teillier,AC Cáceres,"Nueva Revista del Pacífico, 129-146, 2009"
Tensiones de clase en El día que me quieras de Osvaldo Rodríguez Musso,"B Rojas-Castro, A Candia-Cáceres, P Landaeta-Mardones","Izquierdas, 108-128, 2019"
Kafka y Bolaño:¿ Para una literatura menor?,"A Candia-Cáceres, DG González","Revista de Filosofia Aurora 29 (46), 125-144, 2017"
Residencia en la tierra: erotismo en las cenizas,AC Cáceres,"Revista humanidades, 2004"
""" PIEL DE CULEBRA"": REPRESENTACIONES LITERARIAS DE LA INMIGRACIÓN EN VALPARAÍSO DURANTE LOS SIGLOS XIX Y XX",A Candia-Cáceres,"Chasqui 49 (2), 90-106, 2020"
Más allá del urbanismo situacionista. Acerca de New Babylon de Constant,"PL Mardones, JIA Krause, A Candia-Cáceres","Quintana: revista do Departamento de Historia da Arte, 2017"
Porteñas buenas mozas: Corazón y belleza en la construcción de la mujer en la narrativa de Salvador Reyes,"A Candia-Cáceres, O Rosales Neira, P Landaeta","Alpha (Osorno), 157-173, 2016"
"Las mil formas de Venus en Los detectives salvajes:"" anarquia erotica"" en los desiertos de Sonora",A Candia Cáceres,"Revista chilena de literatura, 35-60, 2013"
Wind power forecasting based on echo state networks and long short-term memory,"E López, C Valle, H Allende, E Gil, H Madsen","Energies 11 (3), 526, 2018"
Ensemble methods for time series forecasting,"H Allende, C Valle","Claudio moraga: A passion for multi-valued logic and soft computing, 217-232, 2017"
Evaluating imputation techniques for missing data in adni: a patient classification study,"S Campos, L Pizarro, C Valle, KR Gray, D Rueckert, H Allende","Iberoamerican Congress on Pattern Recognition, 3-10, 2015"
A Multi-Scale Model based on the Long Short-Term Memory for day ahead hourly wind speed forecasting,"IA Araya, C Valle, H Allende","Pattern Recognition Letters 136, 333-340, 2020"
Automating configuration of convolutional neural network hyperparameters using genetic algorithm,"F Johnson, A Valderrama, C Valle, B Crawford, R Soto, R Ñanculef","IEEE Access 8, 156139-156152, 2020"
LSTM-based multi-scale model for wind speed forecasting,"IA Araya, C Valle, H Allende","Iberoamerican Congress on Pattern Recognition, 38-45, 2018"
Parallel approach for ensemble learning with locally coupled neural networks,"C Valle, F Saravia, H Allende, R Monge, C Fernández","Neural processing letters 32 (3), 277-291, 2010"
Comparison of recurrent neural networks for wind power forecasting,"E López, C Valle, H Allende-Cid, H Allende","Mexican Conference on Pattern Recognition, 25-34, 2020"
Training regression ensembles by sequential target correction and resampling,"R Ñanculef, C Valle, H Allende, C Moraga","Information Sciences 195, 154-174, 2012"
Ensemble learning with local diversity,"R Nanculef, C Valle, H Allende, C Moraga","International Conference on Artificial Neural Networks, 264-273, 2006"
Probabilistic forecasting using monte carlo dropout neural networks,"C Serpell, I Araya, C Valle, H Allende","Iberoamerican Congress on Pattern Recognition, 387-397, 2019"
Efficient training over long short-term memory networks for wind speed forecasting,"E López, C Valle, H Allende, E Gil","Iberoamerican congress on pattern recognition, 409-416, 2016"
Behavior analysis of neural network ensemble algorithm on a virtual machine cluster,"C Fernández, C Valle, F Saravia, H Allende","Neural Computing and Applications 21 (3), 535-542, 2012"
Two bagging algorithms with coupled learners to encourage diversity,"C Valle, R Nanculef, H Allende, C Moraga","International Symposium on Intelligent Data Analysis, 130-139, 2007"
Forecasting ozone pollution using recurrent neural nets and multiple quantile regression,"D Flores-Vergara, R Ñanculef, C Valle, M Osses, A Jacques, ...","2019 IEEE CHILEAN Conference on Electrical, Electronics Engineering …, 2019"
Boosting text clustering using topic selection,"M Mendoza, P Ormeno, C Valle","IET Digital Library, 2018"
Local negative correlation with resampling,"R Nanculef, C Valle, H Allende, C Moraga","International Conference on Intelligent Data Engineering and Automated …, 2006"
Recurrent networks for wind speed forecasting,"E López, C Valle, H Allende","IET Digital Library, 2016"
Long short-term memory networks based in echo state networks for wind speed forecasting,"E López, C Valle, H Allende, E Gil","Iberoamerican Congress on Pattern Recognition, 347-355, 2017"
Bagging with asymmetric costs for misclassified and correctly classified examples,"R Ñanculef, C Valle, H Allende, C Moraga","Iberoamerican Congress on Pattern Recognition, 694-703, 2007"
Monitorear la convivencia escolar para fortalecer (no disminuir) las capacidades de las escuelas,"V López Leiva, P Ascorra Costa, MÁ Bilbao, C Carrasco Aguilar, ...","RIEE. Revista Iberoamericana de Evaluación Educativa, 2013"
Victimización de pares y satisfacción con la vida: la influencia del apoyo de profesores y compañeros de la escuela,"B Villalobos-Parada, C Carrasco, D Olavarría, S Ortiz, V López, ...","Psykhe (Santiago) 25 (2), 1-16, 2016"
Construction and validation of a classroom climate scale: A mixed methods approach,"V López, J Torres-Vallejos, P Ascorra, B Villalobos-Parada, M Bilbao, ...","Learning Environments Research 21 (3), 407-422, 2018"
Inclusión y violencia: prevalencia de victimización entre pares en estudiantes que participan en programas de integración escolar,"B Villalobos, C Carrasco, V López, MÁ Bilbao, M Morales, S Ortiz, ...","Facultad de Ciencias de la Educación de la Universidad Central de Chile, 2017"
El papel mediador de la capacitación docente en el manejo de la violencia escolar sobre el bienestar social de profesores,"M Morales, V López, M Bilbao, B Villalobos, D Oyarzún, D Olavarría, ...","terapia psicolÓgica 32 (3), 217-226, 2014"
School and community factors involved in Chilean students’ perception of school safety,"V López, J Torres‐Vallejos, B Villalobos‐Parada, TD Gilreath, P Ascorra, ...","Psychology in the Schools 54 (9), 991-1003, 2017"
Violencia escolar a profesores: Conductas de victimización reportadas por docentes de enseñanza básica,"M Morales, JPÁ González, ÁA del Castillo, PA Costa, MÁB Ramírez, ...","Revista de Estudios Cotidianos 2 (2), 91-116, 2014"
"La convivencia escolar como práctica social: de lo individual a lo social, de lo reactivo y punitivo a lo formativo, del déficit a los recursos, de lo autoritario a lo …","P Ascorra, V López, M Morales, S Ortiz, C Carrasco, M Bilbao, A Ayala, ...","V., López, H., Díaz, & C. Carrasco (Eds.)¡ Nosotros sí podemos, 117-141, 2015"
Victimización del personal de la escuela hacia estudiantes referidos a proyectos de integración escolar,"B Villalobos-Parada, V López, M Bilbao, C Carrasco Aguilar, P Ascorra, ...","Universidad de Almería, 2015"
Peer victimization and mental health risk in Chilean students,"V López, M Murphy, C Lucke, J Torres-Vallejos, B Villalobos-Parada, ...","Journal of Child and Family Studies 27 (8), 2608-2621, 2018"
Construcción de un instrumento para la medición de las actitudes de los docentes hacia la Integración de Estudiantes con Discapacidad,B Villalobos,"Tesis para optar al grado de Magíster en psicología educacional, 2012"
Monitoring School Conviviality in order to Built (not diminish) Schools’ Capacities.,"V López, P Ascorra, MÁ Bilbao, C Carrasco, M Morales, B Villalobos, ...","Revista Iberoamericana de Evaluación Educativa 6 (2), 201-219, 2013"
Desprivatizar la aulas,"FJ Murillo, C Duk, ML Cruz, G Echeita, Y Muñoz, M Sandoval, C Simón, ...","Revista Latinoamericana de Educación Inclusiva 8 (2), 13-15, 2014"
What do support professionals do in schools? Construction and validation of an instrument for assessing whole-school prevention and promotion strategies,"V López, D Olavarría, K Cárdenas, S Ortiz, N Alfaro, B Villalobos-Parada","Journal of Prevention and Health Promotion 2 (2), 329-357, 2021"
Prevalence of victimization from school staff to students referred to school integration programs/Victimizacion del personal de la escuela hacia estudiantes referidos a …,"B Villalobos-Parada, V Lopez, M Bilbao, CC Aguilar, P Ascorra, ...","Psychology, Society, & Education 7 (2), 133-152, 2015"
School Violence Towards Teachers: Victimization Behaviors in Elementary-School Teachers,"M Morales Pinochet, J Pablo Alvarez, A Ayala del Castillo, ...","REVISTA ESTUDIOS COTIDIANOS 2 (2), 91-116, 2014"
The mediating role of teacher training in the management of school violence on the social wellbeing of teachers,"M Morales, V Lopez, M Angeles Bilbao, B Villalobos, D Oyarzun, ...","TERAPIA PSICOLOGICA 32 (3), 217-225, 2014"
Construcción de un Instrumento para la Medición de las Actitudes de los Docentes hacia la Integración de Estudiantes con Discapacidad,B Villalobos Parada,"Universidad Alberto Hurtado, 2012"
SEM study of the growth of electrochemically obtained polythiophene thin films: effect of electrolyte and monomer concentration in acetonitrile,"L Ugalde, JC Bernede, MA Del Valle, FR Díaz, P Leray","Journal of applied polymer science 84 (10), 1799-1809, 2002"
SEM study of the growth of electrochemically obtained polyselenophene thin films. Effect of electrolyte and monomer concentration in acetonitrile,"MA del del Valle, L Ugalde, FR Diaz, ME Bodini, JC Bernède, A Chaillou","Polymer Bulletin 51 (1), 55-62, 2003"
Nucleation and growth mechanism of polycarbazole deposited by electrochemistry,"S Abé, L Ugalde, MA del Valle, Y Trégouët, JC Bernède","Journal of the Brazilian Chemical Society 18, 601-606, 2007"
Nucleation and growth mechanisms of poly (furan): effect of electrolyte and monomer concentration in acetonitrile,"M Valle, L Ugalde, F Pino, FR Díaz, JC Bernède","Journal of the Brazilian Chemical Society 15, 272-276, 2004"
