titulo,autores,revista
Estrategias didácticas y metodológicas del proceso de formación en el balonmano escolar: Una revisión sistemática,"CH Torres, SE Lazo, CF Valenzuela, FB Gómez","Journal of sport and health research 13 (1), 2, 2021"
Serious games: supporting occupational engagement of people aged 50+ based on intelligent tutoring systems,"MA Bruno, L Griffiths","Ingeniare. Revista chilena de ingeniería 22 (1), 125-139, 2014"
Situated learning based on virtual environment for improving disaster risk reduction,"J Caroca, M Bruno, R Aldunate","Journal of e-Learning and Knowledge Society 12 (4), 2016"
Verification of external specifications of reactive systems,"P Bellini, MA Bruno, P Nesi","IEEE Transactions on Systems, Man, and Cybernetics-Part A: Systems and …, 2000"
Verification criteria for a compositional model for reactive systems,"P Bellini, MA Bruno, P Nesi","Proceedings Sixth IEEE International Conference on Engineering of Complex …, 2000"
Realistic terrain model in a wildfire context for El Yali reserve: Serious videogame simulation,"OA Herrera, MA Lévano, M Moreno, RG Aldunate, M Bruno","2014 33rd International Conference of the Chilean Computer Science Society …, 2014"
Life-cycle of a dual object-oriented specification model for real-time systems,"MA Bruno, P Nesi","Information and Software Technology 41 (1), 35-52, 1999"
Personalization of serious video games for self care in aging,"MA Bruno, RG Aldunate, J Melendez","IEEE Latin America Transactions 12 (3), 484-490, 2014"
Assesing and improving the level of agilism in team work,"P Letelier, A León, M Bruno","2016 XLII Latin American Computing Conference (CLEI), 1-12, 2016"
Personalization of Serious Videogames for Occupational Engagement for Elderly,"MA Bruno, RG Aldunate, J Meléndez","International Workshop on Ambient Assisted Living, 55-62, 2013"
Epistemic video game for education in wildfire response: a pilot study,"J Caroca, MA Bruno, RG Aldunate, CU Arancibia","International Journal of Technology Enhanced Learning 11 (3), 247-258, 2019"
Juegos serios: apoyo a la participación ocupacional de personas mayores de 50 años basado en sistemas de tutoría inteligente,"MA Bruno, L Griffiths","Ingeniare. Revista chilena de ingeniería 22 (1), 125-139, 2014"
MACHI Internet del Futuro: La primera Plataforma Tecnológica en Chile,MA Bruno,"V Jornadas de Vinculación Universidad-Industria (JUI 2011)(XL JAIIO, Córdoba …, 2011"
An augmented reality guide for the “open sky museum” in Valparaíso,"JM Rubio, M Bruno, B Crawford","XII Argentine Symposium on Technology (AST 2011)(XL JAIIO, Córdoba, 29 de …, 2011"
Life-cycle for formal object-oriented specification models,"MA Bruno, G Bucci, P Nesi","Proceedings 23rd Euromicro Conference New Frontiers of Information …, 1997"
Exploring the Use of E-Learning in Chilean Universities: A Study Using Structural Equations Modelling,"MA Bruno, P Ramírez-Correa",
DESARROLLANDO LA INNOVACIÓN Y LA CREATIVIDAD EN ESTUDIANTES DE INGENIERÍA DE SOFTWARE,"JM Rubio, F Johnson, M Bruno",
Program Committee Chairs,"R Alarcón, P Barceló, R Aldunate, D Arroyuelo, H Astudillo, J Atkinson, ...",
Competencias transversales en los planes de estudio de las titulaciones de grado: los esfuerzos de Bolonia en calidad universitaria,"CA Salazar, PR Vargas","Revista Entornos, 105-117, 2012"
Competencias transversales en los planes de estudio de las titulaciones de grado: los esfuerzos de Bolonia en calidad universitaria,"CA Salazar, PR Vargas","Revista Entornos, 105-117, 2012"
Los desafíos de la universidad en la formación del siglo XXI: del profesional al ciudadano universitario,"CA Salazar, PR Vargas","Imagonautas: revista Interdisciplinaria sobre imaginarios sociales 1 (1), 52-75, 2011"
El E-learning en el marco de la construcción de ciudadanía. Análisis contemporáneo a partir de la disociación entre modelos sociales y la crisis de sentido,"P Rivera, C Aránguiz","Revista Chilena de Comunicación 4 (1), 89-113, 2011"
"Relaciones entre construcción de ciudadanía, perfiles de empleabilidad, enseñanza y aprendizaje por competencias transversales: Análisis interpretativo de las titulaciones de …",HC Aránguiz Salazar,"Universitat de Barcelona, 2015"
La formación virtual y la construcción de ciudadanía en el marco de la sociedad de la información: análisis en sociedades periféricas latinoamericanas y sociedades desarrolladas,"PR Vargas, CA Salazar","Encuentros 9 (1), 119-128, 2011"
Seducción iconográfica en los desplegamientos del deseo y la subjetividad,C Aránguiz Salazar,"Revista de Ciencias Sociales y Humanidades, Nº2, Edición Fundación Volcán …, 2004"
To a decade of the Bologna Process: possibilities and limits of its implementation in the Universidad de Barcelona,"C Aránguiz Salazar, P Rivera-Vargas, F Imbernón","Revista de la educación superior 50 (200), 85-104, 2021"
nuevas formas de construcción de ciudadanía en educación superior. emergencia de la formación virtual e impacto en sociedades desarrolladas y periféricas,"PR Vargas, C Salazar",
Construcción de ciudadanía y democracia: Relevancia del aprendizaje por competencias transversales en la Educación Superior* Constructions of citizenship and democracy …,"CA Salazar, CF Cisternas","POLITICAS PÚBLICAS PARA LA EQUIDAD SOCIAL, 37, 2019"
Conflicto de racionalidades: el caso del proyecto de Hidroaysén en la Patagonia chilena,"A Pirazzoli, CA Salazar","Crisis y cambio. Propuestas desde la Sociología: actas del XI Congreso …, 2014"
El impacto del Proceso de Bolonia en los mecanismos de socialización y de movilidad social:: análisis crítico delaprendizaje por competencias transversales en las titulaciones …,"CA Salazar, PR Vargas","Crisis y cambio. Propuestas desde la Sociología: actas del XI Congreso …, 2014"
Formación por competencias y transferencias de empleabilidad: análisis crítico del impacto del marco de cualificaciones en las titulaciones de grado en la Universidad de Barcelona,CA Salazar,"Crisis y cambio. Propuestas desde la Sociología: actas del XI Congreso …, 2014"
Modernización reflexiva y participación electoral:¿ confirmación de la compulsión social o emergencia de la congestión social? Análisis del caso chileno en base a sus procesos …,"PR Vargas, CA Salazar","Crisis y cambio. Propuestas desde la Sociología: actas del XI Congreso …, 2014"
Modelos de organización política y su relación con el sistema político educativo,"EA Espina, CA Salazar","OXÍMORA Revista Internacional de Ética y Política, 182-196, 2012"
Formación virtual universitaria en el marco de la Sociedad de la Información. Impacto en sociedades periféricas y sociedades desarrolladas,"R Vargas, C Aranguiz Salazar","III Congrés Europeu de Tecnologies de la Informació en l'Educació i en la …, 2012"
La construcción de ciudadanía y la formación virtual como estrategia de aprendizaje en competencias transversales en la educación superior: Impactos y oportunidades en …,"CA Salazar, PR Vargas","Una visió crítica: III Congrés Europeu de Tecnologies de la Informació en l …, 2012"
La Formación Virtual como herramienta de Construcción de Ciudadanía en las sociedades contemporáneas,"PR Vargas, CA Salazar","Revista Entornos, 277-286, 2011"
Desafios de la universidad en la formacion del siglo xxi: Construccion de ciudadania critica y activa,"CA Salazar, PR Vargas","Quaderns digitals: Revista de Nuevas Tecnologías y Sociedad, 14, 2011"
Procesos de transformación. En la subjetividad social de las comunidades organizacionales La experiencia de un campamento urbano.,CA Salazar,"XXVII Congreso de la Asociación Latinoamericana de Sociología. VIII Jornadas …, 2009"
Field margin floral enhancements increase pollinator diversity at the field edge but show no consistent spillover into the crop field: a meta‐analysis,"J Zamorano, I Bartomeus, AA Grez, LA Garibaldi","Insect Conservation and Diversity 13 (6), 519-531, 2020"
Colder is better: The differential effects of thermal acclimation on life history parameters in a parasitoid fly,"J Zamorano, F Bozinovic, C Veloso","Journal of Thermal Biology 68, 1-4, 2017"
Effects of urban environmental conditions and landscape structure on taxonomic and functional groups of insects,"C González-Césped, AJ Alaniz, PM Vergara, E Chiappa, J Zamorano, ...","Urban Forestry & Urban Greening 58, 126902, 2021"
Intra‐ and inter‐population allometry of the genitalia of Sphex latreillei Lepeletier de Saint Fargeau 1831 (Hymenoptera: Sphecidae) supports the one‐size‐fits …,"J Zamorano, E Chiappa","Austral Entomology 54 (3), 265-269, 2015"
"Reflexiones en torno a la vulnerabilidad social y residencial de los asentamiento informales de los cerros de Valparaíso, Chile","C Bailey, E Zenteno","DINÂMIA'CET-IUL, 2015"
La percepción del espacio urbano. El aporte de los mapas perceptivos al análisis del barrio ZEN de Palermo (Italia),E Zenteno Torres,"Revista invi 33 (93), 99-122, 2018"
"Continuidades, rupturas y emergencias: las desigualdades urbanas en América Latina","A Sehtman, E Zenteno","Universidad Nacional Autónoma de México, Coordinación de Humanidades, Centro …, 2015"
"Continuidades, rupturas y emergencias","A Sehtman, E Zenteno","Las desigualdades urbanas en América Latina. México: Programa Universitario …, 2015"
Searching for the ‘Chilean Oasis’: Waiting and Uncertainty in the Migration Trajectories of Venezuelan Women,"E Zenteno Torres, NB Salazar","Journal of Immigrant & Refugee Studies, 1-14, 2021"
"De ciudadanías insurgentes a planificadores, urbanos. Organización social en la urbanización del campamento Manuel Bustos de Viña del Mar","E Zenteno Torres, K Sepúlveda Muñoz, J Ahumada González, ...","Revista de Geografía Norte Grande, 157-172, 2020"
La violencia en los márgenes. Una maestra y un sociólogo en el conurbano bonaerense. Javier Auyero y María Fernanda Berti,E Zenteno Torre,"Polis (Santiago) 13 (37), 547-550, 2014"
Subaltern urbanization in times of pandemic. Informal settlements in Chile,"E Zenteno-Torres, P Munoz-Salazar, B Rosso-Ávila","Bitácora Urbano Territorial 32 (2), 267-280, 2022"
"L’urbanisation subalterne en temps de pandémie. Quartiers informels à Valparaíso, Chili","E Zenteno-Torres, P Munoz-Salazar, B Rosso-Ávila","Bitácora Urbano Territorial 32 (2), 267-280, 2022"
From insurgent citizenships to urban planners. Social organization in the urbanization of the Manuel Bustos slum in Vina del Mar,"E Zenteno Torres, K Sepulveda Munoz, J Ahumada Gonzalez, ...","REVISTA DE GEOGRAFIA NORTE GRANDE, 157-172, 2020"
Asentamientos (in) formales en ciudades intermedias y pequeñas metrópolis de Sudamérica: Estado de situación y debate actual,"E Zenteno Torres, RA Apaolaza","Universidad de Playa Ancha. Facultad de Ciencias Sociales, 2019"
Situación de salud en asentamientos precarios,"G Morgado, E Zenteno, F Viveros, C Gonazález, P Rodríguez, C Zamora","Revista Chilena de Salud Pública 21 (2), 150-159, 2017"
"La questione di genere nel quartiere San Filippo Neri, zen di Palermo: racconti etnografici",E Zenteno Torres,"La questione di genere nel quartiere San Filippo Neri, zen di Palermo …, 2016"
"Javier Auyero y María Fernanda Berti, La violencia en los márgenes. Una maestra y un sociólogo en el conurbano bonaerense, Katz Editores, Buenos Aires, Argentina, 2013, 174 p.",E Zenteno Torre,"Polis. Revista Latinoamericana, 2014"
"La violencia en los márgenes. Una maestra y un sociólogo. en el conurbano bonaerense. Javier Auyero y María Fernanda Berti. Katz Editores, Buenos Aires, Argentina, 2013, 174 págs.",EZ Torres,"POLIS, Revista Latinoamericana 13 (37), 547-550, 2014"
"Perceptions about the urban space. The contribution of perceptive maps to the analysis of ZEN, Palermo (Italy)",E Zenteno Torres,"Instituto de la Vivienda, Facultad de Arquitectura y Urbanismo, Universidad …, 0"
Presencia e in-diferencia. Por un estatuto visual de la niñez,"F Gascón, L Godoy Peña","Revista Latinoamericana de Ciencias Sociales, Niñez y Juventud 13 (2), 645-656, 2015"
Cuerpo y subjetivación: elementos para una lectura de conflictos escolares,"L Godoy Peña, T Yuing","Praxis & Saber 7 (15), 165-182, 2017"
La infancia colonizada: estatuto de (in) diferencias y visualidad,L Godoy Peña,"Lectura para todos. El aporte de la fácil lectura como vía para la …, 2015"
Hacia una posible epistemología de las diferencias en contextos educativos,L Godoy Peña,"Revista Investigación y Postgrado 29 (2), 35-59, 2014"
Covid-19: del fantasma autoritario del enemigo interno a la biopolítica del distanciamiento social,"F Gascón, L Godoy Peña","El tiempo que vivimos. Covid 19 y su impacto en nuestras sociedades, 121-124, 2020"
Covid-19: del fantasma autoritario del enemigo interno a la biopolítica del distanciamiento social,"F Gascón, L Godoy Peña","Covid 19: La comunicación en tiempos de pandemia, 105-108, 2020"
BODY AND SUBJECTIVATION: ELEMENTS FOR THE ANALYSIS OF SCHOOL CONFLICTS,"TY Alfaro, L Godoy-Peña","Praxis & Saber 7 (15), 165-182, 2016"
CORPS ET SUBJECTIVATION: ELEMENTS POUR UNE LECTURE DES CONFLITS SCOLAIRES,"TY Alfaro, L Godoy-Peña","Praxis & Saber 7 (15), 165-182, 2016"
Imaginarios instituidos sobre la categoría de la diferencia en las políticas educativas de Chile y Argentina,L Godoy Peña,"Doctorado en Estudios Americanos, Área Pensamiento y Cultura, Universidad de …, 2016"
Política de Educación Especial: Entramados de sospechas sobre la inclusión de la diferencia,L Godoy Peña,"Pasajes, 38 – 55, 2016"
Presence and indifference. Towards a visual statute of childhood,"F Gascón, L Godoy","Revista Latinoamericana de Ciencias Sociales, Niñez y Juventud 13 (2), 645-656, 2015"
Retos para un estatuto visual de la subjetividad intercultural,"F Gascón, L Godoy Peña","Políticas públicas y protección de la infancia en América Latina: Familia …, 2015"
Towards a possible epistemology of the differences in educational contexts,L Godoy Peña,"Investigación y Postgrado 29 (2), 35-59, 2014"
Em direção a uma possível epistemologia das diferenças em contextos educacionais,L Godoy Peña,"Investigación y Postgrado 29 (2), 35-59, 2014"
Diversidad e inclusión. Imaginarios socio-educativos en la formación inicial docente de Chile y Argentina,L Godoy Peña,"Filosofar: aprender e insinar, 2012"
Educación Superior en Chile: tensiones epistémicas y retenciones políticas. Una deconstrucción desde la sociología de la educación,L Godoy Peña,"Cuadernos del Pensamiento Latinoamericano, 2012"
Evaluación del efecto del modelo integrado de aprendizaje profundo (MIAP) en la comprensión lectora de estudiantes de NB 4,L Godoy Peña,"Pontificia Universidad Católica de Chile, 2008"
Juvenicidio y capitalismo salvaje,"FG i Martín, LG Peña",
cOvid-19: deL fantasMa aUtOritariO deL enemigo interno a La biOPOLÍtica deL distanciamiento social1,"FG i Martín, LG Peña",
DE IGUALDADES Y DIFERENCIAS: LA EDUCACIÓN ESPECIAL COMO CONTROL BIOPOLÍTICO,"LG Peña, SS Herrera, CD Noack","HORIZONTES CONVERGENTES I APORTES TRANSDISCIPLINARIOS AL ESTUDIO DEL …, 0"
"Percepciones sobre el estudio de casos, como estrategia de aprendizaje, en estudiantes de enfermería","MP González Vega, J Vergara Núñez","Ciencia y enfermería 18 (1), 111-123, 2012"
Resistencia de padres frente a la vacuna contra el Virus Papiloma Humano en sus hijas,"F Viveros, P González, K Volgger, C López, F Zapico, C Zepeda","Cuad. Med. Soc.(Chile) 57, 41-7, 2017"
"Experiencias de enfermeros de la atención primaria, partícipes del modelo de atención integral",MPG Vega,"Revista de Salud Pública 20 (6), 677-683, 2018"
Experience of primary care nurses involved in the Comprehensive Care Model,MP Gonzalez-Vega,"Revista de Salud Pública 20 (6), 677-683, 2018"
Percepción sobre Plataformas Digitales como recurso de aprendizaje en estudiantes de Fonoaudiología,"MFA Vizcaíno, MPG Vega, CA Campos, JS Tavilo, ASP López","Trends and challenges in higher education in Latin America, 94, 2018"
Percepción sobre Plataformas Digitales como recurso de aprendizaje en estudiantes de Fonoaudiología.,"ASPL María Fernanda Agudelo Vizcaíno, Maria Patricia Gonzalez Vega, Carolina ...","J.C. Tovar-Gálvez (Ed.), Trends and challenges in Higher Education in Latin …, 2018"
Percepción sobre las TIC como recurso de aprendizaje en estudiantes de Enfermería,"MPG Vega, CA Campos, JS Tavilo, MFA Vizcaíno","Books of abstracts CIVINEDU 2017: 1st International Virtual Conference on …, 2017"
Establecimiento de un modelo educativo institucional para la orientación del proceso de innovación curricular de las carreras de la Universidad de Playa Ancha,"S Pizarro Barrera, C Valenzuela Urra","Palabra clave 2 (2), 40-48, 2013"
Introducción: Software libre y código abierto: experiencias innovadoras en bibliotecas y centros de información,"C Valenzuela Urra, D Reyes Lillo, S Oliveros Castro","Palabra clave 8 (1), 1-2, 2018"
Tecnología y cambio: una visión desde la perspectiva bibliotecaria,"CV Urra, CP Silva","Revista de Estudios Cotidianos 3 (1), 237-252, 2015"
"Sociedad de la información, alfabetización en información y cambio de rol de la biblioteca universitaria",CV Urra,"Revista Estudios Hemisféricos y Polares 4 (4), 58-72, 2013"
Competencias profesionales de los egresados de la carrera de bibliotecologia de la Universidad de la Playa Ancha de Ciencias de la Educación: una propuesta para Mercosur.,CV URRA,"Transinformação 13 (1), 93-99., 2001"
Base de datos documental gestionada con WinIsis en Dropbox,"H Rueda-Vildoso, C Valenzuela-Urra","El profesional de la información 23 (5), 2014"
Adaptación del Information Competency Assessment Instrument y su aplicación a estudiantes de pregrado de las universidades de Magallanes y Playa Ancha,"C Valenzuela Urra, B Valdenegro Egozcue, S Oliveros Castro, ...","Palabra clave 10 (2), 128-128, 2021"
Análisis temático documental de las tesis de pre y post grado realizadas en las universidades públicas y privadas de Chile sobre alfabetización en información durante el …,"CV Urra, SO Castro","Revista estudios hemisféricos y polares 11 (2), 23-54, 2020"
Ecologías del aprendizaje y la contribución de las competencias informacionales: una reflexión teórica,"C Valenzuela Urra, B Valdenegro Egozcue, S Oliveros Castro","Palabra clave 10 (1), 107-107, 2020"
Document database managed with WinIsis on Dropbox,"H Rueda-Vildoso, C Valenzuela-Urra",
Pedagogía informacional de Oscar Picardo Joao: una revisión y actualización de sus fundamentos en relación con la alfabetización en información,"S Oliveros Castro, C Valenzuela Urra, C Nuñez Chaufleur","Palabra clave 11 (2), 152-152, 2022"
"Introducción al dossier: Alfabetización en información: tendencias, conocimientos y experiencias innovadoras en bibliotecas y otros espacios educativos y culturales","C Valenzuela Urra, S Oliveros Castro, B Valdenegro Egozcue","Palabra clave 11 (2), 149-149, 2022"
Adaptation of the information competency assessment instrument and its application to undergraduate students of the universities of Magallanes and Playa Ancha,"CV Urra, BV Egozcue, SO Castro, M Alvarado","Palabra Clave (La Plata); v. 10 n. 2 (2021); e128 24 (2), 2021"
Winisis multiformato de Unesco para el tratamiento de datos e información textual,"H Rueda Vildoso, C Valenzuela Urra, S Oliveros Castro","Palabra clave 8 (1), 9-10, 2018"
DIGITAL LITERACY: STUDY OF THE IMPACT ON SENIORS OF UNDERGRADE STUDENTS OF EDUCATION AND NATURAL SCIENCES FACULTIES AT THE UNIVERSITY OF PLAYA ANCHA,"C Valenzuela Urra, S Oliveros Castro","REVISTA ESTUDIOS HEMISFERICOS Y POLARES 7 (2), 20-40, 2016"
Alfabetización en información: estudio de su impacto en estudiantes de último año del pregrado de las Facultades de Educación y Ciencias Naturales y Exactas en la Universidad …,"CV Urra, SO Castro","Revista Estudios Hemisféricos y Polares 7 (2), 20-40, 2016"
Technology and change: A view from the library perspective,"C Valenzuela Urra, C Pacheco Silva","REVISTA ESTUDIOS COTIDIANOS 3 (1), 237-252, 2015"
The information professional,"L Rodríguez-Yunta, W Gunn, M Ramírez-Sánchez, JP Suárez-Rivero, ...","El profesional de la información 23 (5), 1386-6710, 2014"
"Sociedad de la Información, alfabetización en información y cambio de rol de la biblioteca universitaria Information Society, information literacy and change roll of the …",CV Urra,"Centro de Estudios Hemisféricos y Polares, 2013"
Una re-visitación a la publicación seriada y su importancia en la investigación,"CV Urra, MEL Campos","F@ ro: revista teórica del Departamento de Ciencias de la Comunicación, 11, 2010"
"Dieta de Athene cunicularia en Isla Choros, Reserva Nacional Pingüino de Humboldt, IV Región.","S Zunino, C Jofré","Boletín Chileno de Ornitología 6, 2-7, 1999"
"Tsunami effects on Coquimbo Bay wetland water-bird species composition, associated with the 2015 Mw8.4 Illapel earthquake (northern Chile).","C Chávez-Villavicencio, E Tabilo-Valdivieso, C Jofré-Pérez","Latin American Journal of Aquatic Research 47 (5), 845-852, 2019"
The preservation of evolutionary value of Chilean amphibians in protected areas,"C Jofré, MA Méndez","Biodiversity conservation in the Americas: lessons and policy …, 2011"
Local actions to tackle a global problem: A multidimensional assessment of the pollination crisis in Chile,"L Vieli, MM Murúa, L Flores-Prado, GO Carvallo, CE Valdivia, G Muschett, ...","Diversity 13 (11), 571, 2021"
Bee–plant assemblage in native flower strips within avocado farms¿ how to optimize plant composition for higher bee taxonomic and functional diversity?,"AE Muñoz, T Zaviezo, C Jofré-Pérez, M Plantegenest","Native-shrub-strip effects on conservation and ecosystem services provided …, 2022"
Las aves acuáticas de los humedales de la Bahía de Coquimbo (Chile): respuesta de su composición al tsunami del 16 de septiembre de 2015 (T16S).,"C Chávez-Villavicencio, E Tabilo-Valdivieso, C Jofré-Pérez","Libro de Resúmenes, Contribuciones Orales Libres 2-29, pp. 109, XII Congreso …, 2017"
Efectos del tsunami del 16 de septiembre de 2015 (T16S) sobre el hábitat de aves acuáticas en los humedales de la bahía de Coquimbo (centro-norte de Chile).,"C Jofré-Pérez, C Chávez-Villavicencio, E Tabilo-Valdivieso","Libro de Resúmenes, Exposiciones Orales, pp. 109, 7ma Reunión del Grupo de …, 2017"
Analysis of the feasibility of marine tailings in Chile and its effect on the Marine Protected Areas of Atacama and Coquimbo.,"C Jofré-Pérez, E Tabilo-Valdivieso, C Chávez-Villavicencio, CF Gaymer, ...","IMPAC 4 Complete Program, Poster, pp. 246, 4th International Marine …, 2017"
Estudios sobre insectos y artrópodos del Parque Nacional La Campana: importancia ecológica y necesidades de investigación para la conservación del bosque de la Cordillera El Melón.,C Jofré-Pérez,"1º Workshop Desafíos de Conservación y Restauración del Sitio Prioritario de …, 2017"
"Restauración ecológica del sitio Ramsar Nº 878 (Reserva Nacional El Yali, litoral Chile central) afectado por el tsunami local de 2010: efectos del cambio climático y …","V Meza Ramírez, P De Kartzow Sánchez, M Contreras López, ...","Memorias de congresos TEC: VII Congreso de la Red Latinoamericana de …, 2013"
"Propuesta de restauración ecológica como mecanismo de adaptación al cambio climático en la Reserva Nacional Humedal “El Yali”, Chile.","V Meza Ramírez, M Contreras López, C Rivera Castro, ...","Libro de Resúmenes, Sección Aguas, Presentaciones Orales, pp. 2, VIII …, 2013"
"Restauración ecológica post-tsunami 2010 y adaptación al cambio climático en el humedal costero “El Yali”, Chile central.","M Contreras-López, V Meza, C Rivera, N Duarte, E Quiroga, C Jofré, ...","Libro de Resúmenes, Presentaciones en Panel, pp. 110, XXXIII Congreso de …, 2013"
Investigaciones científicas sobre la rana grande de Chile (Calyptocephalella gayi): necesidades para su conservación.,C Jofré,"Libro de Resúmenes, Comunicaciones Orales 7, Nº 26, IV Congreso de Anfibios …, 2013"
Nuevos registros y amplitud de la distribución de Liolaemus stolzmanni (=L. pachecoi) en el altiplano de Chile.,"C Jofré, G Lobos","Libro de Resúmenes, Presentación de Paneles 12, Nº 27, IV Congreso de …, 2013"
Propuesta de restauración ecológica como mecanismo de adaptación al cambio climático en la Reserva Nacional El Yali (Región de Valparaíso): implicancias para su herpetofauna.,"C Jofré, M Contreras, V Meza, C Rivera, N Duarte, E Soto, E Quiroga, ...","Libro de Resúmenes, Comunicaciones Orales 1, Nº 28, IV Congreso de Anfibios …, 2013"
"Restauración ecológica del sitio Ramsar Nº 878 (Reserva Nacional El Yali, litoral Chile central) afectado por el tsunami local de 2010: efectos del cambio climático y …","V Meza Ramírez, P De Kartzow Sánchez, M Contreras López, ...","Libro de Resúmenes, Comisión Científica de Cambio Climático, CC.8.0, pp. 318 …, 2013"
Aplicación de índices de diversidad filogenética a la conservación de los anuros chilenos en las Áreas Silvestres Protegidas.,"C Jofré, M Méndez","III Coloquio de Anfibios y Reptiles., 2012"
Evaluación del estatus de conservación de los anuros chilenos en las áreas silvestres protegidas mediante índices de diversidad filogenética.,"C Jofré, M Méndez","Libro de Resúmenes XX, III Reunión Anual Sociedad Chilena de Evolución., 2009"
"Comportamiento de machos y hembras de Sphex latreillei Lepeletier (Hymenoptera: Sphecidae), en la VII Región de Chile.","E Chiappa, C Jofré","Libro de Resúmenes 23, IV Jornadas de Etología., 1998"
Interrelaciones de polinización entre abejas autóctonas y plantas nativas en la V Región de Chile.,"C Jofré, E Chiappa, R Villaseñor","Libro de Resúmenes 48, XIX Congreso Nacional de Entomología., 1997"
