id_gs,idco,nombre_coautor,dominio,cargo
pwL_3ukAAAAJ,rWf6oDkAAAAJ,Max Troell,Dirección de correo verificada de beijer.kva.se,"Beijer Institute, Royal Swedish Academy of Science; Stockholm Resilience Centre, Stockholm"
pwL_3ukAAAAJ,rdQcyDwAAAAJ,Thierry Chopin,Dirección de correo verificada de unbsj.ca,University of New Brunswick
pwL_3ukAAAAJ,0V_ugkQAAAAJ,Carolina Camus Torres,Dirección de correo verificada de ulagos.cl,"Researcher, Centro i-mar, Universidad de Los Lagos"
pwL_3ukAAAAJ,O0ZEvrwAAAAJ,"Amir Neori, Ph.D., a Research Fellow...",Dirección de correo verificada de univ.haifa.ac.il,"Morris Kahn Marine Research Station, Department of Marine Biology. Leon Charney School of Marine"
pwL_3ukAAAAJ,tlr2fqkAAAAJ,Charles Yarish,Dirección de correo verificada de uconn.edu,"Professor of Ecology & Evolutionary Biology, University of Connecticut"
pwL_3ukAAAAJ,Q_FuTD8AAAAJ,Julio A Vásquez,Dirección de correo verificada de ucn.cl,"Prof. Titular Departamento de Biología Marina, Universidad Católica del Norte"
pwL_3ukAAAAJ,X-63wtoAAAAJ,Sandra V. Pereda,Dirección de correo verificada de ulagos.cl,Centro i-mar Universidad de Los Lagos
pwL_3ukAAAAJ,a6cSVp4AAAAJ,Juan A. Correa,Dirección de correo verificada de bio.puc.cl,"Professor Departamento de Ecología, Facultad de Ciencias Biológicas, Pontificia Universidad Católica de Chile"
pwL_3ukAAAAJ,8e8yNDoAAAAJ,Isabel Sousa Pinto,Dirección de correo verificada de ciimar.up.pt,"Centre for Marine and Environmental Research and FCUP, University of Porto"
pwL_3ukAAAAJ,fYcWbSwAAAAJ,Luis Filun Villablanca,Dirección de correo verificada de ulagos.cl,Universidad de Los Lagos
pwL_3ukAAAAJ,aWsv7hUAAAAJ,Michael H Graham,Dirección de correo verificada de mlml.calstate.edu,"Professor of Marine Ecology, Moss Landing Marine Labs"
pwL_3ukAAAAJ,jI8ORYEAAAAJ,Alonso Vega Reyes,Dirección de correo verificada de ucn.cl,Programa de Doctorado Biologia y Ecologia Aplicada - Universidad Católica del Norte
pwL_3ukAAAAJ,2Va4AUEAAAAJ,George P. Kraemer,Dirección de correo verificada de purchase.edu,Purchase College (SUNY)
pwL_3ukAAAAJ,zl6IebwAAAAJ,Javier Infante Rosselot,Dirección de correo verificada de patagoniaseaweeds.com,Patagonia Seaweeds SpA.
pwL_3ukAAAAJ,Tgosdx4AAAAJ,Shawn Robinson,Dirección de correo verificada de dfo-mpo.gc.ca,Scientist at Fisheries and Oceans Canada
pwL_3ukAAAAJ,SUa9XUYAAAAJ,Dane Klinger,Dirección de correo verificada de stanford.edu,Stanford University
pwL_3ukAAAAJ,h07etS4AAAAJ,Sylvain Faugeron,Dirección de correo verificada de bio.puc.cl,Pontificia Universidad Catolica de Chile
pwL_3ukAAAAJ,-r4W6-QAAAAJ,Jose A. Zertuche-Gonzalez,Dirección de correo verificada de uabc.edu.mx,PROFESOR DE BOTANICA MARINA
pwL_3ukAAAAJ,gbLAY8sAAAAJ,Christopher D Neefus,Dirección de correo verificada de unh.edu,"Professor of Plant Biology, University of New Hampshire"
pwL_3ukAAAAJ,aQIdT6YAAAAJ,Martha Hengst,Dirección de correo verificada de ucn.cl,Universidad Católica del Norte
SV8GS1QAAAAJ,JsvLVQkAAAAJ,Luis Velasquez,Dirección de correo verificada de usek.cl,"USEK, UNAB, USACH y PUC"
SV8GS1QAAAAJ,zywiL_EAAAAJ,Claudio Cabello-Verrugio,Dirección de correo verificada de unab.cl,Universidad Andres Bello
SV8GS1QAAAAJ,DSQ3d6YAAAAJ,Mauricio A. Retamal,Dirección de correo verificada de udd.cl,"Universidad del Desarrollo, Centro de Fisiología Celular e Integrativa"
SV8GS1QAAAAJ,0E1mc2kAAAAJ,Lorena Varela-Nallar,Dirección de correo verificada de unab.cl,"Assistant Professor, Universidad Andres Bello"
SV8GS1QAAAAJ,-vFQMzEAAAAJ,Alvaro Becerra F,,Universidad Bernardo O’higgins
by9GKEUAAAAJ,D02-lBUAAAAJ,Vicenç Font Moll ( ORCID: 0000-0003-...,Dirección de correo verificada de ub.edu,Universitat de Barcelona. P. Honorario PUCP (Perú); P. Colaborador UESB (Br.) y ULagos (Ch)
by9GKEUAAAAJ,3v9N8IUAAAAJ,Juan D. Godino (orcid.org/0000-0001-...,Dirección de correo verificada de ugr.es,Universidad de Granada. Catedrático jubilado de Didáctica de la Matemática
by9GKEUAAAAJ,jlxfxsUAAAAJ,Walter Fernando Castro Gordillo,Dirección de correo verificada de udea.edu.co,Universidad de Antioquia
by9GKEUAAAAJ,0q7cOcQAAAAJ,Wilson Gordillo Thiriat,Dirección de correo verificada de udistrital.edu.co,Universidad Distrital Francisco José de Caldas
by9GKEUAAAAJ,9l9NAl4AAAAJ,Jesús Guadalupe Lugo-Armenta,Dirección de correo verificada de ulagos.cl,"Académico del Departamento de Ciencias Exactas, Universidad de Los Lagos"
by9GKEUAAAAJ,ZfPhB5wAAAAJ,Victor Larios Osorio,Dirección de correo verificada de uaq.mx,Doctor
by9GKEUAAAAJ,IRM3CXUAAAAJ,Oscar Molina,Dirección de correo verificada de pedagogica.edu.co,Universidad Pedagógica Nacional
by9GKEUAAAAJ,Fwvwfg8AAAAJ,Belén Giacomone (ORCID: 0000-0001...,Dirección de correo verificada de unirsm.sm,"University of San Marino, Republic of San Marino – University of Granada, Spain."
s-fafYQAAAAJ,pLQd6tQAAAAJ,Luis A. Cubillos,Dirección de correo verificada de udec.cl,Universidad de Concepción
s-fafYQAAAAJ,ix4C11IAAAAJ,Piers Dunstan,Dirección de correo verificada de csiro.au,CSIRO Oceans and Atmosphere
s-fafYQAAAAJ,F48Bo6cAAAAJ,Les Watling,Dirección de correo verificada de hawaii.edu,University of Hawaii at Manoa
s-fafYQAAAAJ,gLOAT_UAAAAJ,John M. Guinotte,Dirección de correo verificada de fws.gov,US Fish and Wildlife Service
s-fafYQAAAAJ,QRRSCXAAAAAJ,Jaime R. Rau,Dirección de correo verificada de ulagos.cl,"Profesor Titular, Depto. de Ciencias Biológicas & Biodiversidad, Universidad de Los Lagos, Campus"
s-fafYQAAAAJ,PRX0HaEAAAAJ,Javier A. Arata,Dirección de correo verificada de ark-krill.org,ARK
s-fafYQAAAAJ,z56ghZoAAAAJ,Paulina Helena Gebauer Mery,Dirección de correo verificada de ulagos.cl,Centro I-mar. Universidad de Lagos. Chile
s-fafYQAAAAJ,4mnGFJcAAAAJ,Jorge Cornejo-Donoso,Dirección de correo verificada de ifop.cl,IFOP Instituto de Fomento Pesquero
s-fafYQAAAAJ,Lw3y2q4AAAAJ,Audrey M. Darnaude,Dirección de correo verificada de cnrs.fr,"CNRS scientist, Montpellier university"
s-fafYQAAAAJ,dxCUOR0AAAAJ,Miguel Araya,Dirección de correo verificada de unap.cl,Universidad Arturo Prat
s-fafYQAAAAJ,Pk7BbA0AAAAJ,Philip Piccoli,Dirección de correo verificada de umd.edu,University of Maryland
s-fafYQAAAAJ,oAGqnfgAAAAJ,Ryan J. Woodland,Dirección de correo verificada de umces.edu,"Associate Professor, UMCES"
s-fafYQAAAAJ,EAYkKy0AAAAJ,M.Teresa González,Dirección de correo verificada de uantof.cl,"Associate Professor, University of Antofagasta, Chile "
s-fafYQAAAAJ,o6u0PNUAAAAJ,Donald F. Larson,Dirección de correo verificada de IIDES.org,IIDES
s-fafYQAAAAJ,WtDQgqQAAAAJ,Yun Li,Dirección de correo verificada de med.unc.edu,University of North Carolina
z56ghZoAAAAJ,sL0g3MMAAAAJ,Kurt Paschke,,profesor fisiología UACh
hmfvWy4AAAAJ,Mj2N5xQAAAAJ,Edison Pablo Reyes Aramburu,Dirección de correo verificada de udd.cl,"profesor de Fisiología, Universidad del Desarrollo"
hmfvWy4AAAAJ,JsvLVQkAAAAJ,Luis Velasquez,Dirección de correo verificada de usek.cl,"USEK, UNAB, USACH y PUC"
hmfvWy4AAAAJ,-jaNEe0AAAAJ,Claudio Coddou,Dirección de correo verificada de ucn.cl,Universidad Católica del Norte
hmfvWy4AAAAJ,Wk-e8hsAAAAJ,Dr. César Echeverría,Dirección de correo verificada de uda.cl,Universidad de Atacama
hmfvWy4AAAAJ,zywiL_EAAAAJ,Claudio Cabello-Verrugio,Dirección de correo verificada de unab.cl,Universidad Andres Bello
hmfvWy4AAAAJ,mumyKh8AAAAJ,Sergio Rey,Dirección de correo verificada de ucd.ie,"University College Dublin, School of Medicine"
hmfvWy4AAAAJ,o-ZBXlsAAAAJ,Víctor Cortés,Dirección de correo verificada de med.puc.cl,Pontificia Universidad Católica de Chile
hmfvWy4AAAAJ,zXSC-9oAAAAJ,Xavier Figueroa,Dirección de correo verificada de bio.puc.cl,Pontificia Universidad Católica de Chile
dEi_qTEAAAAJ,WZm7XKgAAAAJ,Anita Patricia Dorner Paris,Dirección de correo verificada de ulagos.cl,Universidad de Los Lagos Dpto de Salud
dEi_qTEAAAAJ,R-mkIakAAAAJ,Alexis Soto Salcedo,Dirección de correo verificada de umayor.cl,Escuela de Psicología Universidad Mayor Chile
dEi_qTEAAAAJ,2v_BeBAAAAAJ,Juan Guillermo Mansilla Sepúlveda,Dirección de correo verificada de uct.cl,"Profesor Investigador, Universidad Católica de Temuco"
dEi_qTEAAAAJ,3hUcJV8AAAAJ,German Moreno Leiva,Dirección de correo verificada de udla.cl,Universidad de las Américas
dEi_qTEAAAAJ,WECmoiwAAAAJ,Soraya Espinoza-Moraga,Dirección de correo verificada de ulagos.cl,"Trabajo Social , Universidad De Los Lagos"
dEi_qTEAAAAJ,-SIKk2UAAAAJ,"Prof. Ricardo F. Allegri, MD., PhD., FA...",Dirección de correo verificada de fleni.org.ar,"Instituto de Investigaciones Neurológicas (FLENI), Argentina; Universidad de la Costa (CUC) Colombia"
dEi_qTEAAAAJ,Yr5cv20AAAAJ,Ramon Armando Vivanco Muñoz,Dirección de correo verificada de ulagos.cl,Universidad de Los Lagos
dEi_qTEAAAAJ,tcduK9sAAAAJ,Sergio Chesta,Dirección de correo verificada de ufrontera.cl,Universidad de la Frontera - Universidad Mayor
dEi_qTEAAAAJ,LuHNzy0AAAAJ,Marcio Soto-Añari,Dirección de correo verificada de ucsp.edu.pe,"Universidad Católica San Pablo, Arequipa, Perú"
dEi_qTEAAAAJ,ATFF7ikAAAAJ,Francisco Ganga Contreras,Dirección de correo verificada de academicos.uta.cl,Universidad de Tarapacá
dEi_qTEAAAAJ,lOCeOWkAAAAJ,Javier Carreón Guillén,Dirección de correo verificada de unam.mx,Profesor de Carrera en Ciencias Sociales y Humanidades
dEi_qTEAAAAJ,KwDb798AAAAJ,Francisco José Francisco Carrera,Dirección de correo verificada de uva.es,Universidad de Valladolid
dEi_qTEAAAAJ,QNPKc5gAAAAJ,ADA LUCIA GALLEGOS RUIZ CONEJO,Dirección de correo verificada de unmsm.edu.pe,"Docente principal de la Facultad de Educación, Universidad Nacional Mayor de San Marcos"
dEi_qTEAAAAJ,sJtaOnsAAAAJ,Milton Aragón,Dirección de correo verificada de colson.edu.mx,El Colegio de Sonora
dEi_qTEAAAAJ,-KueKSgAAAAJ,Antonia Isabel Nogales-Bocio,Dirección de correo verificada de unizar.es,Universidad de Zaragoza
dEi_qTEAAAAJ,Ri4euEwAAAAJ,Alain Francisco Morejón Giraldoni,Dirección de correo verificada de infomed.sld.cu,"Universidad de Ciencias Médicas Cienfuegos, Cuba"
dEi_qTEAAAAJ,XmjurTEAAAAJ,Pedro Valdivia-Moral,Dirección de correo verificada de ugr.es,University of Granada
dEi_qTEAAAAJ,9KtF4qcAAAAJ,AGUEDA MUÑOZ DEL CARPIO TOIA,Dirección de correo verificada de ucsm.edu.pe,UNIVERSIDAD CATOLICA DE SANTA MARIA
dEi_qTEAAAAJ,L2NjW3MAAAAJ,Pedro Enrique Villasana Lopez,Dirección de correo verificada de ulagos.cl,"Académico Investigador. Departamento de Salud, Universidad de los Lagos, Chile"
dEi_qTEAAAAJ,rXYZZjcAAAAJ,Cristobal Carnero Pardo,Dirección de correo verificada de neurocenter.es,"FIDYAN Neurocenter, Granada"
24VmCxwAAAAJ,4ytmy2oAAAAJ,Pablo P. Leal,Dirección de correo verificada de ifop.cl,Instituto de Fomento Pesquero
24VmCxwAAAAJ,uN4153oAAAAJ,Catriona L. Hurd,Dirección de correo verificada de utas.edu.au,"Institute for Marine and Antarctic Studies, University of Tasmania, Australia"
24VmCxwAAAAJ,pwL_3ukAAAAJ,Alejandro H. Buschmann,Dirección de correo verificada de ulagos.cl,"Centro i-mar, Universidad de Los Lagos"
24VmCxwAAAAJ,tXUaCMcAAAAJ,Juan Diego Gaitán-Espitia,Dirección de correo verificada de hku.hk,"Assistant Professor, School of Biological Sciences, University of Hong Kong"
lXQNVNAAAAAJ,maLX8i4AAAAJ,Margarita Rosa Parraguez Donoso,Dirección de correo verificada de ulagos.cl,Universidad de Los Lagos
lXQNVNAAAAAJ,_87Kn0AAAAAJ,Cristian Araneda,Dirección de correo verificada de uchile.cl,"Associate Professor, Depto. Producción Animal, Universidad de Chile"
lXQNVNAAAAAJ,OIFyRCgAAAAJ,Miguel Segundo Yáñez Alvarado,Dirección de correo verificada de ubiobio.cl,"Doctor en Estadística, Universidad del Bío-Bío"
lXQNVNAAAAAJ,mGYvmPYAAAAJ,Francisca Reyes Marquez,Dirección de correo verificada de wur.nl,Wageningen University and Research
lXQNVNAAAAAJ,QRRSCXAAAAAJ,Jaime R. Rau,Dirección de correo verificada de ulagos.cl,"Profesor Titular, Depto. de Ciencias Biológicas & Biodiversidad, Universidad de Los Lagos, Campus"
lXQNVNAAAAAJ,dipoBusAAAAJ,Dr. Cristian B. Canales-Aguirre,Dirección de correo verificada de ulagos.cl,Universidad de Los Lagos
WdtOUqwAAAAJ,S_kyOjsAAAAJ,Stefan Gelcich C.,Dirección de correo verificada de bio.puc.cl,Pontificia Universidad Catolica de Chile
WdtOUqwAAAAJ,SiWbHxQAAAAJ,Fikret Berkes,Dirección de correo verificada de umanitoba.ca,University of Manitoba
WdtOUqwAAAAJ,8JCigasAAAAJ,Örjan Bodin,Dirección de correo verificada de su.se,"Professor, Stockholm Resilience Centre, Stockholm University"
WdtOUqwAAAAJ,sCe2GYoAAAAJ,Beatrice Crona,Dirección de correo verificada de stockholmresilience.su.se,Stockholm Resilience Center and Royal Swedish Academy of Science
WdtOUqwAAAAJ,7D6RNlcAAAAJ,Rodrigo Oyanedel,Dirección de correo verificada de zoo.ox.ac.uk,University of Oxford
WdtOUqwAAAAJ,QIHKy1UAAAAJ,Fabio A. Labra R.,Dirección de correo verificada de santotomas.cl,"Professor, Facultad de Ciencias, Universidad Santo Tomás, Santiago, Chile"
WdtOUqwAAAAJ,T1tV1o0AAAAJ,José M. Fariña,Dirección de correo verificada de bio.puc.cl,Pontificia Universidad Catolica de Chile
WdtOUqwAAAAJ,U2Dkd_kAAAAJ,Nelson A. Lagos,Dirección de correo verificada de santotomas.cl,Profesor Titular UST
WdtOUqwAAAAJ,2Ivi7n4AAAAJ,Vicente Sandoval,Dirección de correo verificada de fu-berlin.de,"Disaster Research Unit, Freie Universität Berlin"
va6oIWIAAAAJ,y_ssG8UAAAAJ,Angel D. Sappa,Dirección de correo verificada de espol.edu.ec,ESPOL Polytechnic University (Ecuador) and Computer Vision Center (Spain)
va6oIWIAAAAJ,1LO6KBUAAAAJ,Boris X. Vintimilla Burgos,Dirección de correo verificada de espol.edu.ec,Escuela Superior Politécnica del Litoral - ESPOL (ROR 04qenc566). Ecuador
va6oIWIAAAAJ,fBc491YAAAAJ,Dennis Romero López,Dirección de correo verificada de ele.ufes.br,Universidade Federal do Espírito Santo - UFES
va6oIWIAAAAJ,t8dP5IoAAAAJ,Juan Andres Carvajal Ayala,Dirección de correo verificada de purdue.edu,Purdue University
va6oIWIAAAAJ,N-K-13sAAAAJ,Xavier Soria Poma,Dirección de correo verificada de unach.edu.ec,"External researcher, National University of Chimborazo"
va6oIWIAAAAJ,Q8zcX4wAAAAJ,Cristian Duran-Faundez,Dirección de correo verificada de ubiobio.cl,"Department of Electrical and Electronic Engineering, University of the Bío-Bío"
va6oIWIAAAAJ,RNYDdjEAAAAJ,Cristóbal A. Navarro,Dirección de correo verificada de inf.uach.cl,"Professor of Computer Science, Universidad Austral de Chile"
va6oIWIAAAAJ,Jis2KtMAAAAJ,Naveen Onkarappa,Dirección de correo verificada de cvc.uab.es,
va6oIWIAAAAJ,JJPv3QYAAAAJ,Angela Castro,Dirección de correo verificada de uach.cl,Dra. en Educación. Universidad Austral de Chile. Sede Puerto Montt
va6oIWIAAAAJ,Uoj59Y4AAAAJ,Cristhian Aguilera,Dirección de correo verificada de ubiobio.cl,Ubio bio
dipoBusAAAAJ,ZizSEH4AAAAJ,Dr. Cristián E. Hernández,Dirección de correo verificada de udec.cl,"Full Professor, Universidad de Concepción"
dipoBusAAAAJ,NA5x3psAAAAJ,Jorge Avaria-Llautureo,Dirección de correo verificada de ceaza.cl,Centro de Estudios Avanzados en Zonas Aridas (CEAZA)
dipoBusAAAAJ,EwEctbwAAAAJ,Oscar Inostroza-Michael,Dirección de correo verificada de udec.cl,"Laboratorio de Ecología Evolutiva y Filoinformática, Universidad de Concepción"
dipoBusAAAAJ,V4QxzYYAAAAJ,Daniel Gomez-Uchida,Dirección de correo verificada de udec.cl,"Associate Professor at Departamento de Zoología, Universidad de Concepción"
dipoBusAAAAJ,nlYoIBIAAAAJ,Enrique Rodriguez-Serrano,Dirección de correo verificada de udec.cl,Universidad de Concepcion
dipoBusAAAAJ,Th2-4-sAAAAJ,Hugo A Benítez,Dirección de correo verificada de ucm.cl,Universidad Católica del Maule
dipoBusAAAAJ,9hRGtVYAAAAJ,L.E. Parra,Dirección de correo verificada de udec.cl,Profesor Asociado UdeC
dipoBusAAAAJ,B0JgDB4AAAAJ,Pablo A. Marquet,Dirección de correo verificada de bio.puc.cl,"Professor of Ecology, Pontificia Universidad Catolica de Chile & The Santa Fe Institute"
dipoBusAAAAJ,u6A0UtgAAAAJ,Gerardo González-Rocha,Dirección de correo verificada de udec.cl,"Universidad de Concepcion, Full Professor"
dipoBusAAAAJ,9UCD18UAAAAJ,Ivan Arismendi,Dirección de correo verificada de oregonstate.edu,"Associate Professor, Oregon State University"
dipoBusAAAAJ,FYixOH8AAAAJ,Javier Porobic,Dirección de correo verificada de csiro.au,CSIRO-CMS
dipoBusAAAAJ,sWZmHwwAAAAJ,James E. Seeb,Dirección de correo verificada de uw.edu,"Research Professor, School of Aquatic and Fishery Science, University of Washington"
dipoBusAAAAJ,rTjoP2IAAAAJ,Lisa W. Seeb,Dirección de correo verificada de uw.edu,"School of Aquatic and Fishery Sciences, University of Washington"
dipoBusAAAAJ,gQHmbqcAAAAJ,Jose Gallardo Matus,Dirección de correo verificada de pucv.cl,"Profesor adjunto, Escuela de Ciencias del Mar, Pontificia Universidad Católica de Valparaíso."
kMr_yuQAAAAJ,kJF231MAAAAJ,Francisco Gallardo-Fuentes,Dirección de correo verificada de ulagos.cl,"Departamento de Ciencias de la Actividad Física, Universidad de los Lagos"
kMr_yuQAAAAJ,fTGpEQIAAAAJ,victor lopez pastor,Dirección de correo verificada de mpc.uva.es,Facultad de Educación de Segovia
kMr_yuQAAAAJ,IxhhJ9IAAAAJ,Pedro Delgado Floody,Dirección de correo verificada de ufrontera.cl,"Departamento de EF, Universidad de La Frontera"
kMr_yuQAAAAJ,HRHW64gAAAAJ,Dr. Alberto Moreno Doña,Dirección de correo verificada de uv.cl,Prof. Titular. Universidad de Valparaíso
kMr_yuQAAAAJ,olU3U_AAAAAJ,Felipe García-Pinillos,Dirección de correo verificada de ugr.es,"Department of Physical Education and Sport, University of Granada, Spain"
kMr_yuQAAAAJ,c9vCxn4AAAAJ,Rodrigo Ramirez-Campillo,Dirección de correo verificada de unab.cl,Exercise and Rehabilitation Sciences Laboratory. School of Physical Therapy. Faculty of
kMr_yuQAAAAJ,iwLJNiwAAAAJ,Darío Pérez-Brunicardi,Dirección de correo verificada de uva.es,"Profesor Contratado Doctor, Assistant Professor, University of Valladolid"
kMr_yuQAAAAJ,JaBYkPYAAAAJ,Roberto monjas aguado,Dirección de correo verificada de mpc.uva.es,Profesor de Educación Física. Universidad de Valladolid
kMr_yuQAAAAJ,PvGdjj8AAAAJ,Felipe Caamaño Navarrete,,PhD Universidad Católica de Temuco
WZm7XKgAAAAJ,dEi_qTEAAAAJ,Alex L. Véliz Burgos,Dirección de correo verificada de ulagos.cl,Universidad de Los Lagos
WZm7XKgAAAAJ,R-mkIakAAAAJ,Alexis Soto Salcedo,Dirección de correo verificada de umayor.cl,Escuela de Psicología Universidad Mayor Chile
WZm7XKgAAAAJ,2v_BeBAAAAAJ,Juan Guillermo Mansilla Sepúlveda,Dirección de correo verificada de uct.cl,"Profesor Investigador, Universidad Católica de Temuco"
WZm7XKgAAAAJ,A5MnX5IAAAAJ,Paola Lorena Alvarado Toledo,Dirección de correo verificada de ulagos.cl,Académica del Departamento de Humanidades y Artes de la Universidad de los Lagos
WZm7XKgAAAAJ,Ri4euEwAAAAJ,Alain Francisco Morejón Giraldoni,Dirección de correo verificada de infomed.sld.cu,"Universidad de Ciencias Médicas Cienfuegos, Cuba"
WZm7XKgAAAAJ,L2NjW3MAAAAJ,Pedro Enrique Villasana Lopez,Dirección de correo verificada de ulagos.cl,"Académico Investigador. Departamento de Salud, Universidad de los Lagos, Chile"
WZm7XKgAAAAJ,8k5GZAUAAAAJ,Edith Elina Rivas Riveros,Dirección de correo verificada de ufrontera.cl,Profesor Asociado A Universidad de La Frontera
ELVFDR4AAAAJ,skoAD_MAAAAJ,Juan Silva Quiroz,Dirección de correo verificada de usach.cl,"Académico Departamento de Educación y Director de CIIET, Universidad de Santiago de Chile"
ELVFDR4AAAAJ,B9vJ7gEAAAAJ,Pere Marquès,Dirección de correo verificada de uab.cat,UAB. Red Educativa DIM-EDU
ELVFDR4AAAAJ,_lwe3nAAAAAJ,José Luis Lázaro Cantabrana,Dirección de correo verificada de urv.cat,"Profesor, Departament de Pedagogia, Universitat Rovira i Virgili"
ELVFDR4AAAAJ,IjFFuscAAAAJ,Cristina Andrea Alarcon Salvo,Dirección de correo verificada de ulagos.cl,Psicóloga Educacional
ELVFDR4AAAAJ,UM8ftGoAAAAJ,Andrea Minte Münzenmayer,Dirección de correo verificada de ulagos.cl,"profesora de historia, Universidad de Los Lagos"
ELVFDR4AAAAJ,9wAbgyIAAAAJ,Yorladis Alzate Gallego,Dirección de correo verificada de ucm.edu.co,Universidad Católica de Manizales
ELVFDR4AAAAJ,AdVFkSwAAAAJ,Lina Rosa Parra-Bernal,Dirección de correo verificada de ucm.edu.co,"Profesor de maestría, Universidad Catolica de Manizales"
ELVFDR4AAAAJ,k7Es23wAAAAJ,Danilo Díaz-Levicoy,Dirección de correo verificada de ucm.cl,Universidad Católica del Maule
ELVFDR4AAAAJ,rkTiu0sAAAAJ,María Luz Cacheiro-González (ORCID...,Dirección de correo verificada de edu.uned.es,Universidad Nacional de Educación a Distancia (UNED)
ELVFDR4AAAAJ,PrIhVAEAAAAJ,Jose Miguel Garrido Miranda,Dirección de correo verificada de pucv.cl,Pontificia Universidad Católica de Valparaíso
ELVFDR4AAAAJ,n2kW5gYAAAAJ,Alejandra Agudelo-Marín,Dirección de correo verificada de ucm.edu.co,"Profesora, Universidad Católica de Manizales"
24kpDhkAAAAJ,WT3Z4BgAAAAJ,Mario Tello,Dirección de correo verificada de usach.cl,USACH
24kpDhkAAAAJ,ryWpeWIAAAAJ,Gino Corsini,Dirección de correo verificada de uautonoma.cl,Universidad Autónoma de Chile
XLNaP4cAAAAJ,g76Pn5kAAAAJ,Jonathan R. Barton,Dirección de correo verificada de uc.cl,"Institute of Geography, Institute for Sustainable Development & CEDEUS, UC Chile"
XLNaP4cAAAAJ,asVEqIUAAAAJ,Arnt Fløysand,Dirección de correo verificada de hvl.no,Western Norway University of Applied Sciences
XLNaP4cAAAAJ,hIPKpQ4AAAAJ,Alejandro Salazar Burrows,Dirección de correo verificada de uc.cl,Profesor Asociado Geografía UC. Director Estación Patagonia UC. Pontificia
XLNaP4cAAAAJ,OpI95RgAAAAJ,Beatriz Bustos-Gallardo,Dirección de correo verificada de uchilefau.cl,"Departmento de Geografía, Universidad de Chile"
XLNaP4cAAAAJ,l-Rw-W4AAAAJ,CECILIA CAMPERO,Dirección de correo verificada de uc.cl,"Institute for Resources, Environment and Sustainability and SPPGA University of British Columbia"
8yWzaaAAAAAJ,ATFF7ikAAAAJ,Francisco Ganga Contreras,Dirección de correo verificada de academicos.uta.cl,Universidad de Tarapacá
8yWzaaAAAAAJ,FgEMtxQAAAAJ,Liliana Pedraja Rejas,Dirección de correo verificada de uta.cl,Profesora Titular Universidad de Tarapaca
8yWzaaAAAAAJ,U2zDNT8AAAAJ,Luis Araya-Castillo,Dirección de correo verificada de unab.cl,"Investigador, Universidad Andrés Bello"
8yWzaaAAAAAJ,b6DDNIoAAAAJ,Patricio Viancos González,Dirección de correo verificada de gestion.uta.cl,Universidad de Tarapacá
8yWzaaAAAAAJ,FnRVG3MAAAAJ,Mauricio Rifo,Dirección de correo verificada de ubo.cl,Phd Education
8yWzaaAAAAAJ,-rFtH_8AAAAJ,Jazmín Díaz-Barrios. ORCID: 0000-00...,Dirección de correo verificada de fces.luz.edu.ve,"Universidad del Zulia /Global Humanistic University (GHU), Curazao"
8yWzaaAAAAAJ,OZWlilYAAAAJ,Javiera Ulloa Aguilera (ORCID: 0000-...,Dirección de correo verificada de ulagos.cl,"Universidad de Los Lagos, Carrera Ciencias Políticas y Administrativas"
8yWzaaAAAAAJ,I61QOLIAAAAJ,Walter Sáez San Martín,Dirección de correo verificada de uv.cl,Universidad de Valparaíso
ETq6DzkAAAAJ,LEyZz4sAAAAJ,Andres Raineri,Dirección de correo verificada de uc.cl,"Business School, Pontificia Universidad Católica de Chile"
ETq6DzkAAAAJ,6Q4J-SsAAAAJ,Sergio Maturana,Dirección de correo verificada de ing.puc.cl,"Industrial and Systems Engineering, Pontificia Universidad Católica de Chile"
ETq6DzkAAAAJ,CHjpjyMAAAAJ,Leonardo E. Letelier S.,Dirección de correo verificada de iap.uchile.cl,"Instituto de Asuntos Públicos, Universidad de Chile"
UaPEICEAAAAJ,Lcq4fBkAAAAJ,Eduardo Risco Del Valle,Dirección de correo verificada de ulagos.cl,"Profesor de Lingüística, Universidad de Los Lagos, Osorno Chile"
UaPEICEAAAAJ,eI_qScMAAAAJ,Ignacio Soto Silva,Dirección de correo verificada de ulagos.cl,"Doctor en Musicología. Departamento de Humanidades y Artes, Universidad de Los Lagos"
_annQaAAAAAJ,k7Es23wAAAAJ,Danilo Díaz-Levicoy,Dirección de correo verificada de ucm.cl,Universidad Católica del Maule
_annQaAAAAAJ,seOyeu0AAAAJ,Stiven Rafael Vidal Henry,Dirección de correo verificada de uagro.mx,Licenciado en Matemáticas y M.C en Matemática Educativa
_annQaAAAAAJ,QhDes7YAAAAJ,Nicolás Alonso Fernández Coronado,Dirección de correo verificada de alumnos.ulagos.cl,Universidad de Los Lagos
_annQaAAAAAJ,aIRIrcQAAAAJ,J. Marcos Lopez-Mojica,Dirección de correo verificada de uagro.mx,Matemática Educativa
_annQaAAAAAJ,5wudW8UAAAAJ,Isaac Alejandro Imilpán Rivera (ORCI...,Dirección de correo verificada de ulagos.cl,Universidad de Los Lagos
_annQaAAAAAJ,qQuYYxsAAAAJ,CLAUDIA VASQUEZ ORTIZ,Dirección de correo verificada de uc.cl,"Profesor Asociado, Pontificia Universidad Católica de Chile"
_annQaAAAAAJ,tEbcydwAAAAJ,Maximina Marquez,Dirección de correo verificada de ulagos.cl,"Profesora de Matemática, Universidad de los Lagos"
_annQaAAAAAJ,IdTfipkAAAAJ,Blanca Ruiz,Dirección de correo verificada de tec.mx,Tecnologico de Monterrey
_annQaAAAAAJ,8BT3vmIAAAAJ,José Carlos Ramírez Cruz,Dirección de correo verificada de alumnos.udg.mx,Universidad de Guadalajara
L2NjW3MAAAAJ,3hUcJV8AAAAJ,German Moreno Leiva,Dirección de correo verificada de udla.cl,Universidad de las Américas
L2NjW3MAAAAJ,fb5M0mYAAAAJ,Pol De Vos,Dirección de correo verificada de qmu.ac.uk,QMU
L2NjW3MAAAAJ,yWGEDEkAAAAJ,JOEL CARABALLO,Dirección de correo verificada de paho.org,Consultor de la Organización Panamericana de la Salud (OPS/OMS)
L2NjW3MAAAAJ,WZm7XKgAAAAJ,Anita Patricia Dorner Paris,Dirección de correo verificada de ulagos.cl,Universidad de Los Lagos Dpto de Salud
L2NjW3MAAAAJ,2v_BeBAAAAAJ,Juan Guillermo Mansilla Sepúlveda,Dirección de correo verificada de uct.cl,"Profesor Investigador, Universidad Católica de Temuco"
L2NjW3MAAAAJ,dEi_qTEAAAAJ,Alex L. Véliz Burgos,Dirección de correo verificada de ulagos.cl,Universidad de Los Lagos
eLfkat8AAAAJ,k7Es23wAAAAJ,Danilo Díaz-Levicoy,Dirección de correo verificada de ucm.cl,Universidad Católica del Maule
eLfkat8AAAAJ,qQuYYxsAAAAJ,CLAUDIA VASQUEZ ORTIZ,Dirección de correo verificada de uc.cl,"Profesor Asociado, Pontificia Universidad Católica de Chile"
