id_institucion_gs,id_autor_gs,autor,cargo,id_institucion,email,citaciones,intereses
1812728570911196340,7z9-LVYAAAAJ,Rodrigo Venegas Cardenas,Universidad San Sebastian,uss,uss.cl,46,criminologia 
1812728570911196340,utyVZggAAAAJ,Max Silva Abbott,"Profesor de Filosofía del Derecho, Universidad San Sebastián, Chile",uss,uss.cl,45,Derechos humanos 
1812728570911196340,Z5ky2jMAAAAJ,Julie Agatha Vasquez Duque,Universidad San Sebastián,uss,uss.cl,44,Terapia asistida por animales Terapia Ocupacional Educación universitaria. 
1812728570911196340,8c1QT3MAAAAJ,José Manuel Castro,"Investigador, Universidad San Sebastián",uss,uss.cl,44,historia de Chile historia intelectual historia política América Latina 
1812728570911196340,p-dyX4MAAAAJ,Fernando Seguel,Académico Universidad San Sebastián,uss,uss.cl,42,Odontología Educación 
1812728570911196340,UX8jXQIAAAAJ,Francisca Rodríguez Camus,"Docente Facultad de Medicina y Ciencia, Universidad San Sebastián",uss,uss.cl,39,Medicina basada en evidencia 
1812728570911196340,7Auuv5wAAAAJ,"Humberto Velásquez DDS, MSc, Oral Implantologist","Postgrado Implantología, Universidad San Sebastián",uss,correo,39,Implantología Cirugía oral Anatomía 
1812728570911196340,h2ZZolAAAAAJ,Luis Henriquez,Universidad San Sebastián,uss,uss.cl,35,Dolor crónico Educación en dolor 
1812728570911196340,rSLF4FQAAAAJ,cristian hodge,"Investigador, Universidad San Sebastián",uss,uss.cl,31,fraternidad justicia social desarrollo humano 
1812728570911196340,9LjI6pAAAAAJ,Kevin Campos-Campos,Universidad San Sebastián / Universidad Adventista de Chile,uss,docent,30,Adapted sports Paralympic Sport 
1812728570911196340,gZOrGTgAAAAJ,Katherine Weinberger,"Profesor de Histología, Universidad San Sebastián",uss,docent,29,Histología Inmunología 
1812728570911196340,acMRYdoAAAAJ,Paulina Gonzalez Muñoz,Docente Universidad San Sebastián,uss,docent,29,Microbiología 
1812728570911196340,3XUL8KwAAAAJ,César Díaz-Cid,"docente Facultad de Ciencias de la Educación, Universidad San Sebastián.",uss,uss.cl,29,Literatura de auto representación Literatura siglo XIX XX y XXI Ensayo hispanoamericano Teoría crítica. 
1812728570911196340,mHVn3pMAAAAJ,Sebastián Rodrigo Araneda Rojas,"Profesor de Patología, Universidad San Sebastián",uss,docent,27,patología biología celular biología molecular 
1812728570911196340,-f_MBHkAAAAJ,Omar Alejandro González Jorquera,"Docente Anatomía, Depto de Ciencias Morfológicas, Universidad San Sebastián",uss,docent,27,Rehabilitación Oral Neurociencias Anatomía 
1812728570911196340,Fs6sHVEAAAAJ,David Caralt,"Universidad San Sebastian, Chile",uss,uss.cl,21,arquitectura ciudad teoria historia proyecto 
1812728570911196340,wyDDtIcAAAAJ,Juan Pablo Pacheco,"Departamento de Ciencias Morfológicas, Facultad de Medicina y Ciencia, Universidad San …",uss,uss.cl,21,Anatomía Humana Morfología Humana Ciencias de la Salud 
1812728570911196340,tB6OSpMAAAAJ,Nicolás Maldonado A.,"Departamento de Ciencias Básicas, Facultad de Medicina y Ciencia, Universidad San …",uss,uss.cl,20,Virologia Molecular Virologia Animal Bacteriofagos 
1812728570911196340,8O5WdCoAAAAJ,Mauricio Echeverría,"Director del Instituto de Estudios para la Familia, Universidad San Sebastián, Chile",uss,uss.cl,20,familia educación filosofía 
1812728570911196340,-_LWV_8AAAAJ,Jessica Moya Tillería,"Académico Nutrición y Dietética, Universidad San Sebastián",uss,uss.cl,19,
1812728570911196340,nzq6acYAAAAJ,Tatiana Gomes,"profesora de marketing, Universidad San Sebastian y UDD",uss,uss.cl,18,marketing etnomarketing comportamiento del consumidor neuromarketing 
1812728570911196340,8JAIHAcAAAAJ,Claudia Martínez-Carrasco,Universidad San Sebastián,uss,uss.cl,17,Neurorehabilitation Older Adults Executive Function 
1812728570911196340,QFQLBTEAAAAJ,Rodrigo Lizama Pérez,"Departamento Ciencias Morfológicas, Facultad de Medicina y Ciencia, Universidad San …",uss,uss.cl,17,Anatomía Humana Ciencias de la Salud 
1812728570911196340,87i7MY0AAAAJ,Pedro Leiva Alvarez,"Profesor de Histología, Universidad San Sebastián",uss,docent,17,Histología normal Embriología Histopatología Histoprocesamiento 
1812728570911196340,48Db-vMAAAAJ,Monica Morales Urzúa,"Docente adjunto de la Facultad de Ciencias para el cuidado de la Salud, Carrera de …",uss,docent,17,Nutrición Educación para Ciencias de la Salud 
1812728570911196340,4QSwvwMAAAAJ,Stéphane Franck,"Professor of architecture, Universidad San Sebastián",uss,uss.cl,15,Architecture Social Housing Modern Architecture Heritage 
1812728570911196340,p_SoUsEAAAAJ,Jerson G. Sáez Torres,"Profesor Adjunto Biología Celular, Universidad San Sebastián",uss,docent,15,Química Biología Celular y Molecular Bioquímica general y clínica 
1812728570911196340,vY6RssEAAAAJ,Sergio Alberto Oliveros Castro,Universidad San Sebastián,uss,uss.cl,14,Alfabetización en Información Educación Superior y Tecnología … 
1812728570911196340,XOSuBpwAAAAJ,Tatiana Celume Byrne,"Investigador de la Facultad de Derecho y Gobierno, Universidad San Sebastián, Chile",uss,uss.cl,14,Derecho 
1812728570911196340,KBHh51wAAAAJ,Sergio Jara,"Académico de la escuela de Obstetricia, Universidad San Sebastián.",uss,uss.cl,14,Neonatología Educación Médica Simulación. 
1812728570911196340,_wPu94IAAAAJ,Eduardo Asfura,"Profesor de Lenguaje y Comunicación, Universidad San Sebastián",uss,docent,14,Didáctica de la literatura promoción de la lectura análisis de la práctica educativa 
1812728570911196340,QzimcrkAAAAJ,Jonathan Bautista Espinoza Espinoza,"Académico Facultad de Ciencias para el Cuidado de la Salud, Universidad San Sebastián",uss,uss.cl,14,Ciencias y tecnología de los Alimentos 
1812728570911196340,ytbuhWgAAAAJ,Fabiola Soledad Fuentealba Arévalo,"Académico Facultad Ciencias para el Cuidado de la Salud, Universidad San Sebastián",uss,uss.cl,14,Ciencias de los Alimentos 
1812728570911196340,uQIFZUoAAAAJ,David Martínez,Universidad San Sebastián,uss,uss.cl,13,Social work Social science ethics 
1812728570911196340,dcHIqnoAAAAJ,Sebastián Andre Pastén Fuenzalida,Universidad San Sebastián,uss,uss.cl,13,Marketing Comportamiento Organizacional Gestión Estratégica Economia Conductual 
1812728570911196340,VNW2UtgAAAAJ,Alejandro Ianiszewski,"Docente Escuela de Fonoaudiología, Facultad de Ciencias de la Salud, Universidad San …",uss,uss.cl,13,
1812728570911196340,7bpacIAAAAAJ,Carla E. Contreras-Saavedra,"Research teacher, Universidad San Sebastian",uss,uss.cl,12,Cognition Language switching Cognitive stimulation Numerical processing Phonoaudiology 
1812728570911196340,3EEMhYsAAAAJ,José Venegas Lillo,Universidad San Sebastián,uss,uss.cl,11,Higher Education Políticas públicas 
1812728570911196340,EFJh2dQAAAAJ,Luis Bernardo Weky.,Universidad San Sebastian,uss,uss.cl,11,Cienciometría Ciencia Abierta Estudios Sociales de la Ciencia Historia de la Ciencia Educación 
1812728570911196340,6yfFHLsAAAAJ,Renato Martínez Cifuentes,Universidad San Sebastián,uss,uss.cl,10,Disartria Apraxia del habla Educación médica 
1812728570911196340,c0eiUScAAAAJ,Carla Guzmán Pincheira,"Académico, Universidad San Sebastián",uss,uss.cl,10,Antioxidants Obesity 
1812728570911196340,o3cVjmYAAAAJ,Veronica Esparza,"Docente de la Facultad de Arquitectura, Arte y Diseño, Universidad San Sebastián, Chile",uss,docent,10,arquitectura moderna teoría patrimonio ciudad 
1812728570911196340,rcm06PsAAAAJ,Ginnia Moroni Orellana,"Facultad de Ingeniería, Arquitectura y Diseño, Universidad San Sebastián, Chile",uss,uss.cl,10,architecture engineering structural design parametric design seismic design 
1812728570911196340,uBsnO9EAAAAJ,Ana luz Duran,Universidad San Sebastián,uss,uss.cl,9,políticas públicas educación superior 
1812728570911196340,C6pGvHIAAAAJ,Edison Calahorrano,Universidad San Sebastián,uss,uss.cl,9,medical law tort law contract law human rights law 
1812728570911196340,xmxIojQAAAAJ,Andres Riveros Valdes,"Docente de la Facultad de Medicina y Ciencia, Universidad San Sebastián, Chile",uss,uss.cl,9,anatomía Humana anatomía clínica morfología 
1812728570911196340,Bo5C8gUAAAAJ,Matias Alvarado Leyton,Universidad San Sebastián,uss,correo,9,Historia Historia Cultural Historia de Chile Teoría de la Historia 
1812728570911196340,aCN6QssAAAAJ,Anais Tapia,Universidad San Sebastián,uss,correo,9,salud 
1812728570911196340,Mxo8xYgAAAAJ,Eduardo Salas,Universidad San Sebastián,uss,uss.cl,9,Medicina 
1812728570911196340,YyDFy20AAAAJ,Javier Celis,"Docente de la Facultad de Psicología, Universidad San Sebastián, Chile",uss,docent,9,
1812728570911196340,p7QT8XAAAAAJ,Eliana Urrutia Méndez,"Profesor de Historia, Universidad San Sebastián",uss,uss.cl,8,Historia didáctica de la historia aseguramiento de la calidad vinculación con el medio extensión. 
1812728570911196340,3okgDpwAAAAJ,RODRIGO FIGUEROA WEITZMAN,"Profesor de Filosofía, Universidad San Sebastián",uss,uss.cl,8,Antropología ética filosofía contemporánea fenomenología religión y familia 
1812728570911196340,JOtfdLUAAAAJ,Agustín Lavoz Torres,"Interno de Medicina, Universidad San Sebastián",uss,correo,7,philosophy of mind epicureism ancient philosophy medicine phenomenology 
1812728570911196340,sntj9oQAAAAJ,Manuel Luna Monsalve,"Profesor Fonoaudiología, Universidad San Sebastían",uss,uss.cl,7,audiología audición educación 
1812728570911196340,jQxqGWQAAAAJ,Héctor Félix Reyes,Profesor de Biología e Histología Facultad de Odontología. USS,uss,docent,7,Docencia 
1812728570911196340,A6QlZfIAAAAJ,Hugo Osorio Zelada,Universidad San Sebastián - Postgrados,uss,uss.cl,7,Social Public and Private Project Evaluation Project Management Business Analytics Investigation Methodology 
1812728570911196340,bOySrBkAAAAJ,Jaime Abedrapo,Universidad San Sebastian,uss,uss.cl,6,Ciencias Sociales Relaciones Internacionales Derecho Internacional Humanismo Cristiano 
1812728570911196340,x6eAFdcAAAAJ,Héctor Alejandro Torres González,Universidad San Sebastián,uss,uss.cl,6,anatomía fisiología 
1812728570911196340,ZnVJQAMAAAAJ,Rodrigo Esteban Muñoz Alvarado,"Teacher of English, Universidad San Sebastián",uss,uss.cl,6,EFL ESL Education Assessment 
1812728570911196340,udmFiWgAAAAJ,Nelson Jaime,"Académico, Universidad San Sebastián",uss,docent,6,Migraciones Sociología Intervenciones Sociales Metodologías Innovadoras Políticas Públicas 
1812728570911196340,3JMrArkAAAAJ,Viviana Blanco Castro,"Académica Trabajo Social, Universidad San Sebastián",uss,uss.cl,6,Salud mental pobreza y vulnerabilidad social parentalidad Trabajo Social Políticas Públicas 
1812728570911196340,NKgnUocAAAAJ,Marcelo Noël López,"Director de Análisis y Evaluación Institucional, Universidad San Sebastián",uss,uss.cl,5,Educación Superior 
1812728570911196340,dbDrWR8AAAAJ,Rodrigo Soto Guzmán,Universidad San Sebastián,uss,docent,5,Ciencias Sociales Ciencias de la Información y Ciencias de la … 
1812728570911196340,0TymaVYAAAAJ,Carlos Barría Román,Universidad San Sebastián,uss,uss.cl,4,Discriminación Diversidad Sexual Violencia Sexual 
1812728570911196340,tArVaM8AAAAJ,Macarena Martinez Órdenes,Universidad San Sebastian,uss,uss.cl,4,Epidemiología ambiental y social DOHaD Violencia Obstétrica Salud Pública 
1812728570911196340,jE1NJj4AAAAJ,Rodrigo Figueroa,"Profesor de Filosofía, Universidad San Sebastián",uss,uss.cl,4,Antropología ética filosofía contemporánea fenomenología filosofía de la religión 
1812728570911196340,PBCD7uMAAAAJ,Ana Beatriz Lopes,"Docente investigador, Universidad San Sebastián",uss,uss.cl,4,Epidemiologia Odontopediatria Odontogeriatria Salud Publica 
1812728570911196340,ga97rwgAAAAJ,Nicolás Orellana Solari,"Profesor de Derecho Procesal Penal y Litigación, Universidad San Sebastian",uss,docent,3,Derecho Procesal Penal Litigación 
1812728570911196340,YF5PC2AAAAAJ,Gonzalo Puentes,Universidad San Sebastián,uss,uss.cl,3,Educación superior silvicultura 
1812728570911196340,MSuqXRcAAAAJ,Felipe Orellana Ortega,Universidad San Sebastián,uss,uss.cl,3,historia filosofía literatura 
1812728570911196340,bWgCBz4AAAAJ,Marcelo Moraga Catalán,Docente adjunto Universidad San Sebastián,uss,docent,3,
1812728570911196340,-YVg810AAAAJ,Leidy Lagos Beltran,Universidad San Sebastián,uss,uss.cl,3,Geriatría Gerontología Envejecimiento Vejez Demencias 
1812728570911196340,DEjRQDMAAAAJ,Maite Cereceda Martínez,Universidad San Sebastián,uss,uss.cl,2,filosofía práctica filosofia medieval filosofía antigua 
1812728570911196340,85ixb5AAAAAJ,CÉSAR BARRIA LARENAS,"Profesor de Historia y Geografía, Liceo Simón Bolivar / Profesor de Geografía, USS",uss,docent,2,Geografía Educación Geográfica Didáctica 
1812728570911196340,JYHfAjAAAAAJ,Rocío Zúñiga Tapia,Universidad San Sebastián,uss,uss.cl,2,Enfermería Cáncer Salud Pública 
1812728570911196340,pv_fHdcAAAAJ,VICENTE RÍOS URZÚA,"Profesor de Derecho Comercial y Laboral - Advance, Universidad San Sebastián",uss,docent,2,Derecho 
1812728570911196340,-GxC_GgAAAAJ,J. Sepúlveda-Contreras,Universidad San Sebastián,uss,docent,2,Deglución Fonoaudiología Disfagia 
1812728570911196340,Qn4Zs4oAAAAJ,Diego H. Padilla,Universidad San Sebastian,uss,uss.cl,2,social psychology cultural criminology pro-social cultural studies 
1812728570911196340,s0a1yPwAAAAJ,Mg. Yazmina Pleticosic Ramírez,"Académica en Pedagogía en Educación Física, Universidad San Sebastián",uss,uss.cl,1,Educación Física Ciencias de la Actividad Física y Deportes 
1812728570911196340,X_kGYxMAAAAJ,Cristian Soto Gallardo,Universidad San Sebastian,uss,uss.cl,1,Educación 
1812728570911196340,kqZ3q8EAAAAJ,María Paz Rutte Barrera,"Docente y Directora Carrera Psicología Universidad San Sebastián, Chile.",uss,uss.cl,1,Victimología políticas públicas y criminología 
1812728570911196340,_lymXFcAAAAJ,Carlos Avendaño Mendoza,Profesor Adjunto Universidad San Sebastían,uss,docent,1,DDS OMFS MCs (c) 
1812728570911196340,LECXbOsAAAAJ,Jorge L. Zapata Hernández,"Docente de la Facultad de Ciencias de la Educación, Universidad San Sebastián, Chile",uss,uss.cl,1,Sistemas Dinámicos Ecuaciones Diferenciales 
1812728570911196340,_3nunwYAAAAJ,Valentina Veloso Casado,Universidad San Sebastián,uss,uss.cl,1,Educación Superior 
1812728570911196340,X2Tlzw4AAAAJ,Francisco Aravena,"Profesor de Economía, Universidad San Sebastian",uss,uss.cl,1,Economía Laboral distribución del ingreso y teoría de juegos 
1812728570911196340,lUfOZOkAAAAJ,Carol Hewstone,"Profesora de Educación Diferencial, Universidad San Sebastián",uss,uss.cl,1,Educación inclusiva Formación docente. 
1812728570911196340,Frgnu1MAAAAJ,Yurnet  Gonzalez Wong,profesora de Inglés Universidad San Sebastian,uss,uss.cl,,didáctica enseñanza del inglés como lengua extranjera TIC asociadas al proceso de enseñanza … lingüística 
1812728570911196340,qhCFvWgAAAAJ,Pamela Torres Cáceres,Universidad San Sebastian,uss,docent,,Ocupación calidad de vida Rehabilitación 
1812728570911196340,94Roi2gAAAAJ,Luis Guillermo Palacios Sanabria,"Académico, Universidad San Sebastián",uss,uss.cl,,Derecho constitucional derecho electoral derecho administrativo derechos fundamentales 
1812728570911196340,uZug_vAAAAAJ,Mauricio Hidalgo,Universidad San Sebastián / Universidad Técnica Federico Santa María,uss,uss.cl,,Empirical Software Engineering Applied Deep Learning Experimental Software Engineering 
1812728570911196340,pg3cdKgAAAAJ,Felipe Alegría Núñez,"Académico Facultad de Ciencias de la Educación, Universidad San Sebastián",uss,uss.cl,,Evaluación de Aprendizajes Curriculum Didáctica Educación Superior 
1812728570911196340,D263DLYAAAAJ,Macarena Alegría,Universidad San Sebastian,uss,docent,,Educación Sociología de la educación 
1812728570911196340,B5J_-gwAAAAJ,Fernanda Barrera,"Académico psicología, universidad san sebastian",uss,uss.cl,,relaciones interpersonales Psicologia social 
1812728570911196340,ryZX0HcAAAAJ,Viviana Zambrano Lizama,"Académica Trabajo Social, Universidad San Sebastián",uss,uss.cl,,Infancia adolescencia familia procesos de victimización resiliencia y factores de riesgo 
1812728570911196340,HwAHqcMAAAAJ,Daniela Carrillo Rojas,"Docente de la Facultad de Medicina y Ciencia, Universidad San Sebastian, Chile",uss,uss.cl,,biotecnología biomedicina 
1812728570911196340,8JufA4QAAAAJ,Rodolfo Soto Pereira,"Docente en Universidad San Sebastián, Chile",uss,docent,,BPM Data Science Ingeniería de Software 
1812728570911196340,exKmmKcAAAAJ,Mariana Rada,"Profesor de Biología Celular, Universidad San Sebastián",uss,docent,,Genética Humana Biología Celular y Molecular 
1812728570911196340,EBnnrRAAAAAJ,Pedro Valenzuela Reyes,Universidad San Sebastián,uss,correo,,Historia Historia del servicio doméstico Historia de Chile Historia Social 
1812728570911196340,WJsW0S0AAAAJ,Felipe Mondaca,Universidad San Sebastián,uss,uss.cl,,Nanotechnology 
1812728570911196340,gH9KGz4AAAAJ,Roger Ramirez,"Director Pedagogía en Ingles, Universidad San Sebastián",uss,uss.cl,,TESOL Transformative Learning Teacher Training Alternative Methodologies 
1812728570911196340,wgj3rh0AAAAJ,Luis Soto Jara,"Psicopedagogo, Pedagogía en Educación Diferencial, Universidad San Sebastián",uss,correo,,Psicopedagogía Educación Tecnología 
1812728570911196340,LGdIqdQAAAAJ,Jaime Bastías Chian,"Profesor Asistente, Facultad de Ingeniería y Tecnología, Universidad San Sebastián, Chile.",uss,uss.cl,,Finanzas Fondos de Pensiones Mercado de Capitales 
1812728570911196340,uxAm18gAAAAJ,Emilio Morales de la Barrera,Universidad  San Sebastián,uss,uss.cl,,Fenomenología poesía . Antropología Filosófica Solidaridad 
1812728570911196340,MMw4LO4AAAAJ,Belén Gaete-Ramírez,"PhD student, Universidad San Sebastián",uss,correo,,Cancer cell biology extracellular vesicles 
1812728570911196340,n4a8qeUAAAAJ,Francisco N. Avilés,"Instructor Professor, Facultad de Ingeniería, Arquitectura y Diseño, Universidad San …",uss,uss.cl,,Operations Research Logistics Supply Chain Management Scheduling 
