id_institucion_gs,id_autor_gs,autor,cargo,id_institucion,email,citaciones,intereses
1812728570911196340,J3Durw8AAAAJ,Eugenia Morselli,"Faculty of Medicine and Science, Universidad San Sebastián, Chile",uss,uss.cl,20965,autophagy primary cilium metabolism obesity 
1812728570911196340,cE4i7RwAAAAJ,jorge cancino,Universidad San Sebastian,uss,uss.cl,12117,Biología Celular 
1812728570911196340,RnMVg4QAAAAJ,Kokkarachedu Varaprasad,"Associate Professor, Universidad San Sebastián",uss,uss.cl,5161,… for infection control  &  Hydrogels for … 
1812728570911196340,_-9D_40AAAAJ,Rommy von Bernhardi,Professor for Neuroscience; Faculty of Medicine and Science Universidad San Sebastian,uss,uss.cl,4766,Aging Alzheimer's disease glia neurodegenerative diseases neuroinflammation 
1812728570911196340,uyFRCGkAAAAJ,Valentina Echeverria,"Research Professor, Universidad San Sebastián de Chile. Scientist, Bay Pines VAHCS,USA",uss,uss.cl,3965,Neurodegenerative diseases Psychiatric diseases Nicotinic receptors traditional medicine research Tobacco derivatives 
1812728570911196340,3QjSMq0AAAAJ,Carlos P Vio,Universidad San Sebastian,uss,uss.cl,3900,Nephrology Hypertension Renal Physiology and Pathology 
1812728570911196340,5w40_sYAAAAJ,Ernesto Lopez-Morales,Universidad San Sebastián,uss,uss.cl,3135,urban gentrification inner city entrepreneurialism 
1812728570911196340,Mr19oawAAAAJ,Alvaro Muñoz-Castro,Universidad San Sebastián,uss,uss.cl,2792,Química Inorgánica 
1812728570911196340,OdR5EgcAAAAJ,Samuel Durán Agüero,"Professor of Nutrition, Universidad San Sebastián",uss,uss.cl,2685,Nutrition artificial sweeteners obesity old adults 
1812728570911196340,OReZXCQAAAAJ,Alejandro S. Godoy,Universidad San Sebastián; Roswell Park Cancer Institute,uss,uss.cl,2644,Prostate cancer tumor microenvironment angiogenesis metabolism androgens 
1812728570911196340,ecuW5toAAAAJ,Verena Häussermann,Universidad San Sebastian,uss,uss.cl,2565,marine biodiversity cold-water corals marine protected areas biogeography 
1812728570911196340,XYEZ690AAAAJ,Andrea Leiva,Profesor Asociado. Universidad San Sebastián,uss,uss.cl,2390,Lipid metabolism. Endothelial function … 
1812728570911196340,Svu2s9AAAAAJ,Andrea Soza,Universidad San Sebastián,uss,uss.cl,2288,cell biology 
1812728570911196340,Rt9FDvkAAAAJ,PATRICIA V. BURGOS,"Facultad de Medicina y Ciencia, Universidad San Sebastián",uss,uss.cl,1931,Cell Biology Autophagy Proteostasis … 
1812728570911196340,A-iKXMUAAAAJ,Cheril Tapia Rojas,Universidad San Sebastian,uss,uss.cl,1897,Neuroscience 
1812728570911196340,4cZPsgkAAAAJ,Manuel Varas-Godoy,"Associate Professor, Faculty of Medicine and Science, Universidad San Sebastián",uss,uss.cl,1883,Cancer Cell Biology Stem Cells Exosomes Small Extracellular Vesicles 
1812728570911196340,oLXQ8UAAAAAJ,Claudio Molina,"Director Nacional de Investigación, Facultad de Odontología, Universidad San Sebastián",uss,uss.cl,1440,Patología Oral Autoinmunidad 
1812728570911196340,utxxkrcAAAAJ,María Inés Barría,"Universidad San Sebastián, Sede de la Patagonia",uss,uss.cl,1423,Virology Infectious Diseases Molecular Biology 
1812728570911196340,2LCZdhEAAAAJ,Ian Burbulis,"Assistant Professor, Universidad San Sebastian",uss,uss.cl,1365,Lifespan Genomics Somatic Mosaicism 
1812728570911196340,rG_d6K4AAAAJ,Maria Marcela Bravo Zehnder,"Investigador Académico, Universidad San Sebastián",uss,uss.cl,1218,Biología Celular y Molecular e Inmunología 
1812728570911196340,9QBWM9MAAAAJ,Carlos Cespedes Fierro,Universidad San Sebastián,uss,uss.cl,1139,Kidney Physiology Hypertension 
1812728570911196340,h5lwVDUAAAAJ,Pamela J Urrutia,Universidad San Sebastián,uss,uss.cl,1139,Iron neuron neurodegeneration neuroinflammation 
1812728570911196340,AyfEF4YAAAAJ,Marcos Godoy,CIBA - Universidad San Sebastián,uss,uss.cl,1120,fish diseases pathology virology 
1812728570911196340,-xvMIWgAAAAJ,Iván Nancucheo,Universidad San Sebastián,uss,uss.cl,1117,Microbial Biotechnology Biomining Geomicrobiology 
1812728570911196340,tlQLR70AAAAJ,"Dr. Carlos F. Lagos, PhD","Facultad de Medicina y Ciencia, Universidad San Sebastián, Chile",uss,uss.cl,1022,Chemical Biology Drug Discovery Structural Bioinformatics 
1812728570911196340,v8FeGAgAAAAJ,Patricio Oyarzún,"Director de Investigación, Facultad de Ingeniería y Tecnología, Universidad San Sebastián",uss,uss.cl,990,Inmunoinformática diseño racional de vacunas nanotecnología 
1812728570911196340,2a_9ECwAAAAJ,Claudio Retamal,"Docente Investigador, Universidad San Sebastian",uss,uss.cl,981,Cell Biology Intracellular Trafficking Epithelial polarity 
1812728570911196340,Nu-6H0YAAAAJ,Juan Ricardo Couyoumdjian,Universidad San Sebastian,uss,uss.cl,973,Chilean History 
1812728570911196340,zfQU0XsAAAAJ,Kabir P. Sadarangani,Universidad San Sebastián,uss,uss.cl,961,
1812728570911196340,wMB3BaYAAAAJ,Daniel A. Medina,Universidad San Sebastián,uss,uss.cl,947,Bioinformática Microbioma Metagenómica 
1812728570911196340,Zn-iYZYAAAAJ,Ana Maria Obregón Rivas,"Investigador de la Facultad de Ciencias para el cuidado de la salud, Universidad San …",uss,uss.cl,856,Nutrition Obesity Genetics 
1812728570911196340,s1mgbwEAAAAJ,MA Sarabia-Vallejos,"Assistant Professor, Universidad San Sebastian",uss,uss.cl,850,Material science Surface modification Biopolymers Biomechanics 
1812728570911196340,BbRajoQAAAAJ,Cristián A. Amador,Universidad San Sebastian,uss,uss.cl,808,Renal Physiology Hypertension Inflammation 
1812728570911196340,RvtSCSoAAAAJ,Roberto Acevedo,Universidad San Sebastian,uss,uss.cl,777,química física 
1812728570911196340,NhiXlMIAAAAJ,Carolina Concha,"profesor de Enfermería, Universidad San Sebastián",uss,uss.cl,745,antropología enfermería humanismo 
1812728570911196340,FOq3_oAAAAAJ,Elena S. Rotarou,"Assistant Professor, Universidad San Sebastián",uss,uss.cl,724,health inequalities health policies health systems sustainable development 
1812728570911196340,XZdAIZAAAAAJ,Cesar Gonzalez Higuera,"Facultad de Medicina, Universidad San Sebastián, Lago Panguipulli 1390, Puerto Montt …",uss,uss.cl,677,Enfermedades neurodegenerativas células madres 
1812728570911196340,n1vxPrAAAAAJ,Barrera MJ,"Facultad de Odontología, Universidad San Sebastián, Bellavista 7, Santiago, 8420524 …",uss,uss.cl,645,Interés en el estudio de las bases celulares y … especialmente del síndrome de Sjögren. 
1812728570911196340,dNsBXU8AAAAJ,Carlos Hernández Ulloa,Universidad San Sebastián,uss,uss.cl,622,Artificial Intelligence Heuristic Search Automated Planning 
1812728570911196340,IXvfD7QAAAAJ,Alexandre Iarkov,Universidad San Sebastian,uss,uss.cl,609,neuroscience 
1812728570911196340,w-sRYaoAAAAJ,Cristóbal Cerda-Troncoso,"Organelle Phagy Lab, Centro de Biología Celular y Biomedicina-CEBICEM, Universidad …",uss,correo,605,
1812728570911196340,Ss-ertYAAAAJ,Berta Henríquez,"Facultad de Medicina y Ciencia, Universidad San Sebastián",uss,uss.cl,564,epigenetics cellular senescence transcriptional regulation 
1812728570911196340,9-CxjWkAAAAJ,Marcela Vergara,Universidad San Sebastian,uss,uss.cl,563,bioquimica fisiologia 
1812728570911196340,k3_YU_IAAAAJ,Karina Oyarce,"Docente Facultad de Ciencias de la Salud, Universidad San Sebastian, sede Concepcion",uss,uss.cl,561,inflamacion micronutrientes obesidad depresion 
1812728570911196340,sgUogVsAAAAJ,Maria José Monsalves,"Assistant Professor, Facultad de Medicina y Ciencia, Universidad San Sebastián",uss,uss.cl,560,Social epidemiology Health inequalities Public policy Multilevel analysis 
1812728570911196340,_tFjZN8AAAAJ,"Felipe Castillo Farias, MD",Universidad San Sebastian,uss,uss.cl,558,Sleep Surgery Sleep Medicine 
1812728570911196340,3DC69v8AAAAJ,Ximena Triviño,"Profesor, Universidad San sebastián",uss,uss.cl,528,Docencia Universitaria Educación Médica 
1812728570911196340,w4xb-J4AAAAJ,Erica Castro,Profesora Titular de Facultad de Medicina y Ciencia de la Universidad San Sebastián de la …,uss,uss.cl,518,probióticos salud sexual y reproductiva infecciones de transmisión sexual 
1812728570911196340,9u_oM64AAAAJ,Gabriel Cid,Universidad San Sebastián,uss,uss.cl,511,Historia de Chile 
1812728570911196340,k6IZu0MAAAAJ,Ricardo Oyarzún-Salazar,"Doctor en Ciencias de la Acuicultura, Universidad San Sebastian",uss,uss.cl,486,Fisiología animal 
1812728570911196340,p9h-_XoAAAAJ,Massiel Guerra,Universidad San Sebastián,uss,uss.cl,471,Género Tecnologías de información y Comunicación Economía de los Recursos Naturales. 
1812728570911196340,LYFD1wkAAAAJ,Andrea  V. Gómez,Universidad San Sebastián,uss,uss.cl,468,Cell Molecular and Structural Biology 
1812728570911196340,Cm_MkxAAAAAJ,Carlos Rosas,"Profesor de Histología, Universidad San Sebastián",uss,uss.cl,467,Angiogénesis Cicatrización Histología 
1812728570911196340,3TviQhUAAAAJ,"Carolina Añazco, Associate Professor",Universidad San Sebastián,uss,uss.cl,464,Extracellular Matrix Biology Aging Cancer Fibrosis 
1812728570911196340,s6Vcnp8AAAAJ,ANGELICA GUERRERO-CASTILLA,Facultad de Medicina y Ciencia. Universidad San Sebastián.,uss,uss.cl,443,Farmacología y Toxicología 
1812728570911196340,iQ4IK0YAAAAJ,PhD. Cristián Luarte-Rocha,Universidad San Sebastian- Chile  /  Universidad Estadual de Campinas - Brasil,uss,uss.cl,442,Ciencias de la Actividad Física y del Deporte 
1812728570911196340,hqKSrYcAAAAJ,Juan Pablo Pontigo,Universidad San Sebastian,uss,uss.cl,440,immunology celular biology molecular biology microbiology 
1812728570911196340,Bc5DX0QAAAAJ,Mauricio Sandoval Pozo,"Profesor de Bases científicas de la Medicina, Universidad San Sebastián. Profesor de …",uss,docent,414,Fisiología Neurociencias. 
1812728570911196340,CIplQ-wAAAAJ,Raul Araya-Secchi,Facultad de Ingeniería y Tecnología. Universidad San Sebastian,uss,uss.cl,400,Structural Biology Biophysics Molecular Dynamics Simulations Membrane Proteins 
1812728570911196340,5uTriZcAAAAJ,Lilian Reyes,Universidad San Sebastián,uss,uss.cl,398,immunology autoimmunity epigenetic 
1812728570911196340,gs4svFQAAAAJ,Christian Canales Valenzuela,Universidad San Sebastián,uss,uss.cl,391,Biochemical engineering Bioprocess Microbial biotechnology 
1812728570911196340,49dZh2UAAAAJ,Astrid von Oetinger,Universidad San Sebastian,uss,uss.cl,380,Actividad física y Diabetes/Obesidad 
1812728570911196340,bYZjgfoAAAAJ,Marco Batarce,Universidad San Sebastían,uss,uss.cl,349,Economics industrial organization transport economics 
1812728570911196340,QEn5iqsAAAAJ,Jaime Abarca Reveco,Universidad San Sebastián,uss,uss.cl,344,endodoncia 
1812728570911196340,Bd9xdUAAAAAJ,Ximena Moreno,"Docente Investigadora, Universidad San Sebastián",uss,uss.cl,342,Salud Mental Envejecimiento Inequidades en salud Representaciones sociales Género 
1812728570911196340,oTHAYikAAAAJ,Maria Jesus Herrero,Universidad San Sebastian,uss,uss.cl,341,Neuroendocrinology Development Autism Biological Rhythms Metabolism 
1812728570911196340,hLijjx8AAAAJ,Jean Gajardo Jauregui,Universidad San Sebastián,uss,uss.cl,340,Salud pública Envejecimiento Políticas en Salud Demencia 
1812728570911196340,-vV_vlwAAAAJ,María Cristina Aguirre,Universidad San Sebastián,uss,uss.cl,333,Natural product 
1812728570911196340,EeFDW8MAAAAJ,Cristobal Alvarado Livacic,"PROFESOR DE BIOQUÍMICA, UNIVERSIDAD SAN SEBASTIÁN",uss,uss.cl,312,Bioquímica Biología del desarrollo Bioestadística 
1812728570911196340,fZeL5eYAAAAJ,Hector Monardes,Universidad San Sebastian,uss,uss.cl,281,Endodoncia 
1812728570911196340,Xi5ia9AAAAAJ,jorge veloz,Universidad San Sebastian,uss,uss.cl,269,Farmacología 
1812728570911196340,T6OtwtoAAAAJ,Luis Molina Calistro,"Facultad de Medicina y Ciencia, Universidad San Sebastián, Lago Panguipulli 1390, Puerto …",uss,uss.cl,262,Pathophysiology Cancer Inflammation. 
1812728570911196340,7o3r23MAAAAJ,Humberto Rivas Ortega,Universidad San Sebastián Escuela de Ingeniería en Gestión de Expediciones y Ecoturismo,uss,uss.cl,256,Turismo Sustentable Planificación Turística Ecoturismo Gestión de Destinos Turísticos Gobernanza 
1812728570911196340,NbnoN5AAAAAJ,Roberto Espejo Leupin,Universidad San Sebastián,uss,uss.cl,252,Pedagogy university teaching teacher development theory of education epistemology 
1812728570911196340,J7nvTDYAAAAJ,Víctor Díaz-García,Profesor asistente - Universidad San Sebastián,uss,uss.cl,249,Nanotecnología nanomedicina desarrollo de nanobiosensores 
1812728570911196340,kyEpp5UAAAAJ,Dellis Rocha,"Investigador, Universidad San Sebastián",uss,docent,245,Biología Molecular Bioquímica Genómica Biología Celular 
1812728570911196340,qUWzYiUAAAAJ,Angélica María Torres Rodríguez,Universidad San Sebastián,uss,uss.cl,234,Lenguaje lingüística educación aprendizaje terapia de lenguaje 
1812728570911196340,Efo5A_cAAAAJ,Maria Jose Parra,"Departamento de Ciencias Biologicas y Quimicas, Universidad San Sebastian",uss,uss.cl,229,botanica ecofisiologia vegetal agroecología 
1812728570911196340,xkxO6Pw8630C,Eric Gómez Burgos,"Académico de la Facultad de Ciencias de la Educación, Universidad San Sebastián, Chile",uss,uss.cl,229,EFL Lingüística Aplicada teacher education 
1812728570911196340,ChNBAekAAAAJ,Constanza Villarroel,"Investigadora, Universidad San Sebastián",uss,uss.cl,226,Educación Argumentación Formación de Profesores 
1812728570911196340,9cHdRf8AAAAJ,Pilar Espinoza,"Director de investigación, Universidad San Sebastián",uss,uss.cl,220,administración en salud 
1812728570911196340,sr3ozsYAAAAJ,marcela sanhueza parra,"Docente de Enfermería, Universidad San Sebastián",uss,uss.cl,217,Atención primaria de salud 
1812728570911196340,0iVB9oAAAAAJ,Claudio Carril-Pardo,"docente de Bioquímica, Universidad San Sebastián",uss,docent,217,Bioinformática Biología molecular Biología Celular 
1812728570911196340,wNkSGhwAAAAJ,Jessy Pavón Pérez,"Docente adjunto Universidad San Sebastian, Investigador asistente Centro de …",uss,docent,215,Compuestos bioactivos química analítica enfermedades crónicas no transmisibles proteínas 
1812728570911196340,VZZeFpAAAAAJ,Mauricio A. Flores,"Facultad de Ingeniería y Tecnología, Universidad San Sebastián, Chile",uss,correo,212,Condensed matter semiconductors photovoltaics mathematical modelling stochastic methods 
1812728570911196340,t6IkuyIAAAAJ,Jorge Maluenda Albornoz,"Facultad de Psicología, Universidad San Sebastián",uss,uss.cl,210,Educational Psychology Education Psychometry 
1812728570911196340,ZrehanIAAAAJ,Alvaro Martínez Fuenzalida,"Profesor asistente, Universidad San Sebastián (USS); y Director adjunto de propiedad …",uss,uss.cl,209,Patentes de invención biotecnológicas Análisis de patentabilidad Análisis de libertad de operación Prospección tecnoló 
1812728570911196340,v4xsBmYAAAAJ,Yanet Quijada,"Investigadora, Universidad San Sebastián",uss,uss.cl,199,Riesgo suicida y psicótico Desiguadad social y salud mental 
1812728570911196340,7MSb6qoAAAAJ,Patricio Ordenes Constenla,Universidad San Sebastián,uss,docent,193,Ciencias biológicas 
1812728570911196340,p7yGWw8AAAAJ,Alejandra Aguilera Belmonte,Universidad San Sebastian,uss,uss.cl,184,floraciones algales nocivas 
1812728570911196340,ZOr1AFMAAAAJ,Ana valdebenito aravena,Directora de Escuela Terapia Ocupacional. Facultad de Ciencias de la Salud. Universidad …,uss,uss.cl,179,Terapia Ocupacional Educación Superior Trastornos Psiquiátricos Ocupación Salud Mental 
1812728570911196340,0ukIds8AAAAJ,Viviana Andrea Cavieres Risco,"Posdoctoral Researcher, Universidad San Sebastian",uss,docent,171,Biologia Celular 
1812728570911196340,PjCOCvUAAAAJ,Felipe Abad-Colil ,Académico Facultad de Ciencias de la Actividad Física Universidad San Sebastian ,uss,uss.cl,167,Actividad Física y Salud Rendimiento Físico Formación Deportiva y Pedagogía … 
1812728570911196340,iyROdXkAAAAJ,José Maximiliano Rivera Restrepo,Universidad San Sebastian,uss,uss.cl,159,Doctor en Derecho Civil. U. Complutense de … derecho de familia competencia desleal historia de América 
1812728570911196340,P4eJcxUAAAAJ,Pablo Coelho Caro,"Facultad de Ingeniería, Arquitectura y Diseño, Universidad San Sebastián",uss,uss.cl,158,Digital Imaging Processing 
1812728570911196340,dawp_aYAAAAJ,Maichel M. Aguayo,"Researcher, Facultad de Ingeniería y Tecnología, Universidad San Sebastián",uss,uss.cl,157,Operations Research Transportation Logistics Supply chain management Scheduling 
1812728570911196340,LuBmnwYAAAAJ,Nicolas Amigo,Universidad San Sebastián,uss,uss.cl,157,Materials Science Fluid Dynamics Computational Simulations Data Analysis 
1812728570911196340,Sk8ZlgQAAAAJ,Mery De la Fuente,Docente Microbiología (UNAB-USS),uss,docent,152,Microbiología 
1812728570911196340,WxZqABYAAAAJ,Alfredo Gorrochotegui Martell,Universidad San Sebastián,uss,uss.cl,150,Liderazgo educacional 
1812728570911196340,bWvA0z4AAAAJ,Santiago Aranguiz Pinto,"Profesor Investigador Centro de Investigaciones Históricas, Universidad San Sebastián",uss,uss.cl,140,Historia 
1812728570911196340,8UwplQkAAAAJ,Luis Vergara González,"Facultad de Medicina y Ciencia, Universidad San Sebastian",uss,uss.cl,136,Microbiología 
1812728570911196340,QmVSYyQAAAAJ,Pilar Torres,"Profesor asistente ,Universidad San Sebastián, Concepción. Chile",uss,uss.cl,131,educación cariología simulación háptica 
1812728570911196340,8vlbvXgAAAAJ,Lucía Azócar Aedo,Universidad San Sebastian,uss,uss.cl,131,epidemiology public health zoonoses systematic reviews meta-analysis 
1812728570911196340,5wEK__UAAAAJ,Marcelo Fernandez,Universidad San Sebastián,uss,uss.cl,124,Education Dentistry Dental Implants haptic simulators 
1812728570911196340,T1YfhtEAAAAJ,Luisa Quesada Romero,.Universidad San Sebastián,uss,uss.cl,117,Química Orgánica Productos Naturales Ecología Química Alimentos. 
1812728570911196340,agA0EBIAAAAJ,Felipe Vicencio,"Assistant Professor, Facultad de Ingeniería y Tecnología, Universidad San Sebastián",uss,uss.cl,114,Structural Dynamics Earthquake Engineering Structure-soil-structure interaction 
1812728570911196340,p44mP1AAAAAJ,Patricia Olivares Oettinger,Universidad San Sebastián,uss,correo,113,biología celular histología anatomía patológica cáncer angiogénesis 
1812728570911196340,s2vhci8AAAAJ,Javier Rosas Bahamonde,"Profesor Asociado, Universidad San Sebastián",uss,docent,112,Cancer Patología Oncología Terapia antitumoral Biología Celular y Molecular 
1812728570911196340,U48yPXYAAAAJ,Prof. Dr. Diemen Delgado-García,Universidad San Sebastián,uss,docent,110,Enfermedades Respiratorias  - Medicina del … 
1812728570911196340,lFBdPV8AAAAJ,Lien Rodriguez Lopez,Investigador Universidad San Sebastián,uss,uss.cl,109,Environmental Sciences 
1812728570911196340,Jhg3gmAAAAAJ,Giulietta Vaccarezza Garrido,Universidad San Sebastian,uss,uss.cl,106,Educación - Enseñanza - Aprendizaje 
1812728570911196340,oPxuDrwAAAAJ,Andrea Palma,Universidad San Sebastián,uss,uss.cl,105,
1812728570911196340,yX95av8AAAAJ,Cecilia Bastías Díaz,"Profesor de Inglés, Universidad San Sebastián",uss,uss.cl,104,Didáctica del inglés procesos de mentoría pedagogía dialógica formación inicial docente 
1812728570911196340,or-pWjoAAAAJ,Cristian Medina Valverde,Profesor Investigador Universidad San Sebastian (CHILE),uss,uss.cl,97,Historia de las Relaciones Internacionales Historia Regional. 
1812728570911196340,WxP6nHIAAAAJ,Paola Meza,Universidad San Sebastián,uss,uss.cl,96,gravitación cosmología 
1812728570911196340,Ipg5inQAAAAJ,Javier Agustín Neumann Vásquez,"Académico Facultad de Medicina Veterinaria, Universidad San sebastián",uss,uss.cl,96,metabolismo hematología patología 
1812728570911196340,s6VUI58AAAAJ,Consuelo Novoa,UNIVERSIDAD SAN SEBASTIÁN,uss,uss.cl,96,Parentalidad Bienestar Infancia 
1812728570911196340,SeehM9AAAAAJ,Mariana Rosemblatt B.,"Facultad de Medicina y Ciencia, Universidad San Sebastian",uss,uss.cl,94,Inmunología Educación médica 
1812728570911196340,FEsAXcwAAAAJ,Marion Thamara Guerrero Wyss,"Académico, Universidad San Sebastián.",uss,uss.cl,92,nutrición humana nutrición clínica alimentos funcionales síndrome metabólico diabetes 
1812728570911196340,X2MKys0AAAAJ,Andrea Fuentes Aguilar,"Académica Trabajo Social, Universidad San Sebastián.",uss,uss.cl,89,Gestión de riesgo resiliencias y comunidad 
1812728570911196340,w_zwYI0AAAAJ,David Alfonso Garcia Labraña,Docente part-time Universidad San Sebastián,uss,docent,86,Biología Molecular Enzimología Bioquímica 
1812728570911196340,efjonQYAAAAJ,Mauricio Sepulveda,Universidad San Sebastian,uss,uss.cl,86,Inteligencia Artificial Optimización Data Science 
1812728570911196340,T4UKHEcAAAAJ,Javier Campanini-Salinas,"Facultad de Medicina y Ciencia, Universidad San Sebastián, Lago, Panguipulli 1390 …",uss,uss.cl,82,Drug Development Antibacterial Drugs Antimicrobial Resistance 
1812728570911196340,7BPjD-QAAAAJ,Paul Silva Matus,"Docente de Química, Universidad San Sebastián y Universidad de Chile",uss,docent,82,
1812728570911196340,4UzzdbQAAAAJ,Alejandro Amoroso,Universidad San Sebastian,uss,uss.cl,81,biologia celular cancer UPR 
1812728570911196340,tlBefU0AAAAJ,Viviana Sandoval,"Universidad San Sebastián, Escuela de Nutrición y Dietética. Sede Valdivia.",uss,uss.cl,81,Nutrición y Metabolismo 
1812728570911196340,7AMBE84AAAAJ,Carolina Barrios Penna,"Docente Facultad de Odontologia, Magister en Educación Superior, Universidad San …",uss,uss.cl,81,Odontologia Educación Simulación en ciencias de la salud 
1812728570911196340,mcECkdsAAAAJ,Josefina Aubert Valderrama,"Facultad de Medicina y Ciencia, Universidad San Sebastián",uss,uss.cl,80,Salud Pública Prevención en salud Salud oral Iniquidades en salud 
1812728570911196340,5Ft7l9gAAAAJ,Echeverry D.,"PhD, Universidad San Sebastián, Facultad Medicina Veterinaria",uss,uss.cl,80,Veterinary Science stem cells cats wildlife biotechnology 
1812728570911196340,tOfXv4YAAAAJ,Miguel Salazar Muñoz,Facultad de Psicología Universidad San Sebastián,uss,uss.cl,77,Intervención Psicosocial Infancia y Juventud en Riesgo Social Violencia Sexual Infantil Parentalidad 
1812728570911196340,l2x7EDQAAAAJ,jorge dagnino,"Profesor de Historia, Universidad San Sebastián, Chile",uss,uss.cl,75,Historia de Europa siglo XX 
1812728570911196340,ySvy3yoAAAAJ,Braulio Contreras-Trigo,Facultad de Ingeniería y Tecnología Universidad San Sebastián,uss,docent,71,Nanotecnología nanosensores nanovehiculización 
1812728570911196340,JJ0srEoAAAAJ,RICARDO GONZALEZ CORNEJO,Académico e Investigador Universidad San Sebastián - Chile,uss,docent,71,Urbanismo Medio ambiente y Turismo 
1812728570911196340,nXGNVfkAAAAJ,Ángel G. Gordo Molina,Facultad de Humanidades y Ciencias Sociales Universidad San Sebastián,uss,uss.cl,71,Historia Medieval Historia social y económica Urraca I de León Fueros leoneses 
1812728570911196340,uEET6HMAAAAJ,Maricela Pino,"Académica asistente, Universidad San Sebastián",uss,uss.cl,69,Educación Reproducción Humana Sexualidad humana 
1812728570911196340,wubW3d4AAAAJ,Rodolfo Sanzana,Universidad San Sebastián,uss,correo,67,Anatomía 
1812728570911196340,GoIiJFUAAAAJ,Paula Padilla,Profesor Asistente Universidad San Sebastian,uss,correo,65,Salud educación 
1812728570911196340,bNjOA9QAAAAJ,Maria Sylvia Campos Serrano,"Profesor Asociado, Universidad San Sebastián",uss,uss.cl,61,Enfermería comunitaria Fomento y Promoción de la Salud Salud Escolar Alimentación y Nutrición Comunitaria 
1812728570911196340,dS8IvMUAAAAJ,Cristian Gómez Hernández,Docente adjunto Facultad de Medicina y Ciencia USS,uss,docent,60,Biología celular y molecular 
1812728570911196340,BcamrakAAAAJ,maritza galindo,Universidad San Sebastián,uss,uss.cl,59,Investigación en educación superior 
1812728570911196340,90p9L-QAAAAJ,Mariana Perry,Universidad San Sebastian,uss,uss.cl,55,Historia 
1812728570911196340,BtClVXwAAAAJ,Iván Navas Mondaca,Profesor de Derecho Penal. Universidad San Sebastián,uss,uss.cl,54,Derecho Penal 
1812728570911196340,hJQWWj0AAAAJ,Patricio Arroyo,Director de Escuela Pedagogía en Educación Física Universidad San Sebastián,uss,uss.cl,54,Calidad de vida actividad física y Salud 
1812728570911196340,Mh9jd94AAAAJ,Andres Rojas,"Docente Postgrado en Anestesiologia, Facultad de Medicina, Universidad San Sebastian",uss,uss.cl,53,Dolor Anestesia Regional Medicina Intensiva 
1812728570911196340,OWvOxnQAAAAJ,Fabián Alberto Aguilera Barraza,Universidad San Sebastián,uss,docent,52,Food kinetic Shelf life Modeling Simulation Unit Operations 
1812728570911196340,Q0gMEngAAAAJ,sonia prieto,"Profesor Nutrición Clínica, Universidad San Sebastian",uss,uss.cl,52,Soporte Nutricional seguimiento farmacoterapeutico interacciones medicamento alimento 
1812728570911196340,FerbxxsAAAAJ,Cristian Quinzacara,Universidad San Sebastián,uss,uss.cl,51,Gravitation General Relativity Chern-Simons Gravity Black Holes Cosmology 
1812728570911196340,CoindUsAAAAJ,Rita Cristina Rincon,Prof. Salud Ocupacional / Universidad San Sebastián,uss,docent,51,Salud Ocupacional y Ambiental/Investigación … 
1812728570911196340,_mAS2OUAAAAJ,Gabriela Sandoval,"Profesor Asistente, Universidad San Sebastián",uss,uss.cl,50,optimización modelación matemática 
1812728570911196340,83USmKEAAAAJ,Miguel Riquelme,Universidad San Sebastián,uss,docent,48,High Energy Physics General Relativity Asymptotics Symmetries 
1812728570911196340,grB28SkAAAAJ,Karen Isabel Manzano Iturra,Doctora en Estudios Americanos. Universidad San Sebastián,uss,uss.cl,48,Geopolitica Relaciones Internacionales Fronteras Diplomacia 
1812728570911196340,qmVAcuQAAAAJ,Sebastian Hurtado-Torres,"Historiador, Universidad San Sebastián",uss,uss.cl,48,international history 20th century Chile diplomatic history foreign relations 
1812728570911196340,eEIgcosAAAAJ,Carolina Leiva,Academico Facultad de Odontología y Cs. de la Rehabilitación Universidad San Sebastián,uss,uss.cl,48,endodoncia endoscopia oral 
