organization,scholar_id,affiliation,email_domain,citedby,interests
14018219609791295521,QIHKy1UAAAAJ,"Professor, Facultad de Ciencias, Universidad Santo Tomás, Santiago, Chile",@santotomas.cl,1275.0,"Macroecology, Complexity Theory, Conservation Biology, Ecophysiology, Climate Change"
14018219609791295521,iITBNAcAAAAJ,Académico de Universidad Santo Tomás,@santotomas.cl,1248.0,"Alimentos, Análisis sensorial, Algas"
14018219609791295521,ewkobLAAAAAJ,Universidad Santo Tomás,@santotomas.cl,1215.0,
14018219609791295521,LEEYFekAAAAJ,"Full Professor, Facultad de Ciencias, Universidad Santo Tomás, Chile",@santotomas.cl,1210.0,"Ecology, Soil Ecology, Mycorrhizas, Evolution, Biogeochemistry"
14018219609791295521,pAqfjfsAAAAJ,Universidad Santo Tomás,@santotomas.cl,1044.0,
14018219609791295521,KRpmq6EAAAAJ,Universidad Santo Tomás,@santotomas.cl,991.0,"Power electronics, Control, Electrónica"
14018219609791295521,hrJ2XYsAAAAJ,"Profesor de Psicología, Universidad Santo Tomás, Concepción, Chile.",@santotomas.cl,962.0,"Empatía, Psicometría, Metodología de la investigación"
14018219609791295521,sZNkVQ4AAAAJ,"universidad santo tomas, chile",@santotomas.cl,861.0,amphipoda taxonomy
14018219609791295521,X4JpgYwAAAAJ,Universidad Santo Tomás,@santotomas.cl,846.0,"Muscle Strength, Motor Control, Physiotherapy, Sport Science."
14018219609791295521,wOnfkSYAAAAJ,"Departamento de Ciencias Básica, Universidad Santo Tomas",@santotomas.cl,789.0,Conservation Biology in Marine Top Predator & Ecosystem Modelling
14018219609791295521,Zb2h_xAAAAAJ,"Faculty of Health, Universidad Santo Tomás",@santotomas.cl,789.0,
14018219609791295521,v_zvgWgAAAAJ,"Full Professor, Universidad Santo Tomás",@santotomas.cl,766.0,"Biodiversity, Biogeography, Ecology, Evolution"
14018219609791295521,lNlzaIsAAAAJ,Universidad Santo Tomás,@santotomas.cl,699.0,"Rehabilitación, Envejecimiento, Actividad Física, Salud"
14018219609791295521,gj4M9X8AAAAJ,Universidad Santo Tomás,@santotomas.cl,663.0,"género, familia y trabajo"
14018219609791295521,2B6_y20AAAAJ,"Universidad Santo Tomás (UST), Chile",@santotomas.cl,604.0,"Politica educativa, gestión educativa, planificación estratégica, gestión universitaria, gestión de calidad"
14018219609791295521,rTOdPc0AAAAJ,Universidad Santo Tomas,@santotomas.cl,550.0,"Deserción escolar, Convivencia escolar, Violencia escolar, Bienestar"
14018219609791295521,v1S3-soAAAAJ,"Associate Professor, Facultad de Ciencias, Universidad Santo Tomás",@santotomas.cl,528.0,"Ecology, Conservation biology, Bioacoustics, Bats"
14018219609791295521,rRpnAgkAAAAJ,Universidad Santo Tomás,@santotomas.cl,485.0,Formación y Desarrollo Profesional del Profesor de Ciencias
14018219609791295521,bVWIFcEAAAAJ,"Profesor Asociado Universidad Santo Tomás, Viña del Mar",@santotomas.cl,401.0,"biophisics, biochemistry"
14018219609791295521,jlpbJJYAAAAJ,Universidad Santo Tomas,@santotomas.cl,380.0,Microbiología
14018219609791295521,liMAoV0AAAAJ,"Centro de Investigación Austral Biotech, Facultad de Ciencias, Universidad Santo Tomás, Avenida Ejercito 146, Santiago 8320000, Chile",@santotomas.cl,365.0,Nanotecnologia
14018219609791295521,kxPA_igAAAAJ,Universidad Santo Tomás,@santotomas.cl,286.0,"Educación Superior, Estadística, TICs"
14018219609791295521,EgT_3ckAAAAJ,Laboratorio de Fisiología del Ejercicio - Escuela de Kinesiología -Universidad Santo Tomás,@santotomas.cl,270.0,Fisiología clínica del ejercicio
14018219609791295521,ai3xkzMAAAAJ,"Centro Bahía Lomas, Universidad Santo Tomas",@santotomas.cl,266.0,"Marine mammals, Trophic ecology"
14018219609791295521,BiejoiYAAAAJ,"Docente de Psicología, Universidad Santo Tomás",@santotomas.cl,262.0,Psicología
14018219609791295521,sX0h9rEAAAAJ,Universidad Santo Tomás,@santotomas.cl,252.0,"Volcanología, peligros volcánicos, petrología ígnea"
14018219609791295521,MtnRhqUAAAAJ,universidad santo Tomás,@santotomas.cl,243.0,
14018219609791295521,qhvtS1IAAAAJ,"Investigadora Postdoctoral, Centro Cielo, Universidad Santo Tomás",@santotomas.cl,238.0,"cárceles, punitivismo, violencia, criminalidad, exclusión social"
14018219609791295521,3x3B4fAAAAAJ,Universidad Santo Tomás,@santotomas.cl,207.0,"Sociología, relaciones sexo-afectivas, interacciones digitales, juventud"
14018219609791295521,m9Sy2F0AAAAJ,"Associate Professor, PhD, Universidad Santo Tomas",@santotomas.cl,204.0,"biomedicine, veterinary, parasitology"
14018219609791295521,W3ROKzMAAAAJ,Universidad Santo Tomás,@santotomas.cl,191.0,"desarrollo del lenguaje, discurso narrativo, trastornos del espectro autista"
14018219609791295521,-2Ks5O0AAAAJ,"Psychologist. Associate Professor, Universidad Santo Tomás, Chile",@santotomas.cl,182.0,"Psychometrics, Psychological Trauma, PTSD, Higher education"
14018219609791295521,rl6UuJYAAAAJ,"Profesor de Derecho Político, Universidad Santo Tomas (Chile)",@santotomas.cl,175.0,"derecho, historia, politica"
14018219609791295521,JCMwnNcAAAAJ,Universidad Santo Tomás,@santotomas.cl,171.0,"host-parasite relationship and biological conservation, Conservation medicine, intertidal ecology"
14018219609791295521,kz5VqIQAAAAJ,Universidad Santo Tomás,@santotomas.cl,179.0,Psicología infantil y  parentalidad
14018219609791295521,ttwY0R0AAAAJ,Profesor Universidad Santo Tomás,@santotomas.cl,166.0,"Microeconomía, Econometría, Eficiencia Técnica, Modelos Dinámicos."
14018219609791295521,dBfb_BEAAAAJ,"Centro de Investigación e Innovación en Gerontología Aplicada CIGAP, Universidad Santo Tomás",@santotomas.cl,176.0,"Neuropsicología, Gerontología, Demencia, Deterioro Cognitivo"
14018219609791295521,kF7MJKAAAAAJ,"Profesor Bioquimica y Biologia Molecular, Universidad Santo Tomas",@santotomas.cl,135.0,"Microbiologia, Biologia Molecular, salud"
14018219609791295521,-OBRzbUAAAAJ,"Profesor Asistente, Universidad Santo Tomás",@santotomas.cl,112.0,"Physiology of visual system, Alzheimer's disease, Complexity analysis"
14018219609791295521,W3dQzqUAAAAJ,Universidad Santo Tomas,@santotomas.cl,111.0,"Rural financial market, technology trasfer, develoment economics"
14018219609791295521,XowH8MMAAAAJ,"Facultad de Ciencias Sociales y Comunicaciones, Universidad Santo Tomás",@santotomas.cl,111.0,Diversidades sexo genéricas - Responsabilidad Social
14018219609791295521,-KychSwAAAAJ,Universidad Santo Tomás; Universidad de Sevilla; UNIR,@santotomas.cl,103.0,"derecho administrativo, contratación pública, public procurement, contratti pubblici, public law"
14018219609791295521,S2UarykAAAAJ,UNIVERSIDAD SANTO TOMAS,@SANTOTOMAS.CL,100.0,"MICROBIOLOGÍA, VETERINARIA"
14018219609791295521,FcRHcdoAAAAJ,"Escuela de Nutrición y Dietética, Universidad Santo Tomás, Chile.",@santotomas.cl,100.0,"Comportamiento alimentario, Psicología de la salud, Inmigración."
14018219609791295521,SJuVbHoAAAAJ,Universidad Santo Tomás,@santotomas.cl,85.0,"Desarrollo infantil, parentalidad, psicoterapia"
14018219609791295521,erGthQEAAAAJ,Universidad Santo Tomás,@santotomas.cl,76.0,"Estudios Latinoaméricanos, nuevas tecnologias, militarismo"
14018219609791295521,3DD0HlsAAAAJ,Universidad Santo Tomás,@santotomas.cl,72.0,Evolución
14018219609791295521,f5qWgn8AAAAJ,"Profesor Asistente, Escuela de Auditoría y Control de Gestión, Universidad Santo Tomás",@santotomas.cl,69.0,"Gestión de la Calidad, Gestión Hospitalaria, Calidad de la Educación Superior, Planificación Estratégica"
14018219609791295521,aN8IbCMAAAAJ,"Research Professor, Faculty of Economics and Business, Universidad Santo Tomás",@santotomas.cl,67.0,"Organizational behavior, neuroscience, engagement, digital transformation, cross-cultural management"
14018219609791295521,_YLcFIEAAAAJ,Universidad Santo Tomas,@santotomas.cl,56.0,Historia
14018219609791295521,Cr-4uosAAAAJ,Universidad Santo Tomás; Universidad Católica del Norte,@santotomas.cl,60.0,"psicología social, cuidado humanizado, Relaciones interpersonales en contextos de salud"
14018219609791295521,mACalrMAAAAJ,UNIVERSIDAD SANTO TOMAS,@santotomas.cl,57.0,"General Relativity, Quantum field theory"
14018219609791295521,bVido7MAAAAJ,"Kinesiólogo, Universidad Santo Tomás",@santotomas.cl,55.0,Actividad Física y Salud
14018219609791295521,bd5CqeUAAAAJ,"Universidad Santo Tomás, Doctor en Filosofía",@santotomas.cl,50.0,"Tomás de Aquino, tomismos contemporáneos, secularización, racionalización"
14018219609791295521,dDxsl4YAAAAJ,Universidad Santo Tomás - Universidad Andrés Bello,@santotomas.cl,51.0,"Medicina Veterinaria, Comportamiento animal, Vínculo Humano Animal, Etología Clínica"
14018219609791295521,XuON7ZMAAAAJ,Escuela de Kinesiología - Universidad Santo Tomás,@santotomas.cl,46.0,Salud
14018219609791295521,6-QYlMMAAAAJ,Universidad Santo Tomás,@santotomas.cl,45.0,"Ciencias Sociales, Museos, Arqueología, Feminismos"
14018219609791295521,OvfJf0YAAAAJ,"Escuela de Ingeniería Civil Industrial, Universidad Santo Tomás",@santotomas.cl,47.0,"medio ambiente, sustentabilidad, procesos complejos en ingeniería"
14018219609791295521,ajL_dRYAAAAJ,"Laboratorio de Fisiología del Ejercicio, Escuela de Kinesiología, Universidad Santo Tomás, Santiago",@santotomas.cl,40.0,
14018219609791295521,FTiJIakAAAAJ,Universidad Santo Tomás,@santotomas.cl,40.0,"Antropología, Interculturalidad"
14018219609791295521,8-YaNKkAAAAJ,Universidad Santo Tomás,@santotomas.cl,40.0,Salud Pública - Fonoaudiología - Innovación Educativa
14018219609791295521,iWpl8twAAAAJ,Universidad Santo Tomás,@santotomas.cl,33.0,
14018219609791295521,y96eicoAAAAJ,"Directora nacional de Formación e Identidad, Profesora Asociada, Filosofía, Universidad Santo Tomás",@santotomas.cl,32.0,"antropología, ética, formación integral, virtudes"
14018219609791295521,6wUDd3gAAAAJ,Académica e Investigadora  Universidad Autónoma de Barcelona  - Universidad Santo Tomás,@santotomas.cl,31.0,"Cambio ambiental global, pedagogía social, trabajo social, desastres naturales"
14018219609791295521,IH7S-soAAAAJ,"Escuela de Fonoaudiología, Universidad Santo Tomás",@santotomas.cl,25.0,"Audiología, otoneurología"
14018219609791295521,zmFS7b8AAAAJ,"Universidad Santo Tomás, Chile",@santotomas.cl,26.0,"psycholinguistics, metacognition, literacy, teacher education, phonetics"
14018219609791295521,ilgDOCoAAAAJ,Universidad Santo Tomás,@santotomas.cl,23.0,Educación - formación docente - gamificación - videojuegos
14018219609791295521,S31l9G0AAAAJ,Universidad Santo Tomás,@santotomas.cl,20.0,"teacher emotion, practicum, teacher identity"
14018219609791295521,7Bu45vkAAAAJ,Universidad Santo Tomás,@alumnos.santotomas.cl,20.0,
14018219609791295521,GYSTl7kAAAAJ,"Escuela de Enfermería, Universidad Santo Tomás, Chile.",@santotomas.cl,18.0,"Human anatomy, Skeletal muscle physiology, immune responses"
14018219609791295521,QfseitcAAAAJ,"Académica Trabajo Social, Facultad de Ciencias Sociales y Comunicaciones, Universidad Santo Tomás",@santotomas.cl,19.0,"Paternidad, Parentalidad, Bienestar"
14018219609791295521,CdPE7FsAAAAJ,"Profesor de Ciencias Sociales y Humanidades, Universidad Santo Tomás",@santotomas.cl,17.0,"Ciencias Sociales, Humanidades"
14018219609791295521,H3S8NIUAAAAJ,"Universidad Santo Tomás, Santiago de Chile",@santotomas.cl,18.0,"Productivity + Econometrics, Macroeconomics + Labor"
14018219609791295521,6bdxPdsAAAAJ,Universidad Santo Tomás,@santotomas.cl,13.0,Filosofía - Educación - Formación Ciudadana
14018219609791295521,zXwrXmAAAAAJ,Universidad Santo Tomás,@santotomas.cl,14.0,"Circular Economy, Sustainability, Operations Management"
14018219609791295521,VKo_Hw8AAAAJ,Universidad Santo Tomás,@santotomas.cl,7.0,Psicología Educacional y Comunitaria
14018219609791295521,Ad7TwLoAAAAJ,"Docente Universidad Santo Tomás. Sede Santiago, Chile",@santotomas.cl,6.0,Estratificación Social: Movilidad Social
14018219609791295521,d9nQs6kAAAAJ,"Psicólogo. Escuela de Psicología, Facultad de Ciencias Sociales y Comunicaciones,  Universidad Santo Tomás, Chile",@alumnos.santotomas.cl,6.0,psychologist
14018219609791295521,ovZumtMAAAAJ,"Académico Adjunto, Universidad Santo Tomás",@santotomas.cl,8.0,"Educación, Trabajo Social"
14018219609791295521,s3ZqoF0AAAAJ,"Académico de Kinesiología, Universidad Santo Tomás",@santotomas.cl,4.0,"Medicina Deportiva, Rehabilitación Física, Fisiología del Deporte, Biomecánica Clínica y del Deporte"
14018219609791295521,1-WTyiQAAAAJ,"Docente, Universidad Santo Tomás",@santotomas.cl,4.0,"Historia, Filosofía, Estudios Internacionales"
14018219609791295521,HEJYwUwAAAAJ,"Profesora adjunta curso de Estadística para ciencias de la salud, Universidad Santo Tomás",@santotomas.cl,3.0,"Desarrollo de productos saludables, investigación de mercados agroalimentarios"
14018219609791295521,M_WGx8UAAAAJ,"Licenciado en Ciencias del deporte y Actividad Física, Universidad Santo Tomás",@santotomas.cl,3.0,"resistance training, Strength and conditioning, muscle hypertrophy"
14018219609791295521,UvP6MEgAAAAJ,Universidad Santo Tomás,@santotomas.cl,1.0,Educación
14018219609791295521,O5QAJckAAAAJ,"Docente Fonoaudiología, Universidad Santo Tomas",@santotomas.cl,,
14018219609791295521,sYv3IEEAAAAJ,Profesor Facultad de Salud Universidad SANTO TOMAS,@santotomas.cl,,"salud publica, epidemiologia, administracion y gestion en salud"
14018219609791295521,B7ql-DIAAAAJ,Universidad Santo Tomas,@santotomas.cl,,"Administración educativa, fisiología del ejercicio, prescripción del ejercicio en adultos y adultos mayores, rehabilitación deportiva"
14018219609791295521,vnKKBFUAAAAJ,"Escuela de kinesiología, Universidad Santo Tomás, Santiago, Chile",@santotomas.cl,,"Biomecánica, Control Motor, Ciencias del deporte"
14018219609791295521,CJV9_WwAAAAJ,Universidad Santo Tomás,@santotomas.cl,,"Educación, Educación Física, Formación docente"
14018219609791295521,_VAz4BoAAAAJ,Enfermera docente Universidad Santo Tomas,@santotomas.cl,,genero
14018219609791295521,L2ScivwAAAAJ,"Tecnico agricola, Universidad Santo Tomas",@alumnos.santotomas.cl,,agricultura
14018219609791295521,hBd-94YAAAAJ,"Profesora Derecho Administrativo, Universidad Santo Tomás",@santotomas.cl,,"Derecho Administrativo, Derecho Ambiental, Gestión de riesgos, Obras y Empresas Públicas."
14018219609791295521,sjJ0m9oAAAAJ,Universidad Santo Tomás,@santotomas.cl,,
