organization,scholar_id,affiliation,email_domain,citedby,interests
4.794720163447556e+18,9xWEVqwAAAAJ,Universidad del Desarrollo,@udd.cl,8237.0,pediatria infectologia virologia
4.794720163447556e+18,y3s1KhIAAAAJ,Associate Professor // MICROB-R  // Clinica Alemana - UDD (jmunita@alemana.cl),@udd.cl,7128.0,"Infectious Diseases, Antimicrobial Resistance, Bacterial Genomics, ORCID 0000-0002-7870-1056"
4.794720163447556e+18,9M10-BwAAAAJ,Universidad del Desarrollo,@udd.cl,4737.0,"Stress, eating behavior, affective disorders, metacognition, developmental psychopathology"
4.794720163447556e+18,DSQ3d6YAAAAJ,"Universidad del Desarrollo, Centro de Fisiología Celular e Integrativa",@udd.cl,4373.0,"General Physiology, Cell Physiology"
4.794720163447556e+18,gLS_KcAAAAAJ,"Universidad del Desarrollo, Centro de Fisiología Celular e Integrativa",@udd.cl,4267.0,"Ion channels, Connexins, Hemichannels"
4.794720163447556e+18,yQQSbZ0AAAAJ,Prof. Social Epidemiology (UDD); Visiting scholar (UoYork); Board member Lancet Migration LAC,@udd.cl,4232.0,"Health inequalities, global public health, migration and health, patients research, implementation science"
4.794720163447556e+18,wa4_DhAAAAAJ,"Facultad de Medicina, Clínica Alemana Universidad del Desarrollo",@udd.cl,3818.0,"Salud Publica, Determinantes Sociales de La salud, Evaluación de Políticas de Salud"
4.794720163447556e+18,RkH0EgoAAAAJ,Universidad del Desarrollo and Center for Climate and Resilience Research (CR2),@udd.cl,3439.0,"Atmospheric Chemistry, citizen science, ozone, air pollution"
4.794720163447556e+18,M6aEGUcAAAAJ,"GeRM - Universidad del Desarrollo, Facultad de Medicina Clinica Alemana",@udd.cl,3426.0,"Antimicrobial resistance, Microbial genomics"
4.794720163447556e+18,rdxQ_BIAAAAJ,"Centro de Epidemiología y Políticas de Salud, facultad de medicina, CAS-UDD",@udd.cl,2781.0,"Salud Pública, Epidemiología"
4.794720163447556e+18,Vh4tvW0AAAAJ,"Universidad del Desarrollo, Chile",@ingenieros.udd.cl,2768.0,"cement, concrete, LWA, fly ash"
4.794720163447556e+18,xzrPfXIAAAAJ,"Universidad del Desarrollo, Faculty of Psychology, CEBCS",@udd.cl,2683.0,"Survey Methodology, Latent Variable Models, Machine Learning"
4.794720163447556e+18,saVSIikAAAAJ,Centro de Epidemiología y Políticas de Salud. Fac. de Medicina Universidad del Desarrollo Chile,@udd.cl,2638.0,"Public Health, Epidemiology, Communicable Diseases, Health System"
4.794720163447556e+18,tPihtWsAAAAJ,"Facultad de Medicina Clinica Alemana, Universidad del Desarrollo, Chile",@udd.cl,2633.0,"Infectious diseases, ORCID 0000-0001-8075-0626"
4.794720163447556e+18,_lxkUGQAAAAJ,"Sub-Director Centro de Medicina Regenerativa, Facultad de Medicina Clínica Alemana Universidad del Desarrollo",@udd.cl,2362.0,"biología celular, células madre, medicina regenerativa, diabetes mellitus tipo 1"
4.794720163447556e+18,4WVyA4YAAAAJ,"Facultad de Psicologia, Laboratorio de Neurociencia Afectiva (CARE), Universidad del Desarrollo",@udd.cl,2132.0,"Cognitive Neuroscience, Cognition, Neurobiology"
4.794720163447556e+18,8xv3_MIAAAAJ,Universidad del Desarrollo,@udd.cl,2113.0,"Cell Biology, Lysosome Biology, Proteostasis, Neurobiology, Drug Discovery"
4.794720163447556e+18,KSQCg3gAAAAJ,Universidad del Desarrollo,@udd.cl,2063.0,Psicología Comunitaria y Estudio del Bienestar en Infancia y Adolescencia
4.794720163447556e+18,8W2kXpwAAAAJ,"Profesor de Geología, Universidad del Desarrollo",@udd.cl,2037.0,Ciencias de la Tierra
4.794720163447556e+18,W1yc90oAAAAJ,"Profesor de Bioética, Universidad del Desarrollo",@udd.cl,2019.0,"Bioética, ética en investigación, reproducción humana"
4.794720163447556e+18,uaXUJ6EAAAAJ,"Centro de Genetica y Genomica, ICIM, Facultad de Medicina Clínica Alemana Universidad del Desarrollo",@udd.cl,1908.0,"RNA biology, Cancer, Functional Genomics, Precision Medicine, Molecular Diagnostics"
4.794720163447556e+18,vFBgSpgAAAAJ,Universidad del Desarrollo and Baylor College of Medicine,@udd.cl,1921.0,"Inborn Errors of Immunity, Immunology, Rheumatology, Autoinflammatory diseases"
4.794720163447556e+18,y30RH1kAAAAJ,"School of Business and Economics (FEN), Universidad del Desarrollo",@udd.cl,1853.0,"Entrepreneurship, Public Policy, Education"
4.794720163447556e+18,15jvvaEAAAAJ,"Universidad del Desarrollo, Faculty of Government, Research Center for Social Complexity (CICS)",@udd.cl,1697.0,"Social Complexity, Game Theory, Moral Behavior"
4.794720163447556e+18,fmWwUp0AAAAJ,Universidad del Desarrollo,@udd.cl,1654.0,
4.794720163447556e+18,GGUaxpMAAAAJ,Universidad del Desarrollo,@udd.cl,1578.0,"nonmarket valuation, environmental economics, climate change, water demand"
4.794720163447556e+18,P0YhYL0AAAAJ,Universidad del Desarrollo,@udd.cl,1563.0,"Hydrology, Sustainability Sciences, water governance, water management"
4.794720163447556e+18,VvU3h6wAAAAJ,"Associate Professor, Universidad del Desarrollo",@udd.cl,1552.0,Programa Hantavirus
4.794720163447556e+18,fGgQ6MIAAAAJ,Universidad del Desarrollo,@udd.cl,1493.0,"systems genetics, personalized medicine, lysosomal storage disorders, animal models of disease, Parkinson's disease"
4.794720163447556e+18,VQ8kZ6IAAAAJ,"Directora, Instituto Data Science, Universidad del Desarrollo",@udd.cl,1459.0,"Data Science, Data Cleaning, Smart Industries"
4.794720163447556e+18,JLauNGgAAAAJ,"Associate Professor, Business School, Universidad del Desarrollo",@udd.cl,1397.0,"Consumer Behavior, New Product Development, Food Marketing, Corporate Social Responsibility"
4.794720163447556e+18,iYw4rzcAAAAJ,"Docente Investigador Centro de Investigación y Mejoramiento de la Educación (CIME), Universidad del Desarrollo",@udd.cl,1311.0,"Autorregulación del Aprendizaje, Evaluación del Aprendizaje, Procesos de Enseñanza- Aprendizaje, Educación Superior"
4.794720163447556e+18,CVaKZGQAAAAJ,Universidad del Desarrollo,@udd.cl,1273.0,"Psicología Educacional, Psicología Comunitaria, Seguridad Ciudadana"
4.794720163447556e+18,8yiR2CgAAAAJ,"Centro de Investigación en Complejidad Social (CICS), Universidad del Desarrollo, Chile",@udd.cl,1145.0,"Neuroscience, Social Neuroscience, Electroencephalography"
4.794720163447556e+18,Z6LRX7wAAAAJ,"Facultad de Medicina, Clínica Alemana Universidad del Desarrollo",@udd.cl,1078.0,"Epidemiology, Public Health, Zoonosis, Data Science, Machine Learning"
4.794720163447556e+18,Xfv8BYMAAAAJ,"Associate Professor, Centro de Genetica y Genomica, Facultad de Medicina, Universidad del Desarrollo",@udd.cl,1105.0,"Human genetics, Epilepsy, Clinical genetics, Bioinformatics, Data science"
4.794720163447556e+18,KjTakkIAAAAJ,"Research Professor, Universidad del Desarrollo",@udd.cl,1060.0,"data science, multicore algorithms, mobile phones, mobility"
4.794720163447556e+18,Dnb1iqAAAAAJ,"Centro de apego y regulación emocional, Universidad del Desarrollo",@udd.cl,969.0,"perinatal mental health, emotion regulation, breastfeeding, parenting, intervention"
4.794720163447556e+18,19ESz54AAAAJ,Facultad de Medicina Clínica Alemana Universidad del Desarrollo,@udd.cl,941.0,"Physical Therapy, Public Health"
4.794720163447556e+18,PzHpZjsAAAAJ,"Facultad de Psicología, Universidad del Desarrollo",@udd.cl,876.0,"Salud mental, educación, prevención"
4.794720163447556e+18,2ncsjM8AAAAJ,"College of Engineering, Universidad del Desarrollo",@ingenieros.udd.cl,852.0,"Simulation, Operations Management, Multiobjective, Metaheuristics, Healthcare"
4.794720163447556e+18,z-qxJqwAAAAJ,Facultad Medicina Clinica Alemana Universidad del Desarrollo,@udd.cl,819.0,Medicina. Infectologia. Hantavirus
4.794720163447556e+18,kQWz5M0AAAAJ,Facultad de Psicología Universidad del Desarrollo. Instituto de Bienestar Socioemocional (IBEM),@udd.cl,778.0,"Social Psychology, Qualitative & Quantitative Methodology, Research, Health Psychology"
4.794720163447556e+18,FHO5kMYAAAAJ,Universidad del Desarrollo,@udd.cl,783.0,Psicología
4.794720163447556e+18,6h38AR0AAAAJ,Universidad del Desarrollo (Chile) & Universidad de San Andres (Argentina),@udd.cl,753.0,"Strategy, International Business, Business History, Social Networks, Corporate Governance"
4.794720163447556e+18,1hkVN-sAAAAJ,"Centro de Investigación en Complejidad Social, Universidad del Desarrollo",@udd.cl,725.0,"Human aggression, cooperation, sociosexuality"
4.794720163447556e+18,EPbXcKIAAAAJ,Universidad del Desarrollo,@udd.cl,709.0,Parenting and home environment in low-income families and child outcomes
,3iPglKsAAAAJ,Health Informatics - Custom APPs | HICAPPS,@hicapps.com,701.0,"Biomedical Informatics, Medicine, Health, Computer Science, Time Motion Studies"
4.794720163447556e+18,mTbzW9sAAAAJ,"Centro de Investigación en Materiales, Universidad del Desarrollo",@ingenieros.udd.cl,694.0,"Materiales, Caminos"
4.794720163447556e+18,smN3oyMAAAAJ,"Profesora asociada, Universidad del Desarrollo",@udd.cl,708.0,"Antropología Médica, Antropología del Género, Antropología del Cuerpo, Interculturalidad en Salud, Migración y Salud"
4.794720163447556e+18,6XHFLYQAAAAJ,"Faculty of Government, UDD",@udd.cl,666.0,Economics
4.794720163447556e+18,A_JSKHEAAAAJ,Universidad del Desarrollo,@udd.cl,695.0,
4.794720163447556e+18,8hSvpaIAAAAJ,Centro de Genetica y Genomica - Universidad del Desarrollo,@udd.cl,650.0,
4.794720163447556e+18,qKDaZAMAAAAJ,"Facultad de Govierno, Universidad del Desarrollo",@udd.cl,644.0,"Development, multidimensional analysis and public health"
4.794720163447556e+18,57UIvCcAAAAJ,"Centro de Epidemiología y Políticas de Salud - Facultad de Medicina, Universidad del Desarrollo",@udd.cl,636.0,"Health Economics, Health Policy"
4.794720163447556e+18,Mj2N5xQAAAAJ,"profesor de Fisiología, Universidad del Desarrollo",@udd.cl,616.0,"Fisiología, quimiorreceptores arteriales, inflamación, educación médica, simulación"
4.794720163447556e+18,LOEX9XYAAAAJ,Universidad del Desarrollo,@udd.cl,613.0,"salud pública, epidemiología, enfermedades transmisibles"
4.794720163447556e+18,IjVmyKoAAAAJ,"Professor (Associate), Universidad del Desarrollo, Facultad de Ingenieria Civil",@udd.cl,611.0,"geotechnical engineering, structural engineering, earthquakes, earth pressures, numerical modelling"
4.794720163447556e+18,9B564eQAAAAJ,Universidad del Desarrollo,@udd.cl,573.0,"Business Sustainability, Water Economics, Climate Change, Adaptation, Private Sector"
4.794720163447556e+18,61QqHmwAAAAJ,"Assistant Professor, Universidad del Desarrollo, Santiago, Chile",@udd.cl,565.0,"Extracellular Vesicles, Regenerative Medicine, Mesenchymal Stem Cells, Biomaterials"
4.794720163447556e+18,quNH9l4AAAAJ,"Professor of Economics, UDD",@udd.cl,536.0,"Behavioral economics, Experimental economics, Moral psychology"
4.794720163447556e+18,I0rinwIAAAAJ,"Coordinador de Investigación, Facultad de Odontología, Universidad del Desarrollo",@udd.cl,539.0,"Epidemiología, Estadística, Investigación Cualitativa"
4.794720163447556e+18,pOxJ9mIAAAAJ,Researcher at Universidad del Desarrollo,@udd.cl,523.0,"NGS, heteroplasmy, variant detection, mitochondria, genomics"
4.794720163447556e+18,GJ4roWMAAAAJ,"Unidad de Investigación en Terapia de Pareja, facultad de Psicología. Universidad del Desarrollo",@udd.cl,517.0,"Psicoterapia, Procesos relacionales, semióticos, Temporalidad."
4.794720163447556e+18,FF8hf3AAAAAJ,"Universidad del Desarrollo, Santiago, Chile",@udd.cl,493.0,"economics, public policy"
4.794720163447556e+18,kjSvKDIAAAAJ,Universidad del Desarrollo,@udd.cl,496.0,"Entrepreneurship, Imagination, Latin America, Institutions"
4.794720163447556e+18,kHIa5vwAAAAJ,Universidad del Desarrollo,@udd.cl,482.0,Ciencia política
4.794720163447556e+18,VqjxJ4gAAAAJ,"Associate Professor, Universidad del Desarrollo",@udd.cl,493.0,"Entrepreneurship, Institutions, Firm performance, Women Entrepreneurs"
4.794720163447556e+18,Zfg1QGkAAAAJ,Universidad del Desarrollo,@udd.cl,465.0,
4.794720163447556e+18,p51BJ1EAAAAJ,"Assistant Professor and Researcher, Universidad del Desarrollo",@udd.cl,431.0,"Extracellular Vesicles Cell Communication, Virology, Cancer"
4.794720163447556e+18,IeppRzQAAAAJ,Universidad del Desarrollo,@udd.cl,428.0,
4.794720163447556e+18,4kY9Gg4AAAAJ,Universidad del Desarrollo,@udd.cl,414.0,Procesos Industriales
4.794720163447556e+18,qIEeX_MAAAAJ,"Universidad del Desarrollo, Facultad de Ingenieria",@ingenieros.udd.cl,393.0,"Optimization, Natural Resources Management"
4.794720163447556e+18,s0uM4qcAAAAJ,Universidad del Desarrollo,@udd.cl,394.0,Entrepreneurship
4.794720163447556e+18,R3zHiqsAAAAJ,Universidad del Desarrollo,@udd.cl,380.0,"Bioética, ética medioambiental, bioderecho, Filosofía"
4.794720163447556e+18,VM3OxhsAAAAJ,Investigador Docente CICS/UDD,@udd.cl,346.0,"Political Economy, Networks, Social Media"
4.794720163447556e+18,AWmBPwEAAAAJ,Universidad del Desarrollo,@udd.cl,327.0,"Genética, Biología Molecular"
4.794720163447556e+18,-dLdB5kAAAAJ,"Centro de Investigación en Complejidad Social, Universidad del Desarrollo",@udd.cl,326.0,"Sexual selection, animal behaviour, human ethology, social relationships, evolutionary biology"
4.794720163447556e+18,EMW0ekUAAAAJ,Universidad del Desarrollo,@udd.cl,331.0,"Health Psychology, Health Behavior, Emotions and Health, Grief and Health, Psychosocial concerns in Health"
4.794720163447556e+18,W2NR7agAAAAJ,Universidad del Desarrollo,@udd.cl,310.0,Constitutional Law - Fundamental Rights - Equality
4.794720163447556e+18,xzJ_kvgAAAAJ,Universidad del Desarrollo /  UCSF Memory and Aging Center,@udd.cl,316.0,"Cognitive Neuroscience, Neuropsychology, Language, Stroke, Dementia"
4.794720163447556e+18,RveWKf8AAAAJ,"Professor of Economics, Universidad del Desarrollo",@udd.cl,310.0,"Banking, financial economics, economics of entrepreneurship"
4.794720163447556e+18,a4XSjWoAAAAJ,Facultad de Psicología Universidad del Desarrollo,@udd.cl,324.0,"Cognición, Psicología Cultural, Fenomenología"
4.794720163447556e+18,FdXtjBAAAAAJ,Universidad del Desarrollo,@udd.cl,297.0,"Epidemiología de la Actividad Física, Salud Publica, Kinesiología"
4.794720163447556e+18,6m4Wv7gAAAAJ,Facultad de Economía y Negocios - Universidad del Desarrollo,@udd.cl,292.0,"Industrial Organization, Antitrust, Law and Economics"
4.794720163447556e+18,Z4b_UbQAAAAJ,"Director, Universidad del Desarrollo",@udd.cl,292.0,Optimization
4.794720163447556e+18,byLQ59EAAAAJ,Universidad Del Desarrollo,@udd.cl,293.0,
4.794720163447556e+18,GW6MCYEAAAAJ,Profesor Universidad del Desarrollo,@udd.cl,286.0,"economía, innovación, Lena Startup, Project Management, Neurología"
4.794720163447556e+18,zlDmaScAAAAJ,"Centro de Apego y Regulación Emocional (CARE), Facultad de Psicología, Universidad del Desarrollo",@udd.cl,291.0,
4.794720163447556e+18,OAGK2ZAAAAAJ,Universidad del Desarrollo,@udd.cl,262.0,
4.794720163447556e+18,iuNFLbsAAAAJ,Profesor Titular Universidad del Desarrollo,@udd.cl,261.0,"desarrollo economico, historia económica, emprendimiento, educacion, pobreza"
4.794720163447556e+18,6wAc5RUAAAAJ,Profesor de química Universidad del Desarrollo,@udd.cl,263.0,"química, medicina, micro biología, ciencias farmacéuticas"
4.794720163447556e+18,-b3enpQAAAAJ,Universidad del Desarrollo; Universidad de Chile,@udd.cl,248.0,"Medicinas Alternativas, Educacion Inclusiva"
4.794720163447556e+18,pV_kFbEAAAAJ,"Docente e Investigador, Facultad de Medicina, Universidad del Desarrollo.",@udd.cl,247.0,"Epidemiología, Salud Pública, Enfermedades Transmisibles, Sistemas de Salud"
4.794720163447556e+18,rdWjyRMAAAAJ,Associate Professor Universidad del Desarrollo,@udd.cl,254.0,Strategy & Innovation
4.794720163447556e+18,TnxT694AAAAJ,Universidad del Desarrollo,@udd.cl,240.0,"Industrial Organization, Econometrics, Applied Micro"
4.794720163447556e+18,pUAAk5cAAAAJ,"Facultad de Ingeniería, Universidad del Desarrollo.",@udd.cl,252.0,Operations research. Production planning. Wine industry.
4.794720163447556e+18,HL15X0gAAAAJ,"Professor of Economics, Universidad del Desarrollo",@udd.cl,220.0,"financial economics, economics of entrepreneurship"
4.794720163447556e+18,OUjTa7UAAAAJ,"Instituto de Data Science, Universidad del Desarrollo",@udd.cl,216.0,"Image Processing, Mathematical Modelling, splines, Machine Learning, Data Science"
4.794720163447556e+18,0PI5qSEAAAAJ,"PROGRAMA ESTUDIOS SOCIALES EN SALUD, UDD",@udd.cl,222.0,"Medical Anthropology, Etnhopsichiatry, Migration, Andean Studies"
4.794720163447556e+18,qWjxAxEAAAAJ,Universidad del Desarrollo,@udd.cl,212.0,"salud cardiovascular, salud de migrantes internacionales, ciencias delejercicio"
4.794720163447556e+18,1hgheu4AAAAJ,"Profesor derecho civil, Universidad del Desarrollo",@udd.cl,205.0,"Derecho civil, derecho romano, responsabilidad civil"
4.794720163447556e+18,Kjr-IVIAAAAJ,Universidad del Desarrollo,@udd.cl,203.0,"Diversidad e inclusión, interacciones, desarrollo del pensamiento"
4.794720163447556e+18,aHvV_n4AAAAJ,Universidad del Desarrollo,@udd.cl,200.0,"psicología educacional, psicología social, sociología de la educación"
4.794720163447556e+18,ApPshe0AAAAJ,Profesor titular Universidad del Desarrollo,@udd.cl,193.0,"Filosofía política, Derecho constitucional, derechos humanos, teología de la historia"
4.794720163447556e+18,bgtF2uUAAAAJ,Universidad del Desarrollo,@udd.cl,187.0,"environmental and health monitoring, responsive materials, technology exploration, sensor systems, biosafety"
4.794720163447556e+18,3MiwR9EAAAAJ,Universidad del Desarrollo,@udd.cl,195.0,"Teoría y metodología en ciencias sociales, sociología y antropología económica, sociología de la estratificación"
4.794720163447556e+18,u0AoLT4AAAAJ,Clínica Alemana - Universidad del Desarrollo,@udd.cl,188.0,
4.794720163447556e+18,Zd-R1gMAAAAJ,Universidad del Desarrollo,@udd.cl,187.0,Economia Politica
4.794720163447556e+18,O0puL0cAAAAJ,Universidad del Desarrollo,@udd.cl,188.0,Salud pública
4.794720163447556e+18,i-HRgl4AAAAJ,"Facultad de Ingeniería, Universidad del Desarrollo",@ingenieros.udd.cl,187.0,"Complex Networks, Mathematical Model, Data Mining"
4.794720163447556e+18,vwMXA34AAAAJ,Universidad del Desarrollo,@udd.cl,182.0,"Neurociencias, psicología, Trastornos del desarrollo, cerebro social, trastornos del espectro autista"
4.794720163447556e+18,QUclns0AAAAJ,"Centro de Investigación en Tecnologías para la Sociedad, Universidad del Desarrollo",@udd.cl,181.0,"habitabilidad, accesibilidad"
4.794720163447556e+18,bzpfxGgAAAAJ,Universidad Del Desarrollo,@udd.cl,163.0,"Dirección Comercial, Sales, Professional Selling, Sales Force Management, Sales Management"
4.794720163447556e+18,IqLDFm8AAAAJ,Universidad del Desarrollo,@udd.cl,161.0,neuroscience diabetes mesenchymal stem cells epidermolysis bullosa secretome wound healing
4.794720163447556e+18,jOVkuucAAAAJ,Universidad del Desarrollo,@udd.cl,153.0,"Health psychology, Perinatal mental health"
4.794720163447556e+18,pkDYeU8AAAAJ,"Researcher, Genomics & Resistant Microbes group, ICIM, Universidad del Desarrollo",@udd.cl,154.0,"Antimicrobial Resistance, Genomics, Innovation"
4.794720163447556e+18,RBTPijIAAAAJ,Universidad Del Desarrollo,@udd.cl,144.0,"Derecho Ambiental, Derecho de Aguas, Environmental Law, Water Law"
4.794720163447556e+18,TWkDh58AAAAJ,Universidad del Desarrollo; Universidad Autonoma de Chile,@udd.cl,142.0,"Economic Development, History of Economic Thought, Austrian Economics"
4.794720163447556e+18,95ZyzVoAAAAJ,"Universidad del Desarrollo, School of Economics and Business",@udd.cl,148.0,"Circular Economy, Business Model Innovation, Sustainability"
4.794720163447556e+18,YAryivQAAAAJ,Universidad del Desarrollo,@udd.cl,142.0,Filosofía política
4.794720163447556e+18,ryyU2hwAAAAJ,"Universidad del Desarrollo, Chile",@udd.cl,135.0,"Macroeconomics, Banking"
4.794720163447556e+18,sxtmTtYAAAAJ,Universidad del Desarrollo,@udd.cl,129.0,Psicología Social
4.794720163447556e+18,l4q8ODMAAAAJ,"Universidad del Desarrollo, Chile",@udd.cl,137.0,"Occupational Therapy, Paediatrics, Clinical and Professional reasoning, Evidence-Based Practice, Burns"
4.794720163447556e+18,UslO7bgAAAAJ,Centro de Investigación en Complejidad Social. Universidad del Desarrollo,@udd.cl,124.0,"Estudio de las bases biológicas de la conducta en humanos, estudio de la relación que existe entre la manifestación de cierta"
4.794720163447556e+18,aQ6RZ8oAAAAJ,Universidad del Desarrollo,@udd.cl,140.0,"childhood trauma, adverse childhood experience, early life stress, co-regulation, self-regulation"
4.794720163447556e+18,6fXhw0MAAAAJ,Universidad del Desarrollo,@udd.cl,115.0,mining
4.794720163447556e+18,TIuItD4AAAAJ,"PhD (c), Universidad del Desarrollo",@udd.cl,116.0,"Social-dilemmas, Evolution of cooperation, Common-pool Resources, Game Theory"
4.794720163447556e+18,-1KtBP0AAAAJ,"Profesora Asistente Adjunto, Facultad de Medicina, Escuela de Nutrición y Dietética, UDD.",@udd.cl,111.0,"Nutrición, Obesidad, Alimentos Ultraprocesados, Comportamiento alimentario, Calidad de Vida y Salud en Universitarios"
4.794720163447556e+18,NtAWRtoAAAAJ,Universidad Del Desarrollo,@udd.cl,130.0,"Neurociencia afectiva, percepción multimodal, reconocimiento emocional"
4.794720163447556e+18,Dx7qyocAAAAJ,Universidad del Desarrollo,@udd.cl,114.0,Cancer research
4.794720163447556e+18,Nh6N6mQAAAAJ,Universidad del Desarrollo,@udd.cl,107.0,"Choice modeling, consumer behavior, environmental economics, Economics of education"
4.794720163447556e+18,DJ0xLe8AAAAJ,Facultad de Gobierno - Universidad del Desarrollo,@udd.cl,98.0,Políticas Educativas
4.794720163447556e+18,4FcHcf0AAAAJ,Universidad del Desarrollo,@udd.cl,102.0,"Marketing, Consumer Culture, Border Crossing, Vulnerable Consumers, Consumer Activism"
4.794720163447556e+18,VjIgV7UAAAAJ,Universidad del Desarrollo,@udd.cl,92.0,
4.794720163447556e+18,MSd-0lHp6woC,Universidad del Desarrollo,@udd.cl,88.0,"enfermería psiquiátrica, enfermería en salud mental, investigación cualitativa"
4.794720163447556e+18,llsFxBMAAAAJ,"Academic and Researcher, Universidad del Desarrollo",@udd.cl,91.0,"design methodologies, education and design, visual communication"
4.794720163447556e+18,OG3f890AAAAJ,Universidad Del Desarrollo,@udd.cl,84.0,"Entrepreneurship, Organizational Theory, Economic Development"
4.794720163447556e+18,zwYxouYAAAAJ,UNIVERSIDAD DEL DESARROLLO,@udd.cl,81.0,
4.794720163447556e+18,Px4GTdgAAAAJ,Universidad del Desarrollo,@udd.cl,77.0,Entrepreneurship
4.794720163447556e+18,1zs_CkAAAAAJ,Universidad del Desarrollo,@udd.cl,76.0,"Estigma, Nuevas Tecnologías, Stigma, Bienestar Subjetivo, Psicología Social"
4.794720163447556e+18,J8BcdGYAAAAJ,Universidad del Desarrollo,@udd.cl,65.0,"Urban Planning, Resilience, Disaster Risk Management, Wildfires, Bushfires"
4.794720163447556e+18,fWNKP6cAAAAJ,"Universidad del Desarrollo, Pontificia Universidad Católica de Chile",@udd.cl,64.0,"design, education, design thinking"
4.794720163447556e+18,tof_zQQAAAAJ,"Professor and Researcher, School of Government, University of Desarrollo",@udd.cl,65.0,"Political and electoral behaviour, Electoral Systems, Public Policy, Comparative Politics, Quantitative Research Methods"
4.794720163447556e+18,wF2kjokAAAAJ,"Investigador en Universidad del Desarrollo, Profesor de Derecho Administrativo UDD y PUC",@udd.cl,60.0,"Derecho Administrativo, Derecho Constitucional"
4.794720163447556e+18,_EvSKgsAAAAJ,"Profesor investigador asistente regular, Universidad Del Desarrollo",@udd.cl,65.0,Ciencias Biológicas
4.794720163447556e+18,uJ_4OPoAAAAJ,Universidad del Desarrollo,@udd.cl,59.0,jacksonalcazar@gmail.com
4.794720163447556e+18,IMxEIXMAAAAJ,"Professor of Economics, Universidad del Desarrollo",@udd.cl,53.0,"Macroeconomics, International Finance, Labor Economics, Industrial Organization, Regulation"
4.794720163447556e+18,DQAJL5AAAAAJ,"Facultad de Psicología, Universidad del Desarrollo, Santiago, Chile",@udd.cl,54.0,"metacognición, aprendizaje"
4.794720163447556e+18,wzxc2SYAAAAJ,Universidad del Desarrollo,@udd.cl,54.0,"miRNAs, cancer, extracellular vesicles, tumor immunology"
4.794720163447556e+18,mCvLCAoAAAAJ,Universidad del Desarrollo,@udd.cl,52.0,Cancer genomic
4.794720163447556e+18,bqcJdrUAAAAJ,"Centro de Química Médica, Instituto de Ciencias e Innovación en Medicina (ICIM), Facultad de Medicina Clínica Alemana de la Universidad del Desarrollo",@udd.cl,52.0,
4.794720163447556e+18,L0dKW98AAAAJ,Universidad del Desarrollo,@udd.cl,54.0,Digital and Technological Entrepreneurship
4.794720163447556e+18,AX5IJK4AAAAJ,Universidad del Desarrollo,@udd.cl,50.0,"psicobiología, sociosexualidad, agresión y cooperación en grupos"
4.794720163447556e+18,rSdVqZAAAAAJ,Universidad del Desarrollo,@udd.cl,52.0,Management
4.794720163447556e+18,84YnpiEAAAAJ,Universidad del Desarrollo,@udd.cl,49.0,economía política
4.794720163447556e+18,DaIGpg0AAAAJ,Universidad del Desarrollo,@udd.cl,46.0,Learning and Development
4.794720163447556e+18,-q3YqlcAAAAJ,"Docente/Investigador. Universidad del Desarrollo, UNIACC",@udd.cl,43.0,"Gender, Sexuality, LGBTQ Psychology, Family Studies"
4.794720163447556e+18,zKVPCYIAAAAJ,"Faro, Universidad del Desarrollo",@udd.cl,42.0,
4.794720163447556e+18,YFNcdoAAAAAJ,Universidad del Desarrollo,@udd.cl,41.0,"Biotechnology, Biomedicine"
4.794720163447556e+18,G-Fs6_4AAAAJ,Universidad del Desarrollo,@udd.cl,42.0,
4.794720163447556e+18,Y6o4vL4AAAAJ,Universidad del Desarrollo,@udd.cl,37.0,
4.794720163447556e+18,3vrJkQ0AAAAJ,Universidad del Desarrollo,@udd.cl,36.0,
4.794720163447556e+18,4ITpQEkAAAAJ,"Profesora Derecho Constitucional, Universidad del Desarrollo",@udd.cl,35.0,"Justicia constitucional, derechos fundamentales"
4.794720163447556e+18,MocWqw4AAAAJ,Universidad del Desarrollo,@udd.cl,34.0,"Social Complexity, Interdiscipline, Network Science, Link Prediction"
4.794720163447556e+18,-zbyw3gAAAAJ,"profesor psicología, Universidad del Desarrollo",@udd.cl,35.0,"psicología, colaboración"
4.794720163447556e+18,bsnnLyQAAAAJ,Universidad del Desarrollo,@udd.cl,36.0,"Tangible interfaces, Human-computer interaction, design, education"
4.794720163447556e+18,-IRmsmsAAAAJ,UNIVERSIDAD DEL DESARROLLO,@udd.cl,35.0,"rehabilitation oncology, health education, women health"
