organization,scholar_id,affiliation,email_domain,citedby,interests
4.794720163447556e+18,_w3VcbgAAAAJ,"Centro de Investigación en Complejidad Social, Universidad del Desarrollo",@udd.cl,31.0,"Neurociencia cognitiva, NIBS"
4.794720163447556e+18,KVUqKPkAAAAJ,Universidad del Desarrollo,@udd.cl,31.0,"Educación parvularia, Psicología, Bienestar"
4.794720163447556e+18,wo5pqCoAAAAJ,Universidad del Desarrollo,@udd.cl,30.0,"comunicación, periodismo, opinión pública, género"
4.794720163447556e+18,Kj3F1oEAAAAJ,"Profesora Ciencias de la Salud, Universidad del Desarrollo",@udd.cl,30.0,"Investigación, Bioestadística, Epidemiología, Big Data"
4.794720163447556e+18,FU15MscAAAAJ,Universidad del Desarrollo,@udd.cl,29.0,"Parenting, Stress, Attachment, Emotion Regulation"
4.794720163447556e+18,-YyBf_IAAAAJ,Universidad del Desarrollo,@udd.cl,29.0,"Data Science, Machine Learning & Astronomy"
4.794720163447556e+18,lV-J7MsAAAAJ,"Universidad del Desarrollo, Facultad de Economía y Negocios|",@udd.cl,29.0,"Macroeconomics, Economic Development, Environmental Economics"
4.794720163447556e+18,lDAjscwAAAAJ,"Centro de Informática Biomédica, Facultad de Medicina Clínica Alemana Universidad del Desarrollo",@udd.cl,27.0,"Biomedical informatics, Medicine, Data science, Computer Science"
4.794720163447556e+18,k1EJr1cAAAAJ,Universidad del Desarrollo,@udd.cl,28.0,"Marketing y Tecnología, Marketing Turístico, Geografía Humana"
4.794720163447556e+18,AvOvxrQAAAAJ,"Facultad de Ciencias de la Salud, Universidad del Desarrollo",@udd.cl,22.0,
4.794720163447556e+18,ATij85cAAAAJ,Universidad del Desarrollo,@udd.cl,20.0,"Educación superior, rehabilitación oral"
4.794720163447556e+18,ZSAsq3wAAAAJ,"Directora de Periodismo, Universidad del Desarrollo",@udd.cl,20.0,"Periodismo y literatura, medios de comunicación, comunicación y mujer"
4.794720163447556e+18,p4660ksAAAAJ,Profesor Investigador . Facultad de Comunicaciones Universidad del Desarrollo,@udd.cl,20.0,"• Ética, sistemas de accountability (sistemas de responsabilidad mediática) en los medios y Derecho a la Información. • Indicadores de calidad y emociones en producciones audiovisuales (ficción) y contenidos digitales multiplataforma • Pluralismo en el mercado de la televisión y radiodifusión"
4.794720163447556e+18,ZCvLbQ0AAAAJ,"PhD(c) DOCTORADO EN CIENCIAS DE LA COMPLEJIDAD SOCIAL, UNIVERSIDAD DEL DESARROLLO",@udd.cl,22.0,"Ciencias Sociales Computacionales, Teoría y Análisis de Redes, Ciencia de Datos"
4.794720163447556e+18,Ys_95q8AAAAJ,"Centro de Investigación en Complejidad Social, Universidad del Desarrollo",@udd.cl,21.0,"Echo Chambers, Social Media, Polarization, Political Psychology, followership"
4.794720163447556e+18,ntaND2UAAAAJ,"Profesor Universidad Del Desarrollo. Santiago, Chile.",@udd.cl,16.0,"Ciencias Sociales, Ciencia Política, Sistemas Electorales, Observación Electoral, Relaciones Internacionales. América latina."
4.794720163447556e+18,NCEVlGQAAAAJ,Universidad del Desarrollo,@udd.cl,14.0,"Design, Interdisciplinary, Materials, Copper, Creativity"
4.794720163447556e+18,tmBIIEIAAAAJ,Profesora Investigadora del Centro de Justicia Constitucional de la Universidad del Desarrollo,@udd.cl,16.0,"Derecho constitucional, derecho procesal constitucional, justicia constitucional, tribunales constitucionales, control de constitucionalidad de la ley"
4.794720163447556e+18,di8NfV0AAAAJ,"Professor of Strategy & Sustainability, Universidad del Desarrollo",@udd.cl,14.0,"Strategy, Management, Sustainability, Innovation, Positive Impact"
4.794720163447556e+18,1fqfiRoAAAAJ,"PhD en Ciencias de la Complejidad Social, Universidad del Desarrollo",@udd.cl,13.0,
4.794720163447556e+18,fcFkhOYAAAAJ,Universidad del Desarrollo,@udd.cl,11.0,"Human Computer Interaction, design, interface design, education"
4.794720163447556e+18,aky5ujkAAAAJ,Universidad del Desarrollo,@udd.cl,11.0,
4.794720163447556e+18,_O-lNvwAAAAJ,Universidad del Desarrollo,@udd.cl,11.0,data science
4.794720163447556e+18,Q8J28ZcAAAAJ,Universidad del Desarrollo,@udd.cl,11.0,"Political Theory, Moral Psychology, Applied Social Sciences for Policy Technology Development, Public Innovation"
4.794720163447556e+18,5NTg77AAAAAJ,"Profesor Investigador, Universidad del Desarrollo",@udd.cl,10.0,Derecho
4.794720163447556e+18,vpan-F0AAAAJ,"Docente Facultad de Diseño Universidad del Desarrollo, Docente, Universidad de los Andes",@udd.cl,10.0,"Diseño, patrimonio, artesanía, gestión cultural"
4.794720163447556e+18,XyI-YoAAAAAJ,UNIVERSIDAD DEL DESARROLLO,@udd.cl,9.0,"Derecho penal, Derecho procesal penal y Derecho penal constitucional"
4.794720163447556e+18,_R9XL_0AAAAJ,Universidad del Desarrollo,@udd.cl,8.0,"psicología social, políticas de infancia, intervención psicosocial, bienestar subjetivo"
4.794720163447556e+18,E93jwbcAAAAJ,Universidad del Desarrollo,@udd.cl,8.0,Philosophy
4.794720163447556e+18,Gt-iRiYAAAAJ,"PROFESOR INVESTIGADOR EN PSICOLOGÍA ORGANIZACIONAL, UNIVERSIDAD DEL DESARROLLO",@udd.cl,10.0,"Psicología del Trabajo, Interacción humano tecnología, redes sociales"
4.794720163447556e+18,XZLFF28AAAAJ,Universidad del Desarrollo,@udd.cl,10.0,"Business Sustainability, Business Strategy, Circular Economy"
4.794720163447556e+18,YrsTy-EAAAAJ,"Docente Investigador, Universidad del Desarrollo",@udd.cl,7.0,"Underground mining, Mine Planning, Mining Optimization"
4.794720163447556e+18,_yA8RjAAAAAJ,"Investigador, Centro de Justicia Constitucional, Universidad del Desarrollo",@udd.cl,9.0,"Derecho constitucional, derecho procesal"
4.794720163447556e+18,gcilSwIAAAAJ,"Profesor de Enfermería, Universidad del Desarrollo",@udd.cl,9.0,"Industria Sanitaria 4.0, Competencias Digitales, Data Science"
4.794720163447556e+18,TPQzmMIAAAAJ,"Observatorio de Bioética y Derecho, Facultad de Medicina Clínica Alemana Universidad del Desarrollo",@udd.cl,7.0,Bioética fundamental
4.794720163447556e+18,xLcH1x4AAAAJ,"Profesor de Regulación Económica, Universidad del Desarrollo",@udd.cl,8.0,"Libre competencia, análisis económico del derecho, compliance, law & technology"
4.794720163447556e+18,-QkxZpQAAAAJ,"PhD C., UDD",@udd.cl,5.0,"language development, emotion recognition, preverbal children, developmental psychology"
4.794720163447556e+18,bhrMVLsAAAAJ,Universidad del Desarrollo,@udd.cl,3.0,gestión de residuos
4.794720163447556e+18,GncUFcYAAAAJ,"Profesor de Derecho Civil, Universidad del Desarrollo",@udd.cl,3.0,"Hecho generador, daño, causalidad."
4.794720163447556e+18,pPKPBIIAAAAJ,"docente Escuela de Obstetricia, Universidad del Desarrollo, UDD. Santiago, Chile",@udd.cl,5.0,"piso pelviano, incontinencia urinaria, embarazo y parto, adultos mayores, calidad de vida"
4.794720163447556e+18,Plxwkh0AAAAJ,"Medicina, Universidad del Desarrollo",@udd.cl,3.0,
4.794720163447556e+18,rPlJLQQAAAAJ,"PhD. Student, Universidad del Desarrollo",@udd.cl,3.0,"Politics, Political Science, Political Behavior, Political Psicology"
4.794720163447556e+18,H17kPW8AAAAJ,Universidad del Desarrollo,@udd.cl,2.0,Rock Mechanics
4.794720163447556e+18,3BWrAG8AAAAJ,"Universidad del Desarrollo, Faculty of Law",@udd.cl,2.0,"Tax, Corporate Governance, Compliance"
4.794720163447556e+18,KNu153kAAAAJ,UNIVERSIDAD DEL DESARROLLO,@udd.cl,2.0,DERECHO PRIVADO
4.794720163447556e+18,E_9fUrQAAAAJ,Universidad del Desarrollo,@udd.cl,3.0,"Faith and Entrepreneurship, Entrepreneurial Psychology, Entrepreneurship and Poverty"
4.794720163447556e+18,_SxKOMUAAAAJ,Universidad del Desarrollo,@udd.cl,2.0,"Education, Economics, Entrepreneurship"
4.794720163447556e+18,Oqbu9JkAAAAJ,Universidad del Desarrollo,@udd.cl,3.0,
4.794720163447556e+18,-i_pOiAAAAAJ,Profesor de Radiología. Universidad del Desarrollo,@udd.cl,1.0,Radiología Oral y Máxilo Facial
4.794720163447556e+18,JrDlLLgAAAAJ,"Docente Derecho Político y Constitucional, Universidad del Desarrollo",@udd.cl,1.0,"Law, Ethics"
4.794720163447556e+18,C0g5MP4AAAAJ,Universidad del Desarrollo,@udd.cl,1.0,"Innovación, Diseño de Servicios, Interdisciplina, Desarrollo local, Co-Diseño"
4.794720163447556e+18,GVxq6RwAAAAJ,Universidad del Desarrollo,@udd.cl,1.0,"reading, children's literature, motivation"
4.794720163447556e+18,P6-YGWoAAAAJ,"Facultad de Diseño, Universidad del Desarrollo",@udd.cl,1.0,"Diseño, innovación, investigación en diseño, interdisciplina"
4.794720163447556e+18,l7ppDeUAAAAJ,"Hospital de Urgencia Asistencia Pública, Universidad del Desarrollo",@udd.cl,2.0,"Burns, Burns Rehabilitation, Early Mobilization"
4.794720163447556e+18,HflxcOIAAAAJ,Universidad del Desarrollo,@udd.cl,,"Relaciones internacionales, Políticas Públicas"
4.794720163447556e+18,Iqj4PhwAAAAJ,Universidad del Desarrollo,@udd.cl,,Escritura académica
4.794720163447556e+18,Pk3kwYYAAAAJ,"Coordinadora del Centro de Apego y Regulación Emocional y Doctorado en Ciencias del Desarrollo y Psicopatología, Universidad del Desarrollo",@udd.cl,,"Neuropsicología Pediátrica, Psicología de la Salud"
4.794720163447556e+18,qbyv5WcAAAAJ,Universidad del Desarrollo,@udd.cl,,"Políticas Públicas, Política, Sostenibilidad, Administración Pública, Gobierno"
4.794720163447556e+18,u4uJmqsAAAAJ,Universidad del Desarrollo,@udd.cl,,"Higher education, Innovation, Research in higher education"
4.794720163447556e+18,-7KjXTkAAAAJ,"Profesor de Arquitectura, Universidad del Desarrollo",@udd.cl,,"Docencia Arquitectura, Realidad Extendida, Innovación, Metaverso, Inteligencia Colaborativa"
4.794720163447556e+18,fq0hZnoAAAAJ,"Profesor Investigador Arquitectura, Universidad del Desarrollo",@udd.cl,,https://arquitectura.udd.cl/carrera/arquitectura-santiago/
4.794720163447556e+18,zJpfaF0AAAAJ,Universidad del Desarrollo,@udd.cl,,"Life History Theory, Risk Aversion, Cooperation, Human Evolution"
4.794720163447556e+18,6erb4iMAAAAJ,Universidad del Desarrollo,@udd.cl,,"Marketing, Technology, Flow State, Education"
4.794720163447556e+18,T84szW0AAAAJ,MSc. Engineering Student Universidad del Desarrollo,@udd.cl,,"Earthquake Engineering, Numerical Modeling, Geotechnical Engineering"
4.794720163447556e+18,qd92c6gAAAAJ,"Profesor, Universidad del Desarrollo",@udd.cl,,Psicología clínica y forense
