organization,scholar_id,affiliation,email_domain,citedby,interests
9.232372474901008e+18,_dRgKD8AAAAJ,Universidad de Chile,@dcc.uchile.cl,97887.0,"['Neurobiology', 'Cognition', 'Autopoiesis', 'Language', 'Education']"
9.232372474901008e+18,pSY7g_YAAAAJ,"Research Institute of Dental Science  Faculty of Dentistry, University of Chile",@u.uchile.cl,32863.0,"['Cellular Biology', 'Cancer']"
9.232372474901008e+18,9EwBymgAAAAJ,"Profesor de Astronomía, Universidad de Chile",@u.uchile.cl,29927.0,[]
9.232372474901008e+18,_fx52FkAAAAJ,University of Chile,@dcc.uchile.cl,28529.0,"['algorithms and data structures', 'text searching', 'compression', 'similarity search']"
9.232372474901008e+18,SJUEA8uk4iYC,Profesor de Economía Universidad de Chile,@fen.uchile.cl,26512.0,"['Macroeconomics', 'International Economics', 'International Finance', 'Economic Development']"
9.232372474901008e+18,_07ZLa4AAAAJ,"Professor, Molecular & Clinical Pharmacologt, Faculty of Medicine, University of Chile",@med.uchile.cl,20822.0,"['neuroscience', 'toxicology', 'biochemistry', 'molecular biology', 'stem cells']"
9.232372474901008e+18,l2TIoXkAAAAJ,Universidad de Chile,@ciq.uchile.cl,20054.0,['Cardiovascular Disease Inflammation']
9.232372474901008e+18,HmELI5UAAAAJ,"Professor, Geophysics Department, Universidad de Chile",@uchile.cl,19030.0,['Atmospheric Sciences']
9.232372474901008e+18,tFVzdokAAAAJ,Universidad de Chile,@uchile.cl,16489.0,"['Alpine ecology', 'pollination', 'biogeography', 'conservation']"
9.232372474901008e+18,GTiVKRcAAAAJ,Universidad de Chile,@med.uchile.cl,15397.0,"['cardiovascular', 'calcium signaling']"
9.232372474901008e+18,cgjx6tMAAAAJ,"Profesor de Bioquímica, Facultad de Medicina, Universidad de Chile",@med.uchile.cl,15072.0,"['Estrés oxidativo', 'mecanismos de daño y protección hepáticos']"
9.232372474901008e+18,lu8PRvkAAAAJ,"Profesor de Astronomía, Universidad de Chile",@das.uchile.cl,14700.0,"['Radioastronomía', 'Instrumentación Astronómica']"
9.232372474901008e+18,Xf_ulNAAAAAJ,universidad de chile,@uchile.cl,14656.0,['urbanismo']
9.232372474901008e+18,BgkzLTUAAAAJ,Faculty of Dentistry. University of Chile,@odontologia.uchile.cl,13019.0,"['Cellular and Molecular Biology', 'Autophagy', 'Neurodegenerative Diseases', 'Obesity and derived affections', 'Oral diseases']"
9.232372474901008e+18,R86WqdoAAAAJ,Universidad de Chile,@inta.uchile.cl,11839.0,"['Obesity', 'adipose tissue dysfunction', 'calcium sensing receptor']"
9.232372474901008e+18,cxaipVoAAAAJ,Universidad de Chile,@uchile.cl,11729.0,"['Biología celular', 'Biología del Desarrollo', 'Biología Molecular']"
9.232372474901008e+18,1g7H4ToAAAAJ,"Department of economics, University of Chile",@fen.uchile.cl,11081.0,"['Economic development', 'environmental economics']"
9.232372474901008e+18,WboqEP8AAAAJ,"Professor of Cell and Molecular Biology, University of Chile",@med.uchile.cl,11002.0,"['signal transduction', 'cancer', 'cell death']"
9.232372474901008e+18,v1yWwKUAAAAJ,"Assistant Professor of Astronomy, Universidad de Chile",@das.uchile.cl,10813.0,"['Planet Formation', 'Protoplanetary Disks']"
9.232372474901008e+18,yoH4l0UAAAAJ,Universidad de Chile,@das.uchile.cl,10556.0,['astrophysics']
9.232372474901008e+18,BgXxxS8AAAAJ,"Programa de Farmacología Molecular y Clínica, Instituto de Ciencias Biomédicas, Facultad de Medicina, Universidad de Chile",@med.uchile.cl,10469.0,['Estrés Oxidativo']
9.232372474901008e+18,bmtKa3sAAAAJ,"departamento de geografia, universidad de chile",@uchile.cl,10340.0,['glaciology']
9.232372474901008e+18,ecwhM0oAAAAJ,"Electrical Engineering Department, University of Chile",@ing.uchile.cl,10070.0,"['Power Electronics', 'Electric Drives', 'Wind Energy', 'Renewable Energy']"
9.232372474901008e+18,2BLPkosAAAAJ,"Industrial Engineering, Universidad de Chile",@dii.uchile.cl,9999.0,"['operations research', 'optimization']"
9.232372474901008e+18,jzeqUi4AAAAJ,"Computer Science Department, Universidad de Chile",@dcc.uchile.cl,10031.0,"['Data', 'Knowledge Graphs', 'Databases', 'Semantic Web', 'RDF']"
9.232372474901008e+18,xXkuYEEAAAAJ,"University of Chile, Karolinska institutet, Manheim",@med.uchile.cl,9845.0,"['Neuroscience', 'Pharmacology']"
9.232372474901008e+18,zugBuscAAAAJ,"Assistant Professor, Astronomía, Universidad de Chile",@das.uchile.cl,9795.0,"['Active Galactic Nuclei', 'blazars', 'radio astronomy', 'time domain astronomy', 'time series analysis']"
9.232372474901008e+18,gOj959UAAAAJ,"Full Professor, Universidad de Chile",@u.uchile.cl,9731.0,['Astronomy']
9.232372474901008e+18,-8-ZtOEAAAAJ,Professor of Learning Technologies and Human-Computer Interaction at the University of Chile,@uchile.cl,9643.0,"['Learning Technologies', 'Computers in Education', 'Human-Computer Interaction', 'Technology for People with Disabilities']"
9.232372474901008e+18,5ntc1PMAAAAJ,Universidad de Chile,@cec.uchile.cl,9613.0,"['Power Systems', 'Renewables', 'Solar Energy', 'Microgrids', 'Energy Markets']"
9.232372474901008e+18,sSEH1OAAAAAJ,Profesora Universidad de Chile,@uchile.cl,9592.0,"['Educación', 'Politicas']"
9.232372474901008e+18,PWLh77oAAAAJ,"Professor of Economics, University of Chile.",@fen.uchile.cl,9416.0,"['economics', 'statistics']"
9.232372474901008e+18,EqeZJ10AAAAJ,University of Chile,@uchile.cl,9203.0,"['Soil-Plant-Water Relations', 'Plant Breeding', 'Agronomy']"
9.232372474901008e+18,tTMtjNUAAAAJ,Universidad de Chile,@uchile.cl,8666.0,['Quaternary paleoecology paleoclimatology']
9.232372474901008e+18,UeodjIAAAAAJ,Universidad de Chile: Centro de Investigación Avanzada en Educación y Departamento de Sociología,@ciae.uchile.cl,8657.0,"['Educación', 'Política Educacional', 'Sociología de la Educación']"
9.232372474901008e+18,KWObrhMAAAAJ,"Professor, University of Chile",@uchile.cl,8416.0,['Functional genomics']
9.232372474901008e+18,uByOqqwAAAAJ,"Dept. Neurosciences, BNI, CEMC, ICBM, F. Medicine, Universidad de Chile",@med.uchile.cl,8338.0,"['Calcium signaling', 'calcium release channels', 'redox regulation']"
9.232372474901008e+18,Ru_N1TkAAAAJ,"Profesor Titular, Universidad de Chile",@uchile.cl,8045.0,['Fisiología Muscular']
9.232372474901008e+18,KhO5OwkAAAAJ,"Professor of Geology, Universidad de Chile",@ing.uchile.cl,7950.0,"['Economic Geology', 'Geochemistry', 'Earth Science']"
9.232372474901008e+18,8nL6ZKsAAAAJ,Universidad de Chile,@u.uchile.cl,7806.0,['química']
9.232372474901008e+18,mYN1dVQAAAAJ,"Center for Mathematical Modeling, University of Chile",@dim.uchile.cl,7861.0,"['Ergodic Theory', 'Topological Dynamics', 'Symbolic Dynamics', 'Bioinformatics']"
9.232372474901008e+18,2_o6_SkAAAAJ,"Profesor de Nutrición, Universidad de Chile",@inta.uchile.cl,7809.0,['micronutrients']
9.232372474901008e+18,MJ8rA_8AAAAJ,Universidad de Chile,@inta.uchile.cl,7865.0,"['Nutrition', 'Public Health', 'Growth']"
9.232372474901008e+18,bILoTH4AAAAJ,"Full Professor, Facultad de Medicina, Universidad de Chile",@med.uchile.cl,7690.0,"['immunology', 'inflammation']"
9.232372474901008e+18,F77BFPkAAAAJ,"Full Professor, Universidad de Chile",@inta.uchile.cl,7483.0,"['Antioxidants', 'Polyphenols', 'Oxidative stress']"
9.232372474901008e+18,sv8m9q4AAAAJ,Universidad de Chile,@dii.uchile.cl,7428.0,"['Operations Research', 'Logistics', 'Integer Programming', 'Transportation', 'System Analysis']"
9.232372474901008e+18,cgxUZv0AAAAJ,"Professor of Transport Economics, Universidad de Chile",@ing.uchile.cl,7396.0,['Transport Economics']
9.232372474901008e+18,jTWJYbEAAAAJ,Universidad de Chile,@das.uchile.cl,7392.0,"['Exoplanets', 'Astrophysics']"
9.232372474901008e+18,RRxHKGMAAAAJ,"Professor, Universidad de Chile, Advanced Center for Chronic Diseases (ACCDiS)",@ciq.uchile.cl,7193.0,"['nanomedicine', 'drug delivery', 'peptides', 'Chronic diseases']"
9.232372474901008e+18,WzCAULkAAAAJ,"Professor of Industrial Engineering, Universidad de Chile",@dii.uchile.cl,7090.0,"['Operations Research', 'Data Mining', 'Business Analytics', 'Data Science']"
9.232372474901008e+18,gGy4EK8AAAAJ,"Professor, Universidad de Chile. Director, Center for Genome Regulation",@uchile.cl,7077.0,"['Genomics', 'Developmental Biology', 'Regeneration']"
9.232372474901008e+18,Qk3qyJEAAAAJ,Universidad de Chile,@uchile.cl,7155.0,"['Forest ecology', 'Biogeography', 'Forest dynamics', 'Nature conservation', 'Global Change']"
9.232372474901008e+18,OM6_4PQAAAAJ,Universidad de Chile,@uchile.cl,6942.0,"['Neurology', 'neuroscience', 'cognitive neurology']"
9.232372474901008e+18,zstvWCgSQ8YC,"DCC, Universidad de Chile; IMFD",@dcc.uchile.cl,6980.0,"['semantic web', 'linked data', 'knowledge graphs']"
9.232372474901008e+18,x3EwWlgAAAAJ,"Professor of Astronomy, Universidad de Chile",@das.uchile.cl,6843.0,"['Astrophysics', 'intergalactic medium', 'gravitational lensing']"
9.232372474901008e+18,ht2jo50AAAAJ,"Dpt. of Nutrition, Fac. of Medicine, University of Chile",@med.uchile.cl,6923.0,"['Human Nutrition', 'Digestive physiology']"
9.232372474901008e+18,ejYvw6AAAAAJ,"Professor Astronomy Department, Universidad de Chile",@das.uchile.cl,6747.0,"['star formation', 'Interstellar medium', 'molecular clouds', 'Magellanic Clouds', 'low metallicity galaxies']"
9.232372474901008e+18,EnWls0AAAAAJ,Universidad de Chile,@uchile.cl,6705.0,"['radicales libres', 'antioxidantes', 'ESR', 'quimica medica']"
9.232372474901008e+18,ca_qTCkAAAAJ,Universidad de Chile,@inta.uchile.cl,6690.0,"['biotecnología', 'alimentos', 'microbiota', 'enzibióticos', 'fagos']"
9.232372474901008e+18,eZBFWGEAAAAJ,"Associate Professor Department of Computer Science, University of Chile - Amazon Visiting Academic",@dcc.uchile.cl,6552.0,"['Social Networks', 'Data Mining', 'Web', 'Information Retrieval', 'Machine Learning']"
9.232372474901008e+18,slfQrd0AAAAJ,Universidad de Chile,@dgf.uchile.cl,6543.0,"['atmospheric sciences', 'climate', 'geology']"
9.232372474901008e+18,GIB2jSAAAAAJ,"Instituto de Nutrición y Tecnología de los Alimentos, Universidad de Chile",@inta.uchile.cl,6410.0,"['Microbiología', 'evolución']"
9.232372474901008e+18,hMBHGzUAAAAJ,"Professor of Economics, FEN, Universidad de Chile",@fen.uchile.cl,6357.0,"['Economic development', 'international economics', 'macroeconomics']"
9.232372474901008e+18,LRFxpc0AAAAJ,Universidad de Chile,@ing.uchile.cl,6417.0,"['heterogeneous Catalysis', 'Photocatalysis', 'hydrogen', 'CO2', 'energy']"
9.232372474901008e+18,P4MWRFEAAAAJ,Universidad de Chile,@uchile.cl,6336.0,['Conservación biológica']
9.232372474901008e+18,BUc-k1MAAAAJ,Departamento de Economía -  Universidad de Chile,@econ.uchile.cl,6310.0,"['pobreza', 'desigualdad', 'mercados laborales', 'economía de la educación', 'evaluación de impacto']"
9.232372474901008e+18,U_df6NEAAAAJ,Universidad de Chile,@uchile.cl,6387.0,"['cytoskeleton', 'neuronal differentiation', 'neurodegenerative disorders', 'aging', 'geroscience']"
9.232372474901008e+18,Xfl5QmAAAAAJ,"Professor of Anatomy and Developmental Biology, Universidad de Chile",@uchile.cl,6106.0,"['Development', 'Tissue Morphogenesis', 'Mechanics', 'Left-Right Asymmetry', 'Fish Embryos']"
9.232372474901008e+18,Mo_WXS4AAAAJ,Universidad de Chile,@inta.uchile.cl,6073.0,"['obesidad infantil', 'actividad física']"
9.232372474901008e+18,gEnD2_cAAAAJ,Universidad de chile,@ciq.uchile.cl,6041.0,"['Neuroendocrinologia', 'neurofarmacologia']"
9.232372474901008e+18,qabycucAAAAJ,"INTA, Universidad de Chile",@inta.uchile.cl,5851.0,"['Validación de instrumentos', 'modelación', 'análisis multivariados', 'envejecimiento']"
9.232372474901008e+18,kXJYk20AAAAJ,Universidad  de Chile,@odontologia.uchile.cl,5768.0,"['Oral Pathology', 'Periodontitis Biomarkers', 'Endodontics', 'Systemic inflammation']"
9.232372474901008e+18,ce1kvYUAAAAJ,"Departamento de Astronomía, Universidad de Chile",@das.uchile.cl,5639.0,"['Astronomy', 'Star Formation', 'Astrochemistry', 'Astroinformatics']"
9.232372474901008e+18,KLpE0k0AAAAJ,"Profesor titular, Universidad de Chile",@inta.uchile.cl,5636.0,[]
9.232372474901008e+18,UwNv9B0AAAAJ,Universidad de Chile,@ing.uchile.cl,5659.0,['Petrology and Geochemistry']
9.232372474901008e+18,SM1ghUEAAAAJ,"Department of Electrical Engineering, University of Chile",@cec.uchile.cl,5659.0,"['Neural Networks', 'Clustering', 'Feature Selection', 'Big Data', 'Computational Intelligence']"
9.232372474901008e+18,FjUdU10AAAAJ,Universidad de Chile,@dii.uchile.cl,5553.0,"['Industrial organization', 'trade theory', 'regulation', 'corporate finance']"
9.232372474901008e+18,wQUy7CAAAAAJ,University of Chile,@fen.uchile.cl,5561.0,"['International Trade', 'Productivity', 'Innovation']"
9.232372474901008e+18,1SHHThYAAAAJ,University of Chile,@ing.uchile.cl,5580.0,"['Fault diagnosis', 'Failure prognosis', 'Bayesian state estimation']"
9.232372474901008e+18,psy143EAAAAJ,Universidad de Chile,@med.uchile.cl,5465.0,[]
9.232372474901008e+18,i2TCCA4AAAAJ,Profesor titular Universidad de Chile,@uchile.cl,5438.0,['Inmunología']
9.232372474901008e+18,qst2D-gAAAAJ,Profesor Titular Neurologia Hospital Clinico Universidad de Chile,@uchile.cl,5417.0,"['Neurología', 'demencias', 'Alzheimer', 'neurociencias']"
9.232372474901008e+18,ACrUb6MAAAAJ,Universidad de Chile,@uchile.cl,5469.0,['Food Science and Technology']
9.232372474901008e+18,d0Dk7hMAAAAJ,"Facultad de Medicina, Universidad de Chile",@uchile.cl,5340.0,['Infectologia']
9.232372474901008e+18,SkRSKBIAAAAJ,"Full Professor, University of Chile",@ciq.uchile.cl,5228.0,"['Electrochemistry', 'Bioelectrochemistry', 'Electroanalytical']"
9.232372474901008e+18,U0XHBs8AAAAJ,Universidad de Chile,@ing.uchile.cl,5187.0,"['Mobile Robotics', 'Computer Vision', 'Face Analysis']"
9.232372474901008e+18,J14cEJEAAAAJ,University of Chile,@ciq.uchile.cl,5144.0,['Chemistry']
9.232372474901008e+18,3iH2LfsAAAAJ,Universidad de Chile,@inta.uchile.cl,5205.0,"['diabetes', 'autoinmunidad', 'epigenética']"
9.232372474901008e+18,sLVFni0AAAAJ,"Professor, Universidad de Chile",@med.uchile.cl,5150.0,['Cell  and Molecular Biology']
9.232372474901008e+18,aUtukf4AAAAJ,"Computer Science Department, University of Chile",@dcc.uchile.cl,5108.0,"['Mobile and Ubiquitous Computing', 'Socio-technical Systems', 'Software Engineering']"
9.232372474901008e+18,aWUFM5sAAAAJ,"Full Proffesor, Human Nutrition Unit. INTA, University of Chile",@inta.uchile.cl,5109.0,"['Micronutrients', 'Cardiovascular disease', 'Diabetes']"
9.232372474901008e+18,iq-QblMAAAAJ,"Profesor Titular, Universidad de Chile",@uchile.cl,5057.0,"['Procesamiento de alimentos', 'especies de zonas áridas', 'compuestos bioactivos']"
9.232372474901008e+18,sQbSxDoAAAAJ,"Professor, U. Chile",@ing.uchile.cl,5087.0,"['Fuzzy systems', 'Predictive Control']"
9.232372474901008e+18,kNh7fPsAAAAJ,"Associate Professor, Faculty of Dentistry, University of Chile",@uchile.cl,5089.0,"['Oral Mucosal Immunology', 'Periodontology']"
9.232372474901008e+18,GyiegqsAAAAJ,"Profesor, Universidad de Chile",@uchile.cl,4941.0,"['Canales de iones', 'estructura e proteínas de membrana']"
9.232372474901008e+18,4n42PKoAAAAJ,"ACCDiS, Advanced Center for Chronic Diseases. Universidad de Chile.",@ciq.uchile.cl,4977.0,"['Cell Biology', 'Signal Transduction', 'Mitochondria', 'Metabolism']"
9.232372474901008e+18,AWe-qKcAAAAJ,"Profesor de Inmunología, Universidad de Chile",@u.uchile.cl,4948.0,"['Inmunología', 'cáncer', 'inmunoterapia']"
9.232372474901008e+18,JdXR024AAAAJ,"Profesor de Farmacología y Neurociencias, Facultad de Medicina, Universidad de Chile",@med.uchile.cl,4936.0,"['farmacología', 'comportamiento', 'aprendizaje', 'ansiedad', 'depresión']"
9.232372474901008e+18,fCJZmKwAAAAJ,Universidad de Chile,@uchile.cl,4931.0,['Ecology and Evolution']
9.232372474901008e+18,oX4KpNQAAAAJ,Universidad de chile,@u.uchile.cl,4848.0,[]
9.232372474901008e+18,0lczYtMAAAAJ,"INTA, Universidad de Chile",@inta.uchile.cl,4747.0,[]
9.232372474901008e+18,A2WD03UAAAAJ,"Profesor, Universidad de Chile",@hcuch.cl,4701.0,"['Fetal Medicine', 'Maternal Fetal Medicine', 'Fetal Therapy', 'Obstetrics Ultrasound', 'Obstetrics and Gynecology']"
9.232372474901008e+18,9eI25jMAAAAJ,"Professor of Physics, FCFM, Department of Physics, University of Chile",@dfi.uchile.cl,4602.0,"['Nonlinear Physics', 'Non-equilibrium Physics', 'Nonlinear dynamics', 'Nonlinear optics']"
9.232372474901008e+18,_O0imNsAAAAJ,"Profesor Asociado Facultad de Medicina, Universidad de Chile",@uchile.cl,4603.0,[]
9.232372474901008e+18,ii7ImRwAAAAJ,"Departamento de Fisica, Facultad de Ciencias, Universidad de Chile",@macul.ciencias.uchile.cl,4529.0,"['Dynamics of Complex systems', 'Astrophysical Plasmas', 'Nanoscience']"
9.232372474901008e+18,kdP_2ZQAAAAJ,"Departamento de Geofísica, Universidad de Chile",@dgf.uchile.cl,4477.0,"['Sismología', 'Peligro y Riesgo Sísmico', 'Geodinámica', 'Sismotectónica']"
9.232372474901008e+18,jQoTB-gAAAAJ,Universidad de Chile,@antar.uchile.cl,4474.0,"['ecología de ecosistemas', 'moderación numérica']"
9.232372474901008e+18,bbZWdFUAAAAJ,"Department of Computer Science, University of Chile",@dcc.uchile.cl,4446.0,"['Similarity search', 'Content-based multimedia information retrieval', 'Multimedia Indexing', '3D model retrieval']"
9.232372474901008e+18,LZd9fu8AAAAJ,"Full Professor, Universidad de Chile",@uchile.cl,4432.0,"['Plant Ecology', 'Plant invasion Biology', 'Biodiversity Coservation']"
9.232372474901008e+18,kpdsKYwAAAAJ,Universidad de Chile,@uchile.cl,4343.0,['neuroscience']
9.232372474901008e+18,dmj_gE4AAAAJ,"Professor of Computer Science, Universidad de Chile",@dcc.uchile.cl,4354.0,"['Human-Computer Interaction', 'Process Modeling', 'Expert Systems']"
9.232372474901008e+18,d0LISE4AAAAJ,"Professor of Computer Science, University of Chile",@dcc.uchile.cl,4342.0,"['Programming Languages', 'Software Engineering']"
9.232372474901008e+18,GGi4-2QAAAAJ,"Department of Geology, Universidad de Chile",@ing.uchile.cl,4332.0,"['Geochemistry', 'Isotope geochemsitry', 'Geochronology', 'Economic geology', 'Metallogenesis']"
9.232372474901008e+18,-JSkVSQAAAAJ,"Department of Economics, Universidad de Chile",@fen.uchile.cl,4303.0,"['Macroeconomics', 'International Finance', 'Economic Development']"
9.232372474901008e+18,zmrNJHEAAAAJ,"Médico Especialista en Medicina Intensiva; Profesor Titular, Universidad de Chile",@hcuch.cl,4280.0,"['Ventilación Mecánica', 'Sindrome de Distrés Respiratorio Agudo', 'Sepsis']"
9.232372474901008e+18,Kk6Y__gAAAAJ,"Professor of Microbiology, University of Chile",@uchile.cl,4255.0,"['Microbiology', 'Biotechnology']"
9.232372474901008e+18,v6qgA4EAAAAJ,"Profesor de Geología, Facultad de Ciencias Físicas y Matemáticas, Universidad de Chile",@uchile.cl,4214.0,"['Geología y geomorfología cuaternaria', 'geología marina', 'peligros geológicos', 'paleosismología', 'paleoclima']"
9.232372474901008e+18,bvtMvBUAAAAJ,"Associate Professor, INTA, University of Chile",@inta.uchile.cl,4282.0,"['microbiology', 'microbiota', 'probiotics']"
9.232372474901008e+18,9at1wjkAAAAJ,University of Chile,@ing.uchile.cl,4156.0,['geostatistics']
9.232372474901008e+18,njP0LAwAAAAJ,Universidad de Chile,@ciq.uchile.cl,4128.0,['Polymer and Materials Science']
9.232372474901008e+18,wnolr9sAAAAJ,Universidad de Chile,@u.uchile.cl,4171.0,"['Botany', 'Biogeography']"
9.232372474901008e+18,0eZSQEkAAAAJ,UNIVERSIDAD DE CHILE,@uchile.cl,4129.0,[]
9.232372474901008e+18,Oi3Phu8AAAAJ,"Associate Professor, Departamento de Física, FCFM, Universidad de Chile",@ing.uchile.cl,4091.0,"['condensed matter physics', 'quantum transport', 'driven systems and Floquet theory', 'graphene', 'topological quantum matter']"
9.232372474901008e+18,vnH5v4oAAAAJ,"INTA, Universidad de Chile",@inta.uchile.cl,4086.0,"['Osteoporosis', 'Mesenchymal stem cells']"
9.232372474901008e+18,Kq4dWnoAAAAJ,"Profesor de la Facultad de Derecho, Universidad  de Chile",@derecho.uchile.cl,4048.0,"['política comparada', 'regímenes autoritarios', 'bases económicas de la democracia']"
9.232372474901008e+18,QKniBGwAAAAJ,Professor E.E. Dept. University of Chile,@ing.uchile.cl,4001.0,"['Automation', 'Energy', 'Wine Industry']"
9.232372474901008e+18,pkfRv9YAAAAJ,"Prof. Titular, Universidad de Chile",@u.uchile.cl,3972.0,"['Ecología', 'conservación de biodiversidad en agroecosistemas']"
9.232372474901008e+18,6i0W62wAAAAJ,"Department of Geophysics, Universidad de Chile; Center for Climate and Resilience Research, Chile",@dgf.uchile.cl,4004.0,['Climate Variability']
9.232372474901008e+18,h2F8sjEAAAAJ,"Professor of Mathematics, University of Chile",@dim.uchile.cl,3886.0,"['Applied Mathematics', 'Partial Differential Equations', 'Inverse Problems', 'Fluid Mechanics']"
9.232372474901008e+18,Kali-yUAAAAJ,Universidad de Chile,@uchile.cl,3845.0,['Physics']
9.232372474901008e+18,0U7P56IAAAAJ,Universidad de Chile,@u.uchile.cl,3855.0,"['snow hydrology', 'mountain hydrology', 'water resources']"
9.232372474901008e+18,qvCkUSkAAAAJ,"Profesor Asociado, Facultad de Medicina, Universidad de Chile",@uchile.cl,3800.0,"['Fisiología renal', 'Fisiología cardiovascular', 'Insuficiencia Renal', 'Hipertensión Arterial']"
9.232372474901008e+18,i6_OY98AAAAJ,Profesor de Bioética Universidad de Chile/ Researcher Sloan Kettering Cancer Institute,@u.uchile.cl,3737.0,"['genética', 'bioética', 'ética de investigación']"
9.232372474901008e+18,OP0ZdHUAAAAJ,"Profesor Titular, Universidad de Chile",@u.uchile.cl,3690.0,"['energetics', 'physiological ecology', 'isotopic ecology', 'zoology']"
9.232372474901008e+18,YcXCdwMAAAAJ,Laboratorio para el Análisis de la Biósfera (LAB) / Universidad de Chile      Laboratorio de,@uchile.cl,3750.0,['Teledetección Cuantitativa y Energías Eólica Marina']
9.232372474901008e+18,GVmLpu0AAAAJ,Universidad de Chile,@ing.uchile.cl,3707.0,"['engineering', 'social sciences', 'transportation']"
9.232372474901008e+18,90tOwg8AAAAJ,Professor Universidad de Chile,@uchile.cl,3654.0,"['Developmental biology', 'Cancer', 'Regenerative Medicine', 'Stem cells', 'Shh signaling neurodevelopmental disorders']"
9.232372474901008e+18,Zh4GpigAAAAJ,Universidad de Chile,@cec.uchile.cl,3641.0,"['Geology', 'engineering', 'oceanography', 'paleontology']"
9.232372474901008e+18,P-sMWA0AAAAJ,"Full Professor, University of Chile",@ciq.uchile.cl,3627.0,"['Analytical Chemistry', 'Environmental Chemistry']"
9.232372474901008e+18,K9WCXwUAAAAJ,"Departamento de Economía, Universidad de Chile",@fen.uchile.cl,3664.0,"['Economía Ambiental', 'Economía de los RR.NN.', 'Desarrollo Económico']"
9.232372474901008e+18,B-wHfIEAAAAJ,Universidad de Chile,@ing.uchile.cl,3621.0,"['Cosmology', 'Cosmic Inflation', 'CMB']"
9.232372474901008e+18,NKC3t5sAAAAJ,"Full Professor, Universidad de Chile",@uchile.cl,3632.0,"['DOHaD', 'hypoxia oxidative stress', 'cardiovascular', 'high altitude', 'animal models']"
9.232372474901008e+18,EWN2nZgAAAAJ,"Professor, Geophysics Department, Universidad de Chile",@u.uchile.cl,3661.0,"['atmospheric modeling and data assimilation', 'air quality in mega cities', 'and aerosol-cloud-climate interactions.']"
9.232372474901008e+18,QP1aKqcAAAAJ,Universidad de Chile,@uchile.cl,3610.0,"['Operations Research', 'Market Design', 'Algorithmic Game Theory', 'Mechanism Design']"
9.232372474901008e+18,5TouOMAAAAAJ,"INTA, Universidad de Chile",@inta.uchile.cl,3626.0,"['Nutrition', 'Obesity']"
9.232372474901008e+18,fLUHNZUAAAAJ,Universidad de Chile,@uchile.cl,3533.0,['Neuroscience']
9.232372474901008e+18,LUdizE8AAAAJ,"Profesor Titular, Facultad de Ciencias, Universidad de Chile",@uchile.cl,3542.0,"['Phylogeny', 'Comparative Method', 'Evolutionary Biology', 'Conservation Genetics']"
9.232372474901008e+18,Qzl7WeYAAAAJ,"Department of Management Control and Information Systems, University of Chile & ISCI",@fen.uchile.cl,3587.0,"['Business Analytics', 'Machine Learning', 'Pattern Recognition']"
9.232372474901008e+18,3ELxF3YAAAAJ,"Associate Professor, Faculty of Dentistry, Universidad de Chile",@med.uchile.cl,3483.0,['Tumor Cell Biology']
9.232372474901008e+18,NK44AZoAAAAJ,Professor of Immunology at University of Chile,@med.uchile.cl,3444.0,"['Immunology', 'Autoimmunity', 'Tolerance', 'Autoantibodies']"
9.232372474901008e+18,BSxQQbUAAAAJ,"Universidad de Chile, Facultad de Ciencias Quimicas y Farmaceuticas",@ciq.uchile.cl,3466.0,"['Food Science', 'Food Engineering', 'Food Innovation', 'Dehydration', 'Functional Foods']"
9.232372474901008e+18,iD_GfsoAAAAJ,Universidad de Chile (INTA),@inta.uchile.cl,3403.0,"['Public Health Nutrition', 'Human Nutrition', 'Epidemiology & Biostatistics', 'Multidisciplinary Science']"
9.232372474901008e+18,Ar7FIkYAAAAJ,"Facultad de medicina, Universidad de Chile",@med.uchile.cl,3379.0,"['farmacología', 'comportamiento', 'estrés', 'aprendizaje']"
9.232372474901008e+18,eyTYloUAAAAJ,Universidad de Chile,@inta.uchile.cl,3461.0,"['Agro-industry', 'Food Science', 'Food Innovation', 'Food Irradiation', 'Functional Foods']"
9.232372474901008e+18,XkHMNP8AAAAJ,Universidad de Chile,@ing.uchile.cl,3367.0,"['Environmental Hydrodynamics', 'Sediment Transport', 'Granular Flows', 'Geophysical Flows.']"
9.232372474901008e+18,iFqdx5IAAAAJ,Universidad de Chile,@uchile.cl,3430.0,"['Quantitative genetics', 'genomics', 'fish breeding']"
9.232372474901008e+18,XvUFRcgAAAAJ,"Instituto de Nutrición y Tecnología de los Alimentos, Universidad de Chile",@inta.uchile.cl,3378.0,"['cell metabolism', 'mitochondria', 'endoplasmic reticulum', 'aging']"
9.232372474901008e+18,Ug4b1XQAAAAJ,"Full Professor, DCS Department, Universidad de Chile",@fen.uchile.cl,3346.0,"['Collaborative Information Systems', 'Collaborative Learning', 'Technology Enhanced Learning', 'CSCL']"
9.232372474901008e+18,JaW8L3cAAAAJ,"INTA, Universidad de Chile",@inta.uchile.cl,3346.0,[]
9.232372474901008e+18,WHuuVSEAAAAJ,Universidad de Chile,@dim.uchile.cl,3346.0,"['Probability', 'Linear algebra', 'Forestry', 'Astroinformatics']"
9.232372474901008e+18,3AClnpcAAAAJ,Universidad de Chile,@ing.uchile.cl,3326.0,"['Transport demand', 'smart card data', 'public transport']"
9.232372474901008e+18,YWg1LsAAAAAJ,Universidad de Chile,@uchile.cl,3261.0,['microbiología']
