organization,scholar_id,affiliation,email_domain,citedby,interests
1.2216913016116922e+19,jyT8VE4AAAAJ,Universidad Diego Portales,@mail.udp.cl,25683.0,Astronomy
1.2216913016116922e+19,TX3te0QAAAAJ,"Professor,  Sociology of Education. UNESCO Chair, Universidad Diego Portales, Chile",@mail.udp.cl,21590.0,"Higher education, Political economy of education, Policy and cultural analysis"
1.2216913016116922e+19,7Uy51X4AAAAJ,assistant professor Nucleo Astronomia Universidad Diego Portales,@mail.udp.cl,14680.0,stellar and Galactic astrophysics
1.2216913016116922e+19,4iRjwbMAAAAJ,"Professor, Universidad Diego Portales",@udp.cl,14054.0,"comparative politics, populism, democracy"
1.2216913016116922e+19,4tuv9ZUAAAAJ,Universidad Diego Portales,@mail.udp.cl,14063.0,"Galaxy evolution, Interstellar medium, high redshift galaxies and data science"
1.2216913016116922e+19,cn9uqN4AAAAJ,"Professor of Astrophysics, Universidad Diego Portales",@mail.udp.cl,11531.0,"Galaxy formation, Galaxy evolution, Submillimeter galaxies, ISM of galaxies"
1.2216913016116922e+19,TW5VlFsAAAAJ,Universidad Diego Portales,@mail.udp.cl,11189.0,"Active Galactic Nuclei, Galaxy Evolution"
1.2216913016116922e+19,Dt6e_E0AAAAJ,Emeritus professor University Diego Portales and Clinica las Condes,@udp.cl,9944.0,reproductive medicine
1.2216913016116922e+19,n4SKkSAAAAAJ,Universidad Diego Portales,@mail.udp.cl,8567.0,Astronomy
1.2216913016116922e+19,f9Oj5nUAAAAJ,Universidad Diego Portales,@mail.udp.cl,7703.0,Exoplanets
1.2216913016116922e+19,9b8DoS8AAAAJ,"Professor, Universidad Diego Portales",@udp.cl,5965.0,"Educational policies, curriculum, teacher education, citizenship education"
1.2216913016116922e+19,eS_SYGMAAAAJ,Universidad Diego Portales,@udp.cl,3855.0,
1.2216913016116922e+19,cbdbtM0AAAAJ,Universidad Diego Portales,@udp.cl,3096.0,"Organizational behavior, organization studies, cross-cultural management"
1.2216913016116922e+19,C6i7344AAAAJ,Universidad Diego Portales,@mail.udp.cl,2697.0,"Political field, public intellectuals, political competence, political elites, politics of memory"
1.2216913016116922e+19,XrZEaYcAAAAJ,profesor universidad diego portales Chile,@udp.cl,2718.0,"liderazgo directivo, politica docente, mejora escolar"
1.2216913016116922e+19,AaCvn7oAAAAJ,The Astronomy Nucleus at Universidad Diego Portales,@mail.udp.cl,2631.0,"Solar system, planet formation, extreme AO, spectroscopy and Astrobiology"
1.2216913016116922e+19,rC7E0W8AAAAJ,"Professor, Faculty of Education, Diego Portales University",@mail.udp.cl,2559.0,"Política Educacional, Liderazgo Escolar, Mejoramiento Educativo"
1.2216913016116922e+19,NZXPbcsAAAAJ,Universidad Diego Portales,@udp.cl,2378.0,"Brain development, Brain Evolution, Neurogenomics, Neuropathology"
1.2216913016116922e+19,vcD3QfwAAAAJ,Universidad Diego Portales,@udp.cl,2302.0,"Logistics, Transportation, Operations Research, Econometrics"
1.2216913016116922e+19,DmWRYnEAAAAJ,"Professor, Medical Faculty Universidad de Chile, Universidad Diego Portales",@mail.udp.cl,2270.0,Psychiatry
1.2216913016116922e+19,9JegVHcAAAAJ,Universidad Diego Portales,@mail.udp.cl,2174.0,Galaxy evolution
1.2216913016116922e+19,DIwDzUYAAAAJ,"Facultad de Psicología, Universidad Diego Portales",@mail.udp.cl,2026.0,
1.2216913016116922e+19,ckIjzZQAAAAJ,Universidad Diego Portales,@udp.cl,1979.0,"reforma constitucional, sistemas políticos, democracia, América Latina, Chile"
1.2216913016116922e+19,0dJbD08AAAAJ,Universidad Diego Portales,@mail.udp.cl,1964.0,"Justicia penal, proceso penal, policía"
1.2216913016116922e+19,JD_X4KYAAAAJ,Universidad Diego Portales,@mail.udp.cl,1860.0,"Political Science, Comparative Politics, Latin America, Partisanship"
1.2216913016116922e+19,Ka7pywsAAAAJ,universidad diego portales,@udp.cl,1680.0,
1.2216913016116922e+19,r0EzJ_IAAAAJ,"Professor of Law, Universidad Diego Portales",@udp.cl,1681.0,Law
1.2216913016116922e+19,rFUqIdsAAAAJ,"PROFESOR, FACULTAD DE PSICOLOGIA, UNIVERSIDAD DIEGO PORTALES",@udp.cl,1600.0,
1.2216913016116922e+19,n0UQqa4AAAAJ,"Escuela de Ciencia Política, Universidad Diego Portales",@mail.udp.cl,1450.0,"Economía política comparada, Economía política internacional, Desarrollo"
1.2216913016116922e+19,Wbg5yB8AAAAJ,universidad diego portales,@udp.cl,1355.0,"derecho civil, responsabilidad civil, contratos"
1.2216913016116922e+19,4L5fnNEAAAAJ,Universidad Diego Portales,@udp.cl,1299.0,"Political psychology, Social justice, Legitimacy, Intergroup violence, Punitive attitudes"
1.2216913016116922e+19,CAH7H-gAAAAJ,"Prof. of Law, Universidad Diego Portales",@udp.cl,1276.0,"gender, discrimination, violence against women, reproductive rights, administration of justice"
1.2216913016116922e+19,mR_wPscAAAAJ,Universidad Diego Portales,@udp.cl,1266.0,Technology and Education
1.2216913016116922e+19,W8YUEHsAAAAJ,"Universidad Diego Portales, Facultad de Medicina.",@mail.udp.cl,1206.0,Medicina Interna
1.2216913016116922e+19,TU-aWkAAAAAJ,"Full Professor, Universidad Diego Portales. Research director, Faculty of Psychology, UDP",@udp.cl,1327.0,"public health, work psychology, occupational health, mental health"
1.2216913016116922e+19,PL1YL-MAAAAJ,"Professor / Researcher, Universidad Diego Portales",@mail.udp.cl,1175.0,"wireless, internet of things, content-centric networking, experimental networks"
1.2216913016116922e+19,zfQU0XsAAAAJ,Universidad Diego Portales,@mail.udp.cl,1194.0,
1.2216913016116922e+19,pyyrrFMAAAAJ,Universidad Diego Portales,@udp.cl,1124.0,"Psychometrics, Structural Equation Modeling, Item Response Theory, Rasch, Latent Class Analysis"
1.2216913016116922e+19,7EB5IpEAAAAJ,"Instituto de Ciencias Básicas, Facultad de Ingeniería y Ciencias, Universidad Diego Portales",@udp.cl,1118.0,"conic programming, convex optimization, proximal algorithms, machine learning"
1.2216913016116922e+19,B7eRj7QAAAAJ,Universidad Diego Portales,@udp.cl,1085.0,Efficiency
1.2216913016116922e+19,FpyJ96kAAAAJ,"Escuela de Sociologia, Universidad Diego Portales",@udp.cl,1064.0,"Economic Sociology, Science and Technology Studies, Sustainable transitions, Valuation Studies, Social Theory"
1.2216913016116922e+19,4gWQ5SQAAAAJ,Académico udp,@udp.cl,1064.0,"Reformas procesales, litigación oral, prueba"
1.2216913016116922e+19,376TFmAAAAAJ,Universidad Diego Portales,@udp.cl,1037.0,Transportation
1.2216913016116922e+19,AIXsHd0AAAAJ,"Facultad de Psicología, Universidad Diego Portales",@udp.cl,977.0,"Cognitive neuroscience, Behavior, Context, (neuro)biology, Sensory systems"
1.2216913016116922e+19,XDt5RDsAAAAJ,"Profesor de Derecho, Universidad Diego Portales",@udp.cl,866.0,derecho
1.2216913016116922e+19,gkHNPiwAAAAJ,Universidad Diego Portales,@mail.udp.cl,854.0,"Political Science, Comparative Politics, Social Policy, Political Economy, Latin America"
1.2216913016116922e+19,95eKPlwAAAAJ,Universidad Diego Portales,@mail.udp.cl,853.0,
1.2216913016116922e+19,Rf6SVxoAAAAJ,"Académico Escuela de Sociología, Universidad Diego Portales, Chile",@udp.cl,865.0,
1.2216913016116922e+19,JI8pOCwAAAAJ,Universidad Diego Portales,@udp.cl,837.0,"Innovación, Crecimiento, Productividad, Comercio internacional, diversificación"
1.2216913016116922e+19,NvmhwgYAAAAJ,Universidad Diego Portales,@udp.cl,820.0,"educación, infancia, análisis crítico de discurso"
1.2216913016116922e+19,OJ1rTPsAAAAJ,Universidad Diego Portales,@udp.cl,815.0,"Lingüística, Lingüística Computacional, Ciencias Cognitivas, Educación, Literatura"
1.2216913016116922e+19,LzOVVdMAAAAJ,Universidad Diego Portales,@udp.cl,815.0,"Transport Planning, Public Transport, Simulation"
1.2216913016116922e+19,q10ThmQAAAAJ,Universidad Diego Portales,@udp.cl,750.0,"economía, desarrollo económico, economía laboral"
1.2216913016116922e+19,qCfAT3gAAAAJ,"Universidad Diego Portales, Facultad de Medicina. Lab. de Neurociencia Traslacional, Santiago, Chile",@udp.cl,726.0,"Pain, Spinal Cord, Neuronal Networks, Sensory coding, Medical devices."
1.2216913016116922e+19,HaX6qs4AAAAJ,"Profesor Asociado, Escuela de Ciencia Política, Universidad Diego Portales",@mail.udp.cl,731.0,Comparative Politics
1.2216913016116922e+19,iVMScGEAAAAJ,Associate Professor University Diego Portales,@udp.cl,710.0,"luxury, consumer behavior, teens, cross cultural studies, materialism"
1.2216913016116922e+19,fKqdV0IAAAAJ,"Facultad de Administración y Economía, Universidad Diego Portales, Chile",@udp.cl,675.0,Economics
1.2216913016116922e+19,lwZonicAAAAJ,Universidad Diego Portales,@udp.cl,666.0,
1.2216913016116922e+19,22ynv5cAAAAJ,"Professor of Sociology, Universidad Diego Portales (Chile)",@udp.cl,621.0,"critical theory, conceptual history, political sociology, socio-legal studies"
1.2216913016116922e+19,O7I7d1UAAAAJ,Universidad Diego Portales,@mail.udp.cl,649.0,"Hydrological Modelling, UASs, Image Velocimetry, Stochastic Processes, Bridge Scour"
1.2216913016116922e+19,-ToYjIwAAAAJ,Universidad Diego Portales,@udp.cl,621.0,"Facade design, energy efficiency, environmental design"
1.2216913016116922e+19,MVsIFcMAAAAJ,"Profesor de Psiquiatría, Universidad Diego Portales",@mail.udp.cl,605.0,"psiquiatría, educación, trastornos del ánimo, suicidalidad"
1.2216913016116922e+19,Rs03Z1MAAAAJ,Universidad Diego Portales,@udp.cl,586.0,"Fisiología Reproductiva, Infertilidad, Medicina Reproductiva, Embriología"
1.2216913016116922e+19,mBNeLBUAAAAJ,Universidad Diego Portales,@mail.udp.cl,588.0,"mathematical modelling, algorithms, business analytics"
1.2216913016116922e+19,6lYgX_0AAAAJ,Universidad Diego Portales,@mail.udp.cl,543.0,Sociology
1.2216913016116922e+19,apsrhYgAAAAJ,"Instituto do Câncer do Estado de São Paulo. Profesor Universidad Diego Portales, investigador",@mail.udp.cl,513.0,"Dosimetry, Radiological Protection, Medical Physics, Quality Control, SIT"
1.2216913016116922e+19,TQDDs-oAAAAJ,Center for Human Neuroscience and Neuropsychology (CENHN) - Universidad Diego Portales,@udp.cl,517.0,"Cognitive Neuroscience, 4E Cognition, MoBI, Social Interaction, Real-World Neuroscience"
1.2216913016116922e+19,ieeqKmYAAAAJ,Universidad Diego Portales,@udp.cl,473.0,"infancia, políticas públicas, intervención comunitaria"
1.2216913016116922e+19,bFIpeYwAAAAJ,UDP- Associate Professor,@udp.cl,465.0,"Hydrology, fluvial geomorphology, sediment transport"
1.2216913016116922e+19,nm-MHT4AAAAJ,"Profesor de Sociología, Universidad Diego Portales",@mail.udp.cl,454.0,"Sociología cultural, memoria, generaciones, narrativas, desigualdad"
1.2216913016116922e+19,m6Q4YK0AAAAJ,Universidad Diego Portales,@mail.udp.cl,435.0,"Diversidad, Interacciones Pedagógicas, Desarrollo e Identidad Profesional Docente"
1.2216913016116922e+19,77rS9hwAAAAJ,"Universidad Diego Portales, Facultad de Administración y Economía",@udp.cl,436.0,"Organizational Behavior, Work motivation, Leadership, Goal hierarchy and multiple goals pursue"
1.2216913016116922e+19,cpAhnCMAAAAJ,"Assistant Professor, Universidad Diego Portales",@udp.cl,448.0,"Machine Learning, neural networks, Data Science, Business intelligence"
1.2216913016116922e+19,DmMyIp4AAAAJ,"Assistant Professor, Escuela de Ingeniería Civil en Obras Civiles, Universidad Diego Portales",@udp.cl,426.0,"Civil Engineering, Earthquake Engineering, Geotechnical Engineering, Engineering Seismology"
1.2216913016116922e+19,_VWCeRUAAAAJ,"Profesora Asociada, Escuela de Historia, Universidad Diego Portales",@udp.cl,441.0,"género, sexualidades, feminismo, historia oral, memoria"
1.2216913016116922e+19,BvF7m3oAAAAJ,Universidad Diego Portales,@mail.udp.cl,426.0,
1.2216913016116922e+19,ID73yWUAAAAJ,"Escuela de Sociología, Universidad Diego Portales",@udp.cl,405.0,"familia, parentalidad, discapacidad, reproducción, homparentalidad"
1.2216913016116922e+19,3fjKVVYAAAAJ,"Profesor de Métodos Cuantitativos, Universidad Diego Portales",@udp.cl,403.0,Metodología Cuantitativa
1.2216913016116922e+19,DFmmVyMAAAAJ,"Centro de Estudios en Neurociencia Humana y Neuropsicología, Universidad Diego Portales",@udp.cl,356.0,"Neurobiology of social behavior, Social Cognitive Neuroscience, Comparative Cognition"
1.2216913016116922e+19,80nKR9kAAAAJ,Universidad Diego Portales,@udp.cl,349.0,"Antropología urbana, antropología política, ciudad, vivienda, subjetividad"
1.2216913016116922e+19,Haoi7_oAAAAJ,"Profesor Titular de Derecho Penal, Universidad Diego Portales",@mail.udp.cl,325.0,Derecho penal
1.2216913016116922e+19,le4B99MAAAAJ,Universidad Diego Portales,@udp.cl,317.0,"Data center energy and thermal management, electronics cooling, computational fluids mechanics and heat and mass transfer"
1.2216913016116922e+19,qNwNVNIAAAAJ,"Associate Professor, Department of Economics, Universidad Diego Portales, Chile",@udp.cl,283.0,"Financial Econometrics, Time Series Econometrics, Financial Economics, Annuities, Pensions"
1.2216913016116922e+19,UUskKgIAAAAJ,Universidad Diego Portales,@udp.cl,297.0,
1.2216913016116922e+19,Uy-kaZEAAAAJ,"Universidad Diego Portales, Chile",@udp.cl,280.0,Health Communication
1.2216913016116922e+19,SCfVlXAAAAAJ,Universidad Diego Portales,@mail.udp.cl,270.0,"SDSS, Learning, CSCW, geocollaboration"
1.2216913016116922e+19,hKq90fkAAAAJ,Universidad Diego Portales,@mail.udp.cl,267.0,"Large Scale Distributed Systems, Systems"
1.2216913016116922e+19,DnIgg5QAAAAJ,Universidad Diego Portales,@udp.cl,262.0,"Banking, Microfinance, Applied Economics"
1.2216913016116922e+19,Y7D_uNEAAAAJ,"Universidad Diego Portales, Facultad de Medicina",@mail.udp.cl,255.0,"Manejo de la vía aérea, airway management, education"
1.2216913016116922e+19,XUjirgwAAAAJ,"Faculty of Engineering and Science, Universidad Diego Portales, Santiago de Chile",@udp.cl,255.0,"quantum optics & information, laser physics, optomechanics, quantum materials, collective phenomena"
1.2216913016116922e+19,rU9jiAwAAAAJ,"Centro de Investigación Biomédica, Facultad de Medicina, Universidad Diego Portales",@udp.cl,259.0,"Cell signaling, Bioinformatics, Drug design, Neurodegenerative diseases"
1.2216913016116922e+19,oxmZsFcAAAAJ,"eBay, Universidad Diego portales, Universidad de Chile",@mail.udp.cl,241.0,"Algorithms and Data Structures, Recommender Systems"
1.2216913016116922e+19,d_EShyMAAAAJ,"Escuela de Sociología, Universidad Diego Portales",@udp.cl,224.0,"Gender, Motherhood, Reproduction, Time, Life Course"
1.2216913016116922e+19,gh9qyTMAAAAJ,Universidad Diego Portales,@udp.cl,218.0,"victimología, abuso sexual infantil, maltrato infantil, vulneración de derechos"
1.2216913016116922e+19,VlO1OEAAAAAJ,Universidad Diego Portales,@udp.cl,225.0,"Political Philosophy, Kantianism, Carl Schmitt, Salomon Maimon, Friedrich Hölderlin"
1.2216913016116922e+19,7TdyZdcAAAAJ,"Facultad de Derecho, Universidad Diego Portales",@mail.udp.cl,217.0,"Derecho procesal, reformas judiciales, derecho probatorio, tribunales de familia, acciones colectivas cultura legal"
1.2216913016116922e+19,wECRFfoAAAAJ,"Profesora de Derecho, Universidad Diego Portales",@udp.cl,201.0,derecho ambiental
1.2216913016116922e+19,DMvWVB4AAAAJ,"Associate Professor, Universidad Diego Portales",@udp.cl,201.0,"Electronic literature, Digital culture, Latin American cultural studies"
1.2216913016116922e+19,zAw8CDAAAAAJ,"Escuela de Sociologia, Universidad Diego Portales",@udp.cl,199.0,"Sociología y Antropología Política, Sociología del Genero, Políticas Sociales"
1.2216913016116922e+19,-YdeOGkAAAAJ,Universidad Diego Portales,@mail.udp.cl,200.0,"Resilience, Risk Reduction, Sustainability, Housing"
1.2216913016116922e+19,9GxnYLQAAAAJ,Universidad Diego Portales,@mail.udp.cl,203.0,"International Cooperation, Global Governance, European Union, Latin America, Renewable Energy"
1.2216913016116922e+19,OmCMJHoAAAAJ,Universidad Diego Portales,@udp.cl,187.0,"Numerical Cognition, Developmental Dyscalculia, Learning Disabilities, Developmental Cognitive Neuroscience, Education"
1.2216913016116922e+19,f9up4NwAAAAJ,Universidad Diego Portales,@mail.udp.cl,189.0,"Comparative Politics, Political Parties, Populism, Democracy, Polarization"
1.2216913016116922e+19,BE30uxwAAAAJ,Universidad Diego Portales,@mail.udp.cl,173.0,"Memoria, Historia reciente, dictaduras y transciones en el Cono Sur, historia LGBTQ+"
1.2216913016116922e+19,4YiaPv8AAAAJ,Profesor de Universidad Diego Portales,@mail.udp.cl,166.0,"Neuropsicológia, Terapia Ocupacional"
1.2216913016116922e+19,xZ9CsJMAAAAJ,"Assistant Professor, School of Education, Universidad Diego Portales, Chile",@mail.udp.cl,170.0,
1.2216913016116922e+19,mxwiX3MAAAAJ,Universidad Diego Portales,@mail.udp.cl,154.0,
1.2216913016116922e+19,wzoRrcsAAAAJ,"Universidad Diego Portales, Escuela de Kinesiología",@mail.udp.cl,157.0,"Fisiología clínica del ejercicio, diabetes, obesidad."
1.2216913016116922e+19,tHL6bFwAAAAJ,Universidad Diego Portales,@udp.cl,145.0,"políticas culturales, derechos pueblos indígenas"
1.2216913016116922e+19,qK5QPOAAAAAJ,"Profesor de Psicología Jurídica, Universidad Diego Portales (Chile)",@udp.cl,146.0,"Psicología Jurídica, Psicología Forense, Psicopatología, Peritajes, Derecho Penal"
1.2216913016116922e+19,_Yf0PLcAAAAJ,Universidad Diego Portales,@mail.udp.cl,144.0,
1.2216913016116922e+19,LStFQbQAAAAJ,"Profesor de Historia, Universidad Diego Portales",@mail.udp.cl,144.0,"Historía política de Chile y Latinoamérica, Clientelismo, gobiernos locales, Historia Presente"
1.2216913016116922e+19,x7OiALsAAAAJ,Universidad Diego Portales,@udp.cl,140.0,"Time series, Forecasting, econometrics"
1.2216913016116922e+19,nUqBckwAAAAJ,Universidad Diego Portales,@mail.udp.cl,132.0,
1.2216913016116922e+19,-BvxdWgAAAAJ,Researcher for Center of Studies in Clinical Psychology and Psychotherapy (CEPPS-UDP),@mail.udp.cl,129.0,"procesos psicoterapéuticos, episodios de cambio en psicoterapia, investigación cualitativa"
1.2216913016116922e+19,9ONdOmwAAAAJ,UNIVERSIDAD DIEGO PORTALES,@udp.cl,126.0,Finanzas
1.2216913016116922e+19,nm5rdFIAAAAJ,Universidad Diego Portales,@mail.udp.cl,125.0,"Bioética, Sistemas de Salud, Justicia en Salud, Salud Pública"
1.2216913016116922e+19,IglyrwEAAAAJ,"Universidad Central, Universidad Diego Portales",@mail.udp.cl,130.0,"Historia, Ciencias Sociales, Humanidades"
1.2216913016116922e+19,YoRg9aMAAAAJ,Universidad Diego Portales,@mail.udp.cl,119.0,"Gestión de stakeholders, Transporte y sociedad, sociología de las organizaciones, digitalización, teletrabajo"
1.2216913016116922e+19,tBoAo64AAAAJ,Universidad Diego Portales,@mail.udp.cl,113.0,"political philosophy, philosophy of artificial intelligence"
1.2216913016116922e+19,uEWhX_YAAAAJ,Universidad Diego Portales,@udp.cl,121.0,"Thermodynamics, Desalination, Water-energy nexus, Renewable Energies"
1.2216913016116922e+19,nI95XBsAAAAJ,Secretaría Académica Escuela Postgrado Universidad Diego Portales,@udp.cl,114.0,Radioterapia
1.2216913016116922e+19,u0Ccl1YAAAAJ,Universidad Diego Portales,@udp.cl,112.0,"journalism, literature, communication"
1.2216913016116922e+19,pB044BoAAAAJ,"Profesor Facultad de Educación UDP, Chile.",@mail.udp.cl,112.0,"Educación ambiental, Didáctica de las ciencias y geografía"
1.2216913016116922e+19,KZM60-MAAAAJ,"Associate Professor Departament of Psychology,  Universidad Diego Portales (Santiago-Chile)",@udp.cl,111.0,"Therapeutic Cultures, Biopolitics, Governmentality, Psychoanalysis"
1.2216913016116922e+19,Hsc86jQAAAAJ,Universidad Diego Portales,@mail.udp.cl,112.0,"History, Memory Studies, Childhood Studies, Education"
1.2216913016116922e+19,h_Ot68YAAAAJ,Universidad Andres Bello y Universidad Diego Portales,@mail.udp.cl,108.0,Bioquímica teórica
1.2216913016116922e+19,e7_9UIgAAAAJ,Universidad Diego Portales,@udp.cl,113.0,"political communication, democracy, social movements, social media, media literacy"
1.2216913016116922e+19,Widna_QAAAAJ,"Universidad Diego Portales, Santiago de Chile",@udp.cl,106.0,"Filosofía, Estética, Feminismo, Gender, Queertheory"
1.2216913016116922e+19,LPEqjkkAAAAJ,"Servicio de Pediatría, Clínica Dávila, Universidad Diego Portales",@mail.udp.cl,100.0,
1.2216913016116922e+19,dZdJ8RwAAAAJ,Universidad Diego Portales,@mail.udp.cl,102.0,"escritura, literacidad, formación docente"
1.2216913016116922e+19,hzjtYewAAAAJ,Universidad Diego Portales,@udp.cl,105.0,"Psicología, Epistemología, Historia de la Ciencia, Ética, Teoría Crítica"
1.2216913016116922e+19,ttvfkoIAAAAJ,Universidad Diego Portales,@udp.cl,97.0,"HCI, Interaction Design, Ubiquitous Computing"
1.2216913016116922e+19,P81WaoYAAAAJ,Universidad Diego Portales,@udp.cl,89.0,Law and Economics
1.2216913016116922e+19,OzOR8RIAAAAJ,Universidad Diego Portales y Universidad San Sebastián,@mail.udp.cl,86.0,"Psicología Organizacional, salud mental, bienestar en el trabajo, manejo del estrés y de conflictos interpersonales"
1.2216913016116922e+19,Ajt0ThwAAAAJ,"Assistant Professor, Universidad Diego Portales",@udp.cl,79.0,"Synthetic Biology, Systems Biology, Artificial Intelligence"
1.2216913016116922e+19,CnowQgcAAAAJ,Universidad Diego Portales,@mail.udp.cl,76.0,"Brazilian History, Transnational History of the Black Press of the Americas, The Birth of Modern Earthquake Knowledge, Latin Ame"
1.2216913016116922e+19,xbar_vEAAAAJ,"Assistant Professor, Universidad Diego Portales",@mail.udp.cl,75.0,"Global Continuous Optimization, Discrete Optimization, Metaheuristics"
1.2216913016116922e+19,tu2UQaYAAAAJ,"Profesora Asistente Departamento de Sociología, Universidad Diego Portales",@udp.cl,76.0,"sociología del respeto, desigualdad, sociología moral, métodos mixtos"
1.2216913016116922e+19,Jd58NeMAAAAJ,Universidad Diego Portales,@mail.udp.cl,72.0,"comunicación política, redes sociales, participación electoral"
1.2216913016116922e+19,trvx31EAAAAJ,Universidad Diego Portales,@mail.udp.cl,75.0,"High redshift  galaxies, galaxy groups"
1.2216913016116922e+19,hj0Q4iwAAAAJ,Universidad Diego Portales - Fundación Ilusioname,@mail.udp.cl,70.0,"felicidad, bienestar subjetivo, neurociencia, gestión, mindfulness"
1.2216913016116922e+19,X6tQhBAAAAAJ,Universidad Alberto Hurtado - Universidad Diego Portales,@mail.udp.cl,64.0,"Educación, Sociología, Élites, Formaciión ciudadana"
1.2216913016116922e+19,2SdKmo8AAAAJ,Universidad Diego Portales,@udp.cl,66.0,"Household finance, Macro-Finance, Asset Pricing, Structural Econometrics"
1.2216913016116922e+19,l2mmGVIAAAAJ,Universidad Diego Portales,@udp.cl,70.0,"Organizational Psychology, Values, Motivation, Well-being, Responsible Enterprises"
1.2216913016116922e+19,CW-qARsAAAAJ,Docente Universidad Diego Portales,@mail.udp.cl,62.0,"Neonatologia, infectologia neonatal"
1.2216913016116922e+19,CuDHZQoAAAAJ,Universidad Diego Portales,@mail.udp.cl,62.0,"psychometric, econometric, data science"
1.2216913016116922e+19,Yb8gOF0AAAAJ,Universidad Diego Portales,@mail.udp.cl,57.0,"desigualdades sociales, estudios urbanos, estratificación social y mercado laboral"
1.2216913016116922e+19,UN0-wpgAAAAJ,Universidad Diego Portales - Universidad Alberto Hurtado,@mail.udp.cl,54.0,"Inclusive education, teacher development, educational leadership, inclusive school leadership"
1.2216913016116922e+19,XdCfg28AAAAJ,Universidad Diego Portales,@mail.udp.cl,59.0,"Cognitive Neuroscience, Cognitive psychology, Behavioral psychology, Psychobiology, Psychology"
1.2216913016116922e+19,lGm9K6sAAAAJ,UDP / AUH,@mail.udp.cl,54.0,"Chile, feminismo, constitución"
1.2216913016116922e+19,rCXvSCkAAAAJ,Universidad Diego Portales - Universidad Alberto Hurtado,@mail.udp.cl,55.0,"Educación superior, aseguramiento de la calidad, economía política"
1.2216913016116922e+19,Sj0PxXsAAAAJ,Universidad Diego Portales,@udp.cl,46.0,"Media, Communications, social movements, cultural studies"
1.2216913016116922e+19,Uv50hp4AAAAJ,"Académica Facultad de Comunicación y Letras, Universidad Diego Portales",@udp.cl,60.0,"Comunicación, sociología, políticas públicas, género e historia de la tecnología"
1.2216913016116922e+19,AKtuuW8AAAAJ,"Cientista Política UCEN, y Magíster en Métodos para la Investigación Social, UDP",@mail.udp.cl,46.0,"juventud, movimiento estudiantil, movimientos sociales, militancia, organizaciones políticas"
1.2216913016116922e+19,cLqB67AAAAAJ,"Psychology/Centro de Estudios en Neurociencia Humana y Neuropsicología, Universidad Diego Portales",@mail.udp.cl,46.0,"Social Interaction, 4E Cognition"
1.2216913016116922e+19,IqqlfcUAAAAJ,Universidad Diego Portales,@mail.udp.cl,46.0,"Architecture, Heritage, Conservation, Urban Planning, Cultural Landscapes"
1.2216913016116922e+19,36GsmVsAAAAJ,"Centro de Investigación Biomédica,  Facultad de Medicina, Universidad Diego Portales",@udp.cl,43.0,
1.2216913016116922e+19,Dk_phhwAAAAJ,Universidad Diego Portales,@mail.udp.cl,40.0,"Early childhood education, childhood studies, abya yala, anticolonial"
1.2216913016116922e+19,i2VjyG8AAAAJ,Universidad Diego Portales,@mail.udp.cl,44.0,"Sociología Política, Teoría Social, Filosofía Política, Neoliberalismo"
1.2216913016116922e+19,1RhmT8AAAAAJ,Universidad Diego Portales,@mail.udp.cl,37.0,"Historia Urbana, Historia Social, Historia del Paisaje y el Territorio"
1.2216913016116922e+19,muD_JLMAAAAJ,Universidad Diego Portales,@mail.udp.cl,35.0,philosophie
1.2216913016116922e+19,sdMzzWgAAAAJ,Universidad Diego Portales,@mail.udp.cl,42.0,"Psicología del trabajo, formas de gestión flexible, subjetividad y trabajo"
1.2216913016116922e+19,zWIsBT8AAAAJ,"Candidato a Doctor en C. Política, Universidad Diego Portales",@mail.udp.cl,34.0,"Party System, Political parties, Latin America, Colombia, Populism"
1.2216913016116922e+19,GVWiETYAAAAJ,Universidad Diego Portales,@mail.udp.cl,32.0,"Análisis del discurso, multimodalidad, cómics, feminismo"
1.2216913016116922e+19,9ygF7I8AAAAJ,"Universidad Diego Portales, Facultad de Medicina.",@mail.udp.cl,32.0,Internal medicine clinical practice
1.2216913016116922e+19,xzIVM3EAAAAJ,"SUMMA, Universidad Diego Portales - Universidad Alberto Hurtado",@mail.udp.cl,30.0,"Educación, Innovación, Políticas de Conocimiento, Sociología del conocimiento"
1.2216913016116922e+19,OQN50DYAAAAJ,Universidad Diego Portales,@mail.udp.cl,26.0,Critical Care
