organization,scholar_id,affiliation,email_domain,citedby,interests
4.727335469935945e+18,Uc0yu3EAAAAJ,"Universidad de Tarapaca,  Chile",@academicos.uta.cl,14016.0,"Nanomaterials, Photocatalyst, Nanoporous, Semiconductor, Materials"
4.727335469935945e+18,xu1R9IcAAAAJ,Universidad de Tarapacá,@uta.cl,7180.0,Psicología Clínica
4.727335469935945e+18,oaqR2GoAAAAJ,Universidad de Tarapacá,@uta.cl,6914.0,"Chinchorro mummies, Bioarchaeology, Paleopathology"
4.727335469935945e+18,7Yqek_0AAAAJ,"Associate Professor, Instituto de Alta Investigación, Universidad de Tarapacá",@academicos.uta.cl,5955.0,"M dwarfs, brown dwarfs, exoplanets"
4.727335469935945e+18,t8hdQjYAAAAJ,Universidad de Tarapaca,@uta.cl,5869.0,"Archaeology, hunter-gatherers, paleoenviroment, South America, Andes"
4.727335469935945e+18,ATFF7ikAAAAJ,Universidad de Tarapacá,@academicos.uta.cl,4764.0,"Educación superior, gobernanza universitaria, gobierno universitario, talento humano, liderazgo"
4.727335469935945e+18,OSSLHcAAAAAJ,Profesor Titular - Universidad de Tarapacá (Chile),@uta.cl,4412.0,"Educación Superior, Gestión del Conocimiento, Liderazgo"
4.727335469935945e+18,9SvW7BUAAAAJ,Facultad de Educación y Humanidades de la Universidad de Tarapacá,@academicos.uta.cl,4331.0,"Educación superior, políticas educativas, equidad, aseguramiento de calidad"
4.727335469935945e+18,FgEMtxQAAAAJ,Profesora Titular Universidad de Tarapaca,@uta.cl,4138.0,"liderazgo, educación superior, estrategia."
4.727335469935945e+18,jX7ZvS4AAAAJ,Universidad de Tarapacá,@uta.cl,4007.0,
4.727335469935945e+18,p86gQo0AAAAJ,Universidad de Tarapacá,@academicos.uta.cl,3793.0,"migraciones, políticas migratorias, fronteras, interculturalidad, Chile"
4.727335469935945e+18,j1T5Cd4AAAAJ,Universidad de Tarapacá,@academicos.uta.cl,3250.0,"Energía solar, Tratamiento solar de aguas, Desarrollo sustentable, Innovación"
4.727335469935945e+18,TKDdBTkAAAAJ,"Professor of Physics, Universidad de Tarapacá",@uta.cl,2976.0,"Chaos, Hydrodynamic Instabilities, Magnetism, Quantum mechanics, Mathematical modeling"
4.727335469935945e+18,gZJwoscAAAAJ,"Universidad de Tarapacá, profesor titular",@academicos.uta.cl,1924.0,"historia regional, relaciones internacionales, historia de la minería"
4.727335469935945e+18,gMutzEsAAAAJ,Universidad de Tarapacá,@uta.cl,1911.0,
4.727335469935945e+18,raIGAMAAAAAJ,Estudiante Psicología UTA,@alumnos.uta.cl,1486.0,Psicología
4.727335469935945e+18,vOfS1hAAAAAJ,Universidad de Tarapaca,@uta.cl,1475.0,"Psicología, Metodología de Investigación, Gestión Organizacional"
4.727335469935945e+18,h63gYiQAAAAJ,"Independent Researcher, Universidad de Tarapacá",@academicos.uta.cl,1428.0,"Near-Field cosmology, Milky Way, globular clusters, tidal streams"
4.727335469935945e+18,Qu0U_LkAAAAJ,Universidad de Tarapacá,@uta.cl,1360.0,"Arqueología del norte grande de Chile, patrones de asentamiento, relacion es interétnicas"
4.727335469935945e+18,zak53CYAAAAJ,"Staff Profesional, Universidad de Tarapacá",@uta.cl,1352.0,"Educación, Liderazgo, Administración"
4.727335469935945e+18,ZJZKGSEAAAAJ,"Universidad de Tarapacá, Departamento de Psicología",@academicos.uta.cl,1275.0,"psicología organizacional, psicología positiva, metodología de la investigación, análisis de datos"
4.727335469935945e+18,5vzbj6QAAAAJ,Universidad de Tarapacá,@uta.cl,1191.0,"Física, Matemática"
4.727335469935945e+18,iK_qHh4AAAAJ,Universidad de Tarapacá,@uta.cl,1151.0,Entomología
4.727335469935945e+18,3nFdmAsAAAAJ,"Profesor de Historia, Universidad de Tarapacá",@uta.cl,1046.0,"Migraciones, Historia Regional"
4.727335469935945e+18,LQU8XfEAAAAJ,"Professor / Profesor Titular, Universidad de Tarapacá",@academicos.uta.cl,1030.0,"Geography, Environmental Geography, Political Ecology, Cultural Ecology"
4.727335469935945e+18,k7EIK5UAAAAJ,"Universidad de Tarapacá, Chile",@academicos.uta.cl,942.0,"construcción de teoría, diseños mixtos de investigación, microsociología"
4.727335469935945e+18,HPpN_m8AAAAJ,Full Professor at Universidad de Tarapacá; Adjunct Graduate Faculty Member at Trent University,@uta.cl,842.0,"Andean archaeology, pre-Hispanic economy, animal consumption, visual images, production/use of rock art and geoglyphs"
4.727335469935945e+18,tT_v9m8AAAAJ,"Associate Professor, Universidad de Tarapacá",@academicos.uta.cl,814.0,"Climatology, Meteorology"
4.727335469935945e+18,GmwPnicAAAAJ,Universidad de Tarapacá,@academicos.uta.cl,791.0,"Social Psychology, Educational Psychology, Organizational Psychology"
4.727335469935945e+18,nlEleXoAAAAJ,Universidad de Tarapacá,@uta.cl,762.0,"medical physics, física médica, protección radiologica, radiological protection"
4.727335469935945e+18,L__H0V4AAAAJ,Universidad de Tarapacá,@academicos.uta.cl,747.0,"High order finite volumes, unstructured meshes, multiphase flows"
,NXxMAukAAAAJ,BioNaNO3Lab,@uta.cl,756.0,"Arqueometria, Raman, SERS, Nanoestructuras"
4.727335469935945e+18,_mR2Ky8AAAAJ,Universidad de Tarapacá,@academicos.uta.cl,759.0,
4.727335469935945e+18,95XWzKgAAAAJ,"Universidad de Tarapacá, Dpto. de Ciencias Sociales.",@academicos.uta.cl,702.0,"Relaciones Internacionales, Paradiplomacia, Paradiplomacy, Fronteras, Diplomacy"
4.727335469935945e+18,658IkykAAAAJ,Universidad de Tarapacá,@uta.cl,700.0,"Análisis, Ecuaciones Diferenciales"
4.727335469935945e+18,iiBXp3EAAAAJ,Universidad de Tarapaca,@uta.cl,592.0,"agronomia, agricultura, cultivo sin suelos, fertirriego, fertilizacion"
4.727335469935945e+18,ejkmUNkAAAAJ,"Instituto de Alta Investigación, Universidad de Tarapacá",@academicos.uta.cl,602.0,"Teoría Cuantica de Campos, Chromodinámica Cuántica, Teoría Cuántica de Campos No-Perturbativa"
4.727335469935945e+18,hZTCQecAAAAJ,Universidad de Tarapacá,@academicos.uta.cl,550.0,Filosofía de las ciencias cognitivas
4.727335469935945e+18,3YcREFMAAAAJ,Universidad de Tarapacá,@uta.cl,526.0,"Estudios de Género, Salud y Pueblos Originario, Etnicidades"
4.727335469935945e+18,XTQr81wAAAAJ,"Departamento de Ciencias Sociales, Universidad de Tarapacá",@academicos.uta.cl,505.0,
4.727335469935945e+18,CB30R1QAAAAJ,"Associate Professor, University of Tarapaca (Chile)",@uta.cl,510.0,"Mechanical Vibrations, Rotor Dynamics, Tribology, Mechatronics"
4.727335469935945e+18,6ULOSnUAAAAJ,"Departamento de Ingeniería Mecánica, Facultad de Ingeniería, Universidad de Tarapacá",@academicos.uta.cl,508.0,"Air pollution, Aerobiology, Modelling, Noise Pollution, Environmental Health"
4.727335469935945e+18,dDBPR9AAAAAJ,"Assistant Professor of Physics, Universidad de Tarapacá",@uta.cl,532.0,"Computational Physics, Nonlinear Physics, Fluids, Chaos"
4.727335469935945e+18,TpObchYAAAAJ,"University of Tarapacá, Arica, Chile; University of Chile, Santiago, Chile and Solar Energy Research",@academicos.uta.cl,469.0,"solar cooker, solar thermal, bioenergy, clean cooking"
4.727335469935945e+18,mXIwbNQAAAAJ,"Departamento de Física, Universidad de Tarapacá",@academicos.uta.cl,471.0,Cosmology and Particle Physics
4.727335469935945e+18,cV4YES8AAAAJ,"prof Bioquimica, microbiologia, Universidad de Tarapaca, iquique, Chile",@academicos.uta.cl,480.0,"microbiologia ambiental, ecologia, bioquimica"
4.727335469935945e+18,6WkZ67wAAAAJ,"Escuela de Psicología y Filosofía, Universidad de Tarapacá",@academicos.uta.cl,472.0,
4.727335469935945e+18,6dk_MIUAAAAJ,Universidad de Tarapacá,@academicos.uta.cl,466.0,"Historia Cultural, Historia de las Ideas, Antropología Histórica"
4.727335469935945e+18,ru8bR_gAAAAJ,Universidad de Tarapacá,@academicos.uta.cl,435.0,Física
4.727335469935945e+18,jEqDbOQAAAAJ,Universidad de Tarapacá. Escuela de Psicología y Filosofía,@uta.cl,417.0,"qualitative inquiry, psychology, cultural studies, critical methodologies"
4.727335469935945e+18,ihvIJ2oAAAAJ,"Universidad de Tarapacá, Chile",@academicos.uta.cl,425.0,"Rayleigh - Benard convection, Lorenz model, Ginzburg-Landau model"
4.727335469935945e+18,zrdfFyMAAAAJ,"Departamento de Física, Facultad de Ciencias, Universidad de Tarapacá",@uta.cl,391.0,disordered systems
4.727335469935945e+18,F3w8FgQAAAAJ,Profesor Titular Universidad de Tarapacá,@academicos.uta.cl,407.0,"Educación Intercultural, Educación y Migración, Historia y Educación"
4.727335469935945e+18,y0AeVKsAAAAJ,Universidad de Tarapacá,@academicos.uta.cl,358.0,"historia colonial, historia de Chile, Historia de América, militares coloniales, afrodescendientes"
4.727335469935945e+18,1Z4CdjEAAAAJ,Universidad de Tarapacá,@academicos.uta.cl,317.0,"Orgasm, Sex, Sexual Behavior, Sexual Response, Sexual Function"
4.727335469935945e+18,IsTUNNQAAAAJ,Universidad de Tarapacá,@uta.cl,310.0,"Biomecánica en el deporte, Evaluación y mediciones en deportistas, Fisiología deportiva, Actividad Física y nutrición"
4.727335469935945e+18,FY08fJsAAAAJ,Universidad de Tarapacá,@academicos.uta.cl,300.0,"Educación en Ingeniería, Bases de Datos"
4.727335469935945e+18,Mn_m5kAAAAAJ,Académico Universidad de Tarapacá,@academicos.uta.cl,291.0,"Política y Gestión en Educación, Educación Virtual (EaD), Gobernanza Universitaria, Gobernanza Educativa"
4.727335469935945e+18,5mr3c-4AAAAJ,Universidad de Tarapacá,@academicos.uta.cl,253.0,"Semiconductors nanostructures, Condensed matter physics"
4.727335469935945e+18,Daftso8AAAAJ,Universidad de Tarapacá,@academicos.uta.cl,252.0,"Historia Regional, Innovación Educativa, Educación Intercultural, Rol docente, Historia de la migración en Chile"
4.727335469935945e+18,He4a1y8AAAAJ,"Universidad de Tarapacá, Chile. Departamento de Ciencias Sociales, Iquique",@academicos.uta.cl,269.0,"Medical Anthropology, Intercultural Health, Indigenous People, Migrant health"
4.727335469935945e+18,Xs8IvCQAAAAJ,Universidad de Tarapacá,@uta.cl,238.0,"Conjugated polymers, Polymer chemistry, Organic synthesis, Materials chemistry"
4.727335469935945e+18,OoN3seEAAAAJ,Universidad de Tarapacá,@uta.cl,223.0,"Economics, Econometrics, Applied Econometrics"
4.727335469935945e+18,R_hHTxsAAAAJ,"Ph.D. in Applied Sciences with mention in Mathematical Engineer, University of Tarapacá",@academicos.uta.cl,197.0,"Continuous optimization, Nonconvex optimization, generalized convexity, proximal point algorithms"
4.727335469935945e+18,SilKf3gAAAAJ,Universidad de Tarapacá,@academicos.uta.cl,197.0,"Radiología, protección radiológica, garantía de calidad, imagen científica, educación superior"
4.727335469935945e+18,TtR5hkIAAAAJ,Universidad de Tarapacá,@uta.cl,183.0,"Marketing, Business"
4.727335469935945e+18,oU0ug0UAAAAJ,Universidad de Tarapacá,@academicos.uta.cl,182.0,"Data Mining, Model Driven Development, Data Quality"
4.727335469935945e+18,4IojqZgAAAAJ,Universidad de Tarapacá,@academicos.uta.cl,174.0,"Educational Technology, Learning Technology"
4.727335469935945e+18,YapWydUAAAAJ,Universidad de Tarapaca,@uta.cl,171.0,"Antropología de la alimentación, nacionalismos"
4.727335469935945e+18,G9u7N0gAAAAJ,"Profesor de Arqueología, Universidad de Tarapacá",@uta.cl,171.0,"Arqueología costera, Arte rupestre, Etnografía, Antropología"
4.727335469935945e+18,Ex0k3wcAAAAJ,Universidad de Tarapacá,@uta.cl,167.0,"Human-Computer Interaction, Virtual Reality, Entrepreneurship, Software Engineering, Intelligent Environments"
4.727335469935945e+18,MTVLBZgAAAAJ,Universidad de Tarapacá,@academicos.uta.cl,177.0,"cuestión agraria, estudios rurales, estudios territoriales, extractivismo"
4.727335469935945e+18,-bU9ywsAAAAJ,Universidad de Tarapacá,@academicos.uta.cl,159.0,"sociology, education, ethnicity, migration"
4.727335469935945e+18,Tucyot0AAAAJ,"Académica, Departamento de Antropología, Universidad de Tarapacá",@academicos.uta.cl,160.0,"Antropología del cuerpo, Estudios de Performance, Antropología Visual, Antropología del Arte"
4.727335469935945e+18,h69JRoMAAAAJ,"Estudiante de Psicología, Universidad de Tarapacá",@alumnos.uta.cl,138.0,"Psicología, Ciencias Sociales"
4.727335469935945e+18,x2wtU-oAAAAJ,Profesora Asistente. Departamento de Ciencias Históricas y Geográficas. Universidad  de Tarapacá.,@academicos.uta.cl,130.0,"Chinese in Latin America, Migration and health"
4.727335469935945e+18,ZbAPeNkAAAAJ,Universidad de Tarapacá,@academicos.uta.cl,126.0,"inequality, sociology of science, decolonial studies, internationalization of higher education"
4.727335469935945e+18,b6DDNIoAAAAJ,Universidad de Tarapacá,@gestion.uta.cl,108.0,"Gobernanza universitaria, Educación superior, Gobierno Universitario, Universidades"
4.727335469935945e+18,2788zbAAAAAJ,Trabajador Social | Departamento de Ciencias Sociales. Universidad de Tarapacá,@uta.cl,103.0,
4.727335469935945e+18,s-yCVGoAAAAJ,Departamento de Ciencias Sociales - Universidad de Tarapacá,@academicos.uta.cl,105.0,"Riesgos psicosociales, Conciliación Familia-Trabajo, Satisfacción laboral."
4.727335469935945e+18,ZylplBEAAAAJ,Académico - Universidad de Tarapacá,@uta.cl,94.0,"Metodologías de Enseñanza, Aprendizaje"
4.727335469935945e+18,e1qd48sAAAAJ,Universidad de Tarapaca,@academicos.uta.cl,91.0,"Applied Mathematics, Fluid mechanics, convection, heat transfer"
4.727335469935945e+18,L64ZOkEAAAAJ,Universidad de Tarapacá,@academicos.uta.cl,86.0,Marketing Business
4.727335469935945e+18,VEYbhSkAAAAJ,"Docente, Investigador, Universidad de Tarapacá",@academicos.uta.cl,82.0,"Políticas públicas, psicologia política, derechos humanos"
4.727335469935945e+18,lzdaStwAAAAJ,Universidad de Tarapacá,@academicos.uta.cl,86.0,"Física médica, física no-lineal, magnetismo"
4.727335469935945e+18,QJcnQScAAAAJ,"Full Professor, University of Tarapacá",@academicos.uta.cl,77.0,"Statistical Modelling of air quality, Data Sciences"
4.727335469935945e+18,QRQalusAAAAJ,"Estudiante Psicología, Universidad de Tarapacá",@alumnos.uta.cl,73.0,"Psicología, Ciencias Sociales"
4.727335469935945e+18,2VWcYfIAAAAJ,"Profesor de Management, Universidad de Tarapacá",@academicos.uta.cl,77.0,"Educación Superior, Liderazgo, Equipos"
4.727335469935945e+18,I61QOLIAAAAJ,Universidad de Tarapacá,@gestion.uta.cl,70.0,"Educación superior, acreditación Institucional, rankings de universidades"
4.727335469935945e+18,TWwXpdcAAAAJ,INVESTIGADOR ASISTENTE UNIVERSIDAD DE TARAPACA,@uta.cl,67.0,"fisiólogia vegetal, riego, relaciones hidrias"
4.727335469935945e+18,CnEEXs8AAAAJ,Universidad de Tarapacá,@academicos.uta.cl,66.0,"electrical circuits, memristors, electromagnetic field theory"
4.727335469935945e+18,YzsZq08AAAAJ,Universidad de Tarapacá,@academicos.uta.cl,61.0,Nutrición y Salud Pública
4.727335469935945e+18,4J1Hza0AAAAJ,Universidad de Tarapacá,@academicos.uta.cl,60.0,Optimización
4.727335469935945e+18,Sy_683gAAAAJ,Universidad de Tarapacá,@academicos.uta.cl,57.0,"andean archaeology, ceramic analysis"
4.727335469935945e+18,aWIcOjAAAAAJ,University of Tarapacá (UTA),@academicos.uta.cl,51.0,"geography, landslide, floods, debris flow, flood risk"
4.727335469935945e+18,fthf5y4AAAAJ,Universidad de Tarapacá,@academicos.uta.cl,47.0,
4.727335469935945e+18,GcdrbkIAAAAJ,"Profesor Asociado, Universidad de Tarapacá, Arica Chile",@uta.cl,26.0,"Minería de datos, Análisis de Algoritmos, Teoría de la Computación"
4.727335469935945e+18,4_OuL30AAAAJ,Universidad de Tarapacá,@academicos.uta.cl,24.0,"política exterior, relaciones internacionales, marxismo, psicología crítica, teoría de la ideología."
4.727335469935945e+18,Obt0vO4AAAAJ,Universidad de Tarapacá,@academicos.uta.cl,21.0,"Machine Learning, Deep Learning"
4.727335469935945e+18,CeXuEpYAAAAJ,Universidad de Tarapacá,@academicos.uta.cl,22.0,"Didáctica de las ciencias, Formación inicial docente, Desarrollo profesional del profesorado de ciencias"
4.727335469935945e+18,I_MMDRoAAAAJ,"Académico, Universidad de Tarapacá",@uta.cl,19.0,Economía aplicada
4.727335469935945e+18,pApnCoYAAAAJ,Universidad de Tarapacá,@academicos.uta.cl,17.0,Algebra Lineal
4.727335469935945e+18,KA3hBLoAAAAJ,Universidad de Tarapacá,@academicos.uta.cl,16.0,Historia y Relaciones Internacionales
4.727335469935945e+18,SEXYmjcAAAAJ,"Universidad de Tarapacá, Chile/ Universidad de los Andes, Chile",@academicos.uta.cl,12.0,"Derecho Administrativo, Derecho Constitucional, Derecho Público, Derecho de Propiedad"
4.727335469935945e+18,O3KCxPIAAAAJ,"Magíster en Historia, Universidad de Tarapacá",@academicos.uta.cl,11.0,"Historia Social, Historia de las Mujeres, Estudios de Género, Historia del Feminismo, Movimientos Sociales"
4.727335469935945e+18,L8juHp8AAAAJ,"Departamento de ingeniería eléctrica y electrónica, Universidad de Tarapacá (UTA)",@uta.cl,10.0,"Control automático, Robótica"
4.727335469935945e+18,G2INxY4AAAAJ,"Profesora de Castellano , Universidad de Tarapacá",@uta.cl,13.0,"educación, formación docente, cambio educativo, lectura"
4.727335469935945e+18,63xKdBgAAAAJ,Universidad de Tarapacá,@academicos.uta.cl,9.0,"Psicología Social, Educación Superior, Salud Mental"
4.727335469935945e+18,rTgBALEAAAAJ,"profesor de Psicologia, Universidad de Tarapaca",@academicos.uta.cl,11.0,"psicologia, psicologia del deporte, migraciones, grupos minorizados"
4.727335469935945e+18,9kp_v8MAAAAJ,Universidad de Tarapacá,@academicos.uta.cl,8.0,"Criminal Law, Criminology, Education, Political Science, Vulnerability"
4.727335469935945e+18,S2N0UO0AAAAJ,University of Tarapaca,@academicos.uta.cl,7.0,Fluid Dynamics
4.727335469935945e+18,SpltgGAAAAAJ,Universidad de Tarapacá,@academicos.uta.cl,6.0,Termofluidos
4.727335469935945e+18,QkYexZ8AAAAJ,Universidad de Tarapacá,@academicos.uta.cl,6.0,"Youth, education, citizenship education, Social Work, community development"
4.727335469935945e+18,thPVgKYAAAAJ,Universidad de Tarapacá,@alumnos.uta.cl,5.0,"Arqueología, Antropología, Arqueología Costera, Arqueomalacología"
4.727335469935945e+18,StHgOZYAAAAJ,"Académica de Diseño Multimedia, Universidad de Tarapacá",@uta.cl,9.0,"Diseño social, cultural, patrimonial/ epistemología del diseño/ Enseñanza deldiseño"
4.727335469935945e+18,xqN3iYoAAAAJ,Universidad de Tarapacá,@academicos.uta.cl,4.0,"Machine Learning, Information Systems, Business Process Management"
4.727335469935945e+18,uBlchIIAAAAJ,"Profesor de Estadística, Universidad de Tarapacá",@academicos.uta.cl,3.0,"Estadística bayesiana, Análisis de Supervivencia, didáctica de la estadística"
4.727335469935945e+18,V_AXCYsAAAAJ,Universidad de Tarapacá,@academicos.uta.cl,3.0,Psicología
4.727335469935945e+18,lhfun30AAAAJ,"profesor de biología, Universidad de Tarapacá",@academicos.uta.cl,3.0,"Marine biology, histology, developmental biology, ecology, education"
4.727335469935945e+18,-xmTLPYAAAAJ,"Departamento de Ingeniería y Tecnologías, Universidad de Tarapacá, Iquique-Chile",@academicos.uta.cl,2.0,"Control Automático, Sistemas Digitales, Teoría de Circuitos Eléctricos/Electrónicos"
4.727335469935945e+18,M_jGiGEAAAAJ,Universidad de Tarapacá,@academicos.uta.cl,2.0,
4.727335469935945e+18,DAJUCA4AAAAJ,Universidad de Tarapacá,@academicos.uta.cl,1.0,"Psicologia Comunitaria, Community Psychology"
4.727335469935945e+18,2VlU2jIAAAAJ,Universidad de Tarapacá,@academicos.uta.cl,1.0,"Historia constitucional de Chile, teoría del derecho"
4.727335469935945e+18,ixkosUgAAAAJ,"Academico Parcial, Universidad de Tarapacá, Arica Chile",@uta.cl,,"Robot Lego, Motivación, Redes de ordenadores, Enseñanza de la Programación básica de Robótica y Móviles android educativos"
4.727335469935945e+18,56doXw8AAAAJ,Universidad de Tarapacá,@academicos.uta.cl,,"Energy, Power Electronics, Electrical Power Systems, Electrical Machinery, Engineering Education"
4.727335469935945e+18,Rug4V0MAAAAJ,"Bibliotecólogo, Universidad de Tarapacá",@uta.cl,,"Revisiones Sistemáticas, Bibliometría, Cienciometría"
4.727335469935945e+18,dolpTqcAAAAJ,UTA,@alumnos.uta.cl,,Psicologia
4.727335469935945e+18,1XMB75UAAAAJ,Universidad de Tarapacá,@alumnos.uta.cl,1.0,"Comunicación intercultural, Formación Inicial Docente, Competencia Comunicativa Intercultural, Variación lingüística, CCI"
4.727335469935945e+18,uN_GDa0AAAAJ,"Académico, Universidad de Tarapacá",@academicos.uta.cl,,Educación
4.727335469935945e+18,MbNioaYAAAAJ,Universidad de Tarapacá,@academicos.uta.cl,,"Educación Superior, Política Educación Superior, Gobernabilidad democrática."
4.727335469935945e+18,eAn5o6gAAAAJ,"Estudiante de Psicología, Universidad de Tarapacá",@alumnos.uta.cl,,"Neurociencia, Metodología, Inteligencia artificial"
4.727335469935945e+18,UrXQ8RIAAAAJ,"Académico, Universidad de Tarapacá",@academicos.uta.cl,,"Derecho Económico, Derecho y Nuevas Tecnologías, Blockchain"
4.727335469935945e+18,kGESgA8AAAAJ,"Profesor de Matemática, Universidad de Tarapacá",@academicos.uta.cl,,"Educación Matemática, Didáctica de la Matemática"
4.727335469935945e+18,UAnC_gwAAAAJ,Universidad de Tarapacá,@alumnos.uta.cl,,Education
